"text","text_en","cmp_code","eu_code"
"También tiene que impulsar activamente su ""poder blando"" a través de la promoción de sus recursos humanos destinados a la investigación científica, el desarrollo tecnológico y la creatividad cultural, rubros en que el país tiene sobrados antecedentes y logros que le han merecido reconocimiento internacional","It must also actively promote its ""soft power"" through the promotion of its human resources for scientific research, technological development and cultural creativity, areas in which the country has a long track record and achievements that have earned it international recognition","601.1",NA
"El nuevo escenario mundial está caracterizado por el fin de la unipolaridad estadounidense, el ascenso de China y una creciente puja por la hegemonía internacional.","The new world scenario is characterized by the end of U.S. unipolarity, the rise of China and a growing competition for international hegemony.","107",NA
"Para afrontar esa realidad, es preciso enfatizar que la comprensión de la globalización como un fenómeno estructural no nos puede llevar a su ligera aceptación, ni a caer en un ""globalismo"" ingenuo que muchos predican pero que, en la práctica, tiene una aplicación demasiado limitada.","In order to face this reality, it is necessary to emphasize that understanding globalization as a structural phenomenon cannot lead us to accept it lightly, nor to fall into a naïve ""globalism"" that many preach but which, in practice, has too limited an application.","107",NA
"Por su ubicación geográfica y por su historia, el destino de nuestra Nación está indisolublemente unido al porvenir de la región.","Because of its geographic location and its history, the destiny of our nation is inextricably linked to the future of the region.","108",NA
"Esto implica que la prioridad estratégica es el fortalecimiento del MERCOSUR y los vínculos con Brasil, nuestro principal socio comercial, al igual que con Chile, que representa la vía de acceso a los grandes mercados del Pacífico.","This implies that the strategic priority is to strengthen MERCOSUR and ties with Brazil, our main trading partner, as well as with Chile, which represents the gateway to the large Pacific markets.","108",NA
"La política exterior tiene que poner énfasis en la construcción de ese eje regional, concebido con un criterio de regionalismo abierto, como impulsor activo de la unidad latinoamericana.","Foreign policy must emphasize the construction of this regional axis, conceived with a criterion of open regionalism, as an active promoter of Latin American unity.","108",NA
"Como protagonista de vínculos propios de multilateralismo, tiene que fomentar también la integración y la cooperación entre las naciones.","As a protagonist of multilateralism, it must also promote integration and cooperation among nations.","107",NA
"Con todo ello, debemos recorrer el camino que nos lleve a ser una Nación respetada y considerada, por su conducta y su dignidad en el concierto mundial, devolviendo así a nuestro pueblo el orgullo de ser argentinos.","With all this, we must walk the path that will lead us to become a respected and considered Nation, for its conduct and dignity in the world concert, thus giving back to our people the pride of being Argentineans.","601.1",NA
