"text","text_en","cmp_code","eu_code"
"la concreción de la obligatoriedad de la escuela secundaria,","realization of compulsory secondary school, the","506",NA
"la articulación de las universidades y de los institutos de enseñanza con el mundo productivo, teniendo en cuenta las distintas realidades regionales, sin dejar de observar la evolución de los modelos educativos internacionalmente exitosos.","articulation of universities and educational institutes with the productive world, taking into account the different regional realities, while observing the evolution of internationally successful educational models.","411",NA
"El sistema educativo está hoy también más obligado que nunca a inculcar valores éticos y morales, porque su finalidad no se agota en la preparación para el mundo del trabajo.","The educational system today is also more obliged than ever to inculcate ethical and moral values, because its purpose is not limited to preparation for the world of work.","603",NA
"Es, ante todo, una trasmisión de enseñanzas y estrategias para la vida social.","It is, above all, a transmission of teachings and strategies for social life.","603",NA
"Sólo así será posible recrear una cultura del trabajo y responder a las exigencias de una sociedad cada vez más compleja, generando condiciones efectivas para la reducción de las desigualdades sociales.","Only in this way will it be possible to recreate a work culture and respond to the demands of an increasingly complex society, generating effective conditions for the reduction of social inequalities.","503",NA
"La educación no puede concebirse únicamente como una instancia de la vida, sino como una dimensión permanente de la existencia humana.","Education cannot be conceived only as an instance of life, but as a permanent dimension of human existence.","506",NA
"Es necesario crear un ""cuarto nivel"" educativo, más allá del sistema formal, asociado al mundo del trabajo, para incorporar nuevos conocimientos y capacidades, como el pensamiento digital, ya no durante una etapa determinada sino de una manera permanente.","It is necessary to create a ""fourth level"" of education, beyond the formal system, associated with the world of work, to incorporate new knowledge and skills, such as digital thinking, no longer during a specific stage but on a permanent basis.","411",NA
"En esta tarea impostergable, es necesario otorgar un rol decisivo a las organizaciones sindicales, destinadas a convertirse en nuevos actores del sistema educativo del siglo XXI.","In this unpostponable task, it is necessary to give a decisive role to trade union organizations, which are destined to become new actors in the education system of the 21st century.","701",NA
"La Argentina tiene que anticipar el debate sobre la automatización de los procesos productivos y los avances de la inteligencia artificial para definir estratégicamente cómo preparamos a los jóvenes (y también a los adultos), a las instituciones educativas y a las estructuras del Estado,","Argentina needs to anticipate the debate on the automation of production processes and the advances in artificial intelligence in order to strategically define how we prepare young people (and adults as well), educational institutions and State structures,","411",NA
"de manera que las nuevas tecnologías no impliquen una ampliación de la brecha social sino, al contrario, un camino para acceder a nuevas y mejores oportunidades de trabajo.","so that new technologies do not imply a widening of the social gap but, on the contrary, a path to access new and better job opportunities.","411",NA
"6. GOBERNAR ES GENERAR PROSPERIDAD Y CREAR TRABAJO","6. TO GOVERN IS TO GENERATE PROSPERITY AND CREATE JOBS","H",NA
"Los desafíos principales de la gobernabilidad están relacionados con la creación de condiciones para mejorar la vida de las personas.","The main challenges of governance are related to the creation of conditions to improve people's lives.","504",NA
"El Estado no puede limitarse al rol de mero administrador de fondos públicos, que siempre serán insuficientes en relación con las demandas.","The State cannot limit itself to the role of mere administrator of public funds, which will always be insufficient in relation to the demands.","504",NA
"Tiene que cumplir un rol activo como generador de la prosperidad necesaria para cumplir esos objetivos.","It must play an active role as a generator of the prosperity necessary to meet these objectives.","504",NA
"Luego, impulsar una política distributiva que tendrá que hacer su parte.","Then, to push for a distributive policy that will have to do its part.","503",NA
"Gobernar también es crear trabajo.","To govern is also to create jobs.","701",NA
"La justicia social manda la creación de trabajo formal y digno para todas las personas.","Social justice mandates the creation of formal and decent work for all people.","701",NA
"Asumimos el debate sobre las nuevas formas y modalidades que los avances de la ciencia y de la técnica imponen al trabajo humano en nuestra época y el futuro inmediato, pero siempre a partir de la convicción inquebrantable de que el trabajo en condiciones dignas es un requisito indispensable para la realización de la persona humana.","We assume the debate on the new forms and modalities that the advances of science and technology impose on human work in our time and the immediate future, but always from the unshakable conviction that work in dignified conditions is an indispensable requirement for the fulfillment of the human person.","701",NA
"Esa exigencia supone la necesidad de avanzar hacia la incorporación al empleo formal de los millones de trabajadores que, por estar fuera de la ley, se encuentran hoy sometidos a condiciones laborales indignas, privados de sus derechos y carentes de la cobertura de la seguridad social.","This demand implies the need to move towards the incorporation into formal employment of the millions of workers who, because they are outside the law, are currently subjected to undignified working conditions, deprived of their rights and lacking social security coverage.","701",NA
"A fin de posibilitar una mayor generación de empleo y condiciones más favorables para la inversión, cuando la oportunidad lo indique, esto es en momentos de expansión de la economía, será necesario encarar una modernización en el régimen de trabajo,","In order to make possible a greater generation of employment and more favorable conditions for investment, when the opportunity so indicates, that is, in times of economic expansion, it will be necessary to modernize the labor regime,","701",NA
"que en cada una de las actividades productivas tendrá que ser consensuada entre las entidades empresarias y las organizaciones sindicales.","which in each of the productive activities will have to be agreed upon by the business entities and the labor unions.","701",NA
"La movilidad social ascendente tiene que volver a estar en la base de la cultura de los argentinos.","Upward social mobility must once again be at the basis of the culture of Argentines.","503",NA
"Esta perspectiva implica dejar atrás las visiones que circunscriben el tema de la pobreza a la ""inclusión social"",","This perspective implies leaving behind the visions that circumscribe the issue of poverty to ""social inclusion"",","503",NA
"que en realidad no están orientadas a erradicar la marginalidad sino a una simple tarea de contención, a través de la perpetuación de un asistencialismo estatal asociado al clientelismo político.","which in reality are not aimed at eradicating marginality but rather at a simple task of containment, through the perpetuation of state assistance associated with political clientelism.","304",NA
"Esto exige que el Estado no sólo genere condiciones para la igualdad de oportunidades, sino que también atienda al hecho de que las víctimas de las desigualdades sociales preexistentes requieren un tratamiento especial y prioritario, para que ellas y sus familias tengan la posibilidad de salir definitivamente de la pobreza.","This requires the State not only to generate conditions for equal opportunities, but also to address the fact that the victims of pre-existing social inequalities require special and priority treatment, so that they and their families have the possibility of escaping poverty once and for all.","503",NA
"En ese sentido, es prioritario encontrar los mecanismos financieros que posibiliten la implementación efectiva de la ley que establece el acceso a la propiedad de la tierra y la vivienda digna para los centenares de miles familias que no tienen por si solas la posibilidad de acceder a ellas.","In this sense, it is a priority to find the financial mechanisms that make possible the effective implementation of the law that establishes access to land ownership and decent housing for the hundreds of thousands of families who do not have the possibility of accessing them on their own.","504",NA
"7. FEDERALISMO Y REDISEÑO DE LA GEOGRAFÍA ECONÓMICA","7. FEDERALISM AND REDESIGN OF ECONOMIC GEOGRAPHY","H",NA
"La Argentina es un país unitario con una Constitución federal.","Argentina is a unitary country with a federal Constitution.","301",NA
"El desafío de la desigualdad no involucra solamente la disparidad de ingresos entre los distintos sectores sociales, sino también los enormes contrastes entre las distintas regiones del país,","The challenge of inequality involves not only the income disparity between the different social sectors, but also the enormous contrasts between the different regions of the country,","301",NA
"que tienen como consecuencia la concentración demográfica en los grandes conurbanos, con una incidencia cada vez mayor en el tema de la inseguridad pública.","which have resulted in the demographic concentration in the large conurbations, with an increasing impact on the issue of public insecurity.","605.1",NA
"Tenemos que rediseñar la geografía económica argentina, para transformar la actual estructura centralista y macrocéfala, y avanzar en un camino que posibilite el desarrollo autónomo de todas las regiones y provincias argentinas, de manera de generar las bases materiales de un federalismo real, que no se limite a la letra constitucional, sino que se verifique en el campo de los hechos.","We have to redesign Argentina's economic geography, to transform the current centralist and macrocephalous structure, and move forward on a path that enables the autonomous development of all Argentine regions and provinces, so as to generate the material bases of a real federalism, which is not limited to the letter of the Constitution, but is verified in the field of facts.","301",NA
"En esas condiciones, es posible encarar una vasta tarea de ampliación de nuestras fronteras productivas, a partir de la realización de múltiples obras de infraestructura que permitan,","Under these conditions, it is possible to undertake a vast task of expanding our productive frontiers, starting with the implementation of multiple infrastructure works that will allow us to","411",NA
"impulsar una nueva epopeya colonizadora del territorio nacional, de dimensiones semejantes a la que, desde mediados del siglo XIX, sentó las bases de la Argentina del primer centenario.","promote a new colonizing epic of the national territory, of similar dimensions to the one that, since the mid-nineteenth century, laid the foundations of the Argentina of the first centenary.","601.1",NA
"Esto requiere una mayor, mejor y coordinada infraestructura de transportes y comunicaciones: trenes, autopistas, obras energéticas, dragado de ríos y ampliación del sistema de telecomunicaciones, factores indispensables para la creación de incentivos para una redistribución más equilibrada de la población.","This requires more, better and coordinated transport and communications infrastructure: trains, highways, energy works, dredging of rivers and expansion of the telecommunications system, all of which are indispensable for creating incentives for a more balanced redistribution of the population.","411",NA
"En ese terreno, la prioridad es la reconstrucción del sistema ferroviario y un sistema de conexiones aéreas múltiples, abierto y de bajo costo.","In this area, the priority is the reconstruction of the railway system and a system of multiple, open and low-cost air connections.","411",NA
"Del mismo modo, resulta fundamental avanzar en la materialización de las conexiones bioceánicas.","Likewise, it is essential to advance in the materialization of bioceanic connections.","411",NA
"Históricamente, la economía argentina tuvo la mirada puesta casi exclusivamente en la frontera atlántica, que la une con Europa.","Historically, Argentina's economy has focused almost exclusively on the Atlantic border, which links it to Europe.","411",NA
"Ahora tiene que profundizar su frontera americana que nos vincula con los países vecinos y a través de Chile con el Océano Pacífico, vía de comunicación con los grandes mercados del sudeste asiático, principal locomotora hoy de la economía mundial.","Now it has to deepen its American border that links us with neighboring countries and through Chile with the Pacific Ocean, a means of communication with the large markets of Southeast Asia, the main locomotive of the world economy today.","411",NA
"Esta visión tiene que complementarse con el diseño de una política territorial y demográfica que corrija la continuación de un proceso de urbanización anárquico y desordenado.","This vision must be complemented by the design of a territorial and demographic policy that corrects the continuation of an anarchic and disorderly urbanization process.","301",NA
"Esta política no supone en absoluto promover la exclusión de quienes deseen vivir bajo la ley en suelo argentino, sino el propósito de impulsar un ordenamiento racional del desarrollo urbano.","This policy in no way implies promoting the exclusion of those who wish to live under the law on Argentine soil, but rather the purpose of promoting a rational ordering of urban development.","411",NA
"8. TRANSPARENCIA Y DECENCIA COMO PARTE FUNDAMENTAL DEL MODELO DE DESARROLLO","8. TRANSPARENCY AND DECENCY AS A FUNDAMENTAL PART OF THE DEVELOPMENT MODEL","H",NA
"Un programa estratégico para el desarrollo de la Argentina demanda contar con el protagonismo de un Estado inteligente y eficiente, capaz de sostener una relación virtuosa con los sectores económicos particulares, para dinamizar las herramientas que permitan alcanzar los objetivos que se propongan.","A strategic program for the development of Argentina requires the leading role of an intelligent and efficient State, capable of sustaining a virtuous relationship with the particular economic sectors, in order to dynamize the tools to achieve the proposed objectives.","404",NA
"Esa relación interactiva con el sector privado tiene que estar dotada de una absoluta transparencia como característica ineludible de la gestión y la administración.","This interactive relationship with the private sector must be endowed with absolute transparency as an inescapable characteristic of management and administration.","304",NA
"Este punto tiene que ser uno de los ejes principales de un entendimiento nacional, en el que deben confluir todas las organizaciones políticas y también sociales y sectoriales, comprometidas para producir un cambio fundamental destinado a recuperar la credibilidad y la confianza pública.","This point must be one of the main axes of a national understanding, in which all political, social and sectorial organizations must converge, committed to bring about a fundamental change aimed at recovering credibility and public confidence.","304",NA
"Así como la convivencia política instaurada a partir de la restauración de la democracia en 1983 estuvo basada en un pacto social fundado en el ""Nunca Más"" al terrorismo de Estado,","Just as the political coexistence established after the restoration of democracy in 1983 was based on a social pact founded on the ""Never Again"" to State terrorism,","305.5",NA
"en esta nueva etapa es necesario un acuerdo nacional para erradicar definitivamente la ""corrupción de Estado"", asumido como un compromiso irrevocable de todos los argentinos.","in this new stage a national agreement is necessary to eradicate ""State corruption"" once and for all, assumed as an irrevocable commitment of all Argentines.","304",NA
"Porque en la Argentina la corrupción se ha transformado en un fenómeno de carácter sistémico, combatirla demanda una respuesta de fondo, acorde con la gravísima amenaza que significa para la democracia.","Because corruption has become a systemic phenomenon in Argentina, combating it requires an in-depth response, in line with the very serious threat it poses to democracy.","304",NA
"No corresponde ignorar que detrás de cada funcionario corrupto hay un empresario que paga y se distribuyen los beneficios.","It should not be ignored that behind every corrupt official there is a businessman who pays and distributes the benefits.","304",NA
"La ley tiene que ser igual para todos y su cumplimiento irrestricto una obligación ineludible que no admite excepciones.","The law must be equal for all and its unrestricted compliance must be an unavoidable obligation that admits of no exceptions.","202.1",NA
"El mayor incentivo para la corrupción es la impunidad, cuya existencia es responsabilidad de los magistrados.","The greatest incentive for corruption is impunity, the existence of which is the responsibility of the magistrates.","304",NA
"Frente a ello, el Poder Judicial debe producir una profunda recomposición en el propio cuerpo, para poder desarrollar una acción despojada de sospechas que brinde, con eficacia y sin demoras, las respuestas que reclama la ciudadanía.","Faced with this, the Judiciary must produce a profound recomposition in its own body, in order to develop an action stripped of suspicion that provides, effectively and without delay, the answers demanded by the citizenship.","202.1",NA
"La política tampoco puede desentenderse de la responsabilidad que le corresponde en esta situación, asegurando las herramientas para investigar y sancionar esos delitos.","Nor can politics ignore its responsibility in this situation, ensuring the tools to investigate and punish these crimes.","304",NA
"Al mismo tiempo, se necesita impulsar una reforma procesal para simplificar y agilizar la tramitación de los juicios, sin perjuicio de la calidad de la justicia y los principios del derecho.","At the same time, procedural reform is needed to simplify and expedite the processing of trials, without prejudice to the quality of justice and the principles of law.","303",NA
"Es urgente recuperar la moral y la ética en la vida pública, promoviendo los castigos que correspondan para quienes se enriquecen ilícitamente y a costa de recursos públicos que se sustraen a quienes más necesitan la acción del Estado.","It is urgent to recover morality and ethics in public life, promoting the corresponding punishments for those who enrich themselves illicitly and at the expense of public resources that are taken away from those who most need the action of the State.","304",NA
"Sólo la erradicación definitiva de este mal nos permitirá reconstruir la cultura del esfuerzo y el trabajo necesarios para progresar.","Only the definitive eradication of this evil will allow us to rebuild the culture of effort and work necessary for progress.","304",NA
"La Oficina Anticorrupción debe transformarse en un órgano independiente del Poder Ejecutivo.","The Anti-Corruption Office must be transformed into a body independent from the Executive Branch.","304",NA
"Los organismos de control y entes reguladores tienen que integrarse profesionalmente, funcionando con transparencia, responsabilidad y eficacia.","The control and regulatory agencies must be professionally integrated, operating with transparency, accountability and efficiency.","304",NA
"Es necesario impulsar una nueva legislación para establecer un sistema similar al antiguo ""juicio de residencia"", para que todo funcionario público, al abandonar su cargo, rinda cuentas sobre su gestión y patrimonio.","It is necessary to promote new legislation to establish a system similar to the old ""juicio de residencia"", so that every public official, upon leaving office, is accountable for his or her management and assets.","304",NA
"9. DEFENDER LA SOBERANÍA Y ASEGURAR LA PAZ INTERIOR","9. TO DEFEND SOVEREIGNTY AND ENSURE DOMESTIC PEACE","H",NA
"En un escenario mundial signado por los avances del delito transnacional, que incluye el narcotráfico, el terrorismo, el lavado de dinero y la trata de personas, resulta necesario reformular las políticas de Seguridad y Defensa para adecuarlas a estos nuevos desafíos.","In a world scenario marked by the advances of transnational crime, including drug trafficking, terrorism, money laundering and human trafficking, it is necessary to reformulate security and defense policies to adapt them to these new challenges.","605.1",NA
"La seguridad es un derecho fundamental que tiene al Estado como protagonista y garante.","Security is a fundamental right in which the State is the protagonist and guarantor.","605.1",NA
"Las instituciones públicas tienen que definir, con urgencia impostergable, una estrategia política eficaz, integral, compleja, multidisciplinaria y coordinada frente al delito, que garantice este derecho.","Public institutions must define, as a matter of urgency, an effective, comprehensive, complex, multidisciplinary and coordinated political strategy to guarantee this right.","605.1",NA
"En este sentido, se requiere profundizar las tareas de prevención del delito, que exigen reforzar la inteligencia criminal para una mayor eficiencia en la lucha contra los delitos suprajurisdiccionales.","In this sense, it is necessary to deepen crime prevention tasks, which require the strengthening of criminal intelligence for greater efficiency in the fight against supra-jurisdictional crimes.","605.2",NA
"No se trata sólo de garantizar la indispensable protección de nuestras fronteras, sino de establecer mecanismos transversales y transnacionales para proteger a la sociedad de estos flagelos.","It is not only a matter of guaranteeing the indispensable protection of our borders, but also of establishing transversal and transnational mechanisms to protect society from these scourges.","107",NA
"También es necesario avanzar en la incorporación de nuevas tecnologías","It is also necessary to advance in the incorporation of new technologies","605.1",NA
"y en el establecimiento de mecanismos eficientes de control ciudadano sobre las fuerzas de seguridad, para enfrentar la corrupción, y los servicios de inteligencia, evitando que sean empleados ilegalmente con fines políticos.","and in the establishment of efficient mechanisms of citizen control over the security forces, to confront corruption, and the intelligence services, preventing them from being used illegally for political purposes.","304",NA
"Corresponde asimismo impulsar una profunda transformación del sistema penitenciario, para que las cárceles cumplan con su misión de promover la reinserción social y no sean un postgrado del delito.","It is also necessary to promote a profound transformation of the penitentiary system, so that prisons fulfill their mission of promoting social reintegration and are not a postgraduate program for crime.","605.2",NA
"Al mismo tiempo, hay que replantear la política de Defensa Nacional, para subordinarla a la política exterior.","At the same time, the National Defense policy must be rethought in order to subordinate it to foreign policy.","107",NA
"Si bien la integración regional ha eliminado las viejas hipótesis de conflicto con los países limítrofes, la ocupación del espacio territorial (en especial la Patagonia), la preservación de nuestros recursos naturales, particularmente en nuestra plataforma submarina, y el pleno ejercicio de nuestra soberanía nacional, exigen una reestructuración de la Fuerzas Armadas, con una nueva perspectiva estratégica y tecnológica, que demande redefinir su misión y su despliegue territorial, su equipamiento y su formación profesional.","Although regional integration has eliminated the old hypotheses of conflict with neighboring countries, the occupation of the territorial space (especially Patagonia), the preservation of our natural resources, particularly in our submarine platform, and the full exercise of our national sovereignty, require a restructuring of the Armed Forces, with a new strategic and technological perspective, which demands redefining its mission and territorial deployment, its equipment and its professional training.","104",NA
"10. UNA NACIÓN CON PRESENCIA EN EL MUNDO","10. A NATION WITH A PRESENCE IN THE WORLD","H",NA
"La Argentina no puede recaer en un aperturismo indiscriminado ni en un aislacionismo suicida.","Argentina cannot relapse into indiscriminate openness or suicidal isolationism.","107",NA
"La política exterior demanda una estrategia inteligente y pragmática, que articule una efectiva afirmación del interés nacional, especialmente la defensa de la producción y el trabajo argentino, con una cultura de la asociación apropiada a la época.","Foreign policy demands an intelligent and pragmatic strategy, which articulates an effective affirmation of the national interest, especially the defense of Argentine production and labor, with a culture of association appropriate to the times.","406",NA
