"text","text_en","cmp_code","eu_code"
"Se focalizaran acciones que mejoren las condiciones de los colectivos con dificultades de inserción en el mercado de trabajo, a saber: jóvenes —con especial énfasis en el grupo de jóvenes que no estudian ni trabajan—, trabajadores desocupados de larga data, mujeres jefas de hogar, adultos mayores y miembros de grupos vulnerables.","Actions will be focused on improving the conditions of groups with difficulties of insertion in the labor market, namely: young people -with special emphasis on the group of young people who are neither studying nor working-, long-term unemployed workers, female heads of household, senior citizens and members of vulnerable groups.","706",NA
"Fortalecimiento de la inspección del trabajo: la Nación dará el apoyo necesario a aquellas provincias que lo necesitasen para contar con un cuerpo de inspectores suficientes en número y calificación.","Strengthening of labor inspection: the Nation will provide the necessary support to those provinces that need it in order to have a body of inspectors that is sufficient in number and qualification.","701",NA
"Fijación de objetivos en materia de inspección, en el seno del Consejo Federal del Trabajo (CFT) habiéndose definido las pautas de evaluación.","Setting of inspection objectives within the Federal Labor Council (CFT), having defined the evaluation guidelines.","701",NA
"Políticas activas de empleo: desocupados de larga data, trabajadores formales, expandir las Oficinas de Empleo.","Active employment policies: long-term unemployed, formal workers, expansion of Employment Offices.","701",NA
"7. Cultura","7. Culture",NA,NA
"La dimensión cultural es un aporte imprescindible en la vida de los seres humanos.","The cultural dimension is an essential contribution to the life of human beings.","502",NA
"El concepto de calidad de vida no se sostiene si éste no incluye la estimulación de las representaciones simbólicas que hacen a nuestra identidad y al cuidado de nuestro imaginario que hace a nuestro patrimonio histórico y cultural.","The concept of quality of life cannot be sustained if it does not include the stimulation of the symbolic representations that make up our identity and the care of our imaginary that makes up our historical and cultural heritage.","502",NA
"En consecuencia, las políticas culturales deben alcanzar la vida de todos los ciudadanos/as y llegar a todos los ámbitos donde cotidianamente ocurre la vida de los argentinos y argentinas.","Consequently, cultural policies must reach the lives of all citizens and reach all areas where the lives of Argentine men and women occur on a daily basis.","502",NA
"Las políticas culturales deben ayudar a reflexionar, a pensar, a que el ciudadano se exprese y encuentre respuestas a los disímiles interrogantes que la complejidad de la sociedad contemporánea presenta.","Cultural policies should help citizens to reflect, to think, to express themselves and to find answers to the dissimilar questions that the complexity of contemporary society presents.","502",NA
"El sentido de una sociedad está constituido en metas comunes, sus sueños, los anhelos de las generaciones pasadas y su voluntad de llevarlos adelante y todo esto pervive y se expresa con mayor claridad en las manifestaciones culturales.","The meaning of a society is constituted in common goals, its dreams, the yearnings of past generations and their will to carry them forward, and all this survives and is expressed with greater clarity in cultural manifestations.","502",NA
"Una sociedad basada sólo en el consumo y en el éxito económico está vacía e irremediablemente condenada a su disgregación.","A society based only on consumption and economic success is empty and irremediably condemned to disintegration. -","000",NA
"• Derechos culturales","Cultural rights","502",NA
"Todo ser humano tiene el derecho de poder crear dentro de su mundo interior, dentro de su universo privado, las capacidades y las sensibilidades para comprender las manifestaciones culturales y artísticas de sus congéneres y, al mismo tiempo, poder expresarse libremente utilizando las herramientas que la humanidad ha creado.","Every human being has the right to be able to create within his inner world, within his private universe, the capacities and sensibilities to understand the cultural and artistic manifestations of his fellow human beings and, at the same time, to be able to express himself freely using the tools that humanity has created.","502",NA
"Una esperanza que, basada en las pasiones, emociones, anhelos y fundamentalmente en los actos de amor al prójimo, perpetuados en poemas, canciones, novelas, cuentos, ensayos, obras plásticas, obras fílmicas, nos permita seguir creyendo en el género humano.","A hope that, based on passions, emotions, longings and, fundamentally, on acts of love for our fellow man, perpetuated in poems, songs, novels, stories, essays, plastic works, filmic works, allows us to continue believing in the human race.","502",NA
"En esta inteligencia, el desarrollo de la dimsención cultural en cada individuo, aparece como un valor indispensable en la creación de una sociedad más justa y solidaria, imponiendo el derecho cultural la categoría de derecho humano básico e impostergable.","In this understanding, the development of the cultural dimension in each individual appears as an indispensable value in the creation of a more just and solidary society, imposing the cultural right as a basic and unpostponable human right. -","502",NA
"• Industrias culturales","Cultural industries","502",NA
"Otro concepto muy importante es el de diversidad cultural.","Another very important concept is that of cultural diversity.","607.1",NA
"Estamos cada uno construidos culturalmente a partir de lo que hemos sido, de lo que han sido nuestros ascendientes y lo que elegimos ser.","We are each culturally constructed from what we have been, from what our ancestors have been and what we choose to be.","607.1",NA
"Hay diversas formas de construirse culturalmente; existen personas que trabajan en la sociedad que representa a los inmigrantes de su familia y tienen toda una conexión con ese pasado y con esa colonización que llegó a un lugar y a la cual hoy le agrega el sello contemporáneo, es decir, la impronta de su tiempo y espacio.","There are different ways of cultural construction; there are people who work in the society that represents the immigrants of their family and have a connection with that past and with that colonization that came to a place and to which today they add the contemporary stamp, that is to say, the imprint of their time and space.","607.1",NA
"A su vez, existe una cantidad de elecciones que hoy nos permiten la vida cultural y los distintos recursos tecnológicos, desde ese centro cultural que se instala en nuestra casa y abre todas las noches sus puertas para transmitirnos determinados valores —el televisor— hasta Internet, que también nos permite elegir formar parte de lo que se llaman las tribus urbanas, chicos y no tan chicos que escuchan determinadas músicas, que leen determinadas literaturas y que a partir de esa música, de esas lecturas, asumen determinados valores de vida, determinadas filosofías.","At the same time, there are a number of choices that cultural life and the different technological resources allow us to make today, from that cultural center that is installed in our home and opens its doors every night to transmit certain values -the television- to the Internet, which also allows us to choose to be part of what are called urban tribes, children and not so young people who listen to certain music, who read certain literature and who, from that music, from those readings, assume certain values of life, certain philosophies.","502",NA
"La diversidad cultural está relacionada con el pluralismo cultural, con reconocer que esa construcción que existe en cada uno de nosotros existe también en el otro.","Cultural diversity is related to cultural pluralism, to recognizing that the construction that exists in each of us also exists in others.","607.1",NA
"Entonces, la diversidad es un concepto esencial e insoslayable a la hora de proyectar políticas públicas culturales.","Thus, diversity is an essential and unavoidable concept when it comes to projecting cultural public policies.","607.1",NA
"Bajo este análisis se puede visualizar que existen determinadas formas y estilos culturales que en la actualidad tienen mayor difusión en los medios de comunicación porque poseen aceptación masiva y a su vez producen grandes ganancias comerciales.","Under this analysis it can be seen that there are certain cultural forms and styles that currently have greater diffusion in the media because they have mass acceptance and in turn produce large commercial profits.","502",NA
"En este panorama el Estado y la sociedad civil deben estar dispuestos a brindarle y otorgarle valor también a aquellas expresiones culturales que no son hoy rentables para el mercado.","In this scenario, the State and civil society must be willing to offer and give value also to those cultural expressions that are not profitable for the market today.","502",NA
"Pensando en la diversidad, la tarea estratégica es tratar de preservar todos aquellos patrones culturales que hoy no están en el candelero y no circulan en los medios masivos de comunicación, porque es una obligación que tenemos hacia las generaciones futuras preservar todas las formas culturales para transmitirlas.","Thinking about diversity, the strategic task is to try to preserve all those cultural patterns that today are not in the limelight and do not circulate in the mass media, because it is an obligation we have towards future generations to preserve all cultural forms in order to transmit them.","607.1",NA
"Este rescate patrimonial, este rescate de las culturas que hoy no están siendo puestas en valor, es indispensable a la hora de pensar sociedades plurales basadas en su historia y en su producción.","This heritage rescue, this rescue of cultures that today are not being valued, is indispensable when thinking about plural societies based on their history and production.","607.1",NA
"Defender nuestra libertad en la elaboración de nuestras expresiones culturales es en definitiva, poder proyectarnos como seres humanos en un futuro mejor.","To defend our freedom in the elaboration of our cultural expressions is, in short, to be able to project ourselves as human beings into a better future.","502",NA
"En consecuencia, el Estado debe tener imprescindiblemente políticas activas en el tema de industrias culturales.","Consequently, the State must have active policies on the subject of cultural industries.","502",NA
"La producción de bienes culturales conforma nuestra simbolización del mundo, nuestro imaginario, lo que pensamos de nuestra sociedad, lo que pensamos de nuestra provincia, de nuestra ciudad, lo que pensamos de nuestro pueblo, de nuestro futuro.","The production of cultural goods shapes our symbolization of the world, our imaginary, what we think of our society, what we think of our province, of our city, what we think of our people, of our future.","502",NA
"Los sueños de una comunidad están siempre marcados por la producción cultural y artística que realiza.","The dreams of a community are always marked by its cultural and artistic production. - The","502",NA
"• Conformación de un espacio cultural argentino","creation of an Argentine cultural space Thinking","502",NA
"Pensando en la producción y en la circulación de bienes culturales, la conformación de un espacio donde se conozcan las producciones culturales de todas las regiones de nuestra provincia, se pongan en valor y se produzcan nuevas manifestaciones, como consecuencia de la interrelación de las distintas regiones, aparece como una necesidad imperiosa.","about the production and circulation of cultural goods, the creation of a space where the cultural productions of all the regions of our province are known, valued and new manifestations are produced, as a consequence of the interrelation of the different regions, appears as an imperative need.","502",NA
"Un espacio que exhiba las formaciones culturales locales atravesadas por estructuras y flujos globales, que muestre la multiculturalidad contenida en Argentina, con los enfoques e intereses algunas veces encontrados, algunas veces complementarios.","A space that exhibits local cultural formations crossed by global structures and flows, that shows the multiculturality contained in Argentina, with approaches and interests sometimes conflicting, sometimes complementary.","607.1",NA
"Este espacio cultural argentino es pensado como un ámbito territorial, comunicacional y virtual, compuesto por espacios y circuitos donde se reconocen raíces étnicas e históricas, comunidades interculturales, de género, etc., donde los recursos patrimoniales que nos cohesionan son las tradiciones orales, las culturas populares, las memorias históricas y también los sistemas educativos, las industrias culturales y los modos de comunicación.","This Argentine cultural space is thought of as a territorial, communicational and virtual environment, made up of spaces and circuits where ethnic and historical roots, intercultural and gender communities, etc. are recognized, where the patrimonial resources that bind us together are oral traditions, popular cultures, historical memories and also educational systems, cultural industries and modes of communication.","607.1",NA
"En síntesis, un espacio que considere y estimule las interacciones territoriales, económicas, sociales, culturales y mediáticas, que interconecte hacia el interior de cada provincia la producción provincial, permitiéndonos apreciar la infinita riqueza cultural que la diversidad le brinda a Argentina.","In short, a space that considers and stimulates territorial, economic, social, cultural and media interactions, interconnecting provincial production to the interior of each province, allowing us to appreciate the infinite cultural richness that diversity offers Argentina.","607.1",NA
"C-CUESTIONES ECONÓMICAS","C-ECONOMIC ISSUES",NA,NA
"Para lograr una mejora sustancial en las condiciones de vida de la población es necesario articular las políticas en el marco de un proyecto integral de desarrollo.","In order to achieve a substantial improvement in the living conditions of the population, it is necessary to articulate policies within the framework of an integral development project.","404",NA
"Si bien cada área tiene sus políticas específicas, ni lo social ni lo económico concebidos individualmente, pueden generar cambios sólidos.","Although each area has its own specific policies, neither social nor economic policies, taken individually, can generate solid changes.","305.1",NA
"Es necesario implementar un abordaje conjunto entre las políticas de desarrollo económico y social para avanzar con equidad e innovación hacia un mejor país para todos y todas.","It is necessary to implement a joint approach between economic and social development policies in order to advance with equity and innovation towards a better country for all.","503",NA
"Con el objetivo común de lograr una distribución más equitativa de los recursos e ingresos, debemos fortalecer las relaciones intersectoriales de cooperación, coordinación y complementariedad entre los diferentes actores económicos y sociales.","With the common goal of achieving a more equitable distribution of resources and income, we must strengthen intersectoral relations of cooperation, coordination and complementarity among the different economic and social actors.","503",NA
"Nuestra idea de la producción acentúa la importancia de las cadenas de valor en los sistemas productivos, alejándose de concepciones segmentadas de la producción.","Our idea of production emphasizes the importance of value chains in production systems, moving away from segmented conceptions of production.","404",NA
"En materia de políticas sociales adoptamos una perspectiva multidisciplinaria con enfoque de derechos.","In the area of social policies, we adopt a multidisciplinary perspective with a rights-based approach.","601.1",NA
"Nuestro objetivo es pasar de una sociedad de beneficiarios, característicos de una política social prebendaria, a una sociedad de ciudadanos y ciudadanas ejerciendo derechos.","Our objective is to move from a society of beneficiaries, characteristic of a welfare policy, to a society of citizens exercising their rights.","601.1",NA
"1. Propuesta macroeconómica","Macroeconomic proposal",NA,NA
"La política macroeconómica se propone generar las condiciones para alcanzar un crecimiento sostenido, con generación de empleo que desemboque en una mejora de la distribución del ingreso y la erradicación la pobreza.","Macroeconomic policy aims to generate the conditions to achieve sustained growth, with employment generation leading to an improvement in income distribution and poverty eradication.","410",NA
"Es una propuesta macroeconómica que prioriza la reducción de la pobreza como objetivo final.","It is a macroeconomic proposal that prioritizes poverty reduction as the ultimate goal.","503",NA
"La visión de largo plazo que se requiere para alcanzar los objetivos enunciados toma a la sustentabilidad y a la estabilidad macroeconómica como base del verdadero crecimiento y del desarrollo.","The long-term vision required to achieve these objectives takes sustainability and macroeconomic stability as the basis for true growth and development.","404",NA
"Entre los determinantes profundos del crecimiento se destacan: el papel de las instituciones (las reglas del juego), la estabilidad de las políticas macroeconómicas y el papel que puedan cumplir las políticas activas en impulsar el crecimiento.","The deep determinants of growth include: the role of institutions (the rules of the game), the stability of macroeconomic policies and the role that active policies can play in boosting growth.","404",NA
"El armado de cualquier estrategia requiere precisar el diagnóstico de cuál será el punto de partida, o sea la situación del país en 2012.","Any strategy requires a precise diagnosis of the starting point, i.e., the country's situation in 2012.","404",NA
"El rumbo económico actual tiene una dinámica inequívocamente divergente.","The current economic course has an unequivocally divergent dynamic.","305.1",NA
"Las mejoras en el ambiente externo (alto precio de los granos y dólar mundialmente devaluado) contribuyen a prolongar la vida del modelo actual, pero difícilmente puedan romper el círculo vicioso actual que propaga el financiamiento inflacionario del gasto creciente.","Improvements in the external environment (high grain prices and a devalued dollar) contribute to prolonging the life of the current model, but are unlikely to break the current vicious circle that propagates the inflationary financing of growing spending.","305.1",NA
"La recuperación económica pos colapso de la convertibilidad ha sido significativa.","The economic recovery following the collapse of convertibility has been significant.","305.1",NA
"Pero los avances iniciales muestran desde hace no menos de tres años un estancamiento, particularmente en lo que tiene que ver con indicadores sociales.","However, initial progress has been stagnating for at least three years, particularly in terms of social indicators.","503",NA
"Resulta inaceptable que con semejante recuperación uno de cada tres argentinos viva todavía en la pobreza y ello no haya cambiado en los últimos años.","It is unacceptable that with such a recovery, one out of every three Argentines still lives in poverty and this has not changed in recent years.","305.1",NA
"La economía se ha recuperado en 2010, luego de haber entrado en recesión en la última mitad de 2008 y buena parte de 2009, aunque deberá abordar el próximo gobierno déficit fiscal, presiones inflacionarias crecientes, escaso crecimiento del empleo y aumento de situaciones de conflictividad social.","The economy has recovered in 2010, after having entered recession in the last half of 2008 and most of 2009, although the next government will have to deal with fiscal deficits, rising inflationary pressures, low employment growth and increasing social unrest.","305.1",NA
"La inflación elevada no es neutral, particularmente tiene efectos sobre la distribución del ingreso y la pobreza.","High inflation is not neutral, in particular it has effects on income distribution and poverty.","503",NA
"La inflación no provoca una crisis inmediata sino que va debilitando el tejido social de manera progresiva.","Inflation does not cause an immediate crisis, but rather weakens the social fabric progressively.","305.1",NA
"Esto no parece ser reconocido por el gobierno que privilegia el cortoplacismo por encima de las construcciones a largo plazo.","This does not seem to be recognized by the government, which favors short-termism over long-term constructions.","305.1",NA
"La clave entonces consiste en el diseño de un conjunto equilibrado de políticas que logre cumplir con: crecimiento con reducida inflación,","The key, then, is to design a balanced set of policies that will achieve: growth with low inflation,","408",NA
"creación de empleo que permita reducir la pobreza y la indigencia","job creation to reduce poverty and indigence","701",NA
"y una mejora en la distribución del ingreso.",", and an improvement in income distribution.","503",NA
"No obstante, la situación de exclusión social en que se encuentra una amplia franja de la población impone un condicionante adicional en el diseño de la estrategia macro: aún el mejor esquema macroeconómico resulta insuficiente por sí solo para eliminar la indigencia y reducir significativamente la pobreza.","However, the situation of social exclusion in which a large part of the population finds itself imposes an additional conditioning factor on the design of the macroeconomic strategy: even the best macroeconomic scheme is insufficient on its own to eliminate extreme poverty and significantly reduce poverty.","503",NA
"Resulta imprescindible implementar entonces políticas universales que garanticen ingresos y acceso a servicios esenciales en salud, educación y vivienda al conjunto de la población.","It is therefore essential to implement universal policies that guarantee income and access to essential health, education and housing services for the entire population.","504",NA
"Está comprobado que las políticas fiscales más efectivas son las políticas de gasto público que reasignan las prioridades hacia objetivos sociales.","It has been proven that the most effective fiscal policies are public spending policies that reallocate priorities towards social objectives.","504",NA
"La política macroeconómica se basará en: 1) el establecimiento de un esquema metas de inflación que actúe como un ancla de las expectativas inflacionarias;","Macroeconomic policy will be based on: 1) the establishment of an inflation targeting scheme that acts as an anchor for inflationary expectations;","404",NA
"2) intervenciones cambiarias con un objetivo para el sendero del tipo de cambio que garantice la sustentabilidad externa e impulse la generación de empleo;","2) exchange rate interventions with a target for the exchange rate path that guarantees external sustainability and boosts employment generation;","414",NA
"3) una regla fiscal que garantice la sustentabilidad de la deuda a la vez que constituya un apoyo para la política monetaria y cambiaria.","3) a fiscal rule that guarantees debt sustainability while constituting a support for monetary and exchange rate policy.","414",NA
"Un esquema de metas de inflación es aplicable a una economía como la de Argentina si se lo adapta apropiadamente, incorporando la política cambiaria como instrumento independiente, sin descartar los controles a la cuenta financiera internacional, al mismo tiempo que se decida reforzar, en lugar de relajar, aspectos más tradicionales de la política macro, como una política fiscal que garantice la sustentabilidad fiscal ínter temporal y que a la vez constituya una herramienta de política anticíclica.","An inflation targeting scheme is applicable to an economy such as Argentina's if it is appropriately adapted, incorporating exchange rate policy as an independent instrument, without discarding controls to the international financial account, while at the same time deciding to strengthen, rather than relax, more traditional aspects of macro policy, such as a fiscal policy that guarantees inter-temporal fiscal sustainability and at the same time constitutes a countercyclical policy tool.","404",NA
"La política cambiaria, a través de las intervenciones en el mercado cambiario, estará orientada principalmente a impulsar el crecimiento económico que sea externamente sostenible.","Exchange rate policy, through interventions in the foreign exchange market, will be aimed primarily at boosting externally sustainable economic growth.","414",NA
"Esta política garantiza la sustentabilidad externa e impulsa el empleo al estar el tipo de cambio asociado al precio relativo de los factores productivos (salario/renta).","This policy guarantees external sustainability and boosts employment as the exchange rate is associated with the relative price of the factors of production (wages/income).","404",NA
