"text","text_en","cmp_code","eu_code"
"Después de años de desencuentros entre los argentinos y de políticas que han provocado un enorme deterioro económico y social, así como un retroceso del país en el concierto de las naciones,","After years of misunderstandings among Argentines and policies that have caused an enormous economic and social deterioration, as well as a setback of the country in the concert of nations,","305.1",NA
"un conjunto de organizaciones políticas, sociales, sindicales, empresariales y de personas, preocupadas por el futuro de la Nación y dispuestas a contribuir al propósito de una firme recuperación, elaboraron los siguientes ""Lineamientos Básicos para un Gobierno de Unidad Nacional"", basado en preceptos profundamente humanísticos, apuntados al desarrollo integral para alcanzar un Estado con justicia y prosperidad.","a group of political, social, trade union, business and individual organizations, concerned about the future of the Nation and willing to contribute to the purpose of a firm recovery, prepared the following ""Basic Guidelines for a Government of National Unity"", based on deeply humanistic precepts, aimed at the integral development to achieve a State with justice and prosperity.","606.1",NA
"1. CONVOCATORIA A LA UNIDAD, EL DIÁLOGO, LA CONCERTACIÓN Y LA FORMULACIÓN DE ACUERDOS BÁSICOS","1. CALL FOR UNITY, DIALOGUE, CONSENSUS-BUILDING AND THE FORMULATION OF BASIC AGREEMENTS","H",NA
"La situación que atraviesa la Argentina torna imprescindible trabajar con seriedad en una amplia convocatoria a la concertación para establecer un rumbo estratégico, inspirado en una visión de largo plazo, capaz de guiar el destino nacional más allá de los gobiernos de turno, con la participación y el esfuerzo mancomunado de toda la sociedad.","The situation Argentina is going through makes it essential to work seriously on a broad call for concerted action to establish a strategic course, inspired by a long-term vision, capable of guiding the national destiny beyond the governments in office, with the participation and joint effort of the whole society.","606.1",NA
"A través del diálogo se deben encontrar acuerdos básicos, para luego convertirlos en políticas de Estado.","Through dialogue, basic agreements must be reached and then converted into State policies.","202.1",NA
"Eso posibilitará reglas de juego estables, la reducción de la conflictividad social y la reiteración traumática de cambios bruscos y cíclicos de las políticas, que destruyen la credibilidad y la confianza.","This will make it possible to establish stable rules of the game, reduce social conflict and avoid the traumatic repetition of abrupt and cyclical policy changes that destroy credibility and trust.","202.1",NA
"Ninguno de los graves problemas estructurales de la Argentina puede resolverse en el plazo de una gestión gubernamental.","None of Argentina's serious structural problems can be solved within the term of one government administration.","404",NA
"Todos exigen estrategias de mediano y largo plazo.","All require medium- and long-term strategies.","404",NA
"Baste, por ejemplo, mencionar la acuciante necesidad de una reformulación integral del sistema de seguridad social para garantizar su sustentabilidad económica, gravemente amenazada, y el mejoramiento de las prestaciones a jubilados y pensionados.","Suffice it to mention, for example, the pressing need for a comprehensive reformulation of the social security system to guarantee its economic sustainability, which is seriously threatened, and the improvement of benefits for retirees and pensioners.","504",NA
"Sólo esta continuidad en la acción puede evitar que la natural y deseable oscilación del péndulo de la política suponga volver periódicamente a fojas cero, con la consiguiente frustración de las expectativas de la sociedad.","Only this continuity of action can prevent the natural and desirable swing of the political pendulum from periodically returning to square one, with the consequent frustration of society's expectations.","305.1",NA
"Esa amplia concertación requiere la inteligencia necesaria para encontrar coincidencias básicas y promover consensos que beneficien el interés general.","This broad consensus requires the necessary intelligence to find basic coincidences and promote consensus that benefits the general interest.","202.1",NA
"No puede ser sólo el recurso desesperado de gobiernos en situaciones de crisis que intentan transferir a todo el sistema político el fracaso de su gestión.","It cannot only be the desperate recourse of governments in crisis situations that try to transfer the failure of their management to the entire political system.","305.1",NA
"Por ello, es imprescindible generar un tramado institucional que haga del diálogo una práctica permanente de la vida republicana.","Therefore, it is essential to generate an institutional framework that makes dialogue a permanent practice of republican life.","202.1",NA
"Es necesario encauzar la participación activa y responsable de las fuerzas políticas, las entidades representativas de la producción y el trabajo, las provincias, las instituciones académicas y todas las organizaciones de la sociedad civil.","It is necessary to channel the active and responsible participation of the political forces, the entities representing production and labor, the provinces, academic institutions and all civil society organizations.","202.1",NA
"En esa dirección, es imperioso avanzar hacia la constitución de un Consejo Económico y Social,","In this direction, it is imperative to move towards the creation of an Economic and Social Council, a","404",NA
"de un Consejo Federal de Planeamiento Estratégico, con la representación de las provincias y la asistencia técnica del Consejo Federal de inversiones (CFI),","Federal Strategic Planning Council, with the representation of the provinces and the technical assistance of the Federal Investment Council (CFI),","301",NA
"y de un Consejo de Estado integrado por representantes de todas las fuerzas políticas con representación parlamentaria.","and a Council of State made up of representatives of all political forces with parliamentary representation.","202.1",NA
"2. INSTITUCIONES FUERTES, ESTABILIDAD Y PROFUNDIZACIÓN DE LA DEMOCRACIA","2. STRONG INSTITUTIONS, STABILITY AND DEEPENING OF DEMOCRACY","H",NA
"Un modelo de desarrollo con capacidad de atender las problemáticas de los sectores más desprotegidos de la sociedad y asegurar mejores condiciones de vida para las generaciones futuras, necesita sostenerse en instituciones sólidas que garanticen previsibilidad y generen confianza en la ciudadanía.","A development model capable of addressing the problems of the most vulnerable sectors of society and ensuring better living conditions for future generations needs to be based on solid institutions that guarantee predictability and generate public confidence.","503",NA
"necesita sostenerse en instituciones sólidas que garanticen previsibilidad y generen confianza en la ciudadanía.","needs to be sustained by solid institutions that guarantee predictability and generate public confidence.","202.1",NA
"La política es una herramienta para la transformación de la realidad.","Politics is a tool for the transformation of reality.","202.1",NA
"A tal fin, es necesario que los partidos políticos vuelvan a erigirse como columnas del sistema democrático, de modo de dar sentido a su representación, abriendo nuevos ámbitos para la participación social.","To this end, political parties must once again become the pillars of the democratic system, in order to give meaning to their representation, opening up new areas for social participation.","202.1",NA
"Los partidos tienen que ser también actores fundamentales para la construcción de consensos y políticas de Estado, sustento de la gobernabilidad y escuelas de formación de nuevos liderazgos, que propicien la renovación de los elencos dirigentes.","The parties must also be fundamental actors for the construction of consensus and State policies, support for governability and schools for the formation of new leaderships, which favor the renewal of the leadership.","202.1",NA
"Corresponde asimismo reconocer el rol de las mujeres y los jóvenes, que son parte de las nuevas transformaciones sociales y culturales que la política debe saber interpretar.","It is also important to recognize the role of women and young people, who are part of the new social and cultural transformations that politics must know how to interpret.","706",NA
"Esto facilitará su inclusión en los ámbitos decisorios de la vida pública y el establecimiento de una perspectiva de género como parte sustancial de todas las políticas de Estado.","This will facilitate their inclusion in the decision-making spheres of public life and the establishment of a gender perspective as a substantial part of all State policies.","503",NA
"La profundización de la democracia implica que el sistema institucional otorgue una garantía eficaz para la vigencia de los derechos de las personas,","The deepening of democracy implies that the institutional system provides an effective guarantee for the enforcement of people's rights,","201.2",NA
"la implementación de mecanismos efectivos de participación ciudadana y social,","the implementation of effective mechanisms for citizen and social participation,","202.1",NA
"así como el pluralismo y la alternancia.","as well as pluralism and alternation.","202.1",NA
"El Estado de Derecho implica un funcionamiento armónico y equilibrado de los tres poderes del Estado, asegurando su funcionamiento preciso, responsable e independiente, dentro de las competencias que les asigna la Constitución Nacional.","The rule of law implies a harmonious and balanced functioning of the three branches of government, ensuring their accurate, responsible and independent operation, within the competencies assigned to them by the National Constitution.","202.1",NA
"La creación de las condiciones de competitividad e inserción internacional que requiere la Argentina demandan, como requisito ineludible, ciertos aspectos institucionales fundamentales, como la existencia de un Poder Judicial independiente y creíble,","The creation of the conditions of competitiveness and international insertion required by Argentina demands, as an unavoidable requirement, certain fundamental institutional aspects, such as the existence of an independent and credible Judiciary,","202.1",NA
"un sistema de representación popular basado en la equidad y la transparencia en las competencias electorales.","a system of popular representation based on equity and transparency in electoral competitions.","202.1",NA
"3. UN PROYECTO DE DESARROLLO INTEGRAL","3. AN INTEGRAL DEVELOPMENT PROJECT","H",NA
"Para salir de la actual situación de recesión, endeudamiento irresponsable y empobrecimiento colectivo, la Argentina necesita dejar atrás la lógica del ajuste y formular un proyecto de desarrollo integral","In order to get out of the current situation of recession, irresponsible indebtedness and collective impoverishment, Argentina needs to leave behind the logic of adjustment and formulate a comprehensive development project","404",NA
"que le posibilite desplegar la inmensa potencialidad de sus recursos humanos y naturales,","that will enable it to deploy the immense potential of its human and natural resources,","601.1",NA
"generar las condiciones para promover la inversión productiva,","generate the conditions to promote productive investment,","402",NA
"fortalecer el mercado interno","strengthen the domestic market","406",NA
"e impulsar el comercio exterior,","and boost foreign trade, to","407",NA
"para garantizar un crecimiento sustentable y un mejoramiento efectivo en el nivel de vida de nuestro pueblo.","ensure sustainable growth and an effective improvement in the standard of living of our people.","416.2",NA
"Los discursos optimistas no alcanzan para cambiar la realidad.","Optimistic speeches are not enough to change reality.","000",NA
"Se necesitan ideas nuevas y cursos de acción apropiados a las circunstancias.","New ideas and courses of action appropriate to the circumstances are needed.","305.1",NA
"El aperturismo ingenuo ignora que hoy la competencia internacional tiene un carácter sistémico.","Naïve openness ignores the fact that international competition today is systemic in nature.","406",NA
"No es sólo microeconomía sino también, y fundamentalmente, macroeconomía.","It is not only microeconomics but also, and fundamentally, macroeconomics.","404",NA
"No compiten únicamente las empresas, sino los países y las regiones.","It is not only companies that compete, but also countries and regions.","404",NA
"La competencia se libra entonces entre sistemas integrales de organización y decisión.","The competition is then fought between integral systems of organization and decision making.","404",NA
"Por eso, el mejoramiento de la competitividad empresarial tiene que sustentarse en una estrategia nacional orientada a la organización del sistema productivo argentino y de sus niveles de eficiencia institucional.","Therefore, the improvement of business competitiveness must be based on a national strategy aimed at the organization of the Argentine productive system and its levels of institutional efficiency.","404",NA
"El objetivo es una modernización internacionalmente competitiva de la economía argentina, que eluda el grave peligro de su reprimarización.","The objective is an internationally competitive modernization of the Argentine economy, which avoids the serious danger of its reprimarization.","404",NA
"Esto implica utilizar los beneficios derivados del despliegue inmediato de la enorme potencialidad exportadora de los sectores que ya presentan ventajas competitivas, como la agroindustria, la energía, los recursos minerales y las industrias del conocimiento, para construir un sólido sistema productivo que,","This implies using the benefits derived from the immediate deployment of the enormous export potential of sectors that already have competitive advantages, such as agribusiness, energy, mineral resources and knowledge industries, to build a solid productive system that,","404",NA
"a partir de la transformación de las materias primas en productos de alto valor agregado, nos permitan adquirir la diversificación necesaria para hacer de la Argentina un actor de importancia en el comercio internacional.","based on the transformation of raw materials into high value-added products, will allow us to acquire the necessary diversification to make Argentina a major player in international trade.","404",NA
"La preservación del medio ambiente y de los recursos naturales, así como la promoción del uso de las energías limpias, serán parte fundamental de este modelo de desarrollo,","The preservation of the environment and natural resources, as well as the promotion of the use of clean energies, will be a fundamental part of this development model,","501",NA
"como la inversión en ciencia y tecnología y el aliento a la innovación en todos los campos, a través del apoyo a la creación de nuevos polos tecnológicos.","as will investment in science and technology and the encouragement of innovation in all fields, through support for the creation of new technological poles.","411",NA
"De este modo será posible avanzar hacia un nuevo modelo de desarrollo que premie la actividad productiva y desaliente la especulación financiera, con una implementación inteligente que posibilite a las empresas nacionales, sobre todo a las pequeñas y mediana","In this way it will be possible to move towards a new development model that rewards productive activity and discourages financial speculation, with an intelligent implementation that will enable national companies, especially small and medium-sized ones, to undergo","402",NA
"un proceso de transición para ponerse a la altura de los cambios operados en el sistema mundial.","a transition process to catch up with the changes taking place in the global system.","411",NA
"Para mejorar la competitividad es también imprescindible una reforma impositiva progresiva, que reduzca la exorbitante presión fiscal que asfixia a la producción y al trabajo de los argentinos, para avanzar hacia una carga que aliente la inversión","In order to improve competitiveness, a progressive tax reform is also essential to reduce the exorbitant tax burden that suffocates the production and work of Argentines, in order to move towards a burden that encourages investment","402",NA
"y recaiga, de manera virtuosa y efectiva, sobre quienes más tienen y más ganan.","and falls, in a virtuous and effective manner, on those who have the most and earn the most.","503",NA
"Esa estrategia de desarrollo tiene que basar su sustentabilidad en el equilibrio macroeconómico, la eliminación del déficit en el sector público y en la cuenta corriente del balance de pagos,","This development strategy must base its sustainability on macroeconomic equilibrium, the elimination of deficits in the public sector and in the current account of the balance of payments,","414",NA
"la drástica reducción de la inflación,","the drastic reduction of inflation,","414",NA
"el control de las estructuras monopólicas y oligopólicas","the control of monopolistic and oligopolistic structures","403",NA
"y el mejoramiento sustancial de los niveles de transparencia administrativa, para recuperar la previsibilidad de la economía y la confianza de los inversores.","and a substantial improvement in the levels of administrative transparency, in order to recover the predictability of the economy and the confidence of investors.","304",NA
"En este contexto, cada vez cobra mayor valor para el desarrollo y la competitividad de la economía la calidad de los bienes públicos: educación, salud pública, justicia,","In this context, the quality of public goods: education, public health and justice, is becoming increasingly important for the development and competitiveness of the economy,","504",NA
"seguridad ciudadana,","citizen security,","605.1",NA
"vivienda","housing","504",NA
"y medio ambiente.","and environment.","501",NA
"Esto requiere una profunda reorganización del Estado que contemple una reasignación de prioridades y la optimización de estos factores y sistemas,","This requires a profound reorganization of the State that contemplates a reallocation of priorities and the optimization of these factors and systems,","404",NA
"cuidando la preservación de la dignidad de las personas, con especial atención a la niñez y a la tercera edad, en beneficio de la prosperidad del conjunto.","taking care of the preservation of people's dignity, with special attention to children and the elderly, for the benefit of the prosperity of the whole.","504",NA
"4. UNA ECONOMÍA DE MERCADO CON UN ESTADO PROMOTOR DEL CRECIMIENTO ECONÓMICO Y LA JUSTICIA SOCIAL","4. A MARKET ECONOMY WITH A STATE AS PROMOTER OF ECONOMIC GROWTH AND SOCIAL JUSTICE","H",NA
"El fortalecimiento de una sólida economía de mercado, basada en la iniciativa privada, es una condición indispensable para el desarrollo nacional.","The strengthening of a solid market economy, based on private initiative, is an indispensable condition for national development.","401",NA
"Esto exige la plena liberación de la enorme capacidad creadora de nuestras fuerzas productivas.","This demands the full liberation of the enormous creative capacity of our productive forces.","401",NA
"La misión del Estado es promover la actividad económica, no asfixiarla.","The mission of the State is to promote economic activity, not to stifle it.","401",NA
"La Argentina necesita un Estado fuerte, activo y eficiente, puesto al servicio del progreso social y el bienestar general.","Argentina needs a strong, active and efficient State, at the service of social progress and general welfare.","403",NA
"Ni un Estado burocratizado e ineficiente,","Neither a bureaucratized and inefficient State,","303",NA
"ni tampoco uno capturado por los negocios particulares de los grupos de poder.","nor one captured by the private businesses of the power groups.","304",NA
"Esto implica crear un Estado inteligente, con capacidad para el planeamiento estratégico,","This implies creating an intelligent State, with the capacity for strategic planning, with a","404",NA
"con un rol protagónico en la innovación científica y tecnológica,","leading role in scientific and technological innovation,","411",NA
"en la preservación del medio ambiente,","in the preservation of the environment, with","501",NA
"provisto de adecuadas facultades de control y aptitud de liderazgo para impulsar acciones mancomunadas con la ciudadanía y las organizaciones de la sociedad.","adequate powers of control and leadership aptitude to promote joint actions with the citizenry and society's organizations.","606.1",NA
"Para ello, es preciso terminar con la improvisación en la administración de un Estado convertido en botín de guerra de la política y elegir funcionarios públicos competentes, designados por su idoneidad profesional","To this end, it is necessary to put an end to improvisation in the administration of a State that has become a political spoil of war and to elect competent public officials, appointed for their professional suitability","303",NA
"y no por su filiación partidaria, vinculaciones personales o empresarias para ser funcionales a esos intereses.","and not for their party affiliation, personal or business ties to be functional to those interests.","304",NA
"El funcionamiento de la administración pública debe incorporar una visión de mediano y largo plazo, que vaya más allá del cortoplacismo electoral.","The functioning of public administration must incorporate a medium and long-term vision that goes beyond electoral short-termism.","303",NA
"La eficiencia en la gestión es una condición indispensable, pero nunca puede sustituir la noción de proyecto o la idea convocante de Nación.","Efficiency in management is an indispensable condition, but it can never replace the notion of a project or the idea of a Nation.","601.1",NA
"Una gestión, aún eficiente, que no esté sustentada en un proyecto transformador es conservadorismo, no cambio.","A management, even an efficient one, that is not based on a transforming project is conservatism, not change.","305.1",NA
"La política y la gestión estatal tienen que fundarse en una visión profundamente humanista y una agenda de prioridades claramente orientada hacia los sectores más desfavorecidos.","State policy and management must be based on a profoundly humanistic vision and an agenda of priorities clearly oriented towards the most disadvantaged sectors.","503",NA
"""No más niños pobres en la Argentina"" debe ser el lema inspirador para afrontar las urgencias del presente con una visión de futuro.","""No more poor children in Argentina"" must be the inspiring motto to face the urgencies of the present with a vision of the future.","503",NA
"5. IGUALDAD DE OPORTUNIDADES. EDUCACIÓN DE CALIDAD PARA UN TRABAJO CON DIGNIDAD","5. EQUAL OPPORTUNITIES. QUALITY EDUCATION FOR A JOB WITH DIGNITY","H",NA
"En esta nueva sociedad del conocimiento, la educación es una herramienta fundamental para la justicia social, la igualdad de oportunidades y el progreso individual y colectivo.","In this new knowledge society, education is a fundamental tool for social justice, equal opportunities and individual and collective progress.","506",NA
"La vertiginosa aceleración de los adelantos científicos y los cambios tecnológicos representan un gigantesco desafío al mundo del trabajo.","The dizzying acceleration of scientific advances and technological changes represent a gigantic challenge to the world of work.","411",NA
"La respuesta es encarar una verdadera Revolución de la Educación y del Trabajo que promueva las condiciones para que todas las personas puedan participar activamente de los beneficios de este nuevo tiempo.","The answer is to face a true Education and Work Revolution that promotes the conditions for all people to actively participate in the benefits of this new era.","506",NA
"Todos los argentinos, sin distinción, con independencia de su edad, condición social o lugar de nacimiento o residencia, deben tener aseguradas las posibilidades de desarrollar sus capacidades, individual y colectivamente, de manera competitiva.","All Argentines, without distinction, regardless of their age, social status or place of birth or residence, must be assured the possibility of developing their capabilities, individually and collectively, in a competitive manner.","503",NA
"La educación es el único camino hacia la igualdad de oportunidades que debe incorporarse a las conquistas de la justicia social.","Education is the only path to equal opportunities that must be incorporated into the conquests of social justice.","506",NA
"Este replanteo profundo exige una política nacional en su concepción, y descentralizada en su ejecución, orientada a la transformación integral del sistema educativo en todos sus niveles.","This profound rethinking requires a national policy in its conception and decentralized in its execution, aimed at the comprehensive transformation of the education system at all levels.","506",NA
"Requiere incluir como prioridades la jerarquización de la profesión docente,","It requires the prioritization of the teaching profession,","506",NA
"atender la educación inicial,","attention to early education,","506",NA
"la universalización de la enseñanza primaria,","the universalization of primary education, the","506",NA
"la generalización del doble turno escolar,","generalization of the double school shift, the","506",NA
