"text","text_en","cmp_code","eu_code"
"Plataforma de Datos y Programas Sociales, para fortalecer el seguimiento y evaluación de las políticas sociales.","Data and Social Programs Platform, to strengthen the monitoring and evaluation of social policies.","202.1",NA
"App Social, aplicación para teléfonos móviles que permita a cada hogar conocer los beneficios que actualmente recibe y los programas a los que podría tener acceso.","Social App, an application for cell phones that allows each household to know the benefits it currently receives and the programs to which it could have access.","411",NA
"Cuenta RUT Social:","RUT Social Account: a","411",NA
"plataforma única de pago de todos los beneficios sociales entregados por el Estado,","single platform for the payment of all social benefits provided by the State,","411",NA
"que sistematice todos los aportes y transferencias que reciben las personas.","which systematizes all contributions and transfers received by individuals.","411",NA
"Red ""Clase Media Tranquila"":","Red ""Clase Media Tranquila"":","704",NA
"Esquema de seguros sociales para proteger a las familias chilenas de los eventos y vulnerabilidades más relevantes de la vida:","Social insurance scheme to protect Chilean families from the most relevant events and vulnerabilities of life:","504",NA
"1) desempleo.","1) unemployment. 2) unemployment.","701",NA
"3) longevidad (cuarta edad).","3) longevity (fourth age).","503",NA
"4) vivienda y catástrofes naturales.","4) housing and natural catastrophes.","504",NA
"5) acceso a la educación superior.","5) access to higher education.","506",NA
"C.VIVAMOS TRANQUILOS: UN CHILE UNIDO Y EN PAZ","C.VIVAMOS TRANQUILOS: A UNITED AND PEACEFUL CHILE","H",NA
"1. Un Chile más seguro","A Safer Chile","605.1",NA
"Política de Estado para la Prevención del Delito:","State Policy for Crime Prevention:","605.1",NA
"Modernización y fortalecimiento de Carabineros de Chile y la PDI","Modernization and strengthening of the Carabineros de Chile and the PDI","605.1",NA
"Modernización administrativa:","Administrative modernization:","303",NA
"Nuevo sistema de controles internos y reorganización de la gestión financiera,","New system of internal controls and reorganization of financial management,","303",NA
"con procedimientos y protocolos que se ajusten a parámetros modernos de gestión,","with procedures and protocols that conform to modern management parameters,","303",NA
"complementario con el control externo de la Contraloría General de la República.","complementary to the external control of the Office of the Comptroller General of the Republic.","202.1",NA
"Definición presupuestaria por objetivos estratégicos","Budget definition by strategic objectives","202.1",NA
"y auditorías externas asociados a la asignación de recursos.","and external audits associated with resource allocation.","202.1",NA
"Reforma a los sistemas de ingreso,","Reform of income systems,","202.1",NA
"evaluación y promoción para vincular la carrera a los objetivos estratégicos institucionales.","evaluation and promotion to link the career to the institutional strategic objectives.","202.1",NA
"Modernización operativa:","Operational modernization:","411",NA
"Redefinición de facultades y atribuciones, rediseño de estructuras de formación, funciones operativas, carrera funcionaria.","Redefinition of powers and responsibilities, redesign of training structures, operational functions, civil service careers,","303",NA
"incorporación masiva de nuevas tecnologías,","massive incorporation of new technologies,","411",NA
"énfasis en labores preventivas por sobre administrativas,","emphasis on preventive rather than administrative tasks,","605.1",NA
"especialización de las policías,","specialization of the police,","605.1",NA
"creación de unidades mixtas para delitos graves como terrorismo, crimen organizado y narcotráfico,","creation of mixed units for serious crimes such as terrorism, organized crime and drug trafficking,","605.1",NA
"con mando centralizado y énfasis en la detención de delincuentes reincidentes y peligrosos.","with centralized command and emphasis on the arrest of repeat offenders and dangerous criminals.","605.1",NA
"Ley para institucionalizar el sistema de inteligencia para la prevención del delito, con metas específicas de reducción de delitos (STAD 2.0).","Law to institutionalize the intelligence system for crime prevention, with specific crime reduction goals (STAD 2.0).","605.1",NA
"Fortalecimiento de Subsecretaría de Prevención del Delito:","Strengthening of the Undersecretariat for Crime Prevention:","605.1",NA
"Creación de un Sistema Integral de Prevención del Delito,","Creation of an Integrated Crime Prevention System","605.1",NA
"que mejore la gestión y coordinación de las instituciones involucradas en la prevención del delito (policías, municipios y otros órganos involucrados).","to improve the management and coordination of the institutions involved in crime prevention (police, municipalities and other bodies involved).","605.1",NA
"Fortalecimiento del rol preventivo de Carabineros,","Strengthening the preventive role of the Carabineros","605.1",NA
"mediante la introducción de tecnologías,","through the introduction of technologies,","411",NA
"la colaboración mutua con los municipios","mutual collaboration with municipalities","301",NA
"y una clara asignación de responsabilidad en la seguridad privada.","and a clear assignment of responsibility for private security.","605.1",NA
"Fuerza de Tarea Nacional Antidrogas:","National Anti-Drug Task Force:","605.1",NA
"Creación de un mando y unidades conjuntas de las policías, con la colaboración de la ANI, el Ministerio Público, la Unidad de Análisis Financiero, el Registro Civil, el SII y Aduanas,","Creation of a joint police command and units, with the collaboration of the ANI, the Public Prosecutor's Office, the Financial Analysis Unit, the Civil Registry, the SII and Customs,","605.1",NA
"para la prevención y el combate del narcotráfico.","to prevent and combat drug trafficking.","605.1",NA
"Fuerza de Tarea Nacional Anti Terrorismo y Crimen Organizado:","National Anti-Terrorism and Organized Crime Task Force:","605.1",NA
"Creación de un mando y unidades conjuntas de las policías, con la colaboración de la ANI, el Ministerio Público, la Unidad de Análisis Financiero, el Registro Civil, el Servicio de Impuestos Internos y Aduanas y FF.AA., para la prevención y combate de este tipo de delitos específicos.","Creation of a joint police command and units, with the collaboration of the ANI, the Public Prosecutor's Office, the Financial Analysis Unit, the Civil Registry, the Internal Revenue Service, Customs and the Armed Forces, for the prevention and combat of this specific type of crime.","605.1",NA
"Reforma a la ley antiterrorista:","Reform of the anti-terrorism law:","605.1",NA
"introducción de nuevas herramientas de investigación, como agentes encubiertos o protección efectiva de testigos,","introduction of new investigative tools, such as undercover agents or effective witness protection,","605.1",NA
"y normas de sanción más eficaces.","and more effective sanction rules.","605.1",NA
"Nuevo Sistema Nacional de Inteligencia:","New National Intelligence System:","605.1",NA
"Nuevo sistema integrado, con la participación de las instituciones involucradas y afines, como las FF.AA. e institucionales policiales, Gendarmería, la Unidad de Análisis Financiero, el Servicio de Impuestos Internos, el Registro Civil. Aduanas, entre otras.","New integrated system, with the participation of the involved and related institutions, such as the Armed Forces and police institutions, the Gendarmerie, the Financial Analysis Unit, the Internal Revenue Service, the Civil Registry. Customs, among others.","605.1",NA
"Nuevo Centro de Respuesta ante Amenazas Terroristas y Centro Unificado de Datos contra el Terrorismo.","New Terrorist Threat Response Center and Unified Counterterrorism Data Center.","605.1",NA
"Incorporación de Ciberinteligencia como insumo básico y protección de información de importancia para la seguridad nacional.","Incorporation of Cyber Intelligence as a basic input and protection of information of national security importance.","605.1",NA
"Reformas para una justicia más eficaz:","Reforms for a more effective justice system:","605.1",NA
"Revisión integral del Código Procesal Penal, nuevo Código Penal,","Comprehensive review of the Code of Criminal Procedure, new Criminal Code,","605.1",NA
"reforma a la ley de responsabilidad penal adolescente","reform of the law on adolescent criminal responsibility","605.1",NA
"y nuevo Estatuto de Víctimas y Protección de Testigos.","and new Victims and Witness Protection Statute.","605.1",NA
"Mejor coordinación entre policías, fiscales y jueces para mejorar la eficacia de la persecución penal.","Better coordination between police, prosecutors and judges to improve the effectiveness of criminal prosecution.","605.1",NA
"Protección de las personas y comunidades ante catástrofes naturales:","Protection of people and communities from natural disasters:","606.1",NA
"Nuevo Sistema y Agencia Nacional de Emergencias y Protección Civil, incorporando plenamente a las Fuerzas Armadas y de Orden, Bomberos y voluntarios.","New National Emergency and Civil Protection System and Agency, fully incorporating the Armed Forces, Firefighters and volunteers.","606.1",NA
"2. Mejores instituciones y Estado moderno al servicio de las personas:","Better institutions and a modern State at the service of the people:","202.1",NA
"Revisión del periodo presidencial,","Revision of the presidential term,","202.1",NA
"límite a la reelección de las autoridades políticas","limit to the reelection of political authorities","202.1",NA
"y reducción del número de parlamentarios a 120 diputados y 40 senadores,","and reduction of the number of parliamentarians to 120 deputies and 40 senators,","202.1",NA
"manteniendo el actual sistema electoral proporcional.","maintaining the current proportional electoral system.","202.1",NA
"Regulación moderna del tránsito de autoridades entre el sector público y privado.","Modern regulation of the transit of authorities between the public and private sectors.","202.1",NA
"Creación del Consejo de Presidentes de la República","Creation of the Council of Presidents of the Republic","202.1",NA
"y construcción del Museo de la Democracia.","and construction of the Museum of Democracy.","305.5",NA
"Modernización y fortalecimiento de la Contraloría General de la República,","Modernization and strengthening of the Office of the Comptroller General of the Republic, through","202.1",NA
"a través de nueva ley orgánica que, entre otras cosas, incluya dentro de su ámbito de fiscalización el Congreso Nacional,","a new organic law that, among other things, includes the National Congress within its scope of supervision, in order to","202.1",NA
"de forma de fiscalizar pertinencia, transparencia y legalidad de los gastos.","supervise the relevance, transparency and legality of expenditures.","202.1",NA
"Modernización del gobierno corporativo del Congreso y fortalecimiento de sus capacidades,","Modernization of the corporate governance of the Congress and strengthening of its capacities,","303",NA
"regulando uso de urgencias del Ejecutivo,","regulating the use of executive urgencies,","202.1",NA
"profesionalizado la asesoría legislativa,","professionalizing legislative counseling,","303",NA
"creando la Oficina de Presupuesto del Congreso, entre otras medidas.","creating the Congressional Budget Office, among other measures.","303",NA
"Estado digital al servicio de los ciudadanos.","Digital state at the service of citizens.","303",NA
"Plan de Digitalización Universal de Trámites y programa de interoperabilidad de servicios del Estado.","Plan for the Universal Digitalization of Procedures and interoperability program for government services.","303",NA
"Normativa para establecer que el Estado no pida certificados o antecedentes que se encuentren en sus propios registros.","Regulation to establish that the State does not request certificates or records that are in its own records.","303",NA
"Creación de Registro Social Único.","Creation of a Single Social Registry.","303",NA
"Servicio Nacional del Usuario.","National User Service.","411",NA
"Ficha Única Electrónica de Salud.","Single Electronic Health Record (Ficha Única Electrónica de Salud).","411",NA
"Inteligencia Analítica Criminal.","Criminal Analytical Intelligence.","605.1",NA
"Sistema Integrado de Prevención del Delito y número único de emergencias.","Integrated Crime Prevention System and single emergency number.","605.1",NA
"Modernización Integral del Registro Civil y Ley Chile Atiende.","Integral Modernization of the Civil Registry and Chile Atiende Law.","303",NA
"D.CON CALIDAD DE VIDA: UN CHILE PARA VIVIR BIEN","D.WITH QUALITY OF LIFE: A CHILE TO LIVE WELL","416.2",NA
"1.Ciudades más humanas","1.More humane cities","416.2",NA
"Ciudades Inclusivas:","Inclusive cities:","503",NA
"acceso seguro y de calidad a bienes y servicios urbanos.","safe and quality access to urban goods and services.","503",NA
"Reimpulso de Política Nacional de Desarrollo Urbano","Re-launching of the National Urban Development Policy","411",NA
"y construcción de un gran parque urbano por región.","and construction of a large urban park per region.","502",NA
"Nueva institucionalidad para las ciudades:","New institutional framework for cities:","411",NA
"autoridades metropolitanas de transporte y desarrollo urbano.","metropolitan transport and urban development authorities.","411",NA
"Plan Ciudades 500 para conmemorar y modernizar la infraestructura,","Cities 500 Plan to commemorate and modernize the infrastructure,","411",NA
"espacios públicos y calidad de las urbes que se aprontan a cumplir cinco siglos de existencia (Valparaíso. Santiago. Arica. La Serena. Concepción).","public spaces and quality of the cities that are about to celebrate five centuries of existence (Valparaíso, Santiago, Arica, La Serena, Concepción).","411",NA
"Corredores verdes y plazas y Parques de Bolsillo. Política nacional de ciudades inteligentes.","Green corridors and squares and Pocket Parks. National smart cities policy.","411",NA
"Plan Nacional de Aire Limpio:","National Clean Air Plan:","416.2",NA
"Ley de Planes de Descontaminación y puesta en marcha nuevos planes,","Law on Decontamination Plans and implementation of new plans,","416.2",NA
"plan piloto de calefacción distrital, comunal o por barrio, para erradicación de contaminación por leña en ciudades del sur del país.","pilot plan for district, communal or neighborhood heating to eradicate firewood pollution in cities in the south of the country.","416.2",NA
"2.Transporte público para las personas","Public transportation for people","411",NA
"Nuevo Sistema de Transporte Urbano para Chile: ""Transporte Urbano Tercer Milenio""","New Urban Transportation System for Chile: ""Third Millennium Urban Transportation""","411",NA
"Nuevo Plan de Transporte para Santiago:","New Transportation Plan for Santiago:","411",NA
"fin del Transantiago a ocho años plazo y nuevo sistema estructurado en base al Metro y sistemas de rieles.","end of Transantiago in eight years and new system structured on the basis of the Metro and rail systems.","411",NA
"Término de Líneas 3 y 6","Completion of Lines 3 and 6","411",NA
"y construcción de nuevas Líneas 7 y 8 del Metro, incluyendo una ampliación total de la red de 125 kilómetros.","and construction of new Metro Lines 7 and 8, including a total network extension of 125 kilometers.","411",NA
"Extensión de la red al Aeropuerto de Santiago, tranvías y trenes urbanos.","Extension of the network to Santiago Airport, streetcars and urban trains.","411",NA
"Nuevo sistema de buses alimentadores de mayor flexibilidad y calidad,","New feeder bus system with greater flexibility and quality,","411",NA
"sistemas tecnológicos de información y control,","technological information and control systems,","411",NA
"nuevas redes de ciclovías (800 km)","new bicycle lane networks (800 km)","411",NA
"y estacionamientos de bicicletas en la red de Metro","and bicycle racks in the Metro network","411",NA
"y modernización del sistema de taxis colectivos,",", and modernization of the collective cab system,","411",NA
"incorporando nuevos vehículos más apropiados para prestar ese servicio.","incorporating new vehicles that are more appropriate for providing this service.","411",NA
"Planes de Transporte para Regiones:","Transportation Plans for Regions:","411",NA
"más de 200 proyectos de vialidad en ciudades, nuevas redes de trenes urbanos (Antofagasta. La Serena-Coquimbo. Gran Valparaíso. Gran Concepción. Temuco-Padre las Casas y Puerto Montt)","more than 200 road projects in cities, new urban train networks (Antofagasta. La Serena-Coquimbo. Greater Valparaíso. Greater Concepción. Temuco-Padre las Casas and Puerto Montt)","411",NA
"y medios distintos de integración modal,","and different means of modal integration,","411",NA
"incluyendo teleféricos en Valparaíso e Iquique-Alto Hospicio.","including cable cars in Valparaíso and Iquique-Alto Hospicio. Environmental","411",NA
"3. Protección y cuidado del medio ambiente","protection and care","501",NA
"Servicio Nacional de Parques Nacionales y Áreas Protegidas.","National Service of National Parks and Protected Areas.","501",NA
"Modernización y extensión de la red de parques y reservas nacionales.","Modernization and extension of the network of national parks and reserves.","501",NA
"Nueva Ley Única de Donaciones, con beneficios para promover la filantropía ambiental.","New Single Law on Donations, with benefits to promote environmental philanthropy.","501",NA
"Cuidado y protección de mascotas y animales domésticos:","Care and protection of pets and domestic animals:","501",NA
"cumplimiento estricto de Ley de Tenencia Responsable de Mascotas,","strict compliance with the Law on Responsible Pet Ownership,","501",NA
"asegurando cumplimiento de nuevas obligaciones y fiscalizando con rigor el maltrato y abandono.","ensuring compliance with new obligations and rigorously controlling abuse and abandonment.","501",NA
"Creación de un registro de inscripción de mascotas","Creation of a pet registration registry","501",NA
"e incentivo al uso de chips electrónicos de identificación,","and incentives for the use of electronic identification chips","501",NA
"para facilitar la búsqueda en caso de extravío y sanciones para el maltrato o abandono deliberado.","to facilitate searches in case of loss and penalties for mistreatment or deliberate abandonment.","501",NA
"Trabajo conjunto con municipios y sociedad civil para implementar equipamiento especial en parques y plazas, planes de adopción, tratamiento veterinario y programas de esterilización.","Joint work with municipalities and civil society to implement special equipment in parks and squares, adoption plans, veterinary treatment and sterilization programs.","501",NA
"4. Un país para las familias","A country for families","706",NA
"Estatuto de fortalecimiento y protección de las familias:","Statute for the strengthening and protection of families:","504",NA
"ampliación de políticas de promoción de vida familiar a través del programa Elige Vivir Sano y nuevos beneficios tributarios, sociales, educacionales, de vivienda y salud, entre otros, para grupos familiares numerosos.","expansion of policies to promote family life through the Elige Vivir Sano program and new tax, social, educational, housing and health benefits, among others, for large family groups.","504",NA
"Política de prevención y solución de conflictos al interior de las familias.","Conflict prevention and resolution policy within families.","504",NA
"Asistencia profesional para la mediación y conciliación frente a problemas que surgen en la convivencia.","Professional assistance for mediation and conciliation of problems that arise in coexistence.","504",NA
"Nueva red de alerta e intervención temprana de conflictos familiares,","New early warning and intervention network for family conflicts, through","504",NA
"por medio de integración de datos de servicios públicos (Gendarmería, Fiscalía, educación, salud, Desarrollo Social, Sernam. Sename entre otros).","the integration of data from public services (Gendarmería, Public Prosecutor's Office, education, health, Social Development, Sernam. Sename, among others)","504",NA
"pololeo, dispositivos electrónicos para garantizar el cumplimiento de medidas cautelares",", electronic devices to ensure compliance with precautionary measures","605.1",NA
"y estrategias intersectoriales de intervención temprana.","and intersectoral strategies for early intervention.","605.1",NA
"Revisión de nueva Ley de Tuición Compartida,","Revision of the new Shared Guardianship Law,","706",NA
"para facilitar su aplicación y ampliar las oportunidades de convivencia y participación de los padres que no viven en el hogar familiar.","to facilitate its application and expand the opportunities for cohabitation and participation of parents who do not live in the family home.","706",NA
"Promoción de la natalidad:","Promotion of the birth rate:","503",NA
"incentivos tributarios a las familias numerosas,","tax incentives for large families,","504",NA
"incorporación de tratamientos de infertilidad al Plan Auge","incorporation of infertility treatments into the Auge Plan","504",NA
"y subsidio habitacional especial para las familias numerosas.","and special housing subsidies for large families.","504",NA
"Fortalecimiento de la lucha contra la violencia intrafamiliar.","Strengthening the fight against domestic violence.","605.1",NA
"Revisión de la legislación, incluyendo sanciones para violencia en el pololeo,","Revision of legislation, including sanctions for domestic violence,","605.1",NA
"dispositivos electrónicos para garantizar el cumplimiento de medidas cautelares","electronic devices to ensure compliance with precautionary measures","605.1",NA
"y estrategias intersectoriales de intervención temprana.","and intersectoral early intervention strategies.","605.1",NA
"Mejor compatibilización de la vida familiar y el trabajo","Better compatibility of work and family life","504",NA
