"text","text_en","cmp_code","eu_code"
"El sector agropecuario se vincula a por lo menos el 30% de nuestra población y se localiza en la mayor parte del territorio nacional activo, es decir en el mundo rural, aunque contribuya con el 10% de nuestra economía.","The agricultural sector is linked to at least 30% of our population and is located in most of the active national territory, that is, in rural areas, even though it contributes 10% of our economy.","703.1",NA
"Por ello proponemos que se le dedique una atención especial.","We therefore propose that special attention be devoted to it.","703.1",NA
"Vamos a recuperar la confianza y participación de los productores agropecuarios y ofrecerles su corresponsabilidad en los problemas que los afectan.","We are going to recover the trust and participation of agricultural producers and offer them their co-responsibility in the problems that affect them.","703.1",NA
"Para ello proponemos cumplir con las siguientes tareas:","To this end, we propose to accomplish the following tasks:","000",NA
"1. Elevar la participación del sector agropecuario en la economía nacional mediante un crecimiento más intenso de su producción.","1. To increase the participation of the agricultural sector in the national economy through a more intense growth of its production.","703.1",NA
"2. Ampliar la canasta de productos competitivos para el mercado nacional e internacional.","2. To expand the basket of competitive products for the national and international markets.","703.1",NA
"3. Otorgar prioridad a la inversión en laboratorios, centros de investigación y actualización científico-técnica de los profesionales del sector público y privado, de forma tal que se mejore la productividad.","3. To give priority to investment in laboratories, research centers and scientific-technical updating of professionals in the public and private sectors, in order to improve productivity.","411",NA
"4. Elevar el techo tecnológico y la productividad predominante en los modelos económicos y familiares de autoabastecimiento.","4. To raise the technological ceiling and the predominant productivity in the economic and family models of self-sufficiency.","411",NA
"5. Maximizar las ventajas de la ganadería de carne vacuna en un mercado internacional altamente competitivo.","5. Maximize the advantages of beef cattle raising in a highly competitive international market.","703.1",NA
"Para lograr este salto adelante del mundo agropecuario proponemos como medidas principales:","To achieve this leap forward in the agricultural world, we propose as main measures:","703.1",NA
"1. Convocar a todas las fuerzas del sector agropecuario a una alianza en la Nueva Nación para evaluar y corregir, donde sea necesario, la política arancelaria vigente, en el marco de los acuerdos internacionales firmados por Panamá.","1. To summon all the forces of the agricultural sector to an alliance in the New Nation to evaluate and correct, where necessary, the current tariff policy, within the framework of the international agreements signed by Panama.","703.1",NA
"2. Modernizar y fortalecer las instituciones oficiales que rigen al sector agropecuario para garantizar la implementación de los planes de reconversión, de salud vegetal y animal, salud pública, investigación agropecuaria y búsqueda de nuevos mercados.","2. Modernize and strengthen the official institutions that govern the agricultural sector to guarantee the implementation of the plans for reconversion, plant and animal health, public health, agricultural research and the search for new markets.","703.1",NA
"3. Implementar un programa agresivo de reorientación de la producción que cuente con el financiamiento correspondiente.","3. Implement an aggressive production reorientation program with the corresponding financing.","703.1",NA
"4. Iniciar un programa masivo de capacitación al productor para transferirle nueva tecnología.","4. Initiate a massive producer training program to transfer new technology.","703.1",NA
"5. Dotar al IDIAP de los recursos necesarios para intensificar la investigación de nuevas variedades técnicas de producción, mejoramiento genético de la ganadería de leche y carne, nuevas prácticas agropecuarias e investigación de enfermedades.","5. Provide IDIAP with the necessary resources to intensify research on new technical varieties of production, genetic improvement of dairy and beef cattle, new agricultural practices and disease research.","703.1",NA
"6. Consultar con los productores el programa de reconversión productiva.","6. Consult with producers on the productive reconversion program.","703.1",NA
"7. Fortalecer la banca agropecuaria para brindar crédito oportuno al productor.","7. Strengthen the agricultural banking system to provide timely credit to producers.","703.1",NA
"8. Mejorar los canales de comercialización estableciendo centros de acopio y distribución.","8. Improve commercialization channels by establishing collection and distribution centers.","703.1",NA
"9. Establecer un programa de caminos de producción por provincia.","9. Establish a program of production roads by province.","703.1",NA
"10. Fortalecer las organizaciones de productores, en especial las cooperativas.","10. Strengthen producer organizations, especially cooperatives.","703.1",NA
"11. Implementar el Plan Nacional de Riego.","11. Implement the National Irrigation Plan.","703.1",NA
"12. Desarrollar un programa de titulación masiva de tierras.","12. Develop a massive land titling program.","703.1",NA
"2. Las Áreas Revertidas y el Canal de Panamá","2. The Reversed Areas and the Panama Canal","H",NA
"El área del Canal es, hoy, la región más dinámica del país.","The Canal area is, today, the most dynamic region of the country.","411",NA
"Representa el 10% de la economía panameña y su producción y empleo crece al doble de la velocidad de la economía nacional.","It represents 10% of the Panamanian economy and its production and employment is growing at twice the rate of the national economy.","411",NA
"Ese dinamismo se debe a la actividad del mismo canal de Panamá y, en medida subalterna, a la actividad en las áreas revertidas, especialmente en el sector marítimo portuario.","This dynamism is due to the activity of the Panama Canal itself and, to a lesser extent, to the activity in the reverted areas, especially in the maritime port sector.","411",NA
"Los puertos en las entradas del Canal en sólo cuatro años han pasado de manejar 200,000 contenedores a más de 1,000,000 en 1998, especialmente en Coco Solo, y podrán llegar a 2,000,000 en el año 2000.","The ports at the entrances to the Canal in only four years have gone from handling 200,000 containers to more than 1,000,000 in 1998, especially in Coco Solo, and could reach 2,000,000 in the year 2000.","411",NA
"El gobierno de la Alianza Hacia una Nueva Nación imprimirá redoblado vigor al aprovechamiento de las inmensas oportunidades que tenemos los panameños en el Área del Canal que se verán acrecentadas sustancialmente, con las reversiones pactadas hasta el 31 de diciembre de 1999.","The government of the Alliance Toward a New Nation will redouble its efforts to take advantage of the immense opportunities that Panamanians have in the Canal Area, which will be substantially increased with the reversions agreed to until December 31, 1999.","601.1",NA
"3. Aprovechamiento de las Áreas Revertidas","3. Use of the Reversed Areas","H",NA
"Proponemos intensificar la incorporación de las áreas revertidas al desarrollo nacional a través de formas que aseguren que tanto el uso como los beneficios derivados de su actividad se manifiesten en bienestar social para todos los panameños, especialmente para los más necesitados, mediante:","We propose to intensify the incorporation of the reverted areas to national development through ways that ensure that both the use and the benefits derived from their activity are manifested in social welfare for all Panamanians, especially for the most needy, by means of:","503",NA
"a. Promoción de la inversión nacional e internacional en el complejo Howard-Rodman-Kobbe para crear un gran centro multimodal de transporte marítimo y aéreo, y en Sherman-San Lorenzo para el desarrollo turístico-ecoturístico y marítimo.","a. Promotion of national and international investment in the Howard-Rodman-Kobbe complex to create a large multimodal maritime and air transportation center, and in Sherman-San Lorenzo for tourism-ecotourism and maritime development.","411",NA
"b. Incorporación de Clayton al desarrollo urbano de la ciudad de Panamá y al proyecto de Ciudad del saber que deberá exportar servicios educativos, científicos y tecnológicos de alta calidad.","b. Incorporation of Clayton into the urban development of Panama City and the City of Knowledge project that should export high quality educational, scientific and technological services.","411",NA
"c. Establecer áreas especiales de recreación popular para la familia con el fin de que ellas puedan participar del patrimonio que ha revertido al país.","c. Establish special areas of popular recreation for the family so that they can participate in the patrimony that has reverted to the country.","502",NA
"d. Agilización de los trámites del sector público para incorporar las áreas revertidas al desarrollo marítimo, industrial, comercial, turístico y de expansión urbana, además de la protección de los grandes bosques de la cuenca del Canal de Panamá.","d. Expedite the procedures of the public sector to incorporate the reverted areas to the maritime, industrial, commercial, tourist and urban expansion development, in addition to the protection of the great forests of the Panama Canal watershed.","303",NA
"El Canal de Panamá","The Panama Canal","H",NA
"El Canal de Panamá es un estrecho marítimo que brinda un servicio internacional y uno de nuestros propósitos más claros es integrar plenamente dicha vía interoceánica a nuestra economía y a nuestros objetivos de crecimiento.","The Panama Canal is a maritime strait that provides an international service and one of our clearest purposes is to fully integrate this inter-oceanic waterway into our economy and our growth objectives.","411",NA
"Gracias a la importancia que tiene para nuestra nación y para su futuro el Canal de Panamá, todos los asuntos fundamentales que le atañen serán considerados como asuntos de Estado y, en consecuencia, sometidos a un amplio consenso nacional.","Due to the importance of the Panama Canal for our nation and its future, all fundamental matters that concern it will be considered matters of State and, consequently, will be submitted to a broad national consensus.","202.1",NA
"Por ello, respetaremos fielmente el ordenamiento jurídico que se ha logrado ya adoptar sobre el Canal de Panamá y su administración y exigiremos, de parte de sus administradores, una labor eficiente, productiva, competitiva y transparente.","Therefore, we will faithfully respect the legal system that has already been adopted for the Panama Canal and its administration, and we will demand efficient, productive, competitive and transparent work on the part of its administrators.","303",NA
"Asimismo, habida cuenta de la importancia que tendrían obras de ampliación de la capacidad del Canal de Panamá para hacer frente a la demanda en el siglo XXI como un Tercer Juego de Esclusas más grandes, si tuviésemos que tomar una decisión durante el próximo quinquenio de gobierno, ella sería el resultado de más detenido y serio análisis y de la más amplia consulta nacional y del consenso resultante de la gran mayoría de las fuerzas políticas y sociales.","Likewise, given the importance of works to expand the capacity of the Panama Canal to meet the demand in the 21st century, such as a larger Third Set of Locks, if we were to make a decision during the next five years of government, it would be the result of the most careful and serious analysis and the broadest national consultation and consensus resulting from the vast majority of political and social forces.","202.1",NA
"4.  Prioridad a la Educación","4.  Priority to Education","H",NA
"Si el objetivo prioritario en la propuesta de Martín Torrijos será combatir la pobreza y el desempleo, el instrumento fundamental para transformar la sociedad panameña para el siglo XXI será la educación.","If the priority objective in Martín Torrijos' proposal will be to fight poverty and unemployment, the fundamental instrument to transform Panamanian society for the 21st century will be education.","506",NA
"Hay una circunstancia evidente: todo, pobreza o riqueza, empleo o desempleo, desarrollo o subdesarrollo gira alrededor de la educación.","One thing is clear: everything, poverty or wealth, employment or unemployment, development or underdevelopment, revolves around education.","506",NA
"Las posibilidades de los jóvenes de tener acceso a una vida decorosa dependen cada día más de su formación educativa.","Young people's chances of having access to a decent life depend more and more on their educational background.","506",NA
"El objetivo principal es la democratización de la educación panameña.","The main objective is the democratization of Panamanian education.","506",NA
"Dado que la educación primaria cubre al 95% de los niños en esa edad escolar, la democratización propuesta enfatiza los siguientes aspectos:","Given that primary education covers 95% of the children in that school age, the proposed democratization emphasizes the following aspects:","506",NA
"a. Ampliación de la educación pre-escolar.","a. Expansion of pre-school education.","506",NA
"Mientras más temprano pueda un niño incorporarse a tareas escolares, más desarrollará su capacidad de percepción y, en consecuencia, sus aptitudes para el aprendizaje.","The earlier a child can be engaged in schoolwork, the more he or she will develop his or her perceptual capacity and, consequently, his or her learning skills.","506",NA
"En Panamá, el 50% de los niños asisten a la educación pre-escolar y es necesario que todos o la gran mayoría puedan hacerlo.","In Panama, 50% of children attend pre-school education and it is necessary that all or most of them can do so.","506",NA
"Un camino adecuado para ello es el fortalecimiento de los Centros Familiares y Unitarios de Educación Inicial que funcionarían en los sitios señalados por la misma comunidad, con el objeto de brindar atención preescolar desde la más temprana edad.","A suitable way to achieve this is to strengthen the Family and Unitary Centers of Initial Education that would operate in the sites identified by the community itself, in order to provide preschool care from the earliest age.","506",NA
"Hay que hacer énfasis en los proyectos pre-escolares de las áreas de mayor marginación, a fin de que los niños, por la formación temprana recibida, estén en condiciones de superar las limitaciones del propio medio que les rodea.","Emphasis should be placed on pre-school projects in the most marginalized areas, so that children, through early education, will be able to overcome the limitations of their own environment.","506",NA
"b. Ampliación de la educación media, que es la que completa los once años de escolaridad (dos de pre-escolar, seis de básica y tres de media) y que tienen que seguir siendo gratuitos y obligatorios.","b. Expansion of secondary education, which completes the eleven years of schooling (two years of pre-school, six years of basic education and three years of secondary education) and which should continue to be free and compulsory.","506",NA
"El objetivo es que todos los jóvenes entre 14 y 19 años de edad reciban educación media","The objective is that all young people between 14 and 19 years of age receive secondary education","506",NA
"c. Reducción del 50% del analfabetismo, es especialmente en el sector indígena del país.","c. 50% reduction of illiteracy, especially in the indigenous sector of the country.","506",NA
"Un programa activo para erradicar en el analfabetismo entre los mayores será necesario para lograr este objetivo.","An active program to eradicate illiteracy among the elderly will be necessary to achieve this goal.","506",NA
"El segundo objetivo principal es la elevación de la calidad de la educación panameña.","The second main objective is to improve the quality of Panamanian education.","506",NA
"Desde luego, los objetivos de la educación no pueden limitarse a la finalidad cuantitativa.","Of course, the objectives of education cannot be limited to quantitative goals.","506",NA
"También se requiere una transformación significativa en el contenido de la educación, lo que significa, entre otras cosas,","A significant transformation in the content of education is also required, which means, among other things,","506",NA
"a. Señalar prioridades de contenido a fin de hacer énfasis en las asignaturas que pueden resultar en una formación más sólida del estudiante.","a. To indicate content priorities in order to emphasize those subjects that can result in a more solid formation of the student.","506",NA
"b. Fijar un conjunto de asignaturas comunes para los tres primeros años de la educación media y señalar las que, en los últimos años de la media, indiquen la vocación del estudiante, ya sea en materia científico-técnica o en la humanística.","b. To establish a set of common subjects for the first three years of secondary education and to indicate those that, in the last years of secondary education, indicate the student's vocation, whether in scientific-technical or humanistic subjects.","506",NA
"c. Establecer el idioma inglés como parte del contenido educativo desde el nivel pre-escolar.","c. Establish the English language as part of the educational content from the pre-school level.","506",NA
"d. Asegurar que los niños, desde la pre-escolar, tengan acceso real a los textos, si es preciso mediante el subsidio correspondiente por parte del Estado.","d. Ensure that children, from pre-school, have real access to texts, if necessary through the corresponding subsidy by the State.","506",NA
"e. Introducir el aprendizaje y uso de la computadora para el acceso al sistema de internet, a fin de ampliar el mundo de conocimientos de estudiantes y educadores.","e. Introduce computer learning and use for access to the internet system, in order to expand the world of knowledge of students and educators.","506",NA
"f. Desarrollar un eficiente sistema nacional de bibliotecas escolares.","f. Develop an efficient national system of school libraries.","506",NA
"Esta transformación del sistema educativo deberá acompañarse de algunas decisiones administrativas complementarias de extraordinaria importancia.","This transformation of the educational system will have to be accompanied by some complementary administrative decisions of extraordinary importance.","303",NA
"Es absolutamente conveniente que estudiantes y educadores sientan la necesidad de emplear más tiempo en las instalaciones escolares.","It is absolutely appropriate that students and educators feel the need to spend more time in school facilities.","303",NA
"Ello se puede lograr mediante las siguientes medidas:","This can be achieved through the following measures:","506",NA
"a. Instalación de nuevos comedores escolares y ampliación de los existentes, en los casos en los que sea necesario para dar apoyo a la ampliación del tiempo de presencia de los protagonistas de la educación en los centros educativos.","a. Installation of new school canteens and expansion of existing ones, where necessary to support the extension of the time of presence of the protagonists of education in schools.","506",NA
"b. Adecuar la compensación de los docentes en virtud de la ampliación de su tiempo efectivo de trabajo.","b. Adjust the compensation of teachers by virtue of the extension of their effective working time.","506",NA
"c. Mejoramiento de la estructura física y de la dotación de materiales en las escuelas, para lo cual debe reservarse una inversión pública de alrededor de ciento veinte millones de balboas.","c. Improvement of the physical structure and the provision of materials in schools, for which a public investment of about one hundred and twenty million balboas should be reserved.","506",NA
"La aplicación de este plan de transformación profunda de la educación , lo que significará el cambio cualitativo del ser humano panameño, cerrará la vieja brecha existente entre la escuela del área urbana y la del área rural y, en consecuencia, habrá más coincidencia entre todos los componentes de la nacionalidad.","The implementation of this plan of profound transformation of education, which will mean the qualitative change of the Panamanian human being, will close the old gap existing between the school in urban and rural areas and, consequently, there will be more coincidence between all the components of the nationality.","506",NA
"Al final, Panamá será un país más educado y el panameño tendrá un marco de referencia cultural más abarcador y comprensivo, ya que la escuela será verdadero centro del conocimiento y desde allí se generará la actividad cultural en pueblos y ciudades, sin depender exclusivamente de las iniciativas que emanen del Ministerio de Educación.","In the end, Panama will be a more educated country and Panamanians will have a more encompassing and comprehensive cultural frame of reference, since the school will be the true center of knowledge and from there cultural activity will be generated in towns and cities, without depending exclusively on initiatives emanating from the Ministry of Education.","506",NA
"Naturalmente, es necesario insistir que la descentralización administrativa de la educación es conveniente y que cualquier decisión de trascendencia en el campo de la educación debe ser el resultado de un consenso entre gobernantes, educadores y padres de familia, como mínimo.","Naturally, it is necessary to insist that the administrative decentralization of education is desirable and that any important decision in the field of education should be the result of a consensus between government leaders, educators and parents, at the very least.","506",NA
"Los protagonistas de la educación deben ponerse de acuerdo para poder cumplir con estos planes ambiciosos, que inciden en la esencia del problema educativo.","The protagonists of education must come to an agreement in order to fulfill these ambitious plans, which go to the heart of the educational problem.","506",NA
"Insistimos en la necesidad de una educación superior de elevada calidad y competencia.","We insist on the need for high quality and competitive higher education.","506",NA
"La educación superior debe ser una alternativa de calidad a la necesidad de formación científica, profesional y técnica, que Panamá requiere para alcanzar las metas de desarrollo sostenible y enfrentar las nuevas condiciones del mundo globalizado.","Higher education should be a quality alternative to the need for scientific, professional and technical training that Panama requires to achieve the goals of sustainable development and face the new conditions of the globalized world.","506",NA
"Proponemos que el gobierno nacional apoye los esfuerzos en la educación superior destinados a:","We propose that the national government support efforts in higher education aimed at:","506",NA
"a. Elevar la calidad de la educación superior pública, haciendo énfasis en la formación de docentes necesarios para los niveles medio y primario.","a. Raise the quality of public higher education, with emphasis on the training of teachers needed for the middle and primary levels.","506",NA
"b. Estimular la competencia entre todos los centros de educación superior y su productividad.","b. Stimulate competition among all centers of higher education and their productivity.","506",NA
"c. Orientar y coordinar mejor los crecientes esfuerzos en la educación superior, de naturaleza pública y privada, estableciendo un Sistema Nacional de Educación Superior con la participación de todas las Universidades, el IFARHU, el INAFORP, el Ministerio de Educación y la sociedad civil.","c. Better orient and coordinate the growing efforts in higher education, both public and private, by establishing a National System of Higher Education with the participation of all Universities, IFARHU, INAFORP, the Ministry of Education and civil society.","506",NA
"El próximo gobierno nacional deberá comprometerse firmemente a respetar la autonomía universitaria, la libertad de cátedra y todos los derechos consagrados en la Constitución Nacional.","The next national government must make a firm commitment to respect university autonomy, academic freedom and all the rights enshrined in the National Constitution.","506",NA
"La relación entre los centros de educación superior y el gobierno nacional debe ser útil u productiva.","The relationship between higher education institutions and the national government must be useful and productive.","506",NA
"Es conveniente y necesario incrementar la presencia de aquellos en el desarrollo de asesorías, consultorías y proyectos, fortaleciendo de este modo su capacidad de autogestin, a fin de que puedan tener acceso a los recursos que les permitan alcanzar las metas de modernización y calidad que se han trazado.","It is convenient and necessary to increase their presence in the development of advisory services, consultancies and projects, thus strengthening their capacity for self-management, so that they can have access to the resources that will enable them to achieve the modernization and quality goals they have set for themselves.","506",NA
