"text","text_en","cmp_code","eu_code"
"5. Procurar el saneamiento ambiental, el tratamiento de aguas y desechos líquidos y sólidos, el tratamiento de la basura, y la eliminación de contaminantes y la limpieza de la polución urbana.","5. Procure environmental sanitation, water and liquid and solid waste treatment, garbage treatment, and the elimination of pollutants and the cleaning of urban pollution.","501",NA
"7. Medio ambiente y desarrollo","7. Environment and development","H",NA
"Mención aparte debe hacerse del tema ambiental.","Special mention should be made of the environmental issue.","501",NA
"No hay contradicción entre progreso material y la preservación del ambiente.","There is no contradiction between material progress and environmental preservation.","416.2",NA
"Se reconoce, desde luego, la necesidad de fortalecer la conciencia ecológica, pero debe recordarse que lo que procede no es la contemplación sagrada de la naturaleza, sino la restitución de sus componentes.","Of course, the need to strengthen ecological awareness is recognized, but it should be remembered that it is not the sacred contemplation of nature, but the restitution of its components.","501",NA
"Cada proyecto de desarrollo deberá evaluarse tomando en consideración sus costos y estos deberán incluir la reposición de los bienes que hayan resultado afectados.","Each development project should be evaluated on the basis of its costs, which should include the replacement of affected assets.","416.2",NA
"Los costos ambientales serán incluidos en todos los proyectos públicos, no como un apéndice más sino como parte de sus costos.","Environmental costs will be included in all public projects, not as an appendix but as part of their costs.","416.2",NA
"Si la inclusión de estos costos ambientales no hace rentable socialmente a estos proyectos, los mismos no serán financiados ni con fondos propios ni con fondos externos.","If the inclusion of these environmental costs does not make these projects socially profitable, they will not be financed with either own or external funds.","416.2",NA
"No basta desarrollar una lista de efectos ambientales si no los incorporamos en las decisiones de realizar o no los proyectos de manera científica, no meramente descriptiva.","It is not enough to develop a list of environmental effects if we do not incorporate them into decisions on whether or not to carry out projects in a scientific, not merely descriptive, manner.","416.2",NA
"Proponemos las siguientes acciones estratégicas entre las más sobresalientes en el tema del ambiente:","We propose the following strategic actions among the most outstanding in the area of the environment:","000",NA
"1. Promover y fomentar el desarrollo de una identidad nacional que vincule el orgullo por el patrimonio natural del país, además del histórico y cultural, con la conservación  y el uso sostenible de los mismos.","1. Promote and encourage the development of a national identity that links pride in the country's natural, historical and cultural heritage with the conservation and sustainable use of the same.","416.2",NA
"2. Consolidar la Autoridad Nacional del Ambiente y Reglamentar la Ley General del Ambiente.","2. To consolidate the National Environmental Authority and to regulate the General Environmental Law.","501",NA
"3. Iniciar el Plan de Descontaminación de la Bahía de Panamá que en su primera etapa contempla el saneamiento de la capital, el tratamiento de aguas residuales en los ríos que la atraviesan y una gestión mucho más eficiente de los desechos industriales y comunitarios.","3. Initiate the Panama Bay Decontamination Plan, which in its first stage contemplates the sanitation of the capital city, the treatment of wastewater in the rivers that cross it and a much more efficient management of industrial and community waste.","501",NA
"4. Descentralizar el manejo de los desechos sólidos en todo el país, con amplia participación de la sociedad civil, la empresa privada y las municipalidades.","4. Decentralize solid waste management throughout the country, with broad participation of civil society, private enterprise and municipalities.","501",NA
"5. Ejecutar los acuerdos alcanzados para la protección y manejo de la Cuenca Hidrográfica del Canal de Panamá.","5. To execute the agreements reached for the protection and management of the Panama Canal Watershed.","501",NA
"6. Ejecutar el Programa de Desarrollo Sostenible del Darién.","6. Execute the Darien Sustainable Development Program.","416.2",NA
"7. Habilitar el Parque Natural Metropolitano para que sirva a las grandes mayorías de la ciudad de Panamá que necesitan un verdadero Parque Central en medio de la capital.","7. Enable the Metropolitan Natural Park to serve the great majorities of Panama City that need a true Central Park in the middle of the capital.","501",NA
"8.  Por el Imperio de la Ley y de la Justicia","8.  For the Rule of Law and Justice","H",NA
"El pueblo percibe que la administración de justicia en Panamá es lenta, poco confiable, y no está al alcance del ciudadano común.","The people perceive that the administration of justice in Panama is slow, unreliable, and unavailable to the common citizen.","303",NA
"Esta percepción tiene su origen en problemas que, como la congestión de los tribunales, pueden y deben ser superados si existe la voluntad política necesaria para enfrentar las causas que los originan como el atraso de los códigos y los procedimientos;","This perception is rooted in problems that, like court congestion, can and should be overcome if there is the necessary political will to address their root causes, such as the backlog of codes and procedures;","303",NA
"las limitaciones presupuestarias que impiden la modernización técnica de los despachos judiciales; las limitaciones de la independencia judicial que se derivan de la falta de una Carrera Judicial moderna;","the budgetary limitations that prevent the technical modernization of the judicial offices; the limitations of judicial independence that derive from the lack of a modern Judicial Career;","303",NA
"y el abuso de la detención preventiva, la multiplicidad de funcionarios con facultad para aplicarla que conlleva la sobrepoblación y el hacinamiento que aquejan el sistema penitenciario nacional.","and the abuse of preventive detention, the multiplicity of officials with the power to apply it that leads to the overpopulation and overcrowding that afflict the national penitentiary system.","303",NA
"Ante esta compleja situación, la Alianza Nueva Nación, otorgará prioridad a la tarea de poner la justicia al alcance del pueblo, fortaleciendo la administración de justicia en todo el país.","Faced with this complex situation, the New Nation Alliance will give priority to the task of making justice available to the people, strengthening the administration of justice throughout the country.","303",NA
"Los problemas de la seguridad ciudadana son extraordinariamente importantes, porque afectan a la población y demandan la utilización de recursos financieros que podrían utilizarse en proyectos de desarrollo social como los de educación, salud, vivienda y otros.","Citizen security problems are extremely important because they affect the population and require the use of financial resources that could be used in social development projects such as education, health, housing and others.","605.1",NA
"Hay proliferación de delitos, sobre todo los relacionados con el tráfico de drogas o los que se originan en ese tráfico.","There is a proliferation of crimes, especially those related to drug trafficking or those originating in drug trafficking.","605.1",NA
"También hay, desde luego, hacinamiento penitenciario, que contribuye a agravar la situación.","There is also, of course, prison overcrowding, which contributes to aggravating the situation.","303",NA
"Para resolverla, las siguientes medidas serán puestas en práctica:","In order to solve it, the following measures will be implemented:","000",NA
"a. La aplicación de una nueva concepción en materia de administración de justicia, especialmente la de carácter penal.","a. The implementation of a new conception in the administration of justice, especially criminal justice.","303",NA
"Aunque en ocasiones se enfoca el problema en términos de los más altos niveles, debe empezarse de abajo hacia arriba, es decir, adoptando decisiones en relación con las instituciones que afectan más directamente a la población de menos recursos destinando los recursos presupuestarios para aumentar la capacidad de ejecución del Ministerio Público y del Órgano Judicial a saber, destinando los recursos presupuestarios a la creación de juzgados y funcionarios que los atiendan directamente.","Although the problem is sometimes approached in terms of the highest levels, it must start from the bottom up, that is, by adopting decisions regarding the institutions that most directly affect the population with the least resources by allocating budgetary resources to increase the enforcement capacity of the Public Prosecutor's Office and the Judicial Branch, namely, by allocating budgetary resources to the creation of courts and officials that directly serve them.","303",NA
"b. La sustitución de los Juzgados nocturnos de policía por jueces municipales que formen parte del sistema judicial y que puedan resolver los asuntos puestos a su cuidado sin el complicado sistema de actuar exclusivamente en horas de la noche.","b. The replacement of the night police courts by municipal judges who are part of the judicial system and who can resolve the matters placed under their care without the complicated system of acting exclusively during night hours.","303",NA
"c. La determinación clara de quien puede ejercer la facultad de la detención preventiva y en qué casos específicos, atendiendo al grado de peligrosidad física del sindicato y superando el concepto de que la detención preventiva es la regla general.","c. The clear determination of who may exercise the power of preventive detention and in which specific cases, attending to the degree of physical danger of the syndicate and overcoming the concept that preventive detention is the general rule.","303",NA
"d. La provisión del número suficiente de defensores públicos para que se carguen de atender a las personas que carecen de recursos para contratar su propia defensa, de tal modo que no haya en las cárceles acusados sin fundamento legal para serlo y se puedan descongestionar aquellas.","d. The provision of a sufficient number of public defenders to take care of people who lack the resources to hire their own defense, so that there are no accused in prisons without legal grounds to be so, and so that they can decongest those prisons.","303",NA
"e. El aumento de las penas por delitos graves, especialmente los que provienen del narcotráfico y los que ponen en peligro la vida o la salud de los ciudadanos.","e. The increase of penalties for serious crimes, especially those stemming from drug trafficking and those that endanger the life or health of citizens.","303",NA
"Garantía de la seguridad ciudadana","Guarantee of public safety","H",NA
"El fortalecimiento de la Fuerza Pública, en particular de la Policía Nacional tiene que ser una preocupación constante del Estado panameño.","The strengthening of the Public Force, particularly the National Police, must be a constant concern of the Panamanian State.","605.1",NA
"El criterio de una Policía vinculada a la comunidad debe ampliarse a fin de obtener mejores resultados en la prevención y en el combate al delito, en conjunto con los asociados.","The criterion of a police force linked to the community must be expanded in order to obtain better results in preventing and combating crime, together with its partners.","605.1",NA
"La dotación acusada de equipos y la creación de incentivos que garanticen una policía motivada en sus tareas será nuestra responsabilidad.","It will be our responsibility to provide the necessary equipment and incentives to ensure that the police are motivated in their duties.","605.1",NA
"Una situación que merecerá estricta atención es la de Darién.","One situation that will merit close attention is that of Darien.","605.1",NA
"La Policía Nacional ha estado estableciendo nuevas estaciones en esa provincia, sobre todo en vistas al problema fronterizo, pero es necesario aplicar el Plan de Desarrollo Integral y retomar con Colombia la decisión de desarrollar el Parque Binacional en la región.","The National Police has been establishing new stations in that province, especially in view of the border problem, but it is necessary to implement the Integral Development Plan and resume with Colombia the decision to develop the Binational Park in the region.","605.1",NA
"Por otro lado, debe recordarse que en Panamá se vive en un Estado de Derecho.","On the other hand, it should be remembered that Panama lives under the rule of law.","202.1",NA
"La violación de las garantías individuales no es la regla general, sino la excepción.","The violation of individual guarantees is not the general rule, but the exception.","202.1",NA
"No obstante, se pueden adoptar las siguientes medidas para proveer mayor seguridad jurídica y, en consecuencia, para crear mejores condiciones para el crecimiento y la solución de los problemas sociales:","However, the following measures can be adopted to provide greater legal security and, consequently, to create better conditions for growth and the solution of social problems:","202.1",NA
"a. Reforzar la administración de justicia marítima, por razón de la importancia de la misma en Panamá, ampliada por la reversión del Canal; y","a. Strengthen the administration of maritime justice, by reason of the importance of the same in Panama, amplified by the reversion of the Canal; and","303",NA
"b. Crear todos los nuevos instrumentos para asegurar que Panamá, así como se ha estado vinculando al comercio internacional, complemente ese legítimo interés con el establecimiento de los instrumentos de justicia económica y comercial que serán absolutamente necesarios para proteger los intereses de nuestro país y de sus productores.","b. To create all new instruments to ensure that Panama, just as it has been linking itself to international trade, complements that legitimate interest with the establishment of the instruments of economic and commercial justice that will be absolutely necessary to protect the interests of our country and its producers.","406",NA
"Por un Estado administrativo con eficiencia y transparencia","For an administrative State with efficiency and transparency","H",NA
"Justicia no es solamente un asunto de litigios y tribunales.","Justice is not just a matter of litigation and courts.","000",NA
"Justicia es también que el gobierno le ofrezca al pueblo el servicio que merece y por los que paga impuestos.","Justice is also that the government offers the people the service they deserve and for which they pay taxes.","303",NA
"La modernización de la administración pública es un tema de urgencia nacional para que las políticas públicas sean efectivas y se cumpla plenamente con las leyes.","The modernization of public administration is a matter of national urgency so that public policies are effective and laws are fully complied with.","303",NA
"Proponemos, para lograrlo, los siguientes principios generales:","In order to achieve this, we propose the following general principles:","000",NA
"1. El usuario es quien manda y no el funcionario público.","1. The user is in charge, not the public official.","303",NA
"2. La gestión pública debe basarse en resultados y no es normas.","2. Public management must be based on results and not on rules.","303",NA
"3. La transparencia es la enemiga principal de la corrupción.","3. Transparency is the main enemy of corruption.","304",NA
"4. La evaluación de resultados es necesaria para el funcionamiento eficiente de las instituciones.","4. Evaluation of results is necessary for the efficient functioning of institutions.","303",NA
"5. Es imprescindible resaltar la importancia del funcionario.","5. It is essential to highlight the importance of the civil servant.","303",NA
"Un gobierno eficiente se basa, fundamentalmente, en la capacidad gerencial de sus más altas autoridades.","An efficient government is based, fundamentally, on the managerial capacity of its highest authorities.","303",NA
"En consecuencia, proponemos otorgarle prioridad a la formación de verdaderos gerentes de la función pública y mecanismos para exigirles producción, es decir, resultados en beneficio de la población panameña.","Consequently, we propose to give priority to the training of true public service managers and mechanisms to demand production, that is, results for the benefit of the Panamanian population.","303",NA
"Muchas veces se propone solucionar situaciones negativas mediante la adopción de una nueva legislación, cuando ni siquiera logramos asegurar el cumplimiento de las leyes de la república.","Many times it is proposed to solve negative situations by adopting new legislation, when we do not even manage to ensure compliance with the laws of the republic.","303",NA
"En consecuencia, proponemos que se instale una Comisión Nacional para el Cumplimento de las Leyes, que haga una revisión integral de nuestra legislación, el estado de su cumplimiento y recomiende medidas para remediar las situaciones anómalas.","Consequently, we propose the establishment of a National Commission for the Enforcement of Laws to conduct a comprehensive review of our legislation, the status of its enforcement and recommend measures to remedy anomalous situations.","303",NA
"Sería esta, además, una de las formas efectivas de atacar el problema de la corrupción que debe ser erradicada, tal como es la intención de esta propuesta de la Alianza Nueva Nación.","This would also be one of the effective ways to attack the problem of corruption that must be eradicated, as is the intention of this proposal of the New Nation Alliance.","304",NA
"9. Democracia y participación ciudadana","9. Democracy and citizen participation","H",NA
"Defenderemos y protegeremos la democracia y todas las libertades que la componen.","We will defend and protect democracy and all the freedoms that comprise it.","202.1",NA
"La libertad de expresión es base fundamental del sistema y no puede ser objeto de censura, coacción, presión directa o indirecta ni limitación de ninguna naturaleza.","Freedom of expression is the fundamental basis of the system and may not be subject to censorship, coercion, direct or indirect pressure or limitation of any kind.","201.2",NA
"Esta convicción sobre la necesidad y la convivencia de fortalecer constantemente la libertad de expresión incluye los siguientes compromisos:","This conviction about the necessity and coexistence of constantly strengthening freedom of expression includes the following commitments:","201.2",NA
"a. Reconocer que las normas legales que autorizan al Órgano Ejecutivo a aplicar sanciones a los medios de comunicación por razón de publicación de noticias, son contrarias a la libertad de expresión y, en consecuencia, deben ser derogadas.","a. Recognize that the legal norms that authorize the Executive Branch to apply sanctions to the media for the publication of news are contrary to freedom of expression and, consequently, should be repealed.","201.2",NA
"b. Reconocer que las disposiciones legales que sancionan la calumnia y la injuria con penas privativas que la libertad son contrarias al ideal democrático y no han protegido la honra de los ciudadanos.","b. Recognize that the legal provisions that punish slander and libel with custodial sentences are contrary to the democratic ideal and have not protected the honor of citizens.","201.2",NA
"c. En consecuencia, deben ser sustituidas por un sistema que, al mismo tiempo que brinde protección a la honra y a la dignidad, establezca mecanismos sencillos y prácticos que permitan a los agraviados por calumnia o injuria una justa compensación económica.","c. Consequently, they should be replaced by a system that, while providing protection for honor and dignity, establishes simple and practical mechanisms that allow those aggrieved by slander or libel to receive fair financial compensation.","201.2",NA
"d. Establecer, como una facultad indeclinable, la libertad de información  sobre los asuntos del gobierno, para que todos los ciudadanos tengan el derecho de informarse sobre cualquier tema de gobierno.","d. Establish, as an indeclinable power, freedom of information on government affairs, so that all citizens have the right to be informed on any government issue.","201.2",NA
"e. Es inadmisible el secreto en las cuestiones gubernamentales.","e. Secrecy in governmental matters is inadmissible.","304",NA
"Por otra parte, se adquiere el compromiso de asegurar la autonomía financiera del Tribunal Electoral, mediante la provisión automática de los recursos necesarios para organizar los procesos electorales y para asegurar el cumplimiento de todas sus atribuciones.","On the other hand, a commitment is made to ensure the financial autonomy of the Electoral Tribunal, through the automatic provision of the necessary resources to organize the electoral processes and to ensure the fulfillment of all its attributions.","202.1",NA
"Se rechaza  cualquier medida que de por resultado el aumento de los costes de funcionamiento del Órgano Legislativo.","Any measure that results in an increase in the operating costs of the Legislative Body is rejected.","303",NA
"En la Asamblea Legislativa no debe haber aumento ni de legislaciones ni de sueldos.","In the Legislative Assembly there should be no increase in legislation or salaries.","303",NA
"Hay que, por el contrario, aumentar los mecanismos de participación ciudadana, a fin de que la democracia sea más participativa.","On the contrary, it is necessary to increase the mechanisms for citizen participation in order to make democracy more participatory.","202.1",NA
"En ese sentido, se adquieren los siguientes compromisos:","In this sense, the following commitments are made:","000",NA
"a. Aplicar el artículo 236 de la Constitución Política, sobre el derecho de iniciativa y de referéndum que tienen los ciudadanos en asuntos municipales.","a. Apply Article 236 of the Political Constitution, on the right of initiative and referendum that citizens have in municipal matters.","202.4",NA
"b. Realizar consultas mediante votación directa para que la ciudadanía se pronuncie sobre distintos temas de interés público.","b. To carry out consultations through direct voting so that citizens may express their opinion on different issues of public interest.","202.4",NA
"c. Establecer el Consejo Consultivo en cada ministerio que deberá reunirse por lo menos dos veces al año.","c. Establish the Advisory Council in each ministry, which shall meet at least twice a year.","202.1",NA
"Este Consejo estará formado por ciudadanos en distinta procedencia, con el objeto de que, con sus criterios y opiniones, ayuden a la realización de una gestión pública eficaz, que responda a las preocupaciones de la sociedad.","This Council will be made up of citizens from different backgrounds, so that, with their criteria and opinions, they can help to achieve effective public management that responds to the concerns of society.","202.1",NA
"d. Trasladar a los municipios algunas facultades que actualmente residen en el gobierno central.","d. Transfer to the municipalities some of the powers that currently reside in the central government.","301",NA
"En algunos casos, el impuesto de inmueble deberá ser administrado por los municipios.","In some cases, the property tax should be administered by the municipalities.","301",NA
"e. Establecer claros mecanismos de rendición de cuentas por parte de los administradores municipales hacia la comunidad.","e. Establish clear accountability mechanisms for municipal administrators to the community.","202.1",NA
"Que todos los ciudadanos del distrito puedan enterarse de la manera como se han gastado o se están gastando los recursos municipales.","That all citizens of the district can find out how municipal resources have been or are being spent.","202.1",NA
"Para estos efectos, no se aceptará ninguna excusa ni pretextos.","For these purposes, no excuses or pretexts will be accepted.","202.1",NA
"f. Señalar la obligación de los Consejos Municipales de discutir el presupuesto municipal en sesiones públicas, con la participación de las comunidades.","f. Point out the obligation of the Municipal Councils to discuss the municipal budget in public sessions, with the participation of the communities.","202.1",NA
"Cuando ello, por razones físicas, no sea posible, se establecerán los mecanismos para la discusión pública de los presupuestos.","When, for physical reasons, this is not possible, mechanisms for public discussion of the budgets shall be established.","202.1",NA
"10.  Una Política Exterior para el Siglo XXI","10.  A Foreign Policy for the 21st Century","H",NA
"La función internacional de Panamá ha sido, en los últimos casi cinco siglos de nuestra historia y lo será en nuestro porvenir, la columna vertebral de su existencia y marca principal  de su identidad.","Panama's international role has been, in the last almost five centuries of our history and will be in our future, the backbone of its existence and the main mark of its identity.","601.1",NA
