"text","text_en","cmp_code","eu_code"
"El ahorro privado se debe promover mediante el fortalecimiento de instituciones como el mercado de valores y las superintendencias del sector financiero.","Private savings should be promoted by strengthening institutions such as the stock market and financial sector superintendencies.","414",NA
"La adaptación de tecnología en todos los sectores contribuye en un elevado porcentaje al crecimiento.","The adaptation of technology in all sectors contributes to a high percentage of growth.","411",NA
"Este plan contempla la reconversión de ciertas labores agrícolas de baja tecnología hacia sistemas de producción y comercialización modernos para incrementar los ingresos de los trabajadores agropecuarios, los cuales constituyen el principal núcleo de pobreza y pobreza extrema en el país.","This plan contemplates the reconversion of certain low-technology agricultural activities to modern production and marketing systems in order to increase the income of agricultural workers, who constitute the main nucleus of poverty and extreme poverty in the country.","703.1",NA
"La mayor participación ciudadana en la fuerza laboral se logrará cuando el paternalismo estatal se reemplace por un ambiente en donde se premie con los salarios adecuados al trabajo bien hecho.","Greater citizen participation in the labor force will be achieved when state paternalism is replaced by an environment where proper wages are rewarded for a job well done.","701",NA
"Esto toma tiempo, pero lograremos avances importantes mediante la institucionalización de un proceso de capacitación laboral dirigido a satisfacer las demandas del mercado laboral.","This takes time, but we will make significant progress by institutionalizing a job training process aimed at meeting the demands of the labor market.","411",NA
"La estructura del empleo, la productividad y los ingresos laborales son muy peculiares en Panamá.","The structure of employment, productivity and labor income are very peculiar in Panama.","000",NA
"En ciertos sectores llamados modernos, la productividad de la mano de obra y con ello sus salarios han sido hasta diez veces superiores a los de los sectores más atrasados por los últimos quince años.","In certain so-called modern sectors, labor productivity and thus wages have been up to ten times higher than those of the most backward sectors for the last fifteen years.","000",NA
"En el Panamá moderno existe escasez de mano de obra, lo cual se ha reflejado en elevados salarios.","In modern Panama there is a shortage of labor, which has been reflected in high wages.","000",NA
"En el Panamá atrasado, por el contrario, hay más gente dispuesta a trabajar que puestos de trabajo disponibles; por ello, los salarios no suben y la desocupación es enorme.","In backward Panama, on the contrary, there are more people willing to work than there are jobs available; therefore, wages do not rise and unemployment is enormous.","000",NA
"Esta es la paradoja fundamental de la economía nacional: su evidente dualidad.","This is the fundamental paradox of the national economy: its evident duality.","000",NA
"Mover la población del sector atrasado al moderno no es cuestión de meses.","Moving the population from the backward to the modern sector is not a matter of months.","000",NA
"Eso toma tiempo, pero se requiere empezar pronto y con decisión porque el largo plazo comienza hoy.","This takes time, but we need to start early and decisively because the long term starts today.","411",NA
"Por ello, como temas centrales de nuestra propuesta económica, la educación y la capacitación serán los grandes equilibradores de la sociedad panameña.","Therefore, as central themes of our economic proposal, education and training will be the great balancers of Panamanian society.","506",NA
"En el plazo más corto, proponemos los siguientes puntos de apoyo a una estrategia laboral de mayor plazo.","In the shorter term, we propose the following points to support a longer-term labor strategy.","000",NA
"Apoyo a la micro, pequeña y mediana empresa","Support for micro, small and medium-sized enterprises","403",NA
"Existe un gran número de micros, pequeñas y medianas empresas en el país que generan muchísimo empleo urbano.","There are a large number of micro, small and medium-sized enterprises in the country that generate a great deal of urban employment.","403",NA
"Creemos que ellas seguirán siendo las fuentes más importantes de puestos de trabajo para los niveles de calificación media y baja en Panamá.","We believe that they will continue to be the most important sources of jobs for the middle and low skill levels in Panama.","403",NA
"Proponemos eliminar todos los impedimentos legales que atrasan la creación de estas empresas tales como licencias comerciales y permisos especiales, entre otros.","We propose to eliminate all legal impediments that delay the creation of these companies, such as commercial licenses and special permits, among others.","303",NA
"Los papeleos burocráticos castigan la creación de empleo en toda la economía, pero especialmente en las empresas de menor capacidad económica.","Bureaucratic red tape penalizes job creation throughout the economy, but especially in companies with less economic capacity.","303",NA
"La capacitación del micro, pequeño y mediano empresario y empresaria para administrar los recursos humanos y de crédito será prioridad gubernamental para el desarrollo de la nueva empresa panameña","Training micro, small and medium-sized entrepreneurs to manage human and credit resources will be a government priority for the development of the new Panamanian enterprise.","411",NA
"Programas de aprendices","Apprenticeship programs","H",NA
"Instituiremos un programa masivo de aprendices que permita incorporar a la experiencia laboral por un corto período a los miembros más jóvenes de la población.","We will institute a massive apprenticeship program that will allow us to incorporate the youngest members of the population into the work experience for a short period of time.","411",NA
"El programa masivo de aprendices romperá el círculo vicioso de que no se emplea a quien no tiene experiencia, pero no se puede adquirir experiencia si esa persona no se emplea.","The massive apprenticeship program will break the vicious cycle of not employing someone who has no experience, but no experience can be gained if that person is not employed.","411",NA
"El mejor uso del seguro educativo","The best use of educational insurance","H",NA
"Se debe reestructurar por completo el sistema de capacitación nacional.","The national training system must be completely restructured.","411",NA
"En esto nos llevan ventaja muchos países vecinos.","Many neighboring countries are ahead of us in this respect.","411",NA
"Los fondos se encuentran disponibles: el seguro educativo, ese impuesto que pagan las empresas, los asalariados y los profesionales independientes, produce alrededor de 80 millones de balboas, mucho más que el ITBM.","The funds are available: the educational insurance, that tax paid by companies, salaried employees and independent professionals, produces around 80 million balboas, much more than the ITBM.","411",NA
"Estos fondos deben canalizarse para que el IFARHU, en INAFORP, las organizaciones sindicales y los otros centros de capacitación, se logre el mejoramiento de la mano de  obra como la vía más rápida para adaptar al trabajador a los requisitos de los cambiantes mercados.","These funds should be channeled to IFARHU, INAFORP, trade union organizations and other training centers to improve the labor force as the fastest way to adapt the worker to the requirements of changing markets.","411",NA
"En particular, le daremos además al INAFORP el carácter de agente normador de las nuevas empresas y organizaciones públicas y privadas que brinden programas de capacitación.","In particular, we will also make INAFORP the regulatory agent for new companies and public and private organizations that provide training programs.","411",NA
"Dejaremos que el sector productivo determine las necesidades de calificación de la mano de obra y el entrenamiento a los potenciales trabajadores.","We will leave it to the productive sector to determine labor qualification needs and the training of potential workers.","411",NA
"El Estado vigilará que este proceso sea eficiente y de alta calidad.","The State will ensure that this process is efficient and of high quality.","411",NA
"Apoyaremos a la Fundación del Trabajo en sus esfuerzos de buscar el consenso en las políticas laborales panameñas.","We will support the Fundación del Trabajo in its efforts to seek consensus in Panamanian labor policies.","701",NA
"Por el surgimiento de nuevos empresarios","Due to the emergence of new entrepreneurs","H",NA
"Luchar contra el desempleo presume un cambio significativo y esencial en la conducta nacional.","Fighting unemployment presumes a significant and essential change in national behavior.","402",NA
"El objetivo de los jóvenes en Panamá debe de ser no tanto convertirse en empleados públicos y tampoco en empleados del sector privado, porque el espacio no siempre es suficiente.","The goal of young people in Panama should be not so much to become public employees but also to become employees in the private sector, because there is not always enough space.","402",NA
"Lo correcto es que en Panamá florezca la idea de que cada cual quiera ser empresario, grande, mediano o pequeño.","The right thing is that in Panama the idea that everyone wants to be an entrepreneur, big, medium or small, should flourish.","402",NA
"Hay campo para que puedan surgir nuevos empresarios y convertirse en líderes de la economía.","There is room for new entrepreneurs to emerge and become leaders in the economy.","402",NA
"C. El manejo de los Fondos Públicos","C. Management of Public Funds","H",NA
"Las finanzas públicas se encuentran en una difícil situación.","Public finances are in a difficult situation.","414",NA
"Los ingresos corrientes no alcanzan para pagar los gastos corrientes y financiar una porción importante de las inversiones públicas.","Current revenues are not enough to pay current expenses and finance a significant portion of public investments.","414",NA
"Alrededor de un tercio de estos ingresos se debe destinar a pagar los intereses de deudas acumuladas en el pasado, a pesar de los esfuerzos recientes por mejorar este perfil de endeudamiento.","About one-third of this income must be used to pay interest on debts accumulated in the past, despite recent efforts to improve this debt profile.","414",NA
"Otro tercio corresponde a compromisos con los trabajadores del Estado.","Another third corresponds to commitments to government employees.","414",NA
"Por tanto, la capacidad de maniobra de la política fiscal es muy limitada.","Therefore, the fiscal policy maneuvering capacity is very limited.","414",NA
"Como consecuencia de ello, se requiere lo siguiente:","As a result, the following is required:","000",NA
"a. Finanzas Públicas","a. Public Finances","H",NA
"Uno de los elementos más importantes para mantener el riesgo de invertir en Panamá como uno de los más bajos de América Latina, es mantener las finanzas públicas en orden.","One of the most important elements to keep the risk of investing in Panama as one of the lowest in Latin America is to keep public finances in order.","414",NA
"La situación financiera del gobierno nacional es difícil, tanto frente a sus compromisos actuales como frente a las necesidades de salir a los mercados internacionales de capital a realizar operaciones millonarias de refinanciamiento.","The national government's financial situation is difficult, both in view of its current commitments and the need to go to the international capital markets to carry out millionaire refinancing operations.","414",NA
"La tarea de ordenar las cuentas fiscales será una de las labores más prioritarias de la administración financiera de los próximos años.","The task of sorting out the fiscal accounts will be one of the highest priority tasks of the financial administration in the coming years.","414",NA
"Del lado de los ingresos, se buscará una mayor justicia tributaria mediante mecanismos de mejor recaudación de los impuestos existentes.","On the revenue side, greater tax fairness will be sought through mechanisms to improve the collection of existing taxes.","414",NA
"Del lado de los gastos, se buscará la racionalización de los mismos.","On the expenditure side, rationalization will be sought.","414",NA
"El pago de intereses de la deuda, que absorbe un tercio de los ingresos fiscales, debe reducirse poco a poco mediante el crecimiento de los ingresos y juiciosas operaciones de financiamiento, en las cuales el país ha tenido experiencias exitosas recientes.","Interest payments on the debt, which absorb one third of fiscal revenues, should be gradually reduced through revenue growth and judicious financing operations, in which the country has had recent successful experiences.","414",NA
"b. Racionalización del funcionamiento del Estado","b. Rationalization of the functioning of the State","H",NA
"Ello se hará no sólo por las implicaciones sobre las cuentas fiscales, sino para volverlo más eficiente en realizar aquellas cosas que deben hacer bien: seguridad ciudadana, educación de primera calidad, promoción de la salud, reconversión productiva y administración de justicia, entre otros.","This will be done not only because of the implications on the fiscal accounts, but also to make it more efficient in doing those things it should do well: citizen security, quality education, health promotion, productive reconversion and administration of justice, among others.","303",NA
"c. Lucha contra la corrupción","c. Fight against corruption","H",NA
"La corrupción es un fenómeno de diversas causas y de múltiples consecuencias.","Corruption is a phenomenon of diverse causes and multiple consequences.","304",NA
"La corrupción abarca todos los estamentos de la sociedad: en el sector privado y en público, al empleado de bajos ingresos y al jefe.","Corruption covers all levels of society: in the private and public sector, the low-income employee and the boss.","304",NA
"Pero la fuerza del ejemplo, especialmente de los más grandes, y el castigo que imponen las leyes son los principales obstáculos a la corrupción.","But the force of example, especially of the greatest, and the punishment imposed by the laws are the main obstacles to corruption.","304",NA
"Por ahí empezaremos, vamos a nombrar en todos los cargos de responsabilidad a personas que den ejemplo con su honestidad y honradez a los subalternos.","That is where we will start, we will appoint to all positions of responsibility people who will set an example to their subordinates with their honesty and integrity.","304",NA
"Trabajaremos con los Órganos Legislativo y Judicial con la Contraloría General de la República para revisar y mejorar las leyes que castigan la corrupción administrativa.","We will work with the Legislative and Judicial Bodies and the Office of the Comptroller General of the Republic to review and improve the laws that punish administrative corruption.","304",NA
"Todas las contrataciones que celebre el Gobierno Nacional estarán disponibles al escrutinio público y los funcionarios responsables estarán obligados a brindar todas las explicaciones que soliciten los ciudadanos.","All contracts entered into by the National Government shall be open to public scrutiny and the responsible officials shall be obliged to provide all explanations requested by citizens.","304",NA
"D. La Política Comercial","D. Commercial Policy","H",NA
"Existe una tendencia mundial y regional de la cual Panamá no puede ni debe aislarse, orientada hacia la creación de zonas de libre comercio y apertura de mercados.","There is a global and regional trend from which Panama cannot and should not isolate itself, oriented towards the creation of free trade zones and the opening of markets.","401",NA
"Sin embargo, nuestra participación en dichas iniciativas debe darse tomando en cuenta nuestras realidades, ventajas y limitaciones siempre son la participación del sector privado, buscando la aplicación del principio de reciprocidad con cualquier nación del mundo.","However, our participation in such initiatives must take into account our realities, advantages and limitations, always with the participation of the private sector, seeking the application of the principle of reciprocity with any nation in the world.","401",NA
"Uno de los fines principales de las reformas comerciales debe ser aumentar el nivel de competitividad de las empresas panameñas, por lo que es un deber del gobierno diseñar y ejecutar programas de apoyo al sector productivo y planes de reconversión industrial y agropecuario para preparar  a los sectores menos competitivos para que puedan competir con éxito en el mercado nacional e internacional.","One of the main purposes of trade reforms should be to increase the level of competitiveness of Panamanian companies, so it is the government's duty to design and implement programs to support the productive sector and industrial and agricultural conversion plans to prepare less competitive sectors to compete successfully in the domestic and international markets.","411",NA
"Se adoptarán, con este propósito, incentivos para la realización del ajuste estructural necesario que tenga como finalidad la viabilidad económica de las empresas que se vean amenazadas por la rebaja arancelaria.","To this end, incentives will be adopted for the necessary structural adjustment aimed at the economic viability of the companies threatened by the tariff reduction.","402",NA
"El programa de apoyo al sector productivo incluirá, entre otros, subsidios al crédito, entrenamiento y formación  técnica de mano de obra especializada, acceso a información de mercados y a tecnología, apoyo a la relocalización, auxilio en la búsqueda de puestos de trabajadores desplazados como consecuencia de las reformas y protección arancelaria temporal.","The support program for the productive sector will include, among others, credit subsidies, training and technical training of skilled labor, access to market information and technology, relocation support, assistance in finding jobs for workers displaced as a result of the reforms, and temporary tariff protection.","402",NA
"Es igualmente deber del gobierno nacional garantizar a las empresas que se vean amenazadas como consecuencia de la rebaja arancelaria o que sean víctimas de prácticas desleales de comercio exterior, una protección temporal rápida y eficaz que permita su viabilidad económica mientras  realicen los ajustes necesarios.","It is also the duty of the national government to guarantee companies that are threatened as a result of the tariff reduction or that are victims of unfair foreign trade practices, a quick and effective temporary protection that allows their economic viability while they make the necessary adjustments.","403",NA
"En tal sentido revisaremos las normas que actualmente regulan las medidas de salvaguardia y comercio desleal, en particular la ley 29 de 1996 para convertirla en un mecanismo más expedito de protección.","In this regard, we will review the rules that currently regulate safeguard and unfair trade measures, in particular Law 29 of 1996, in order to make it a more expeditious protection mechanism.","403",NA
"Vemos con agrado la creación de organizaciones de desarrollo provincial formadas por empresarios de la región para estudiar, desde un enfoque de la producción, las oportunidades y desafíos que enfrentan los productores agrícolas frente a la apertura comercial.","We welcome the creation of provincial development organizations formed by entrepreneurs in the region to study, from a production approach, the opportunities and challenges faced by agricultural producers in the face of trade liberalization.","703.1",NA
"Los trabajadores y empresarios del país se han caracterizado por su creatividad y esfuerzo y ellas los harán salir airosos del desafío de los nuevos tiempos.","The country's workers and entrepreneurs have been characterized by their creativity and effort, and these will enable them to rise to the challenge of the new times.","601.1",NA
"Pero la política comercial no se refiere sólo al comercio exterior.","But trade policy is not just about foreign trade.","000",NA
"Existen monopolios y privilegios en los mercados internos que impiden que la rebaja de aranceles se trasladen a los consumidores.","There are monopolies and privileges in domestic markets that prevent tariff reductions from being passed on to consumers.","403",NA
"En la eliminación de estas distorsiones apoyaremos activamente a la CICLAC.","We will actively support CICLAC in eliminating these distortions.","403",NA
"E. Los Sectores dinámicos en la Economía Panameña","E. Dynamic Sectors in the Panamanian Economy","H",NA
"No es tarea de los gobiernos determinar qué sectores productivos deben ser favorecidos por el Estado: todos deben tener el mismo tratamiento, hasta donde sea posible.","It is not the task of governments to determine which productive sectors should be favored by the State: all should be treated equally, as far as possible.","401",NA
"Los países que han intentado, desde una oficina pública, decidir qué sectores deben ser favorecidos y cuáles no, han fracasado rotundamente con el consecuente costo para la economía.","Countries that have tried, from a public office, to decide which sectors should be favored and which should not, have failed miserably with the consequent cost to the economy.","401",NA
"La competitividad de nuestro país ha descansado en los servicios, especialmente los vinculados al transporte internacional y a las finanzas.","Our country's competitiveness has relied on services, especially those related to international transportation and finance.","408",NA
"Estos sectores, sin embargo, demandan mano de obra de alta calificación y generan poco empleo, aunque bien remunerado.","These sectors, however, require highly skilled labor and generate few, albeit well-paid, jobs.","701",NA
"Existe todavía un amplio espacio para el crecimiento de estos sectores de alta productividad.","There is still ample room for growth in these high-productivity sectors.","410",NA
"Los sectores industrial y turístico pueden mejorar su competitividad no mediante incentivos especiales, sino con la colaboración del Estado en la eliminación de los obstáculos para su desarrollo.","The industrial and tourism sectors can improve their competitiveness not through special incentives, but with the collaboration of the State in removing obstacles to their development.","403",NA
"De esta forma apoyarán en la generación de exportaciones que es la base del crecimiento a largo plazo del país.","In this way, they will support the generation of exports, which is the basis for the country's long-term growth.","403",NA
"En la industria, reestructuraremos los servicios estatales de capacitación laboral para mejorar la productividad del trabajador;","In industry, we will restructure the state's labor training services to improve worker productivity; we","411",NA
"reduciremos los costos internos de los bienes que se comercializan fuera del país para hacer más competitivas nuestras exportaciones;","will reduce the domestic costs of goods traded outside the country to make our exports more competitive;","406",NA
"y aceleraremos los trámites para lograr que las resoluciones de los entes reguladores de la competencia se lleven a la práctica sin demora.","and we will speed up procedures to ensure that the rulings of competition regulators are implemented without delay.","403",NA
"En el turismo, creemos que el país debe adaptarse a las demandas del llamado turismo del siglo XXI.","In tourism, we believe that the country must adapt to the demands of the so-called 21st century tourism.","408",NA
"Este tipo de turismo consiste en actividades enriquecedoras del visitante como las ecológicas, visitas a lugares históricos, compenetración con las culturas autóctonas, turismo deportivo especializado, entre otros.","This type of tourism consists of enriching activities for the visitor, such as ecological activities, visits to historical sites, rapport with native cultures, specialized sports tourism, among others.","502",NA
"Mediante el proyecto de Turismo-Conservación-Investigación tenemos una oportunidad única de ofrecer un producto turístico de alta calidad en todo el país en la red de rutas patrimoniales.","Through the Tourism-Conservation-Research project we have a unique opportunity to offer a high quality tourism product throughout the country in the network of heritage routes.","402",NA
"El papel del Estado debe ser adaptar las instituciones de promoción turística a estas nuevas realidades: desburocratizar el otorgamiento de incentivos existentes que son importantes: colaborar en la capacitación del personal especializado de atención al turista; mejorar la seguridad individual de todos incluyendo la de los turistas; y, mejorar la imagen externa del país.","The role of the State should be to adapt tourism promotion institutions to these new realities: to reduce bureaucracy in the granting of existing incentives that are important; to collaborate in the training of specialized tourist service personnel; to improve the individual safety of all, including that of tourists; and to improve the country's external image.","408",NA
"1.  Atención Especial al Sector Agropecuario","1. Special Attention to the Agricultural and Livestock Sector","H",NA
