"text","text_en","cmp_code","eu_code"
"I. El México Que Anhelamos.","I. The Mexico We Long For.",NA,NA
"Es posible pensar en un México que sea una verdadera patria para todos los mexicanos.","It is possible to think of a Mexico that is a true homeland for all Mexicans.","601",NA
"El México que surgirá cuando Acción Nacional llegue al poder, con la colaboración de todos, será una patria como un hogar amplio y acogedor, en el que nos sentiremos seguros, protegidos, estimados y respetados, en él cada mexicano encontrará los elementos y las condiciones adecuadas para su propio desarrollo y perfeccionamiento.","The Mexico that will emerge when Acción Nacional comes to power, with the collaboration of all, will be a homeland like a wide and welcoming home, where we will feel safe, protected, esteemed and respected, where each Mexican will find the elements and the adequate conditions for his or her own development and improvement.","601",NA
"Tenemos que ambicionar un México así; en él, los gobernantes no recibirán un culto público personal, ni formarán una clase social apartada y privilegiada.","We must aspire to such a Mexico; in it, the rulers will not receive a personal public cult, nor will they form an isolated and privileged social class.","601",NA
"México será una república en la que los ciudadanos y gobernantes se verán como iguales","Mexico will be a republic in which citizens and rulers will see each other as equals","503",NA
"y el presidente y el policía, el cartero y el diputado, el gobernador y el presidente municipal recibirán el respeto y la estima de todos por igual, porque serán tan sólo sobrios servidores públicos, dedicados a cumplir con su misión, bien remunerados para que tengan lo suficiente para una existencia plena, y con éste motivo siempre dispuesto a cumplir con su deber.","and the president and the policeman, the letter carrier and the deputy, the governor and the municipal president will receive the respect and esteem of all alike, because they will be only sober public servants, dedicated to fulfilling their mission, well remunerated so that they have enough for a full existence, and with this motive always ready to do their duty.","601",NA
"En ese México que construiremos entre todos, los maestros dejarán de ser profesionistas de segunda línea, la educación será preocupación principal del gobierno y la actividad fundamental de la sociedad entera.","In this Mexico that we will build together, teachers will cease to be second-rate professionals, education will be the main concern of the government and the fundamental activity of society as a whole.","506",NA
"Sin monopolio educativo, con recursos bien distribuidos, maestros con una jerarquía social correspondiente a la importancia de su misión, se educará a los niños y a los jóvenes en la solidaridad, la comprensión y el trabajo, y paulatinamente veremos que se toma el camino del orden, de la justicia y del verdadero progreso.","Without an educational monopoly, with well-distributed resources, teachers with a social hierarchy corresponding to the importance of their mission, children and young people will be educated in solidarity, understanding and work, and gradually we will see that the path of order, justice and true progress is taken.","506",NA
"La justicia será un valor fundamental en la sociedad, cada quién recibirá lo que le corresponde; los delincuentes, de todos los niveles sociales, su castigo sin excesos ni atropello a su dignidad,","Justice will be a fundamental value in society, everyone will receive their due; criminals, of all social levels, will be punished without excesses or outrages to their dignity,","605",NA
"los hombres de bien, el fruto justo de su trabajo","good men will receive the just fruits of their labor","401",NA
"y todos, especialmente los niños y los jóvenes, las mismas o parecidas oportunidades para su perfeccionamiento físico, cultural y espiritual.","and everyone, especially children and young people, will have the same or similar opportunities for their physical, cultural and spiritual improvement.","503",NA
"La justicia hará que se acabe el acaparamiento y la acumulación de la riqueza, con el predominio de los extranjeros sobre los mexicanos, con las diferencias abismales de las clases sociales.","Justice will put an end to the hoarding and accumulation of wealth, to the predominance of foreigners over Mexicans, to the abysmal differences between social classes.","503",NA
"La justicia será la virtud por excelencia de la sociedad mexicana, y sus valores, los que rijan todos los actos de las autoridades.","Justice will be the virtue par excellence of Mexican society, and its values will govern all acts of the authorities.","601",NA
"Se buscará tanto en las empresas públicas como en las privadas, que los que las integran –inversionistas y trabajadores o empleados- participen cada vez más y con mayor equidad en la dirección, en la propiedad y el disfrute de las utilidades.","In both public and private companies, it will be sought that those who make up the companies -investors and workers or employees- participate more and more and with greater equity in the management, ownership and enjoyment of the profits.","701",NA
"De esa manera, disminuirán los pobres y los ricos y aumentará una clase media pujante, educada, vigilante de sus derechos y presta a cumplir con sus obligaciones.","In this way, the poor and the rich will decrease and a thriving middle class, educated, vigilant of its rights and ready to fulfill its obligations, will increase.","704",NA
"En el campo, volverá la seguridad, la libertad y la justicia y se suprimirán todos los mecanismos de control y extorsión que ahora funcionan.","In the countryside, security, freedom and justice will return and all the mechanisms of control and extortion that now operate will be abolished.","703",NA
"Cada ejidatario o pequeño propietario sabrá con certeza que lo que produzca será en su beneficio y no en el del cacique o la tienda oficial","Each ejidatario or small landowner will know with certainty that what he or she produces will be for his or her benefit and not that of the cacique or the official store","703",NA
"y con créditos oportunos,",", and with timely credits,","703",NA
"seguridad en la tenencia de la tierra","security of land tenure","401",NA
"y libre comercialización de los productos, el campo será de nuevo la fuente principal de la riqueza del país.","and free marketing of products, the countryside will once again be the main source of the country's wealth.","703",NA
"México tendrá conciencia de su grandeza como nación, de los altos valores de su cultura, de la fuerza que da la unidad alrededor de convicciones y compromisos comunes y con su creciente población, plena de gente trabajadora y capaz, en un ambiente propicio, con todos los recursos naturales de que disfrutamos, el desarrollo del país, su progreso constante, la felicidad de sus habitantes serán metas alcanzables, reales, cercanas.","Mexico will be aware of its greatness as a nation, of the high values of its culture, of the strength that comes from unity around common convictions and commitments, and with its growing population, full of hardworking and capable people, in a favorable environment, with all the natural resources we enjoy, the development of the country, its constant progress, the happiness of its inhabitants will be achievable, real and near goals.","601",NA
"Es posible un México así, en el que imperen la democracia, la sobriedad republicana, el trabajo, el orden, la justicia, la seguridad.","Such a Mexico is possible, where democracy, republican sobriety, work, order, justice and security prevail.","601",NA
"En el que la verdad sea el primer requisito de la comunicación, en especial de la que proviene del gobierno, en el que la honradez y el respeto a los bienes ajenos, en especial los bienes públicos, sea regla estricta de conducta para todos.","In which truth is the first requirement for communication, especially from the government, in which honesty and respect for the property of others, especially public property, is a strict rule of conduct for all.","304",NA
"Un México honorable, seguro limpio, próspero, justo, con oportunidades para todos, es posible.","An honorable, safe, clean, prosperous, just Mexico, with opportunities for all, is possible.","601",NA
"Para alcanzarlo lucha el Partido Acción Nacional.","The National Action Party is fighting to achieve this.","601",NA
"El sistema ha perdido todas las oportunidades; el mismo grupo político ha gobernado desde 1929, desde ésa época cada presidente designa a su sucesor y éste hacia debajo de la pirámide del poder, designa a los secretarios de estado, a los gobernadores, a los diputados, a los senadores, a los ayuntamientos.","The system has lost every opportunity; the same political group has governed since 1929, since that time each president appoints his successor and this, down the pyramid of power, appoints the secretaries of state, the governors, the deputies, the senators, the city councils.","202",NA
"Que es el mismo grupo y que hay una línea no interrumpida de continuidad, es un hecho indiscutible.","That it is the same group and that there is an unbroken line of continuity is an indisputable fact.","202",NA
"En éste largo periodo, la democracia ha sido una fórmula sin contenido real, salvo en contadas excepciones y gracias al esfuerzo de mexicanos que confían en su acción y en sus ideales.","In this long period, democracy has been a formula without real content, except in a few exceptions and thanks to the efforts of Mexicans who trust in its action and ideals.","202",NA
"La falta de democracia ha sido, a su vez, fuente de corrupción en las esferas públicas, de irresponsabilidad de los gobernantes y de desengaño y falta de interés del pueblo para participar en política.","The lack of democracy has been, in turn, a source of corruption in public spheres, of irresponsibility of those in power, and of disillusionment and lack of interest of the people to participate in politics.","304",NA
"El presidencialismo, la centralización de todo el poder en unas solas manos, la simulación de la democracia, han sido causa de la crisis en la que ha caído el país, de la eficacia y de la pobreza creciente de todos y extrema de muchos.","Presidentialism, the centralization of all power in a few hands, the simulation of democracy, have been the cause of the crisis into which the country has fallen, of the efficiency and growing poverty of all and extreme poverty of many.","202",NA
"Tanto en lo material como en lo espiritual, México ha ido en retroceso; cada sexenio, como lo dijo alguien del sistema, se produce una “comalada de millonarios”.","Both materially and spiritually, Mexico has gone backwards; every six-year term, as someone in the system put it, there is a ""millionaire's salad"".","304",NA
"Todos los funcionarios –con unas cuantas excepciones que confirman la regla- se enriquecen en los cargos, obran para sí, para su negocio, para sus amigos, para sus cómplices.","All officials -with a few exceptions that confirm the rule- get rich in office, work for themselves, for their business, for their friends, for their accomplices.","304",NA
"La educación pública es un fracaso; cuantitativa y cualitativamente deja mucho que desear; la preparación de los jóvenes es más deficiente cada día y la formación de los niños, incompleta e insuficiente.","Public education is a failure; quantitatively and qualitatively it leaves much to be desired; the preparation of young people is more deficient every day and the training of children is incomplete and insufficient.","506",NA
"Los niveles académicos son ínfimos y no son comparables con los de otros países con un potencial y una tradición similares a los nuestros.","The academic levels are very low and are not comparable to those of other countries with a similar potential and tradition to ours.","506",NA
"Los maestros, especialmente de educación primaria, pero también de niveles superiores, se ven obligados a tomar varias plazas y turnos por los bajos sueldos y por la lucha para subsistir;","Teachers, especially in primary education, but also at higher levels, are forced to take various positions and shifts due to low salaries and the struggle to survive;","506",NA
"el control faccioso de los sindicatos atenta contra su dignidad, atropella su libertad y la represión económica o violenta no se deja esperar en contra de quienes disienten o protestan.","the factious control of the unions is an attack on their dignity, trampling on their freedom and economic or violent repression is not to be expected against those who dissent or protest.","702",NA
"El campo es un desastre, la larguísima, confusa y caótica reforma agraria ha repartido entre los campesinos mexicanos miseria e inseguridad.","The countryside is a disaster, the very long, confusing and chaotic agrarian reform has distributed misery and insecurity among Mexican peasants.","703",NA
"La producción agropecuaria, antes suficiente, ha disminuido al grado de que año con año se tienen que importar del exterior los alimentos más indispensables para la subsistencia popular;","Agricultural production, once sufficient, has decreased to the point that year after year the most indispensable foodstuffs for the people's subsistence have to be imported from abroad;","703",NA
"la inseguridad en la tenencia de la tierra ha producido un doble efecto; por un lado, la emigración de trabajadores mexicanos al extranjero y por otro, bajísimos niveles de producción que agravan la situación económica del país.","the insecurity of land tenure has produced a double effect; on the one hand, the emigration of Mexican workers abroad and on the other, very low levels of production that aggravate the country's economic situation.","401",NA
"La seguridad pública casi ha desaparecido; todos los días y a todas horas hay robos, asaltos, violencia, en las ciudades, en el campo, en las carreteras.","Public safety has almost disappeared; every day and at all hours there are robberies, assaults, violence, in the cities, in the countryside, on the highways.","605",NA
"La policía requiere un cambio a fondo; en éste país hemos armado a los más impreparados, a los menos aptos, frecuentemente a los más inmorales y más inadaptados.","The police require a profound change; in this country we have armed the most unprepared, the least apt, often the most immoral and the most unsuitable.","605",NA
"La justicia es lenta, cara, laberíntica; los funcionarios judiciales están mal pagados, sujetos a los caprichos de sus superiores e inseguros en sus cargos.","Justice is slow, expensive, labyrinthine; judicial officials are poorly paid, subject to the whims of their superiors and insecure in their positions.","605",NA
"En todos los presupuestos, pero especialmente en el federal, la partida menos significativa y que deja mayores carencias es la del Poder Judicial y grandes áreas de la administración de justicia se han incorporado al Poder Ejecutivo.","In all budgets, but especially in the federal budget, the least significant item and the one that leaves the greatest deficiencies is the Judiciary, and large areas of the administration of justice have been incorporated into the Executive Branch.","605",NA
"La economía del país no puede estar peor; la devaluación de nuestra moneda, la inflación galopante, la pobreza generalizada lo evidencian y desmienten las superficialmente optimistas declaraciones oficiales.","The country's economy could not be worse; the devaluation of our currency, galloping inflation and widespread poverty are evidence of this and belie the superficially optimistic official statements.","414",NA
"Cada padre de familia, cada ama de casa, ve con angustia cómo día a día el dinero alcanza para menos y la carestía es preludio de la escasez y ésta del hambre.","Every father of a family, every housewife, sees with anguish how, day by day, money is enough for less and scarcity is the prelude to scarcity and this is the prelude to hunger.","414",NA
"La producción de bienes y servicios en lugar de crecer, disminuye;","The production of goods and services, instead of growing, is decreasing;","410",NA
"la planta productiva es con frecuencia obsoleta","the productive plant is often obsolete","410",NA
"y está subutilizada y el estado de las finanzas públicas está en constante déficit.","and underutilized; and the state of public finances is in constant deficit.","414",NA
"La soberanía nacional está comprometida con la deuda externa y con sus intereses; las deudas internacionales contraídas de espaldas al pueblo, sin control en su contratación y luego despilfarradas, han hecho de México uno de los deudores más grandes del mundo y han comprometido sus decisiones de política económica, que han quedado en manos de los banqueros internacionales.","National sovereignty is compromised with the foreign debt and its interests; international debts contracted without the people's knowledge, without control in their contracting and then squandered, have made Mexico one of the largest debtors in the world and have compromised its economic policy decisions, which have been left in the hands of international bankers.","109",NA
"El petróleo, que es una gran fuente de ingresos para otros países que tienen la fortuna de producirlo, en México apenas alcanza para sostener a los líderes omnipotentes y millonarios del sindicato y su aparato de publicidad, represión y control; lo que dejan alcanza sólo para cubrir los intereses de la deuda externa.","Oil, which is a great source of income for other countries that are fortunate enough to produce it, is barely enough in Mexico to sustain the omnipotent and millionaire leaders of the union and their apparatus of publicity, repression and control; what they leave behind is only enough to cover the interest on the foreign debt.","411",NA
"Las relaciones internacionales son zigzagueantes y en lugar de beneficios, nos traen problemas.","International relations are zigzagging and instead of benefits, they bring us problems.","109",NA
"Nuestro gobierno ha apoyado absurdamente a la guerrilla centroamericana","Our government has absurdly supported the Central American guerrillas","105",NA
"y ha prestado ayuda a gobiernos no democráticos,","and has given aid to non-democratic governments,","202",NA
"y frente a las delicadas relaciones con los Estados Unidos, ha mantenido un riesgoso doble juego, consistente en pedir con una mano y desafiar e injuriar con la otra.","and in the delicate relations with the United States, has maintained a risky double game, consisting of asking with one hand and defying and insulting with the other.","102",NA
"En fin, hacia cualquier lado que volvamos los ojos, hacia cualquier área de la economía, de la cultura, de la estructura social de nuestro país, encontraremos atraso, deterioro, inseguridad, crisis.","In short, whichever way we turn our eyes, to any area of the economy, of culture, of the social structure of our country, we will find backwardness, deterioration, insecurity, crisis.","305",NA
"El grupo en el poder desde 1929 ha fracasado y ha perdido su oportunidad; no pueden presentarse como los salvadores de hoy los mismos que nos han llevado a la situación en que nos encontramos.","The group in power since 1929 has failed and has lost its opportunity; the same people who have brought us to the situation in which we find ourselves cannot present themselves as today's saviors.","305",NA
"Ante la perspectiva de una campaña presidencial y con base en el panorama general que se nos presenta, Acción Nacional convoca a todo el pueblo de México a luchar por el cambio que sólo será posible con el concurso de todos.","With the prospect of a presidential campaign and based on the general panorama that is presented to us, Acción Nacional calls on all the people of Mexico to fight for the change that will only be possible with the cooperation of all.","606",NA
"Las acciones para el cambio, enmarcadas en diez grandes líneas, son resultado de las luchas vividas por Acción Nacional en casi 50 años de presencia constante en la vida política en México: Las plataformas presentadas, las experiencias de gobierno municipales, los trabajos legislativos, el contacto diario con el pueblo, con sus carencias y sus anhelos, son piezas fundamentales en la conformación de esta propuesta a los mexicanos.","The actions for change, framed in ten main lines, are the result of the struggles experienced by Acción Nacional in almost 50 years of constant presence in Mexico's political life: the platforms presented, the experiences of municipal governments, the legislative work, the daily contact with the people, with their needs and their desires, are fundamental pieces in the conformation of this proposal to the Mexican people.","305",NA
"Por otra parte, estas acciones para el cambio proceden de las aportaciones de panistas y simpatizantes de toda la República, que durante un año hemos trabajado en la búsqueda de soluciones concretas a los problemas actuales, como resultado de la decisión tomada por la Convención del partido celebrada en San Luis Potosí en octubre de 1986.","On the other hand, these actions for change come from the contributions of PAN members and supporters from all over the Republic, who for a year have been working on the search for concrete solutions to current problems, as a result of the decision taken by the party's Convention held in San Luis Potosí in October 1986.","305",NA
"En el gobierno, al que Acción Nacional aspira para servir a México, basaremos nuestro trabajo en las siguientes acciones para el cambio.","In the government, to which Acción Nacional aspires to serve Mexico, we will base our work on the following actions for change.","305",NA
"1. Límites del Poder","1. Limits of Power",NA,NA
"El poder centralizado, absoluto, sin barreras ni controles, tiende necesariamente al abuso y a la arbitrariedad.","Centralized, absolute power, without barriers or controls, necessarily tends to abuse and arbitrariness.","301",NA
"El poder debe estar limitado por la ley, por el respeto a la división de poderes establecida en la Constitución","Power must be limited by law, by respect for the division of powers established in the Constitution","202",NA
"y por el voto de los ciudadanos.","and by the vote of the citizens.","202",NA
"En Acción Nacional queremos un gobierno que esté dispuesto a respetar los derechos humanos,","In Acción Nacional we want a government that is willing to respect human rights,","201",NA
"la estructura de las funciones constitucionales","the structure of constitutional functions","203",NA
"y especialmente la voluntad popular.","and especially the will of the people.","202",NA
"1.1 Sufragio Efectivo.","1.1 Effective Suffrage.",NA,NA
"Acción Nacional retoma el lema con el que Francisco I. Madero inició en 1910 la Revolución Mexicana: “Sufragio Efectivo”, respeto al voto, acceso al poder mediante elecciones honradas, limpias, transparentes, confiables.","Acción Nacional retakes the slogan with which Francisco I. Madero started the Mexican Revolution in 1910: ""Effective Suffrage"", respect for the vote, access to power through honest, clean, transparent and reliable elections.","202",NA
"Este será el primer gran paso de la transformación de México.","This will be the first major step in Mexico's transformation.","202",NA
"Acción Nacional se compromete desde ahora y cuando acceda el gobierno, a respetar escrupulosamente el sufragio y sostener su eficacia, sea quien fuere el favorecido por la voluntad popular mayoritaria expresada en las urnas.","National Action is committed from now on and when it becomes the government, to scrupulously respect the suffrage and uphold its effectiveness, whoever is favored by the majority popular will expressed at the polls.","202",NA
"Bajo un gobierno de Acción Nacional, las elecciones quedarán en manos de los ciudadanos y de los partidos, y la autoridad solamente proporcionará los elementos que el proceso requiere y garantizará la tranquilidad y la seguridad del mismo.","Under a National Action government, the elections will be in the hands of the citizens and the parties, and the authority will only provide the elements that the process requires and will guarantee the tranquility and security of the process.","202",NA
"1.2 Derechos Humanos.","1.2 Human Rights.",NA,NA
"Los derechos humanos, son un límite natural y necesario al poder público; sin su respeto escrupuloso, ni el Estado se justifica, ni la autoridad tiene razón de ser.","Human rights are a natural and necessary limit to public power; without their scrupulous respect, neither the State is justified, nor authority has any reason to exist.","201",NA
"Por ese motivo el Partido Acción Nacional, se propone:Promover y garantizar los derechos humanos sin distinción de credos religiosos, convicciones políticas, rangos o categorías sociales, clases o ideologías.","For this reason, the National Action Party proposes to: Promote and guarantee human rights without distinction of religious creeds, political convictions, social ranks or categories, classes or ideologies.","201",NA
"Insistir en que los derechos humanos son anteriores y superiores al Estado y éste, por tanto, debe reconocerlos y garantizarlos plenamente.","To insist that human rights are prior and superior to the State and, therefore, the latter must fully recognize and guarantee them.","201",NA
