"text","text_en","cmp_code","eu_code"
"Este fenómeno replantea los alcances y límites al poder de los Estados, lo que frecuentemente impacta en sus acciones dentro del ámbito social.","This phenomenon rethinks the scope and limits of state power, which often impacts on their actions in the social sphere.","107",NA
"No obstante, el Estado debe mantener dos funciones prioritarias: la primera, en la relación entre países no puede dejar de exigir un orden mundial regido por normas claras y compartidas;","Nevertheless, the State must maintain two priority functions: first, in relations between countries, it cannot fail to demand a world order governed by clear and shared rules;","305.3",NA
"y la segunda, en la vida interna, no puede dejar de mantener su papel como garante del desarrollo social.","and second, in domestic life, it cannot fail to maintain its role as guarantor of social development.","504",NA
"Para Encuentro Social la globalización debe ser entendida como una forma de vinculación con el mundo, con el firme propósito de potencializar las posibilidades de desarrollo tanto de los individuos como de la nación en general.","For Encuentro Social, globalization should be understood as a way of linking with the world, with the firm purpose of empowering the development possibilities of both individuals and the nation in general.","107",NA
"Es por eso que en este tema proponemos las siguientes acciones:","That is why we propose the following actions in this area:","305.1",NA
"Apoyar activamente los esfuerzos de los mexicanos en el extranjero para hacer valer sus derechos humanos.","Actively support the efforts of Mexicans abroad to assert their human rights.","201.2",NA
"Proponer desde México soluciones globales a las violaciones a los derechos humanos que se generan por la misma globalización en materias como la migración, la salud, la bioseguridad, el terrorismo, la trata de personas, la volatilidad financiera, el cambio climático o el acceso al agua.","Propose global solutions from Mexico to human rights violations generated by globalization itself in areas such as migration, health, biosecurity, terrorism, human trafficking, financial volatility, climate change and access to water.","201.2",NA
"Apoyar activamente los esfuerzos de los inversionistas mexicanos en el extranjero para que no sean sujetos de prácticas discriminatorias.","Actively support the efforts of Mexican investors abroad so that they are not subject to discriminatory practices.","503",NA
"Crear y participar en los mecanismos de cooperación internacional que hagan eficaz y eficiente el combate al crimen organizado transnacional.","To create and participate in international cooperation mechanisms that make the fight against transnational organized crime effective and efficient.","605.1",NA
"Promover y adoptar mecanismos de cooperación internacional que ayuden a regular las conductas antiéticas de corporaciones y empresas transnacionales.","Promote and adopt international cooperation mechanisms to help regulate unethical conduct by corporations and transnational companies.","107",NA
"Evaluar la red de acuerdos internacionales celebrados hasta ahora y maximizar sus beneficios.","Evaluate the network of international agreements entered into to date and maximize their benefits.","107",NA
"Mejorar la comunicación con otros Estados para aumentar la reciprocidad e intercambio comercial, cultural, educativo y tecnológico.","Improve communication with other States to increase reciprocity and commercial, cultural, educational and technological exchange.","107",NA
"Fortalecer el ambiente de negocios al interior de las entidades federativas para propiciar mayor atracción de inversiones.","Strengthen the business environment within the states to attract more investment.","301",NA
"Mejorar la oferta turística orientada a todos los sectores y niveles sociales, desarrollando de manera paralela la infraestructura necesaria.","Improve the tourist offer oriented to all sectors and social levels, developing in parallel the necessary infrastructure.","411",NA
"II. ACCIONES  DE RECONCILIACIÓN PARA DISMINUIR LA VIOLENCIA","II. RECONCILIATION ACTIONS TO REDUCE VIOLENCE","H",NA
"En los últimos años el debate en torno a las estrategias y acciones por parte de los distintos niveles de gobierno para enfrentar el fenómeno de la inseguridad pública, prácticamente ha polarizado al país.","In recent years, the debate on the strategies and actions of the different levels of government to address the phenomenon of public insecurity has practically polarized the country.","605.1",NA
"Mientras en los círculos políticos y sociales aún no hay acuerdos o consensos que logren articular la mejor estrategia de paz y seguridad, el país continúa su vertiginosa y delicada escalada de violencia.","While in political and social circles there are still no agreements or consensus to articulate the best peace and security strategy, the country continues its dizzying and delicate escalation of violence.","605.1",NA
"En una sociedad en la que las instituciones pierdan la confianza de los gobernados, hay un riesgo latente de ingobernabilidad e inestabilidad.","In a society in which institutions lose the trust of the governed, there is a latent risk of ungovernability and instability.","305.3",NA
"El sentimiento de temor, la percepción de vulnerabilidad y la visible angustia colectiva obliga a revisar y replantear las actuales acciones y propuestas gubernamentales,","The feeling of fear, the perception of vulnerability and the visible collective anguish make it necessary to review and rethink current governmental actions and proposals,","305.3",NA
"generando vínculos de confianza entre los gobernados y sus autoridades,","generating bonds of trust between the governed and their authorities,","305.3",NA
"así como enderezar el rumbo hacia la búsqueda de la reconciliación nacional.","as well as straightening the course towards the search for national reconciliation.","601.1",NA
"Es indispensable lograr la conciliación entre el uso legítimo de la fuerza del Estado y las garantías del gobernado, es la obligación y responsabilidad más grande que tiene que cumplir el Estado.","It is essential to reconcile the legitimate use of force by the State with the guarantees of the governed; this is the greatest obligation and responsibility that the State must fulfill.","305.3",NA
"Desde la concepción que le da origen, Encuentro Social busca lograr que la pacificación del país sea una obra colectiva.","From the conception that gives it origin, Encuentro Social seeks to make the pacification of the country a collective work.","606.1",NA
"A diferencia de las otras opciones políticas, Encuentro Social apuesta por la concordia, no por la acción unilateral o por la recreación o regeneración a partir de una ruptura o revolución decidida unilateralmente.","Unlike other political options, Encuentro Social is committed to concord, not to unilateral action or to recreation or regeneration based on a unilaterally decided rupture or revolution.","106",NA
"Como nuestro nombre lo indica, creemos que la paz inicia al encontrarnos, al conversar y discutir entre todos, sin exclusiones, sin rencillas los problemas que, como lo hace evidente la violencia, son de todos.","As our name indicates, we believe that peace begins when we meet, talk and discuss among all, without exclusions, without quarrels, the problems that, as violence makes evident, belong to everyone.","106",NA
"La propuesta de Encuentro Social  aborda la diversidad de aspectos que han limitado el establecimiento de estrategias efectivas de paz y seguridad, así como la impartición de justicia basado principalmente en los siguientes ejes:","The proposal of Encuentro Social addresses the diversity of aspects that have limited the establishment of effective strategies for peace and security, as well as the administration of justice based mainly on the following axes: The","106",NA
"El primero es la incapacidad de la fuerza pública para mantener seguridad pública:","first is the inability of the public force to maintain public security:","605.1",NA
"una de las mayores críticas que ha recibido la administración federal, es la incorporación del Ejército en tareas de combate al crimen organizado,","One of the major criticisms that the federal administration has received is the incorporation of the Army in tasks of combating organized crime,","105",NA
"dicha situación fue generada por el altísimo grado de involucramiento que las policías locales han sostenido con el crimen organizado,","this situation was generated by the high degree of involvement that local police have sustained with organized crime, which","304",NA
"lo que hace evidente la necesidad de reorganizar y profesionalizar a los cuerpos policiacos en los diferentes niveles de gobierno.","makes evident the need to reorganize and professionalize the police forces at different levels of government.","411",NA
"El segundo es la necesidad de arraigar la cultura de la legalidad: es urgentemente generar acciones que fomenten entre los ciudadanos el respeto a las leyes, reglamentos y cualquier otra disposición legal.","The second is the need to establish a culture of legality: it is urgent to generate actions that encourage citizens to respect laws, regulations and any other legal provision.","605.1",NA
"Para ello es importante que las reglas básicas de convivencia social sean una prioridad en el ejercicio gubernamental.","To this end, it is important that the basic rules of social coexistence be a priority in the governmental exercise.","605.1",NA
"En este aspecto resulta fundamental que todas las autoridades del país colaboren a que las personas comprendan a cabalidad que son titulares de derechos y que, como miembros de la sociedad tienen obligaciones de respeto hacia los demás.","In this regard, it is essential that all the country's authorities work together to ensure that people fully understand that they are rights holders and that, as members of society, they have obligations to respect others.","201.2",NA
"Es importante el establecimiento de alianzas con organismos sociales para difundir en la comunidad el conocimiento de las normas y reglamentos que regulan las relaciones entre los ciudadanos.","It is important to establish alliances with social organizations to disseminate knowledge of the rules and regulations governing relations between citizens in the community.","606.2",NA
"El tercero es perfeccionar los mecanismos de prevención del delito: al igual que en el tema anterior, mucho se ha dicho y tratado de hacer en temas de prevención del delito.","The third is to improve crime prevention mechanisms: as in the previous topic, much has been said and tried to be done in terms of crime prevention.","605.1",NA
"Es necesario atender las causas estructurales que dan origen a diversos delitos.","It is necessary to address the structural causes that give rise to various crimes.","305.1",NA
"De manera particular estas acciones deben orientarse a los jóvenes que, en muchos de los casos, frente a la falta de oportunidades educativas y una oferta laboral formal, son absorbidos por grupos delictivos.","In particular, these actions should be aimed at young people who, in many cases, in the absence of educational opportunities and a formal job offer, are absorbed by criminal groups.","706",NA
"El último es la procuración, administración e impartición de justicia: los cambios que los órganos relacionados con la justicia requieren,","The last one is the procurement, administration and administration of justice: the changes required by the bodies related to justice","605.1",NA
"están en función de la adecuación de las estructuras orgánicas de las Procuradurías de Justicia y las Secretarias de Seguridad Pública, lo anterior con el objetivo de hacer eficiente su desempeño,","are based on the adaptation of the organizational structures of the Attorney General's Offices and the Secretariats of Public Security, with the purpose of making their performance efficient,","303",NA
"privilegiando el orden público, a las víctimas del delito y el respeto a los derechos humanos, previniendo las violaciones a los mismos e incluyendo un sistema de mejoramiento de las aéreas de atención al público.","giving priority to public order, the victims of crime and respect for human rights, preventing human rights violations and including a system to improve the areas of attention to the public.","201.2",NA
"Asimismo, es preciso que desde el Poder Legislativo se realice una amplia discusión para mejorar y modernizar el sistema de impartición de justicia, depositado en juzgados y tribunales de todo el país.","Likewise, it is necessary for the Legislative Branch to carry out a broad discussion to improve and modernize the justice delivery system, deposited in courts and tribunals throughout the country.","605.1",NA
"En este sentido, es preciso revisar las normas procesales que permiten a las personas ejercer sus derechos, concretamente la ley de amparo en dos vertientes: por un lado, logrando su plena armonización con la reforma constitucional en materia de derechos humanos y,","In this sense, it is necessary to review the procedural rules that allow individuals to exercise their rights, specifically the amparo law in two ways: on the one hand, achieving its full harmonization with the constitutional reform on human rights and,","201.2",NA
"por el otro, generado estrategias normativas que impidan que las sentencias de amparo no se cumplan.","on the other hand, generating regulatory strategies that prevent amparo rulings from not being complied with.","605.1",NA
"El ánimo que inspira a la reforma constitucional en materia penal, debe permear el trabajo de todos los jueces del país.","The spirit that inspires the constitutional reform in criminal matters must permeate the work of all judges in the country.","605.1",NA
"Las personas deben apropiarse de los juzgados y tribunales, los cuales deben convertirse en órganos que prestan un servicio público.","The courts and tribunals must be appropriated by the people and become organs that provide a public service.","605.1",NA
"Es indispensable lograr que las y los jueces sean cercanos a la sociedad y sensibles a sus problemas.","It is essential for judges to be close to society and sensitive to its problems.","503",NA
"Para ello tendremos que vigilar permanentemente que los jueces se apeguen a los estándares de protección de derechos establecidos en nuestra Constitución y en los tratados internacionales de los que México forma parte.","To this end, we will have to be permanently vigilant that judges adhere to the standards of rights protection established in our Constitution and in the international treaties to which Mexico is a party.","201.2",NA
"Debemos erradicar la corrupción en tribunales y juzgados y exigir cuentas a los impartidores de justicia que no cumplan el mandato constitucional que tienen asignado como guardianes de los derechos humanos.","We must root out corruption in courts and tribunals and hold accountable those justice providers who fail to fulfill their constitutional mandate as guardians of human rights.","304",NA
"Definido el objetivo general de la reconciliación social para disminuir la violencia que Encuentro Social adopta, a continuación se presentan las principales propuestas que servirán de guía y discusión para permear, en la ciudadanía mexicana y en las políticas públicas del Estado, los ideales por los cuales pugna el Partido:","Having defined the general objective of social reconciliation to reduce violence that Encuentro Social adopts, the following are the main proposals that will serve as a guide and discussion to permeate, in the Mexican citizenship and in the public policies of the State, the ideals for which the Party strives:","305.1",NA
"Certificar a los altos mandos policiacos, acreditando que cuentan con solvencia moral, ética y desarrollo patrimonial justificado, a partir del ajuste de su actuación a los más altos estándares internacionales.","To certify the high police commanders, accrediting that they have moral solvency, ethics and justified patrimonial development, based on the adjustment of their performance to the highest international standards.","411",NA
"Realizar las adecuaciones normativas para asegurar la destitución de elementos involucrados con el crimen, apegado a los procedimientos legales y su seguimiento con la finalidad de que no se involucren en actividades u organizaciones delictivas","To make the necessary regulatory adjustments to ensure the dismissal of elements involved in crime, in accordance with legal procedures and their follow-up so that they do not become involved in criminal activities or organizations","605.1",NA
"o en prácticas indeseables como la tortura, las amenazas, las extorsiones o los malos tratos.","or in undesirable practices such as torture, threats, extortion or mistreatment.","201.2",NA
"Fomentar la participación de organismos sociales y asociaciones civiles que contribuyan a difundir el respeto al Estado de Derecho, a los derechos humanos y que fomenten valores y principios éticos.","Encourage the participation of social organizations and civil associations that contribute to disseminating respect for the rule of law and human rights and that promote values and ethical principles.","606.2",NA
"Emprender estrategias integrales que impidan la cooptación de jóvenes y niños en la delincuencia organizada,","Undertake comprehensive strategies to prevent the co-optation of young people and children into organized crime,","706",NA
"con acciones en materia educativa,","with actions in the field of education,","506",NA
"empleo,","employment,","701",NA
"cohesión social, actividades recreativas y cualquier otra que fuera necesaria según las necesidades específicas locales,","social cohesion, recreational activities and any others that may be necessary according to specific local needs,","502",NA
"a partir del rescate del papel de mentoraje y apoyo que pueden brindar las familias.","by rescuing the mentoring and support role that families can provide.","603",NA
"Propiciar mecanismos eficientes de denuncia ciudadana, otorgando plena seguridad a la población de que no existirán represalias por parte del crimen organizado.","Promote efficient mechanisms for citizen complaints, providing full assurance to the population that there will be no retaliation by organized crime.","606.1",NA
"Impulsar mecanismos permanentes de evaluación y medición de resultados de la intervención del gobierno para inhibir la aparición de una conducta delictiva dentro de la fuerza pública o reorientar la estrategia de seguridad","Promote permanent mechanisms for the evaluation and measurement of results of government intervention to inhibit the appearance of criminal behavior within the public force or to reorient the security strategy","304",NA
"Promover programas de servicio profesional de carrera policial en el caso de corporaciones policiacas y Secretarías de Seguridad Pública encaminados a la certificación de control y confianza, profesionalización y trascendencia de los mandos medios de dichas instituciones.","Promote professional police career service programs in the case of police corporations and Public Security Secretariats aimed at the certification of control and trust, professionalization and transcendence of the middle management of such institutions.","411",NA
"Incorporación de policías comunitarios que permitan reconstituir el tejido social en sus localidades.","Incorporation of community police officers to help rebuild the social fabric in their localities.","301",NA
"Fomentar la participación social para atender el problema de adicciones, abordándolo desde una perspectiva integral, desde aspectos médicos, psicológicos, sociales y familiares del adicto,","Promote social participation to address the problem of addictions, approaching it from an integral perspective, from medical, psychological, social and family aspects of the addict,","606.1",NA
"generando partidas presupuestales específicas para la atención de los mismos.","generating specific budget allocations for their care.","504",NA
"Establecer contralorías u observatorios ciudadanos que evalúen la actuación de las corporaciones policiacas.","Establish comptrollers or citizen observatories to evaluate the performance of police forces.","304",NA
"Establecer un órgano técnico especializado encargado de la implementación, impulso y perfeccionamiento del Nuevo Sistema de Justicia Penal para garantizar su eficiencia y el cumplimiento de sus objetivos.","To establish a specialized technical body in charge of the implementation, promotion and improvement of the New Criminal Justice System to guarantee its efficiency and the fulfillment of its objectives.","411",NA
"III. ACCIONES EN Y RENDICIÓN DE CUENTAS PARA EL COMBATE A LA CORRUPCIÓN Y BUEN GOBIERNO","III. ACTIONS AND ACCOUNTABILITY FOR THE FIGHT AGAINST CORRUPTION AND GOOD GOVERNANCE","H",NA
"a) Acciones de transparencia y rendición de cuentas","a) Actions of transparency and accountability","H",NA
"En Encuentro Social impulsamos 3 ejes en materia de Transparencia y Acceso a la información como elementos trascendentales para el combate a la corrupción siendo los siguientes:","In Encuentro Social we promote 3 axes in terms of Transparency and Access to information as transcendental elements for the fight against corruption, being the following:","304",NA
"El primer eje es la consolidación, en el que proponemos que el IFAI, debe robustecer el Sistema Nacional de Transparencia, Acceso a la Información y Protección de Datos Personales (SINAT),","The first axis is consolidation, in which we propose that the IFAI, should strengthen the National System of Transparency, Access to Information and Protection of Personal Data (SINAT), in order","202.1",NA
"a fin de asegurar su adecuado funcionamiento, caracterizado por su alto compromiso con la sociedad y tendiente, en todo momento, a fortalecer el ejercicio de los derechos y la rendición de cuentas.","to ensure its proper functioning, characterized by its high commitment to society and tending, at all times, to strengthen the exercise of rights and accountability.","202.1",NA
"Para lo cual debe implementarse una reforma constitucional en materia de transparencia.","To this end, a constitutional reform on transparency must be implemented.","204",NA
"De igual forma, se debe construir, a través de acciones coordinadas de los organismos garantes, un Sistema Nacional capaz de garantizar, mediante procedimientos, mecanismos e instrumentos estandarizados, el ejercicio de los derechos de acceso a la información, protección de datos personales y el cumplimiento de obligaciones de transparencia.","Likewise, a National System capable of guaranteeing, through standardized procedures, mechanisms and instruments, the exercise of the rights of access to information, protection of personal data and compliance with transparency obligations must be built through the coordinated actions of the guarantor agencies.","202.1",NA
"Todo lo cual deberá orientarse a mayor y mejor gestión de los sistemas de información, mayor gestión presupuestal, mejores procesos de transparencia, mayor monitoreo de los servidores públicos, evaluación y fiscalización.","All of which should be oriented towards more and better management of information systems, better budget management, improved transparency processes, greater monitoring of public servants, evaluation and auditing.","304",NA
"El segundo, la estandarización, tiene como objetivo homologar los mecanismos, instrumentos, formatos y criterios de resolución de los organismos garantes, a fin de unificar la protección y ejercicio de los derechos de acceso a la información y protección de datos, así como las obligaciones de transparencia.","The second, standardization, aims to standardize the mechanisms, instruments, formats and resolution criteria of the guarantor agencies, in order to unify the protection and exercise of the rights of access to information and data protection, as well as transparency obligations.","202.1",NA
"Creemos que se deben homologar las obligaciones de transparencia de los sujetos obligados, a fin de que las personas puedan acceder a la información independientemente del lugar en donde se encuentre y del sujeto obligado que posea la información, favoreciendo en todo momento la política de datos abiertos.","We believe that the transparency obligations of the obligated entities should be standardized, so that people can access information regardless of the place where it is located and the obligated entity that holds the information, favoring at all times the open data policy.","202.1",NA
"Debemos permitir que las personas puedan ejercer sus derechos de acceso a la información y de protección de datos personales desde un solo sitio, garantizando información confiable y certera.","We must enable people to exercise their rights of access to information and protection of personal data from a single site, guaranteeing reliable and accurate information.","304",NA
"Es necesario formular, revisar y unificar criterios que emanen de las resoluciones que recaigan a los recursos de revisión.","It is necessary to formulate, review and unify criteria that emanate from the resolutions of the appeals for review.","411",NA
