"text","text_en","cmp_code","eu_code"
"Fortalecer la investigación de delitos, para asegurar que ningún ilícito quede impune y que efectivamente los procesados sean quienes realmente cometieron dichos actos.","Strengthen the investigation of crimes, to ensure that no crime goes unpunished and that those who are effectively prosecuted are those who actually committed such acts.","605.1",NA
"Profesionalizar las Procuraduría Federal y Estatales, asegurando que tengan los más altos estándares técnicos y tecnológicos de investigación.","Professionalize the Federal and State Prosecutor's Offices, ensuring that they have the highest technical and technological standards of investigation.","411",NA
"Buscar las reformas necesarias para asegurar que se respeten los estándares más altos de valoración de pruebas en el proceso,","Seek the necessary reforms to ensure that the highest standards of evidence assessment are respected in the process,","411",NA
"lo anterior sin demeritar el acceso a la justicia, cuidando en todo momento que las partes tengan la misma posibilidad de presentar pruebas en el mismo.","without detracting from access to justice, taking care at all times that the parties have the same opportunity to present evidence in the process.","605.1",NA
"Establecer mecanismos de sustitución de medidas preventivas que permitan analizar estrictamente los casos específicos de cada persona detenida, otorgado beneficios en aquellos casos que realmente no se genere un perjuicio a la sociedad.","Establish mechanisms for the substitution of preventive measures that allow for a strict analysis of the specific cases of each detainee, granting benefits in those cases that do not really generate harm to society.","605.2",NA
"Establecer los incentivos indicados tanto en la aplicación como en su configuración para que las penas sean efectivas y logren incidir en la conducta de los ciudadanos y así disminuir la criminalidad de delitos graves y no graves.","Establish the appropriate incentives, both in the application and in their configuration, so that the penalties are effective and have an impact on the behavior of citizens and thus reduce the criminality of serious and non-serious crimes.","605.1",NA
"Redimensionar la figura de la reincidencia y efectivamente evitar que las personas que cometan un delito, lo hagan de manera consuetudinaria sin respeto a las instituciones y en contra de la sociedad.","To resize the concept of recidivism and effectively prevent people who commit a crime from committing it in a customary manner without respect for institutions and against society.","605.1",NA
"Analizar la función, capacidad y eficiencia de los Ministerios Públicos para crear una fiscalía que se encargue de construir los casos, con estricto apego a derecho,","Analyze the function, capacity and efficiency of the Public Prosecutor's Offices in order to create a prosecutor's office that is in charge of building cases, with strict adherence to the law,","411",NA
"que realmente investigue y vigile la actuación del Estado, que esté especializada y que su nombramiento se encuentre sujeto a reglas claras de competencia.","that really investigates and monitors the actions of the State, that is specialized and that its appointment is subject to clear rules of competence.","303",NA
"Crear medios para que las víctimas y procesados puedan inconformarse de la actuación de los Ministerios Públicos y servidores públicos relacionados sin que existan represalias.","Create means for victims and defendants to be able to complain about the actions of the Public Prosecutor's Office and related public servants without reprisals.","605.1",NA
"Realizar las adecuaciones legislativas necesarias para generar mecanismos alternos de conmutación de penas que permitan un mayor beneficio social.","To make the necessary legislative adjustments to generate alternative mechanisms for commutation of sentences that allow for greater social benefit.","605.2",NA
"Reorganizar el sistema penitenciario promoviendo otra cultura de readaptación, propiciando mayor control dentro de los centros y evitando la proliferación de conductas delictivas en contra de la sociedad.","To reorganize the penitentiary system by promoting a different culture of readaptation, fostering greater control within the centers and preventing the proliferation of criminal behavior against society.","605.2",NA
"Aceptar la vigilancia de organizaciones de la sociedad civil y transparentar los centros de readaptación.","Accept the monitoring of civil society organizations and make readaptation centers transparent.","606.2",NA
"Promover leyes claras y mucho más accesibles que propicien autoridades más efectivas y eficientes,","Promote clear and much more accessible laws that promote more effective and efficient authorities, that have","303",NA
"que incidan de una manera positiva en la vida diaria de las personas y que fortalezcan instituciones como la familia y sus valores.","a positive impact on people's daily lives and that strengthen institutions such as the family and its values.","603",NA
"b) Acciones en materia de Derechos Humanos","b) Actions in the area of Human Rights","H",NA
"Por una parte, continuamos con la ratificación de los tratados y convenciones internacionales que constituyen la vanguardia en esta materia,","On the one hand, we continue to ratify international treaties and conventions that constitute the vanguard in this area,","107",NA
"pero también continuamos considerándolos como letra muerta al momento de traducirlos en políticas públicas y acciones concretas de la población en general","but we also continue to consider them a dead letter when it comes to translating them into public policies and concrete actions for the general population","305.1",NA
"y particularmente de los grupos históricamente discriminados, afectando así severamente la dignidad de las personas.","and particularly for historically discriminated groups, thus severely affecting people's dignity.","201.2",NA
"Para Encuentro Social en el Estado de Derecho debe de existir una concepción ética y moral, que cobra forma en los Derechos Humanos.","For Encuentro Social in the Rule of Law there must be an ethical and moral conception, which takes shape in Human Rights.","201.2",NA
"Uno de los principales derechos que debe garantizar la autoridad es la seguridad de las personas.","One of the main rights that the authority must guarantee is the safety of people.","201.2",NA
"De hecho se trata de un derecho humano que se vincula estrechamente a otros como el derecho a la vida, la propiedad, la expresión, el tránsito, la alimentación, entre otros muchos.","In fact, it is a human right that is closely linked to others such as the right to life, property, expression, transit, food, among many others.","201.2",NA
"El régimen constitucional mexicano existe sobre la base del respeto irrestricto a los derechos humanos.","The Mexican constitutional regime exists on the basis of unrestricted respect for human rights.","201.2",NA
"Definido el objetivo general de la política de Derechos Humanos que Encuentro Social adopta, a continuación se presentan las principales propuestas que servirán de guía y discusión para permear, en la ciudadanía mexicana y en las políticas públicas del Estado, los ideales por los cuales pugna el Partido:","Having defined the general objective of the Human Rights policy that Encuentro Social adopts, the following are the main proposals that will serve as a guide and discussion to permeate, in the Mexican citizenship and in the public policies of the State, the ideals for which the Party strives:","201.2",NA
"Dar concreción política y social a la reforma constitucional en materia de derechos humanos del 2011, para incorporar este paradigma como eje de la acción pública","To give political and social concreteness to the constitutional reform on human rights of 2011, to incorporate this paradigm as the axis of public action","201.2",NA
"y, así, reconocer a los tratados internaciones de derechos humanos una jerarquía superior a la normatividad federal y local,","and, thus, to recognize international human rights treaties a hierarchy superior to federal and local regulations,","107",NA
"con el señalamiento expreso de que todos los poderes públicos se someterán a dicho orden internacional de acuerdo con los principios pro personae.","with the express indication that all public powers will submit to said international order in accordance with pro personae principles.","605.1",NA
"Ninguna autoridad está excluida de orientar su actuación por la máxima protección de los derechos humanos","No authority is excluded from guiding its actions towards the maximum protection of human rights","201.2",NA
"y el Estado mexicano debe asumir a cabalidad las recomendaciones que le han sido formuladas en los mecanismos de evaluación entre pares, en particular el de Evaluación Periódica Universal en materia de Derechos Humanos auspiciado por la ONU.","and the Mexican State must fully assume the recommendations that have been formulated in peer review mechanisms, particularly the Universal Periodic Review on Human Rights sponsored by the UN.","107",NA
"Garantizar que los derechos establecidos en la Declaración Universal de los Derechos Humanos y en otras resoluciones y declaraciones internacionales sean incorporados plenamente al régimen jurídico mexicano,","Ensure that the rights set forth in the Universal Declaration of Human Rights and other international resolutions and declarations are fully incorporated into the Mexican legal system,","201.2",NA
"particularmente los principios e interpretaciones dictadas por la Corte Interamericana de Derechos Humanos en los asuntos que han  sido sometidos a su jurisdicción.","particularly the principles and interpretations dictated by the Inter-American Court of Human Rights in matters that have been submitted to its jurisdiction.","107",NA
"Garantizar mecanismos efectivos para asegurar el derecho de  los individuos a la vida, la libertad, la igualdad, la educación, la cultura, el trabajo, entre otros.","Guarantee effective mechanisms to ensure the right of individuals to life, liberty, equality, education, culture, work, among others.","201.2",NA
"Promover los mecanismos necesarios para el acceso a servicios públicos y  elementos necesarios para la vida, como agua, luz, alimentación entre otros.","Promote the necessary mechanisms for access to public services and elements necessary for life, such as water, electricity, food, among others.","411",NA
"Garantizar que el derecho de información y el derecho de libre expresión y libre prensa sea una realidad en México, exigiendo que los comunicadores y periodistas sean protegidos y cuenten con todas las garantías para ejercer su trabajo.","To guarantee that the right to information and the right to free expression and free press is a reality in Mexico, demanding that communicators and journalists are protected and have all the guarantees they need to carry out their work.","201.2",NA
"Asegurar una especial protección de los derechos humanos en grupos en estado de vulnerabilidad,","Ensure special protection of the human rights of vulnerable groups,","201.2",NA
"tales como personas de la tercera edad, indígenas, migrantes, así como niños y niñas y personas con discapacidad.","such as the elderly, indigenous people, migrants, as well as children and people with disabilities.","705",NA
"Robustecer el principio que exige el respeto al interés superior del niño, niña o adolescente en las decisiones que las autoridades tomen en relación con ellos, garantizando siempre que estén informados y su opinión sea tomada en cuenta en relación con los actos que puedan afectarlos.","Strengthen the principle that requires respect for the best interests of the child or adolescent in the decisions taken by the authorities in relation to them, always guaranteeing that they are informed and their opinion is taken into account in relation to acts that may affect them.","706",NA
"Impulsar la entrada en vigor de un sistema de justicia para adolescentes apegado a los principios y derechos que deben regir a este sector de la sociedad.","Promote the entry into force of a juvenile justice system in accordance with the principles and rights that should govern this sector of society.","706",NA
"Asegurar que el derecho a la consulta previa sea respetado en los casos en los cuales pueda afectarse el derecho de los pueblos y comunidades indígenas.","Ensure that the right to prior consultation is respected in cases in which the right of indigenous peoples and communities may be affected.","607.3",NA
"Promover normas y políticas públicas que produzcan las medidas de ajuste necesarias para garantizar vidas libres de discriminación en beneficio de las personas con discapacidad.","Promote regulations and public policies that produce the necessary adjustment measures to guarantee lives free of discrimination for the benefit of people with disabilities.","503",NA
"Modificar el sentido de las normas y disposiciones que criminalizan la migración ilegal, así como de aquellas que incentivan la violencia y el crimen en contra de los migrantes.","Modify the meaning of the norms and provisions that criminalize illegal migration, as well as those that encourage violence and crime against migrants.","607.2",NA
"Impulsar una abierta política de apoyo al ejercicio pleno de asistencia consular, así como a favor de que las garantías del debido proceso y demás estándares internacionales, se apliquen en esos casos.","Promote an open policy of support for the full exercise of consular assistance, as well as in favor of ensuring that due process guarantees and other international standards are applied in such cases.","607.2",NA
"Abolir la privación de la libertad de los migrantes que no lo ameriten y depurar el funcionamiento de las estaciones migratorias desde una perspectiva que se ajuste a los derechos humanos.","Abolish the deprivation of liberty of migrants who do not merit it and clean up the operation of migration stations from a human rights perspective.","607.2",NA
"Modificar el marco normativo para asegurar el derecho al empleo y al salario justo, principalmente de jóvenes que entran por primera vez al mercado laborar","Modify the regulatory framework to ensure the right to employment and fair wages, especially for young people entering the labor market for the first time","701",NA
"y sobre todo implementando acciones en contra de la discriminación por razón de edad en contra de las personas que buscan trabajo.",", and above all, implement actions against age discrimination against job seekers.","503",NA
"Garantizar los derechos sociales de la población como mecanismo de acceso a una mejor calidad de vida y como aseguramiento mínimo de estos derechos que les permitan el ejercicio de sus libertades.","Guarantee the social rights of the population as a mechanism of access to a better quality of life and as a minimum assurance of these rights that allow them to exercise their freedoms.","201.2",NA
"Asegurar la interpretación de las leyes en todo tiempo a las personas, la protección más amplia en todos los actos y políticas públicas que realice el Estado con especial énfasis en grupos en estado de vulnerabilidad.","To ensure the interpretation of the laws at all times to people, the broadest protection in all acts and public policies carried out by the State with special emphasis on groups in a state of vulnerability.","503",NA
"Asegurar que todas las personas que han sido víctimas de violaciones a sus derechos puedan ejecutar los derechos a las garantías judiciales y la protección judicial de los que son titulares.","To ensure that all persons who have been victims of violations of their rights can enforce the rights to judicial guarantees and judicial protection of which they are entitled.","201.2",NA
"Promover mecanismos que garanticen los derechos del consumidor en busca de relaciones equitativas de consumo y para combatir prácticas comerciales lesivas.","Promote mechanisms to guarantee consumer rights in search of equitable consumer relations and to combat harmful commercial practices.","403",NA
"Buscando incorporar estos derechos en acuerdos  comerciales internacionales y políticas públicas transversales de gobierno que favorezcan su protección.","Seeking to incorporate these rights into international trade agreements and cross-cutting government policies that favor their protection.","107",NA
"Promover la protección de los derechos de los jóvenes, asegurando el ejercicio de sus libertades","Promote the protection of young people's rights, ensuring the exercise of their freedoms","706",NA
"propiciando el mayor desarrollo de sus capacidades, poniendo especial énfasis en el acceso a la educación","and fostering the greatest development of their capabilities, with special emphasis on access to education","506",NA
"y acceso a oportunidades de incorporación al sector productivo.","and access to opportunities to join the productive sector.","701",NA
"Generar el tejido institucional y el capital social para garantizar, en el marco del Estado de derecho, el derecho a la seguridad humana en su interdependencia con el resto de derechos fundamentales.","Generate the institutional fabric and social capital to guarantee, within the framework of the rule of law, the right to human security in its interdependence with other fundamental rights.","201.2",NA
"Generar modalidades de vinculaciones eficientes y creativas con la sociedad civil y las personas activistas y defensoras de derechos humanos -de manera particular con quienes han sido víctimas directas de la violencia y la inseguridad-,","Generate modalities for efficient and creative linkages with civil society and human rights activists and defenders -particularly with those who have been direct victims of violence and insecurity-, with the purpose of","606.2",NA
"con el propósito de incorporar y dar seguimiento a los contenidos de los tratados internacionales.","incorporating and following up on the contents of international treaties.","107",NA
"Diseñar y transversalizar, con la suficiente asignación presupuestal, una política de Estado en materia de no discriminación,","Design and mainstream, with sufficient budget allocation, a State policy on non-discrimination,","503",NA
"armonizada con los instrumentos de derecho internacional","harmonized with international law instruments","107",NA
"y supervisada su implementación y evaluación por la sociedad civil.","and monitored for implementation and evaluation by civil society.","606.2",NA
"Fortalecer las capacidades de la sociedad civil para acceder a las instituciones y mecanismos efectivos para la exigibilidad y justiciabilidad de los derechos, cuando estos son violados.","Strengthen civil society's capacity to access institutions and effective mechanisms for the enforceability and justiciability of rights when they are violated.","605.1",NA
"Promover la eliminación del uso de estereotipos, prejuicios y estigmas (por razón de sexo, edad, raza, etnia, condición económica, religión o pertenencia política, entre otros) en todos los instrumentos de carácter público que inciden en la formación y socialización de la población","Promote the elimination of the use of stereotypes, prejudices and stigmas (based on sex, age, race, ethnicity, economic status, religion or political affiliation, among others) in all public instruments that have an impact on the education and socialization of the population","503",NA
"en el campo educativo,","in the field of education,","506",NA
"de los medios de comunicación y mediante conductas discriminatorias en los servicios públicos,","the media and through discriminatory behavior in public services,","503",NA
"promoviendo la adopción de protocolos de actuación construidos a partir de las normas vinculantes establecidas en los tratados y convenciones que forman el Derecho Internacional de los Derechos Humanos.","promoting the adoption of protocols for action based on the binding standards established in the treaties and conventions that make up International Human Rights Law.","107",NA
"Fortalecer los mecanismos de investigación de los crímenes del pasado y garantizar el esclarecimiento de las violaciones graves a los derechos humanos que permanecen en la impunidad, así como la reparación integral del daño y las garantías de no repetición.","Strengthen the mechanisms for the investigation of past crimes and guarantee the clarification of serious human rights violations that remain unpunished, as well as comprehensive reparations for damages and guarantees of non-repetition.","305.6",NA
"Daremos un seguimiento particular al cumplimiento de las condenas establecidas por la Corte Interamericana de Derechos Humanos en contra de México,","We will particularly follow up on compliance with the sentences established by the Inter-American Court of Human Rights against Mexico, as they","305.6",NA
"por tratarse de casos emblemáticos que pueden servir de guía para evitar repetir acciones lesivas de derechos.","are emblematic cases that can serve as a guide to avoid repeating actions that violate rights.","201.2",NA
"Fortalecer y aplicar de manera efectiva en todos los niveles y ámbitos de gobierno, la igualdad de derechos y oportunidades entre el hombre y la mujer, para desalentar e incidir en aquellas prácticas que promueven estereotipos y prejuicios que redundan en afectaciones a la calidad de vida de las mujeres.","Strengthen and effectively apply at all levels and spheres of government, equal rights and opportunities between men and women, in order to discourage and influence those practices that promote stereotypes and prejudices that affect women's quality of life.","503",NA
"Erradicar la violencia de género y combatir las consecuencias nocivas que la misma tiene en términos de educación, salud y desarrollo personal.","Eradicate gender-based violence and combat the harmful consequences it has in terms of education, health and personal development.","503",NA
"Fortalecer y transversalizar la igualdad de género en todos los niveles y ámbitos de gobierno, para desalentar e incidir en aquellas prácticas que promueven estereotipos y prejuicios que redundan en afectaciones a la calidad de vida de las mujeres.","Strengthen and mainstream gender equality at all levels and spheres of government to discourage and influence practices that promote stereotypes and prejudices that affect women's quality of life.","503",NA
"Combatir el estigma y la discriminación, así como crear espacios de seguridad, para el ejercicio de aquellas libertades -como las que se refiere a la libertad de pensamiento, orientación sexual o la de tipo religioso- que implican una tensión con las identidades mayoritarias.","Combat stigma and discrimination, as well as create safe spaces for the exercise of those freedoms -such as freedom of thought, sexual orientation or religious freedom- that imply a tension with majority identities.","503",NA
"V. ACCIONES PARA UN NUEVO SISTEMA DE EDUCACIÓN","V. ACTIONS FOR A NEW EDUCATION SYSTEM","H",NA
"Una educación de calidad con equidad, gratuita y laica  como la que propone Encuentro Social requiere cumplir al menos cuatro condiciones:","A quality, equitable, free and secular education such as the one proposed by Encuentro Social requires the fulfillment of at least four conditions:","506",NA
"La primera tiene que ver con la promoción de la igualdad en el acceso, calidad y la permanencia de los niños en educación básica (preescolar, primaria y secundaria) e inicial.","The first has to do with the promotion of equality in access, quality and permanence of children in basic education (preschool, primary and secondary) and initial education.","506",NA
"El acceso a la educación de todos los niños todavía implica un reto en México, sin embargo el principal desafío es consolidar la permanencia en el sistema educativo, principalmente la de los niños que pertenecen a grupos marginados.","Access to education for all children is still a challenge in Mexico; however, the main challenge is to consolidate permanence in the educational system, especially for children belonging to marginalized groups.","506",NA
"Esta condición tiene que ver con la disponibilidad efectiva de la oferta educativa a lo largo de la educación inicial y básica,","This condition has to do with the effective availability of educational offerings throughout early and basic education,","506",NA
"pero también con la capacidad del sistema educativo de asegurar la permanencia de los niños en situaciones de desventaja y menor capital social.","but also with the capacity of the educational system to ensure the permanence of children in disadvantaged situations and with lower social capital.","506",NA
"La segunda condición se refiere a la importancia de ofrecer más y mejor educación a los alumnos de los grupos vulnerables.","The second condition refers to the importance of offering more and better education to students from vulnerable groups.","503",NA
"No basta que ingresen al sistema, sino que el Estado debe hacer un esfuerzo extra para compensar las desventajas en el capital cultural con el que los niños ingresan.","It is not enough for them to enter the system; the State must make an extra effort to compensate for the disadvantages in the cultural capital with which children enter the system.","503",NA
