"text","text_en","cmp_code","eu_code"
"El gobierno de Acción Nacional vigilará que los medios informativos y la industria editorial presten eficazmente el servicio, esencial para una Nación, de orientar la formación de una conciencia nacional respetuosa de los valores nacionales fundamentales, como son la veracidad, la honradez, la integridad de la familia, el respeto al pudor y al buen nombre de personas e instituciones, la educación para la libertad y la solidaridad.","The government of Acción Nacional will ensure that the media and the publishing industry effectively provide the service, essential for a Nation, of guiding the formation of a national conscience respectful of fundamental national values, such as truthfulness, honesty, the integrity of the family, respect for decency and the good name of persons and institutions, education for freedom and solidarity.","603",NA
"3. Reconstrucción de la Economía.","3. Reconstruction of the Economy.",NA,NA
"Los más graves males que agobian al mexicano en estos momentos son de carácter económico, aun cuando sus causas profundas sean de índole política.","The most serious ills burdening Mexicans at this time are economic in nature, even though their root causes are political in nature.","408",NA
"Por lo que más se padece hoy es por la carestía de la vida a través de la inflación, el empobrecimiento permanente mediante la pérdida del poder de compra del salario;","What we suffer most today is the high cost of living through inflation, permanent impoverishment through the loss of purchasing power of wages,","414",NA
"los altos impuestos para sostener al gobierno,","high taxes to support the government, the","303",NA
"la pesada carga de la deuda externa.","heavy burden of foreign debt.","414",NA
"Ante todo esto, la economía, a fin de cuentas es una técnica social al servicio del Bien Común, debe reestructurarse, perfeccionarse, corregirse, para que alcance su finalidad, para que sea un instrumento eficaz y sirva no para el control político, sino para que el pueblo de México produzca con plenitud lo que necesita","In view of all this, the economy, which is after all a social technique at the service of the Common Good, must be restructured, perfected, corrected, so that it can achieve its purpose, so that it can be an effective instrument and serve not for political control, but so that the people of Mexico can fully produce what they need","410",NA
"y lo producido se distribuya con criterio de justicia y de solidaridad.","and that what is produced is distributed with criteria of justice and solidarity.","503",NA
"3.1 El papel del Estado en la Economía.","3.1 The role of the State in the Economy.",NA,NA
"A la luz de sus principios Acción Nacional pretende la organización de un Estado en el que se busquen los siguientes objetivos económicos:","In light of its principles, Acción Nacional seeks the organization of a State in which the following economic objectives are pursued:","408",NA
"El Estado tiene en la economía la función de rector,","The State has the function of guiding the economy,","403",NA
"que puede justificar que en ocasiones asuma la propiedad y el monopolio de ciertas actividades;","which may justify that on occasions it assumes the ownership and monopoly of certain activities;","413",NA
"pero ésta facultad debe limitarse a casos especiales, estratégicos, determinados por la ley, para impedir un excesivo poder económico en manos de particulares y siempre para procurar el bien común,","but this power must be limited to special, strategic cases, determined by law, to prevent excessive economic power in the hands of private individuals and always to procure the common good,","403",NA
"a la vez que cuidar la prestación adecuada y eficaz de los servicios públicos.","while ensuring the adequate and efficient provision of public services.","304",NA
"El Estado debe reservarse para sí la administración directa de las áreas estratégicas de la economía como emisión de moneda, energía nuclear, extracción de petróleo crudo,","The State should reserve for itself the direct administration of strategic areas of the economy such as currency issuance, nuclear energy, crude oil extraction,","413",NA
"pero debe permitir bajo su vigilancia que los particulares actúen en áreas como la petroquímica secundaria, la generación de energía eléctrica, solar, eólica o bien en campos como el del crédito a través de la banca regional.","but should allow, under its supervision, private individuals to operate in areas such as secondary petrochemicals, electric, solar and wind energy generation, or in fields such as credit through regional banks.","401",NA
"Áreas estratégicas son aquellas que aportan un beneficio social indispensable que los particulares no pueden brindar y que de no estar en manos del Estado, comprometerían la soberanía nacional.","Strategic areas are those that provide an indispensable social benefit that private individuals cannot provide and that, if they were not in the hands of the State, would compromise national sovereignty.","413",NA
"El Estado actuará en forma subsidiaria en materia económica, supliendo a los particulares en todas aquellas actividades en las cuales la iniciativa privada sea imposible o insuficiente.","The State shall act in a subsidiary manner in economic matters, supplying the private sector in all those activities in which private initiative is impossible or insufficient.","401",NA
"La planeación, sin perder de vista el Bien Común, tenderá a concertar los legítimos intereses de la comunidad, con la participación de todos los mexicanos.","Planning, without losing sight of the Common Good, will tend to coordinate the legitimate interests of the community, with the participation of all Mexicans.","404",NA
"3.2 Deuda Pública.","3.2 Public Debt.",NA,NA
"La única forma de detener el crecimiento de la deuda pública es disminuyendo drásticamente el gasto corriente del gobierno","The only way to stop the growth of the public debt is by drastically reducing the government's current spending","414",NA
"y restituyendo al dinero del pueblo su poder de compra; una economía sana, con una moneda sana","and restoring the people's money to its purchasing power; a healthy economy, with a healthy currency, and a healthy economy, with a healthy currency.","414",NA
"y disminución del déficit público aumentarán la confianza, harán volver las inversiones y con ellas el trabajo productivo de los mexicanos será el único mecanismo que permita saldar las dos hipotecas que nos agobian, la de la deuda interna y la de la deuda externa.","and a reduction in the public deficit will increase confidence, will bring back investments and with them the productive work of Mexicans, and will be the only mechanism to pay off the two mortgages that burden us, that of the internal debt and that of the foreign debt.","414",NA
"Al respecto, un gobierno panista tomaría las siguientes medidas de emergencia:La incautación de bienes de los funcionarios públicos que tuvieran responsabilidad en el endeudamiento.","In this regard, a PAN government would take the following emergency measures: Seizure of assets of public officials responsible for the indebtedness.","414",NA
"La aplicación de estos bienes y otros que se rescaten de funcionarios que se enriquecieron en sus cargos, para aliviar la pesada carga de la deuda interna y detener su crecimiento.","The application of these assets and others that are rescued from officials who enriched themselves in office, to alleviate the heavy burden of the internal debt and stop its growth.","414",NA
"3.2.1 Deuda Interna.","3.2.1 Domestic Debt.",NA,NA
"Al comienzo de este sexenio la deuda interna era de unos tres billones de pesos y hoy, al final del 5º. Año de gobierno, es de casi 40 billones, que por el efecto multiplicador de los altísimos intereses se convertirán en cuando menos otro tanto en un año más, con la agravante de que esa deuda tan enorme no ha sido suficiente para lograr el desarrollo económico del país.","At the beginning of this six-year term, the domestic debt was about three trillion pesos, and today, at the end of the 5th year of government, it is almost 40 trillion pesos. Today, at the end of the 5th year of government, it is almost 40 trillion pesos, which due to the multiplying effect of the very high interest rates will become at least as much in another year, with the aggravating factor that this enormous debt has not been sufficient to achieve the economic development of the country.","414",NA
"3.2.2 Deuda Externa.","3.2.2 External Debt.",NA,NA
"Acción Nacional sostiene al respecto que la actual polémica del pago de la deuda se refiere a las consecuencias y que es necesario ir primero a las causas; se buscan soluciones respecto a la forma de pago, plazos e intereses, pero no se plantea la posibilidad de que un país se desarrolle sin necesidad de acudir al endeudamiento.","Acción Nacional argues that the current debt payment controversy refers to the consequences and that it is necessary to go first to the causes; solutions are sought regarding the form of payment, terms and interest, but the possibility for a country to develop without the need to resort to indebtedness is not considered.","414",NA
"La alternativa primordial no es pagar o no pagar sino pedir o no pedir.","The primary alternative is not to pay or not to pay, but to ask or not to ask.","414",NA
"Sin embargo, la deuda existe y hay que enfrentarla y para ello, el gobierno de Acción Nacional tomará las siguientes medidas en ésta materia:","However, the debt exists and must be confronted, and to this end, the government of Acción Nacional will take the following measures in this matter:","414",NA
"Una política de mayor honradez y austeridad en el manejo del dinero público","A policy of greater honesty and austerity in the management of public money","303",NA
"y simultáneamente una mayor libertad de acción económica para incrementar la producción de bienes y servicios, serán las medidas indispensables para detener el incremento anual de la deuda pública.","and simultaneously a greater freedom of economic action to increase the production of goods and services will be the indispensable measures to stop the annual increase in public debt.","410",NA
"Revisión de cada uno de los acuerdos y documentos de las obligaciones contraídas por el gobierno para determinar si los recursos obtenidos fueron aplicados a los propósitos planteados y si se contrajeron por autoridades debidamente facultadas por la ley.","Review of each of the agreements and documents of the obligations contracted by the government to determine whether the resources obtained were applied to the purposes intended and whether they were contracted by authorities duly empowered by law.","304",NA
"Esto con objeto de obtener la reintegración de desvíos y la anulación de créditos irregulares, especialmente en los casos en que se descubra colusión del acreedor.","This is in order to obtain the reinstatement of deviations and the cancellation of irregular credits, especially in cases where creditor collusion is discovered.","304",NA
"A partir de esta primera depuración y con la autoridad de un verdadero gobierno representativo, negociar la deuda bajo el principio ético de que no se puede pagar con cargo a la miseria del pueblo.","From this first purge and with the authority of a true representative government, negotiate the debt under the ethical principle that it cannot be paid out of the people's misery.","107",NA
"La decisión de eliminar del presupuesto los gastos políticos, publicitarios y suntuarios.","The decision to eliminate political, advertising and sumptuary expenses from the budget.","414",NA
"También se comprometerá el gobierno de Acción Nacional a sujetar su crecimiento burocrático a las necesidades reales del servicio público","The National Action government will also commit itself to subject its bureaucratic growth to the real needs of the public service","303",NA
"y a desterrar la corrupción y los malos manejos de la administración.","and to banish corruption and mismanagement in the administration.","304",NA
"Para la renegociación de los intereses de la deuda, los acreedores deberán reconocer su corresponsabilidad al haber ofrecido y colocado créditos al margen de la existencia constitucional que ordena que los préstamos se empleen en inversiones productivas.","In order to renegotiate the interest on the debt, the creditors must acknowledge their co-responsibility for having offered and placed loans outside of the constitutional requirement that the loans be used for productive investments.","203",NA
"Dado que la deuda externa se cotiza bajo su valor nominal, buscar arreglos dando preferencia al pago de capital.","Given that external debt is priced below its face value, seek arrangements giving preference to principal repayment.","414",NA
"Estudiar y fijar un porcentaje sobre el total de exportaciones efectivas para destinarlo al pago de la deuda, tomando en cuenta variables como ingresos por turismo, balanza comercial y otros.","Study and set a percentage of total effective exports to be used for debt payment, taking into account variables such as tourism income, trade balance and others.","414",NA
"3.3 Banca y Crédito.","3.3 Banking and Credit.",NA,NA
"El Partido Acción Nacional propone en esta materia:La descentralización de la banca a través de la constitución de bancos regionales en cada uno de los estados de la República con el mayor número posible de inversionistas locales.","The National Action Party proposes in this matter:The decentralization of banking through the constitution of regional banks in each of the states of the Republic with the largest possible number of local investors.","301",NA
"Corresponderá a las autoridades hacendarias en la especialidad, el establecimiento de la política bancaria, el riesgoso control y garantía de las operaciones y la regulación de las transferencias de recursos para la mejor nivelación de la demanda de crédito u oferta, según la situación de los distintos estados de la federación.","It will correspond to the treasury authorities in the specialty, the establishment of the banking policy, the risk control and guarantee of the operations and the regulation of the transfer of resources for the best leveling of the credit demand or supply, according to the situation of the different states of the federation.","403",NA
"De igual manera el manejo de las cámaras de compensación, servicios de control nacional de usuarios de crédito, asientos y operaciones a nivel nacional, relacionados con tarjetas de crédito y otros instrumentos similares, deberán ser supervisados por las autoridades bancarias y otorgados para su operación a centros de servicio técnico de carácter privado o mixto.","Likewise, the management of clearing houses, national control services for credit users, entries and operations at national level, related to credit cards and other similar instruments, must be supervised by the banking authorities and granted to private or mixed technical service centers for their operation.","403",NA
"El único tipo de servicio bancario además de la emisión de moneda, que quedará exclusivamente a cargo del gobierno, será el manejo de la banca de promoción para redescuentos operados en primera instancia en la banca regional.","The only type of banking service other than the issuance of currency, which will remain exclusively in charge of the government, will be the management of promotional banking for rediscounts operated in the first instance in regional banking.","402",NA
"En un plazo de tres años, la banca regional sustituirá a la banca concentrada y la infraestructura central será reducida a la dimensión de sus necesidades de servicio.","Within three years, regional banking will replace concentrated banking and the central infrastructure will be reduced to the size of its service needs.","301",NA
"El apoyo de la banca regional al desarrollo de los estados de la República permitirá una mayor vigencia del federalismo en lo económico e impulsará la mayor amplitud y equilibrio en el desarrollo nacional.","The support of regional banks to the development of the states of the Republic will allow for a greater validity of federalism in the economic sphere and will promote greater breadth and balance in national development.","301",NA
"Se creará una institución fiduciaria, con el fin específico de administrar aquellas empresas paraestatales incosteables o no estratégicas, ya sea transfiriendo su propiedad a sus trabajadores o liquidándolas en forma definitiva.","A fiduciary institution will be created for the specific purpose of administering those parastatal companies that are unaffordable or non-strategic, either by transferring their ownership to their workers or by liquidating them definitively.","303",NA
"3.4 Política Fiscal.","3.4 Fiscal Policy.",NA,NA
"Una medida inmediata que deberá tomarse será reintegrar en plenitud a la Cámara de diputados sus facultades fiscalizadoras y revisoras del gasto público.","An immediate measure to be taken is to fully reinstate the Chamber of Deputies' powers of oversight and review of public spending.","202",NA
"No se autorizará al Ejecutivo en cada Presupuesto de Egresos o en cada Ley de Ingresos un cheque en blanco para que disponga a su arbitrio de los recursos públicos.","The Executive Branch shall not be authorized a blank check in each Expenditure Budget or in each Revenue Law to dispose of public resources at its discretion.","202",NA
"Llevaremos a cabo una reducción del gasto corriente limitando la burocracia a niveles de utilidad, eficiencia y necesidad.","We will reduce current spending by limiting bureaucracy to levels of utility, efficiency and necessity.","303",NA
"Se pondrá fin al gasto encaminado a asegurar el control político y a cooptar las iniciativas y movimientos de grupos sociales.","Spending aimed at ensuring political control and co-opting social group initiatives and movements will be stopped.","414",NA
"Proponemos que el Presupuesto de Ingresos descanse primordialmente en el Impuesto sobre la Renta, por ser un impuesto directo y personal que responde a la norma constitucional de ser equitativo y proporcional.","We propose that the Revenue Budget be based primarily on the Income Tax, since it is a direct and personal tax that complies with the constitutional rule of being equitable and proportional.","503",NA
"En necesario revertir la tendencia a que el Impuesto al Valor Agregado (IVA) disparador de la inflación, continúe su tendencia a convertir en la principal fuente tributaria.","It is necessary to reverse the trend that the Value Added Tax (VAT), which triggers inflation, continues its tendency to become the main source of taxes.","414",NA
"La multitud de impuestos indirectos y derechos que el gobierno cobra por unos bienes de los que se ha apropiado y por servicios de dudosa utilidad, recargan con costos excesivos e injustificados la actividad productiva de los ciudadanos y desde luego serán revisados y reducidos a su proporción justa y constitucional.","The multitude of indirect taxes and duties that the government charges for goods it has appropriated and for services of dubious utility, burden the productive activity of citizens with excessive and unjustified costs, and will certainly be reviewed and reduced to their fair and constitutional proportion.","402",NA
"4. Para el Campo: Tierra y Libertad.","4. For the Countryside: Land and Freedom.",NA,NA
"Pensamos que el campo es el punto de partida para romper el círculo vicioso de la crisis y por lo tanto la política agropecuaria debe tener prioridad en los planes de trabajo del próximo gobierno.","We believe that the countryside is the starting point to break the vicious circle of the crisis and therefore agricultural policy must be a priority in the work plans of the next government.","703",NA
"Si se insiste en aplicar sistemas desgastados, si no se tiene la valentía suficiente para desterrar vicios y abatir tabúes, evidentemente la situación del campo no cambiará nunca.","If we insist on applying worn-out systems, if we do not have enough courage to banish vices and break down taboos, the situation in the countryside will obviously never change.","703",NA
"Pero si se emprende una “reconversión rural” fundamentada principalmente en un cambio de estructuras que reconozca que el principal problema del campo es el de la marginación de los hombres que en el trabajan y viven de él,","But if a ""rural reconversion"" is undertaken, based mainly on a change of structures that recognizes that the main problem of the countryside is the marginalization of the people who work and live from it,","703",NA
"México puede tener un sector agropecuario vigoroso y pujante que satisfaga sus necesidades de alimentos, que provea a la industria de materia prima suficiente, que produzca para la exportación y que sea motor del desarrollo nacional.","Mexico can have a vigorous and thriving agricultural sector that satisfies its food needs, provides industry with sufficient raw materials, produces for export and is the engine of national development.","703",NA
"El postulado revolucionario de “Tierra y Libertad” lejos de ser un lema vacío o un sueño quimérico por incumplimiento culpable, podría ser un anhelo alcanzable en el corto plazo si ponemos los medios idóneos para lograrlo.","The revolutionary postulate of ""Land and Liberty"", far from being an empty slogan or a chimerical dream for culpable non-fulfillment, could be an attainable desire in the short term if we put in place the ideal means to achieve it.","703",NA
"4.1 Tierra agraria en propiedad.","4.1 Agricultural land in property.",NA,NA
"No podrá haber verdadero desarrollo en México mientras el sector agrícola siga reprimido, mientras se le siga considerando como un apéndice del sector industrial o un problema político.","There can be no real development in Mexico as long as the agricultural sector continues to be repressed, as long as it continues to be considered an appendage of the industrial sector or a political problem.","703",NA
"Todo intento de solución para los problemas del campo debe por tanto, contemplar, tres aspectos.","Any attempt to solve the problems of the field must therefore consider three aspects.","703",NA
"La seguridad jurídica para la tenencia y explotación de la tierra;","Legal security for land tenure and exploitation;","401",NA
"el aumento de la productividad","productivity gains","703",NA
"y el fortalecimiento de la Dignidad de la Persona Humana del campesino.","and the strengthening of the Dignity of the Human Person of the farmer.","703",NA
"La reforma agraria como una exigencia de justicia social, está fuera de discusión.","Agrarian reform as a demand for social justice is out of the question.","703",NA
"Sin embargo actualmente el problema más urgente es el de su actualización y adaptación a las nuevas condiciones del campesino de hoy para que se logre una reforma de la reforma agraria.","However, the most urgent problem today is to update and adapt it to the new conditions of today's peasants in order to achieve a reform of the agrarian reform.","703",NA
"La reforma agraria debe ser mucho más que eso.","Agrarian reform must be much more than that.","703",NA
"Exige el derecho del hombre que trabaja la tierra a que le sea útil para su bienestar e independencia, para que le sea útil para su bienestar e independencia, para que sea más libre y más responsable.","It demands the right of the man who works the land to be useful for his well-being and independence, to be useful for his well-being and independence, to be freer and more responsible.","703",NA
"Para esto la reforma agraria debe abarcar, además de la seguridad y definición jurídicas de la posesión de la tierra,","For this, agrarian reform must include, in addition to the legal security and definition of land ownership,","401",NA
"el crédito para poderla trabajar,","credit to be able to work it,","703",NA
"la asistencia para poderla trabajar,","assistance to be able to work it,","703",NA
"la seguridad de los mercados","security of markets","703",NA
"y precios justos para hacerla verdaderamente productiva.","and fair prices to make it truly productive.","703",NA
"Estas exigencias se traducen hoy para el campesino en: derecho a la propiedad de tierra, derecho a producir, derecho a la productividad y derecho al fruto de trabajo.","These demands translate today for the peasant into: the right to land ownership, the right to produce, the right to productivity and the right to the fruits of labor.","703",NA
"Por ello proponemos la incorporación a las disposiciones legales constitucionales y reglamentarias de naturaleza agraria de los siguientes principios:","Therefore, we propose the incorporation of the following principles into the constitutional and regulatory legal provisions of an agrarian nature:","703",NA
"Es de interés público la conservación, preservación, fomento, explotación racional y justa distribución de los recursos naturales renovables que por su naturaleza o destino sean objeto de las actividades agropecuarias","It is of public interest the conservation, preservation, promotion, rational exploitation and fair distribution of renewable natural resources that by their nature or destination are the object of agricultural activities and","501",NA
"y, así mismo, es de utilidad pública incrementar la producción agrícola ganadera y forestal, así como la productividad de bienes destinados a ese fin.",", likewise, it is of public utility to increase agricultural, livestock and forestry production, as well as the productivity of goods destined for that purpose.","703",NA
