"text","text_en","cmp_code","eu_code"
"Se trata de proporcionar una desigualdad cuantitativa de insumos en favor de los grupos en desventaja o llevar a la práctica el principio de proporcionalidad orientado a fortalecer a los más débiles, bajo criterios de discriminación positiva o de focalización.","The aim is to provide a quantitative inequality of inputs in favor of disadvantaged groups or to put into practice the principle of proportionality aimed at strengthening the weakest, under criteria of positive discrimination or targeting.","503",NA
"La tercera condición plantea la oportunidad que deben tener todos los niños, independientemente de su condición de origen, para lograr y mantener un nivel aceptable de aprendizaje.","The third condition states that all children, regardless of their background, should have the opportunity to achieve and maintain an acceptable level of learning.","506",NA
"Se debe garantizar el acceso pleno y equitativo a una educación de buena calidad y de un buen rendimiento, el reto clave es asegurar una educación de calidad y al mismo tiempo valorar la diversidad.","Full and equitable access to good quality education and good performance must be guaranteed, the key challenge is to ensure quality education while valuing diversity.","506",NA
"Para ello el objetivo fundamental de un sistema educativo de calidad como el que propone Encuentro Social es cambiar el énfasis en la transmisión frontal del conocimiento —que empobrece el aprendizaje sobre todo en las escuelas con menos insumos educativos— a un aprendizaje personalizado, constructivo y grupal","To this end, the fundamental objective of a quality educational system such as the one proposed by Encuentro Social is to change the emphasis on the frontal transmission of knowledge -which impoverishes learning, especially in schools with fewer educational inputs- to personalized, constructive and group learning","506",NA
"que garantice la adquisición de competencias para la vida y para el desempeño laboral.","that guarantees the acquisition of competencies for life and for work performance.","411",NA
"La cuarta condición hace referencia a la importancia de que los egresados del sistema educativo, principalmente de media superior o superior, cuenten con aprendizajes socialmente relevantes y útiles para desempeñarse en el sector productivo.","The fourth condition refers to the importance of ensuring that graduates of the educational system, mainly at the upper secondary and higher education levels, have socially relevant and useful learning to be able to perform in the productive sector.","411",NA
"La prioridad debe ser mejorar los resultados del aprendizaje con conocimientos socialmente significativos, favoreciendo  el  “acceso universal a los códigos de la modernidad”","The priority should be to improve learning outcomes with socially meaningful knowledge, favoring ""universal access to the codes of modernity""","506",NA
"y a la importancia de lograr convergencias entre  los desempeños productivos y los desempeños ciudadanos.","and the importance of achieving convergence between productive and citizenship performances.","411",NA
"Se destaca en esta propuesta la distribución equitativa de conocimientos socialmente significativos, no únicamente para insertarse en la vida productiva, sino como la condición fundamental para crear una cultura de la paz y de  tolerancia.","This proposal emphasizes the equitable distribution of socially significant knowledge, not only for insertion into productive life, but also as a fundamental condition for creating a culture of peace and tolerance.","503",NA
"Encuentro Social propone una estrategia nacional, estatal y municipal orientada a reducir la desigualdad y las grandes inequidades que existen en México,","Encuentro Social proposes a national, state and municipal strategy aimed at reducing inequality and the great inequities that exist in Mexico,","503",NA
"mejorando la calidad y cobertura en todos los niveles educativos.","improving quality and coverage at all educational levels.","506",NA
"La importancia de la educación integral para la primera infancia compensando las limitaciones y desventajas iniciales de los niños en condiciones de pobreza para desarrollar la capacidad de aprendizaje en edades posteriores.","The importance of comprehensive early childhood education compensating for the initial limitations and disadvantages of children in conditions of poverty in order to develop the capacity for learning at later ages.","506",NA
"Para disminuir estas desigualdades de origen en la niñez mexicana a la vez que proporcionarle las herramientas y los recursos para una escolarización con mayores posibilidades de éxito.","To reduce these inequalities of origin in Mexican children while providing them with the tools and resources for a schooling with greater chances of success.","506",NA
"Definido el objetivo general de la construcción de un nuevo sistema de educación que Encuentro Social adopta, a continuación se presentan las principales propuestas que servirán de guía y discusión para permear, en la ciudadanía mexicana y en las políticas públicas del Estado, los ideales por los cuales pugna el Partido:","Having defined the general objective of the construction of a new education system that Social Encounter adopts, the following are the main proposals that will serve as a guide and discussion to permeate, in Mexican citizenship and in the public policies of the State, the ideals for which the Party strives: To","305.1",NA
"Ampliar, enriquecer y estimular los proyectos y programas orientados a capacitar a las madres y padres cabeza de familia para potenciar al máximo el desarrollo integral de los niños","expand, enrich and stimulate projects and programs aimed at training mothers and fathers who are heads of households to maximize the integral development of children","411",NA
"con el objetivo de que proporcionen servicios de cuidados en salud, nutrición, estimulación temprana, entre otros,","with the objective of providing health care services, nutrition, early stimulation, among others, to the","504",NA
"a toda la población infantil en condiciones de vulnerabilidad y marginación social y económica.","entire child population in conditions of vulnerability and social and economic marginalization.","503",NA
"Estimular y apoyar la participación de las organizaciones de la sociedad civil y de la comunidad para crear un entorno educativo que contrarreste los efectos adversos de la marginación social y la falta de educación.","Stimulate and support the participation of civil society and community organizations to create an educational environment that counteracts the adverse effects of social marginalization and lack of education.","606.2",NA
"Garantizar y monitorear la operación y la calidad de los programas que existen en la actualidad y, una vez demostrado sus resultados, apoyar su ampliación y multiplicación en las zonas marginadas del país.","Guarantee and monitor the operation and quality of existing programs and, once their results have been demonstrated, support their expansion and multiplication in marginalized areas of the country.","303",NA
"Generación de conocimiento que permita en el corto y mediano plazo tener emprendimientos exitosos globalmente de cuño nacional.","Generation of knowledge that will allow in the short and medium term to have globally successful national ventures.","506",NA
"Siendo la educación preescolar un factor de justicia que favorece la igualdad de oportunidades,","Since preschool education is a factor of justice that favors equality of opportunity, it","503",NA
"es importante que el Estado realice una gran inversión para desarrollar un sistema de educación preescolar con amplia cobertura y que proporcione una oferta educativa de calidad a estos sectores para amortiguar las desventajas de inicio.","is important that the State invest heavily in developing a preschool education system with broad coverage and that provides a quality educational offer to these sectors in order to cushion the disadvantages at the outset.","506",NA
"Desarrollar un programa ambicioso de infraestructura y enriquecimiento de los ambientes de aprendizaje en educación preescolar principalmente los sectores más pobres y marginados.","Develop an ambitious program of infrastructure and enrichment of learning environments in preschool education, mainly in the poorest and most marginalized sectors.","411",NA
"Involucrar a las familias y las comunidades, con recursos y capacitación, para que participen en la educación y cuidado de sus hijos.","Involve families and communities, with resources and training, to participate in the education and care of their children.","606.1",NA
"Acabar con los factores que mantienen un sistema educativo nacional mediocre que apunta a reproducir y mantener la desigualdad en México.","To put an end to the factors that maintain a mediocre national education system that aims to reproduce and maintain inequality in Mexico.","503",NA
"Identificar, seleccionar y centrar la atención en las escuelas de cada municipio que se encuentran en mayor situación de desventaja y que son las que generan menores niveles de aprovechamiento por lo tanto presentan más dificultades para evitar el fracaso escolar.","Identify, select and focus attention on the schools in each municipality that are most disadvantaged and that generate the lowest levels of achievement and therefore present the greatest difficulties in preventing school failure.","301",NA
"Capacitar para promover el mejoramiento de la calidad de los aprendizajes y la disminución de la deserción escolar, mediante la introducción de metodologías altamente pertinentes que han probado su eficacia.","Training to promote the improvement of the quality of learning and the reduction of school dropout rates, through the introduction of highly relevant methodologies that have proven their effectiveness.","411",NA
"Apoyo material y académico de calidad para reforzar los procesos de aprendizaje.","Quality material and academic support to reinforce learning processes.","411",NA
"Mejorar la oferta educativa, sobre todo lo relacionado con la infraestructura.","Improve the educational offer, especially in terms of infrastructure.","411",NA
"Fomentar una educación en la que se desarrollen las competencias necesarias para ejercer la ciudadanía y la titularidad de derechos,","To promote an education that develops the necessary skills to exercise citizenship and the ownership of rights,","202.1",NA
"para insertarse en la actual sociedad del conocimiento y acceder a un empleo digno,","to be inserted in today's knowledge society and to access decent employment,","701",NA
"así como en materia de transparencia, educación cívica, educación para el consumo, educación financiera, tolerancia, diálogo y derechos humanos.","as well as in transparency, civic education, consumer education, financial education, tolerance, dialogue and human rights.","506",NA
"Orientar la educación al logro de finalidades y expectativas de alta relevancia, expresadas en un conjunto de competencias clave que respondan a las exigencias de un mundo globalizado pero al mismo tiempo contribuyan a la integración local.","To orient education towards the achievement of highly relevant goals and expectations, expressed in a set of key competencies that respond to the demands of a globalized world but at the same time contribute to local integration.","506",NA
"Definir facultades precisas para cada orden de gobierno, incluyendo además a los centros educativos, con base en los cuales se creen mecanismos efectivos de evaluación y auditoría del gasto público estatal y federal.","Define precise powers for each order of government, including educational institutions, based on which effective mechanisms for evaluating and auditing state and federal public spending can be created.","303",NA
"Crear redes de colaboración público-privado para atender a los grupos en estado de vulnerabilidad.","Create public-private collaboration networks to assist vulnerable groups.","405",NA
"Consolidar el sistema de evaluación de la educación básica y media, creando un nuevo esquema de evaluación de la calidad de las instituciones de educación superior ligada al financiamiento educativo.","Consolidate the evaluation system for basic and secondary education, creating a new scheme for evaluating the quality of higher education institutions linked to educational financing.","303",NA
"Fomentar un sistema de financiamiento a la educación superior, privilegiando la asignación de recursos en atención a la demanda y no a la oferta.","Promote a higher education financing system, prioritizing the allocation of resources based on demand rather than supply.","402",NA
"Reconocer el derecho a la educación de todos los habitantes del país, como un derecho exigible que cuente con mecanismos efectivos y expeditos de intervención del Poder Judicial ante cualquier incumplimiento.","To recognize the right to education of all the inhabitants of the country, as an enforceable right with effective and expeditious mechanisms for intervention by the Judiciary in the event of non-compliance.","506",NA
"Regular la participación de empresas en la provisión de servicios educativos, buscando una transición normativa para que solamente entidades y organizaciones no lucrativas participen en la provisión de servicios en educación superior.","Regulate the participation of companies in the provision of educational services, seeking a regulatory transition so that only non-profit entities and organizations participate in the provision of higher education services.","506",NA
"Modificar el currículo de educación básica por otro centrado en el logro de finalidades y expectativas de alta relevancia, expresadas en un conjunto reducido de competencias clave, particularmente aquellas consideradas como habilidades del siglo XXI.","Modify the basic education curriculum to one focused on the achievement of highly relevant goals and expectations, expressed in a reduced set of key competencies, particularly those considered as 21st century skills.","506",NA
"Crear centros de investigación y desarrollo en materia educativa, como fuentes de evaluaciones rigurosas y para proveer evidencia que sustente el diseño de innovaciones.","Create educational research and development centers as sources of rigorous evaluations and to provide evidence to support the design of innovations.","411",NA
"Promover el acceso universal a la educación inicial (0 a 4 años).","Promote universal access to early education (0 to 4 years).","506",NA
"Implementar mecanismos efectivos para evaluar y auditar el gasto educativo público federal y estatal, y sancionar la desviación de recursos educativos.","Implement effective mechanisms to evaluate and audit federal and state public education spending and sanction the detour of educational resources.","303",NA
"Profesionalizar los servicios de educación para adultos.","Professionalize adult education services.","411",NA
"Crear un organismo con facultades claras y suficientes para asegurar la rápida restitución de derechos a todo ciudadano o grupo social afectado por las decisiones o la inacción de las autoridades educativas.","To create a body with clear and sufficient powers to ensure the prompt restitution of rights to any citizen or social group affected by the decisions or inaction of the educational authorities.","506",NA
"Crear condiciones para que todas las entidades federativas tengan capacidad para atender la demanda de acceso a la educación media superior obligatoria","Create conditions so that all states have the capacity to meet the demand for access to compulsory secondary education.","506",NA
"VI. Acciones para fortalecer a la familia y la identidad comunitaria ante la crisis de las instituciones sociales","VI. Actions to strengthen the family and community identity in the face of the crisis of social institutions.","H",NA
"La familia es para Encuentro Social el pilar fundamental de la sociedad y eje de las políticas públicas.","For Encuentro Social, the family is the fundamental pillar of society and the axis of public policies.","603",NA
"Si bien es cierto que no podemos negar una realidad en la que la globalización,  el predominio de las tecnologías, la democratización, entre otros son fenómenos y procesos que se han implantado en nuestra vida cotidiana, es importante recuperar la importancia de la familia en el desarrollo de la sociedad en general.","While it is true that we cannot deny a reality in which globalization, the predominance of technologies, democratization, among others, are phenomena and processes that have been implanted in our daily lives, it is important to recover the importance of the family in the development of society in general.","603",NA
"Esto apunta a redefinir la relación que se ha mantenido entre la sociedad y el gobierno, en la que prevalecieron posiciones individualistas.","This aims to redefine the relationship that has been maintained between society and government, in which individualistic positions prevailed.","603",NA
"La atención de las familias tiene como propósito alcanzar el bienestar de la sociedad, atendiendo las necesidades de todo y cada uno de sus miembros.","The purpose of caring for families is to achieve the well-being of society, attending to the needs of each and every one of its members.","603",NA
"Para Encuentro Social, es a partir de la familia como se recuperará la confianza en la sociedad y en las instituciones.","For Encuentro Social, it is through the family that trust in society and institutions will be restored.","603",NA
"Es por ello que resulta indispensable, inducir el desarrollo familiar mediante el ejercicio de un trabajo constante y coordinado con todos los actores y sectores sociales,","It is therefore essential to induce family development through constant and coordinated work with all social actors and sectors,","603",NA
"tales como: el sector gobierno,","such as: the government sector, the","504",NA
"sector educativo,","educational sector,","506",NA
"organizaciones sociales, y la comunidad misma,","social organizations and the community itself,","606.2",NA
"procurando para ello impulsar en la función pública, mecanismos y herramientas propicias e idóneas para el diseño e implementación de acciones que correspondan a las demandas de la sociedad mexicana.","In order to do so, we seek to promote mechanisms and tools in the public sector that are conducive and suitable for the design and implementation of actions that correspond to the demands of Mexican society.","504",NA
"Definido el objetivo general de la política para fortalecer a la familia y la identidad comunitaria que Encuentro Social adopta, a continuación se presentan las principales propuestas que servirán de guía y discusión para permear, en la ciudadanía mexicana y en las políticas públicas del Estado, los ideales por los cuales pugna el Partido:","Having defined the general objective of the policy to strengthen the family and the community identity that Social Encounter adopts, the following are the main proposals that will serve as a guide and discussion to permeate, in the Mexican citizenship and in the public policies of the State, the ideals for which the Party strives:","305.1",NA
"Diseñar políticas públicas y programas en los que la unidad de intervención de diferentes dependencias u órganos de gobierno sea la familia, con objetivos específicos a las problemáticas de cada uno de los miembros que la integran.","To design public policies and programs in which the unit of intervention of different government agencies or bodies is the family, with specific objectives to the problems of each of the members that integrate it.","603",NA
"Reconstruir el tejido social de las comunidades a partir de la familia, recuperando la importancia y contribución que cada uno de sus miembros tiene en desarrollo.","To rebuild the social fabric of communities based on the family, recovering the importance and contribution that each of its members has in development.","603",NA
"Procurar la interacción y corresponsabilidad de los ciudadanos con el gobierno,","To seek the interaction and co-responsibility of citizens with the government, in","606.1",NA
"para de esta forma, dirimir de manera conjunta los problemas, situaciones o estados de necesidad de las familias que conforman las comunidades de cada estado y sus respectivos municipios, en el tema de desarrollo familiar.","order to jointly solve the problems, situations or states of need of the families that make up the communities of each state and their respective municipalities, in the area of family development.","603",NA
"Crear un organismo público denominado “Instituto Nacional de la Familia”, por sus siglas (INFAM), que coordine y regule la elaboración de un Plan de Acción General, bajo una agenda para el Desarrollo Familiar Integral.","To create a public organism called ""Instituto Nacional de la Familia"" (INFAM), which coordinates and regulates the elaboration of a General Action Plan, under an agenda for Integral Family Development.","603",NA
"Incorporar figuras jurídicas que introduzcan mecanismos de atención familiar de apoyo y responsabilidad de los padres y tutores con respecto a las infracciones y delitos cometidos por los menores de edad.","Incorporate legal figures that introduce family care mechanisms for the support and responsibility of parents and guardians with respect to infractions and crimes committed by minors.","603",NA
"Fomentar estrategias de participación social en las que todos los miembros sean incorporados a la discusión y toma de decisiones en los problemas de sus comunidades, de manera que en los niños se vaya formando una cultura cívica activa y participativa.","Promote social participation strategies in which all members are incorporated into the discussion and decision making process regarding the problems of their communities, so that children develop an active and participatory civic culture.","606.1",NA
"Realizar políticas y programas que atiendan el problema migratorio con acciones integrales orientadas a las familias y las necesidades específicas de cada uno de sus miembros.","To carry out policies and programs that address the migration problem with comprehensive actions aimed at families and the specific needs of each of their members.","603",NA
"Diseñar estrategias que permitan conciliar la vida familiar y laboral de las mujeres, principalmente en los casos en que son cabeza de familia.","Design strategies to reconcile family and work life for women, especially in cases where they are heads of household.","701",NA
"Integrar a los adultos mayores en el desarrollo de la comunidad, reconociendo su contribución pasada y presente.","To integrate older adults in the development of the community, recognizing their past and present contribution.","706",NA
"Apoyar de manera particular a las familias en la prestación de cuidados personales cuando alguno de sus miembros se encuentra en estado de dependencia, ya sea por edad o discapacidad.","To particularly support families in the provision of personal care when one of their members is in a state of dependency, either due to age or disability.","603",NA
"Asegurar una vivienda digna como espacio fundamental para el desarrollo armónico y saludable de las familias.","Ensure decent housing as a fundamental space for the harmonious and healthy development of families.","411",NA
"Simplificar y facilitar los procedimientos de adopción, de manera que todos los niños mexicanos tengan derecho a formar parte de una familia.","Simplify and facilitate adoption procedures so that all Mexican children have the right to be part of a family.","603",NA
"VII. Acciones para la transformación de la cultura política y la necesidad de un nuevo liderazgo.","VII. Actions for the transformation of the political culture and the need for a new leadership.","H",NA
"El concepto de la Política debe redignificarse, se ha pervertido tanto que ha llegado a considerarse cosa exclusiva de políticos, muchas veces vinculada a la corrupción.","The concept of politics must be redefined, it has become so perverted that it has come to be considered something exclusive to politicians, often linked to corruption.","304",NA
"La Política como ese espacio donde deliberamos y tomamos decisiones que nos afectan en conjunto, requiere de sus mejores ciudadanos; hombres y mujeres comprometidos con la idea de país que queremos.","Politics as that space where we deliberate and make decisions that affect us as a whole, requires its best citizens; men and women committed to the idea of the country we want.","202.1",NA
"En nuestro país la política se sitúa en un contexto democrático, entendida ésta, no como un fin en sí mismo, sino como el mejor camino que existe para alcanzar una sociedad libre, igualitaria y fraterna que propicie las mejores condiciones de vida.","In our country, politics is situated in a democratic context, understood not as an end in itself, but as the best way to achieve a free, egalitarian and fraternal society that fosters the best living conditions.","202.1",NA
"La supervivencia de una democracia de calidad depende de la capacidad que tengan las sociedades de atraer en el gobierno a los más capacitados y de abrir canales efectivos de participación social.","The survival of a quality democracy depends on the ability of societies to attract the most qualified people to the government and to open effective channels for social participation.","202.1",NA
