"text","text_en","cmp_code","eu_code"
"Por lo anterior Acción Nacional propone:El desarrollo en las áreas estratégicas, de una actividad eficiente y productiva, cuyos beneficios alcancen a todos los mexicanos y sirvan de palanca para el desarrollo de la industria nacional.","Therefore, Accion Nacional proposes: The development in strategic areas of an efficient and productive activity, whose benefits reach all Mexicans and serve as a lever for the development of the national industry.","410",NA
"Amplia información respecto de las materias primas disponibles y de las riquezas naturales susceptibles de explotación,","Extensive information on available raw materials and natural resources that can be exploited, as well as the","411",NA
"así como de la infraestructura y los servicios con que se cuenta, para el desarrollo industrial.","infrastructure and services available for industrial development.","411",NA
"Simplificación de leyes y reglamentos para el desarrollo industrial,","Simplification of laws and regulations for industrial development, in which the","403",NA
"en las que se confieran a los gobiernos de las entidades federativas, facultades que ahora tiene el gobierno federal en exclusiva.","The Mexican federal government has the power to grant to the governments of the federative entities powers that are now held exclusively by the federal government.","301",NA
"Fomento y estímulos de una conciencia industrial que propicie la preparación y la investigación técnica,","Promotion and encouragement of an industrial conscience that favors technical preparation and research,","411",NA
"así como el mejoramiento de los niveles educativos, tanto cualitativa como cuantitativamente.","as well as the improvement of educational levels, both qualitatively and quantitatively.","411",NA
"Promover las agroindustrias, las pequeñas y medianas industrias, a partir de obras de infraestructura,","Promote agro-industries, small and medium-sized industries, based on infrastructure works,","411",NA
"asistencia técnica","technical assistance","411",NA
"y financiera","and financial","402",NA
"así como crear mecanismos ágiles de comercialización de los productos.","as well as creating agile mechanisms for product commercialization.","402",NA
"Fomentar las cooperativas de producción y apoyarlas con asistencia técnica y financiera","Encourage production cooperatives and support them with technical and financial assistance","411",NA
"y promover la creación de canales adecuados de comercialización.","and promote the creation of adequate marketing channels.","402",NA
"Fomentar la creación de uniones de crédito de pequeños y medianos industriales, para que sus integrantes puedan adquirir créditos con bajos intereses.","Encourage the creation of credit unions of small and medium-sized industrialists, so that their members can acquire low-interest loans.","402",NA
"Se combatirán los monopolios y a todo mecanismo que atente en contra de la libertad de la actividad industrial o que propicie el acaparamiento de materias primas y créditos.","Monopolies and any mechanism that threatens the freedom of industrial activity or that favors the hoarding of raw materials and credits shall be combated.","403",NA
"Se promoverá la creación de parques industriales que cuenten con las estructuras y los servicios necesarios, tales como carreteras de acceso, vías de ferrocarril, agua, energía eléctrica, servicios telefónicos, radiofónicos, telex y demás.","The creation of industrial parks with the necessary structures and services, such as access roads, railroads, water, electricity, telephone, radio, telex and other services, will be promoted.","411",NA
"Se agilizarán los servicios portuarios para los productos que exportemos, así como también se mejorarán sus instalaciones y vías de acceso.","Port services for our exported products will be expedited, and port facilities and access roads will be improved.","411",NA
"5.2 Inversión extranjera y maquiladoras.","5.2 Foreign investment and maquiladoras.",NA,NA
"En momentos de crisis resulta importante aprovechar las ventajas que tenemos en relación con otros países; compartimos una larga frontera con el país que constituye el mayor mercado del mundo y si países muy lejanos han logrado abrir importantes segmentos de ese mercado para sus productos, es evidente que para nosotros el ahorro en fletes y embarques es una oportunidad que debemos aprovechar.","In times of crisis it is important to take advantage of the advantages we have in relation to other countries; we share a long border with the country that constitutes the largest market in the world and if countries far away have managed to open important segments of that market for their products, it is evident that for us the savings in freight and shipments is an opportunity that we must take advantage of.","101",NA
"El reverso de este panorama lo constituye el riesgo potencial de que se frenen las inversiones en maquiladoras o que por encontrar mayores ventajas en otros lugares, las empresas instaladas decidan retirarse de lugares, las empresas instaladas decidan retirarse de nuestro territorio, aumentando así gravemente los índices de desempleo.","The flip side of this scenario is the potential risk that investments in maquiladoras may be halted or that, because they find greater advantages in other places, the installed companies may decide to withdraw from other places, thus seriously increasing unemployment rates.","402",NA
"Ante estas oportunidades y riesgo simultáneos y frente a la realidad de las maquiladoras ya instaladas y la posibilidad de su incremento, Acción Nacional procurará.","Faced with these simultaneous opportunities and risks, and in view of the reality of the maquiladoras already installed and the possibility of their increase, Acción Nacional will seek to.","402",NA
"Como medida de emergencia y en tanto se encuentran fuentes propias de empleo, admitir la inversión extranjera en nuevas empresas, dando preferencia a aquellas que signifiquen avances tecnológicos a que requieran de mano de obra intensiva.","As an emergency measure and while sources of employment are being found, admit foreign investment in new companies, giving preference to those that represent technological advances and those that require intensive labor.","402",NA
"Eliminar obstáculos formales y burocráticos y establecer una política clara de preferencias y estímulos a las empresas que mayores beneficios nos representen y constituyan menos riegos.","Eliminate formal and bureaucratic obstacles and establish a clear policy of preferences and incentives for those companies that represent the greatest benefits and pose the least risk.","402",NA
"Lograr que las maquiladoras nuevas se instalen en áreas con elevado índice de desempleo para evitar su concentración en un número limitado de poblaciones fronterizas.","To ensure that new maquiladoras are located in areas with high unemployment rates in order to avoid their concentration in a limited number of border towns.","402",NA
"Simultáneamente se fomentará el desarrollo de nuestra propia tecnología para ser autosuficientes a mediano plazo en materia de empleo y dejar así de depender de empresas extranjeras.","Simultaneously, we will promote the development of our own technology in order to be self-sufficient in the medium term in terms of employment and thus stop depending on foreign companies.","411",NA
"5.3 Comercio y Abasto.","5.3 Commerce and Procurement.",NA,NA
"Ningún país podrá considerarse verdaderamente independiente y soberano hasta en tanto sea capaz de satisfacer las necesidades alimentarias de su población.","No country can be considered truly independent and sovereign until it is able to meet the food needs of its population.","703",NA
"Acción Nacional se propone adoptar las siguientes medidas:Establecer la revisión periódica de los precios de garantía de los productos del campo eliminando el concepto de precios tope.","Acción Nacional proposes to adopt the following measures:Establish a periodic review of the guarantee prices of agricultural products, eliminating the concept of price ceilings.","703",NA
"Eliminar las alcabalas que de hecho existen contraviniendo la ley.","Eliminate the alcabalas that in fact exist in contravention of the law.","703",NA
"Suspender la revisión arbitraria de vehículos de carga salvo para la comprobación de la documentación correspondiente por violación a los reglamentos.","Suspend the arbitrary inspection of cargo vehicles except for the verification of the corresponding documentation for violation of the regulations.","402",NA
"Promover la creación de cooperativas de producción, transporte, almacenaje y comercialización de productos agropecuarios y pesqueros.","Promote the creation of cooperatives for the production, transportation, storage and marketing of agricultural and fishery products.","703",NA
"Hacer un esfuerzo para simplificar los trámites de apertura de nuevos negocios comerciales mediante la simplificación de controles y de requisitos fiscales.","Make an effort to simplify the procedures for opening new commercial businesses by simplifying controls and tax requirements.","402",NA
"Promover la construcción de puertos con equipo mecánico moderno, capaz de manejar contenedores","Promote the construction of ports with modern mechanical equipment capable of handling containers","411",NA
"y eliminar todo tipo de restricciones al tránsito de éstos por las carreteras nacionales.","and eliminate all types of restrictions on the transit of containers on national highways.","411",NA
"Fomentar la marina de cabotaje para lograr la reducción en los costos de transporte y abaratar así el proceso de intercambio de mercancía entre las distintas zonas del país.","To promote coastal shipping in order to reduce transportation costs and thus make the process of exchanging goods between different areas of the country less costly.","411",NA
"5.4 Política de Energéticos.","5.4 Energy Policy.",NA,NA
"Una política de energéticos sensata deberá prever las necesidades del los mexicanos del futuro y no sólo la convivencia de los gobernantes de hoy; es por ello que deben revisarse a fondo los planes que actualmente se han diseñado al respecto.","A sensible energy policy must foresee the needs of the Mexicans of the future and not only the coexistence of today's rulers; that is why the plans currently designed in this regard must be thoroughly reviewed.","411",NA
"Acción Nacional se propone en esta materia, implementar medidas, modificar reglas y adecuar la legislación a efecto de lograr lo siguiente:","Acción Nacional proposes to implement measures, modify rules and adapt legislation in order to achieve the following:","403",NA
"Levantar un inventario de recursos energéticos disponibles, con el propósito de trazar un programa relativo a la construcción de nuevas plantas de generación eléctrica,","To draw up an inventory of available energy resources, with the purpose of outlining a program related to the construction of new electricity generation plants,","411",NA
"en el cual se conceda prioridad a aquellas que utilicen fuentes renovables de energía, como lo son la hidráulica, la eólica, la geotermia, la solar y la marina.","in which priority is given to those that use renewable sources of energy, such as hydro, wind, geothermal, solar and marine.","501",NA
"Invertir recursos federales en la adquisición de tecnologia existente ya en otros países, en relación a estas fuentes renovables de energia,","To invest federal resources in the acquisition of technology already existing in other countries, in relation to these renewable energy sources,","501",NA
"y también para estimular el desarrollo de tecnologia prôpia en Universidades y Tecnológicos de nuestro pais.","and also to stimulate the development of own technology in Universities and Technological Universities of our country.","411",NA
"Eliminar estorbos burocráticos y legales, para crear incentivos para la instalación de equipos destinados a la recuperacién de calor de desperdicio que actualmente sepiercle.","Eliminate bureaucratic and legal hurdles to create incentives for the installation of waste heat recovery equipment that is currently being used for waste heat recovery.","402",NA
"Promover previa, reforma al artículo 28 constitucional, la participación ciudadana en el aprovechamiento de fuentes renovables de energía, eliminando todo aquello que estorbe o dificulte la investigación de recursos renovables y, la instalación de plantas destinadas a la generación de energía eléctrica que utilicen estas fuentes de energía.","Promote, prior to the reform of Article 28 of the Constitution, citizen participation in the use of renewable energy sources, eliminating everything that hinders or hinders the research of renewable resources and the installation of plants for the generation of electricity using these energy sources.","501",NA
"De acuerdo a esto, será libre el aprovechamiento de la energía solar, eólica y de biomasa, así como el acceso a fuentes renovables de tipo hidroeléctrico, de geotermia o marina, con el 'propósito de multiplicar el número de plantas de tamaño mediano o pequeño y quizá de tamaño grande, para satisfacer necesidades de comunidades enteras que se decidan a invertir en estos proyectos.","Accordingly, the use of solar, wind and biomass energy will be free, as well as access to hydroelectric, geothermal or marine renewable sources, with the 'purpose of multiplying the number of small and medium-sized plants, and perhaps large ones, to meet the needs of entire communities that decide to invest in these projects.","501",NA
"Se promoverá asi mismo la proliferación de proyectos individuales, en cooperativas o ere copropiedad en el campo energético en sustitución de plantas que utilizan recursos no renovables.","The proliferation of individual, cooperative or joint-ownership projects in the energy field will also be promoted to replace plants that use non-renewable resources.","411",NA
"Establecer una limitante a la plataforma de explotación petrolera, para que la extracción anual de hidrocarburos no exceda en ningún año de calendario a la sesentava parte de las reservas probadas de petróleo.","Establish a limit to the oil exploitation platform, so that the annual extraction of hydrocarbons does not exceed in any calendar year one-sixtieth of the proven oil reserves.","501",NA
"En esta forma, habremos de garantizar un plazo de sesenta años para dar lugar al desarrollo de nuevas fuentes de energía, antes de que se agoten las reservas que la Providencia puso en el subsuelode México.","In this way, we will have to guarantee a sixty-year term to give way to the development of new energy sources, before the reserves that Providence has placed in Mexico's subsoil are exhausted.","501",NA
"Modificar nuestra política de ventas al exterior para que se promueva la exportación de productos resultantes de la refinación y petroquímicas en lugar de la venta de petróleo crudo; esto nos dará un major margen economic  y disminuirá el desempleo.","Modify our foreign sales policy to promote the export of products resulting from refining and petrochemicals instead of crude oil sales; this will give us a better economic margin and reduce unemployment.","402",NA
"Desarrollar al máximo nuestra capacidad de generación de energía eléctrica base de geotermia.","To develop our geothermal-based electric power generation capacity to the maximum.","411",NA
"Adelantar estudio sobré el posible aprovechamiento de la energía magmática, ya que alcanzada ésta; se convierte en fuente renovable mediante la inyección de agua.","Advance study on the possible use of magmatic energy, since once it is reached, it becomes a renewable source through the injection of water.","501",NA
"Promover el desarrollo de digestores de desechos orgánicos como fuentes de energía (biomasa) que además de proporcionar gas metano para generación de electricidad, son elementos de prevención de contaminación ambiental.","Promote the development of organic waste digesters as sources of energy (biomass) that, in addition to providing methane gas for electricity generation, are elements of environmental pollution prevention.","501",NA
"Contando el país con extensas zonas de fuertes vientos, es imperativo el aprovechamiento de la energía eólica que podría proporcionarnos buenos volúmenes de energía eléctrica para la distribución local.","Since the country has extensive areas with strong winds, it is imperative to take advantage of wind energy, which could provide us with good volumes of electricity for local distribution.","501",NA
"Se limitarán por su baja eficiencia, las centrales termoeléctricas a base de hidrocarburos, aprovechando su capacidad para las ""horas pico"" y se alentará su conversión a ciclo combinado para mejorar su eficiencia.","Due to their low efficiency, hydrocarbon-based thermoelectric plants will be limited, taking advantage of their ""peak hour"" capacity, and their conversion to combined cycle will be encouraged to improve their efficiency.","411",NA
"Por ser una fuente de alto riesgo y, eventualmente peligroso contaminante, Acción Nacional no promoverá por ahora, el desarrollo de programas nucleoeléctricos, considerando su baja eficiencia y nuestra alta dependencia del extranjero, tanto en tecnología como en combustible.","Because it is a high-risk and eventually dangerous polluting source, Acción Nacional will not promote, for now, the development of nuclear power programs, considering its low efficiency and our high dependence on foreign countries, both in terms of technology and fuel.","501",NA
"No obstante lo anterior, se estará pendiente de los avances tecnológios en el futuro, para usar esa fuente de energía en caso de que se haga seguro su empleo:","Notwithstanding the above, future technological advances will be monitored in order to use this source of energy in the event that its use becomes safe:","411",NA
"Se intensificarán programas de educación al consumidor tendientes al ahorro de energía.","Consumer education programs aimed at saving energy will be intensified.","501",NA
"5.5.- Comercio Exterior","5.5.- Foreign Trade",NA,NA
"Un México fuerte que ofrezca niveles crecientes de vida a sus ciudadanos y los prepare para los retos del siglo XXI no puede vivir desvinculado de las fuerzas económicas nacionales que lo rodean.","A strong Mexico that offers rising standards of living to its citizens and prepares them for the challenges of the 21st century cannot live detached from the national economic forces that surround it.","407",NA
"La capacidad de hacer frente a nuestros compromisos externos mediante una producción exportable supone condiciones de apertura efectiva en los mercados extranjeros a los: que se destina.","The ability to meet our external commitments through exportable production presupposes conditions of effective openness in the foreign markets to which it is destined.","407",NA
"La Integración Latinoamericana de la que México es iniembro fundador brinda a nuestros productos preferencias en tanto que nosotros extendemos trato similar a los artículos dé esa zona.","The Latin American Integration of which Mexico is a founding member provides our products with preferences while we extend similar treatment to goods from that zone.","407",NA
"Hay que dar lugar especial en nuestros intercambios a la América Latina, con particular atención a los países Cen troamericanos y del Caribe.","Latin America should be given a special place in our exchanges, with particular attention to the countries of Central America and the Caribbean.","107",NA
"En las relaciones con los demás países y bloques, hay que mantener posiciones firmes que promuevan el nuevo orden, económico internacional aprobado por Naciones Unidas, coordinando nuestra actuación en organismos internacionales con países de intereses análogos a los nuestros para respaldar así los planteamientos que en el terreno bilateral hacemos a nuestros principales clientes y proveedores.","In our relations with other countries and blocs, we must maintain firm positions that promote the new international economic order approved by the United Nations, coordinating our actions in international organizations with countries with interests similar to ours in order to support the proposals we make bilaterally to our main customers and suppliers.","107",NA
"5.5.1.- GATT","5.5.1.- GATT",NA,NA
"El ingreso al GATT, que sin duda implica riesgos, puede ser también aprovechado para el fortalecimiento interno de nuestra planta industrial y para pasar de negociaciones bilaterales a negociaciones multilaterales en materia de importaciones y exportaciones, lo que no deja de constituir una ventaja potencial que debernos saber aprovechar.","The entry into GATT, which undoubtedly entails risks, can also be used to strengthen our industrial plant internally and to move from bilateral negotiations to multilateral negotiations on imports and exports, which is a potential advantage that we should know how to take advantage of.","407",NA
"5.6.- Comunicaciones y Transportes","5.6.- Communications and Transportation",NA,NA
"Ningún país puede pasar del subdesarrollo al desarrollo borles no cuenta con una red de comunicaciones y transportes adecuada y suficiente.","No country can move from underdevelopment to development without an adequate and sufficient communications and transportation network.","411",NA
"Acción Nacional propone:Modernizar y hacer eficiente el sistema ferroviario, dándole prioridad sobre otros medios más caros y con mayor costo social.","Acción Nacional proposes: To modernize and make the railroad system efficient, giving it priority over other more expensive and socially costly means of transportation.","411",NA
"Hacer un estudio realista para optimizar la inversión v mejorar los servicios de la transportación aérea y crear una red de líneas alimentadoras.","Conduct a realistic study to optimize investment to improve air transportation services and create a network of feeder lines.","411",NA
"Construir los caminos vecinales y carreteras que resulten necesarios","Constructing the necessary local roads and highways after","411",NA
"después de hacer una consulta democrática con las comunidades para que, los que se decida construir, respondan efectivamente a las necesidades de las mayorías.","a democratic consultation with the communities so that those that are decided to be built effectively respond to the needs of the majority of the population.","202",NA
"Capacitar adecuadamente a todo el personal que labore en las áreas de comunicación y establecer un sistema adecuado de estímulos y sanciones para obtener eficiencia en dichas áreas.","Adequately train all personnel working in the communication areas and establish an adequate system of incentives and sanctions to achieve efficiency in these areas.","411",NA
"Ampliar las redes telefónicas y telegráficas a fin de satisfacer las necesidades de todas las comunidades.","Expand telephone and telegraph networks to meet the needs of all communities.","411",NA
"Mejorar el transporte urbano a fin de dar el servicio que satisfaga las necesidades de los usuarios.","Improve urban transportation in order to provide a service that meets the needs of users.","411",NA
"Reestructurar, modernizar y ordenar la transportación marítima.","Restructure, modernize and organize maritime transportation.","411",NA
"5.7.- Cooperativas","5.7.- Cooperatives",NA,NA
"Acción Nacional no pretende imponer criterios sobre el•cooperativismo porque considera que esta doctrina debe ser respetada en su operatividad y en sus principios propios.","Acción Nacional does not intend to impose criteria on cooperativism because it considers that this doctrine must be respected in its operation and in its own principles.","202",NA
"Un gobierno de Acción Nacional seguirá las siguientes políticas en esta materia:Respetará estrictamente los principios del movimiento cooperativo mundial así como la independencia de las cooperativas ya existentes y las que se creen en el futuro.","A National Action government will follow the following policies in this area:Strictly respect the principles of the global cooperative movement as well as the independence of existing and future cooperatives.","202",NA
"Suprimirá trabas burocráticas y controles sobre las cooperativas y les permitirá su pleno autogobierno y funciona miento.","It will remove bureaucratic hurdles and controls on cooperatives and allow them full self-governance and operation.","202",NA
"Reconocerá a las Cajas Populares como sociedades cooperativas con personalidad jurídica y las apoyará como unaalternativa de crédito y financiamiento popular, democático ysin ánimo de lucro crático y sin ánimo de lucro.","It will recognize the Cajas Populares as cooperative societies with legal personality and will support them as a democratic, non-profit, non-profit, democratic, popular credit and financing alternative.","202",NA
"Fomentará la creación de más y mejor organizadas cooperativas de servicios, transporte, comercialización, consumo y producción, como un medio de incrementar la eficacia productiva de los mexicanos y su espíritu de ayuda y solidaridad.","It will encourage the creation of more and better organized service, transportation, marketing, consumption and production cooperatives as a means of increasing the productive efficiency of Mexicans and their spirit of help and solidarity.","410",NA
"5.8.-Turismo","5.8.-Tourism",NA,NA
