"text","text_en","cmp_code","eu_code"
"Acercar los servicios esenciales de atención de la salud a las mujeres, introduciendo profesionales sanitarios comunitarios y clínicas móviles.","Bring essential health care services closer to women by introducing community health professionals and mobile clinics.","503",NA
"Programa para penalizar y prevenir la violencia obstétrica","Program to criminalize and prevent obstetric violence","503",NA
"Disminución del porcentaje de embarazo adolescente.","Decrease in the percentage of teenage pregnancy.","503",NA
"Porcentaje de incremento de sentencias por alimentos y cumplimiento.","Percentage increase in the number of maintenance and compliance judgments.","503",NA
"Despenalización del aborto en caso de violación sexual","Decriminalization of abortion in cases of rape","604",NA
"Procesos ejecutivos para el oportuno acceso de justicia en casos de reconocimiento de procesos de alimentos y paternidad.","Enforcement proceedings for timely access to justice in cases of recognition of maintenance and paternity proceedings.","503",NA
"Congelar automáticamente las cuentas bancarias de quienes tengan deudas por alimentos, transfiriendo los pagos comprometidos a las madres o cuidadores.","Automatically freeze the bank accounts of those with child support debts, transferring committed payments to mothers or caregivers.","503",NA
"Programa para combatir el incremento del embarazo adolescente en coordinación con los sectores de Salud y Educación, que mejore la formación educativa, la generación de empleo decente y la autoestima de las mujeres jóvenes.","Program to combat the increase in teenage pregnancy in coordination with the health and education sectors, to improve educational training, the generation of decent employment and the self-esteem of young women.","503",NA
"Garantizar el acceso a la salud sexual y reproductiva diferenciada y gratuita.","Guarantee access to free and differentiated sexual and reproductive health care.","503",NA
"Incremento gradual de licencia hasta las 18 semanas y homologación de licencias de maternidad y paternidad.","Gradual increase of leave up to 18 weeks and homologation of maternity and paternity leave.","503",NA
"Regulación del trabajo sexual, lucha contra el proxenetismo y la trata de personas.","Regulation of sex work, fight against pimping and human trafficking.","503",NA
"DIVERSIDAD","DIVERSITY","H",NA
"Ausencia de legislación que proteja y garantice los derechos de las personas lesbianas, gais, transgénero, transexuales, travestis, bisexuales e intersexuales.","Lack of legislation to protect and guarantee the rights of lesbian, gay, transgender, transsexual, transvestite, bisexual and intersex persons.","503",NA
"Proteger y garantizar los derechos de las personas lesbianas, gais, transgénero, transexuales, bisexuales e intersexuales.","Protect and guarantee the rights of lesbian, gay, transgender, transsexual, bisexual and intersex persons.","503",NA
"Constitución Política del Perú que incluya en su artículo 2 orientación sexual e identidad de género dentro de las variables de discriminación","Political Constitution of Peru that includes sexual orientation and gender identity in its article 2 within the variables of discrimination","204",NA
"Ley de Matrimonio Igualitario","Law of Equal Marriage Law of","604",NA
"Ley de Unión de Hecho","De Facto Union","604",NA
"Ley de Identidad de Género","Law of Gender Identity Law","503",NA
"Ley para prevenir, sancionar y erradicar la Discriminación y los Crímenes de Odio hacia personas LGTBI","Law to Prevent, Punish and Eradicate Discrimination and Hate Crimes against LGTBI persons.","503",NA
"Reforma constitucional que incluye orientación sexual e identidad de género en el artículo 2","Constitutional reform that includes sexual orientation and gender identity in Article 2","503",NA
"50% de parejas conformadas por lesbianas o gais son reconocidas como matrimonio","50% of lesbian or gay couples are recognized as marriages","604",NA
"50% de parejas conformadas por lesbianas o gais son reconocidas como uniones de hecho","50% of lesbian or gay couples are recognized as de facto unions","604",NA
"100% de personas trans (transexuales, transgénero y travestis) tienen un DNI que reconoce su identidad","100% of transsexual, transgender and transvestite persons have a DNI that recognizes their identity","503",NA
"Disminuyen las denuncias sobre discriminación por orientación sexual e identidad de género.","Decrease in the number of complaints of discrimination based on sexual orientation and gender identity.","503",NA
"Disminuyen asesinatos originados por discriminación por orientación sexual e identidad de género.","Decrease in murders caused by discrimination based on sexual orientation and gender identity.","503",NA
"Se reconoce la orientación sexual e identidad de género como variables de discriminación en la Constitución Peruana","Sexual orientation and gender identity are recognized as variables of discrimination in the Peruvian Constitution","204",NA
"Ausencia de políticas públicas que permitan un mejor acceso de las personas lesbianas, gais, transgénero, transexuales, travestis, bisexuales e intersexuales a los servicios del Estado","Absence of public policies that allow better access of lesbian, gay, transgender, transsexual, transvestite, bisexual and intersex persons to State services","503",NA
"Creación de un Consejo Nacional para la Ciudadanía LGBTI","Creation of a National Council for LGBTI Citizenship","503",NA
"Diseño e implementación de las políticas públicas nacionales específicas para la población LGBTI.","Design and implementation of specific national public policies for the LGBTI population.","503",NA
"Creación de un registro oficial de crímenes de odio.","Creation of an official hate crimes registry.","503",NA
"Impulso de investigación académica sobre temas de la diversidad sexual y de género.","Promoting academic research on sexual and gender diversity issues.","503",NA
"Promoción de actividades culturales específicas en beneficio de la población LGBTI","Promotion of specific cultural activities for the benefit of the LGBTI population","503",NA
"Establecimiento de sanciones y responsabilidad política por el no cumplimiento de las políticas públicas nacionales específicas para la población LGBTI","Establishment of sanctions and political responsibility for non-compliance with national public policies specific to the LGBTI population","503",NA
"Fiscalización de instituciones del Estado incorporen variables de orientación sexual e identidad de género en el diseño de sus actividades.","Oversight of State institutions that incorporate sexual orientation and gender identity variables in the design of their activities.","503",NA
"Se establecen y cumplen metas de políticas públicas nacionales específicas para la población LGBTI","National public policy goals specific to the LGBTI population are established and met","503",NA
"Se publica registro oficial de crímenes de odio.","Official registry of hate crimes is published.","503",NA
"Incrementa la producción académica mediante publicaciones y eventos de difusión.","Increases academic production through publications and dissemination events.","503",NA
"Incrementan actividades culturales específicas en beneficio de la población LGBTI.","Specific cultural activities for the benefit of the LGBTI population are increased.","503",NA
"100% de políticas públicas nacionales específicas para la población LGBTI se hacen efectivas.","100% of national public policies specific to the LGBTI population are made effective.","503",NA
"Disminuye la difusión de expresiones homofóbicas en medios de comunicación","Decrease in homophobic expressions in the media","503",NA
"100% de instituciones públicas incorporan variables de orientación sexual e identidad de género en el diseño de sus actividades.","100% of public institutions incorporate sexual orientation and gender identity variables in the design of their activities.","503",NA
"100% de instituciones educativas públicas han sido capacitadas en “Respeto a la Diversidad Sexual y de Género”","100% of public educational institutions have been trained in ""Respect for Sexual and Gender Diversity"".","503",NA
"100% de las Facultades de Educación han incluido en su currículo el tema de “Respeto a la Diversidad Sexual y de Género”.","100% of the Faculties of Education have included the topic ""Respect for Sexual and Gender Diversity"" in their curricula.","503",NA
"100% de docentes y autoridades educativas han sido capacitadas en “Respeto a la Diversidad Sexual y de Género”.","100% of teachers and educational authorities have been trained in ""Respect for Sexual and Gender Diversity"".","503",NA
"100% de operadores de salud capacitados en atención a personas LGBTI.","100% of health operators trained in care for LGBTI people.","503",NA
"100% de centros de salud capacitados en la aplicación de protocolos de atención en salud a personas LGBTI.","100% of health centers trained in the application of health care protocols for LGBTI people.","503",NA
"100% de centros de salud consideran data sobre orientación sexual e identidad de género en historias clínicas.","100% of health centers consider data on sexual orientation and gender identity in medical records.","503",NA
"Disminuyen casos de discriminación por orientación sexual e identidad de género en el ámbito laboral.","Cases of discrimination based on sexual orientation and gender identity in the workplace are decreasing.","503",NA
"Incremento del acceso al empleo de personas LGBTI, enfatizado en población transgénero.","Increased access to employment for LGBTI people, with emphasis on the transgender population.","503",NA
"Incremento de personas LGBTI capacitadas profesionalmente.","Increase in the number of LGBTI people professionally trained.","503",NA
"100% de operadores de justicia capacitados en atención a la diversidad sexual y de género.","100% of justice operators trained in attention to sexual and gender diversity.","503",NA
"100% de centros de justicia capacitados en la aplicación de protocolos de atención en caso de discriminación o violencia hacia personas LGTBI.","100% of justice centers trained in the application of protocols for attention in cases of discrimination or violence against LGTBI persons.","503",NA
"La población LGBTI se encuentra incluida en el Plan Nacional de Derechos Humanos 2016-2021","The LGBTI population is included in the National Human Rights Plan 2016-2021","503",NA
"Debilidad del tejido social comunitario, dificultad en la convivencia y ausencia de respeto hacia las personas LGTBI","Weakness of the community social fabric, difficulty in coexistence and absence of respect towards LGTBI persons","503",NA
"Fortalecimiento del tejido social comunitario, facilitación de la convivencia e implementación de medidas que generen respeto hacia las personas LGTBI","Strengthening of the community social fabric, facilitation of coexistence and implementation of measures that generate respect towards LGTBI persons","503",NA
"Establecer días nacionales de reconocimiento y memoria de la comunidad LGBTI como el Día Nacional del Orgullo LGBTI (28 de junio) y el Día Nacional contra los Crímenes de Odio (31 de mayo).","Establish national days of recognition and memory of the LGBTI community such as the National LGBTI Pride Day (June 28) and the National Day against Hate Crimes (May 31).","503",NA
"Promover la memoria histórica de la población LGBTI con el fin de visibilizar los aportes en la construcción de la nación.","Promote the historical memory of the LGBTI population in order to make visible their contributions to nation building.","503",NA
"Emitir disculpas públicas por parte del Estado peruano a todas las víctimas de los crímenes de odio, a sus familiares y a la población LGBTI en general, por todos los años de negligencia y abandono.","Issue public apologies by the Peruvian State to all victims of hate crimes, their families and the LGBTI population in general, for all the years of neglect and abandonment.","503",NA
"Se reconocen como días de interés nacional el Día Nacional del Orgullo LGBTI (28 de junio) y el Día Nacional contra los Crímenes de Odio (31 de mayo).","National LGBTI Pride Day (June 28) and National Day against Hate Crimes (May 31) are recognized as days of national interest.","503",NA
"Se desarrollan actividades como ferias, publicaciones de libros, entre otros, que promueven la memoria histórica de la población LGBTI.","Activities such as fairs, book publications, among others, are developed to promote the historical memory of the LGBTI population.","503",NA
"El Estado peruano reconoce y pide disculpas públicas a todas las víctimas de los crímenes de odio, a sus familiares y a la población LGBTI en general, por todos los años de negligencia y abandono.","The Peruvian State recognizes and publicly apologizes to all victims of hate crimes, their families and the LGBTI population in general, for all the years of neglect and abandonment.","503",NA
"SALUD","HEALTH","H",NA
"Falta de organización, articulación e integración del sistema de salud","Lack of organization, articulation and integration of the health system","504",NA
"Atención universal, integral y de calidad a las necesidades de salud","Universal, comprehensive and quality attention to health needs","504",NA
"Territorializar la atención de la salud desde la implementación de Redes Integradas de Salud abiertas a toda la población sin ningún trámite, para lo que es necesario conformar equipos de salud con población adscrita, determinar una respuesta pública de servicios obligatoria, adecuada capacidad resolutiva y de apoyo al diagnóstico.","Territorialization of health care through the implementation of Integrated Health Networks open to the entire population without any formalities, for which it is necessary to form health teams with an assigned population, determine a mandatory public response of services, adequate resolution capacity and diagnostic support.","504",NA
"Aplicando el enfoque de médicos y equipos de salud de familia por cada 1500 habitantes.","Applying the approach of physicians and family health teams per 1,500 inhabitants.","504",NA
"Fortalecer y convertir el SIS en Seguro Público de Salud como brazo de extensión de la atención integral en salud, tal como establece el Acuerdo Nacional en Salud.","Strengthen and convert the SIS into Public Health Insurance as an extension arm of comprehensive health care, as established in the National Health Agreement.","504",NA
"Lograr la protección en salud de todos los peruanos y peruanas que no cuentan con protección pública en salud, estando aseguradas al sistema público.","To achieve health protection for all Peruvians who do not have public health protection and are insured in the public system.","504",NA
"Establecer el diseño financiero, administrativo y funcional para garantizar la atención igualitaria basada en el Plan Nacional de Atención Integral de la Salud para todos los peruanos, en cumplimiento de lo establecido en el Acuerdo Nacional por la Salud.","Establish the financial, administrative and functional design to guarantee equal attention based on the National Plan of Integral Health Care for all Peruvians, in compliance with the provisions of the National Agreement for Health.","504",NA
"Implementar la universalización de la atención de salud abierta a todos los peruanos estableciendo franjas de atención garantizadas que se inician con:","Implement the universalization of health care open to all Peruvians by establishing guaranteed care bands that begin with:","504",NA
"1) primer nivel de atención y la determinación de su respuesta pública de servicios,","1) first level of care and the determination of its public response of services,","504",NA
"2) atención de emergencias vía conformación de un Sistema Nacional de Atención y Regulación de Emergencias,","2) emergency care through the creation of a National System of Care and Regulation of Emergencies,","504",NA
"3) atención de enfermedades de alto costo de mayor incidencia en el país a partir del FISSAL para los que no cuentan con ESSALUD.","3) care of high-cost diseases of greater incidence in the country from the FISSAL for those who do not have ESSALUD.","504",NA
"Inmediata anulación de todo cobro en el sistema público de salud, desactivando los Recursos Directamente Recaudados como fuente de financiamiento del sistema de salud.","Immediate cancellation of all charges in the public health system, deactivating the Directly Collected Resources as a source of financing for the health system.","504",NA
"Cierre de las “Clínicas Hospitalarias” y demás distorsiones que se mantienen en el sistema, que impulsan la discriminación y el mal uso de recursos.","Closure of ""Hospital Clinics"" and other distortions that remain in the system, leading to discrimination and misuse of resources.","504",NA
"50% del Sistema Nacional de Salud ha Conformado Redes Integradas","50% of the National Health System has formed Integrated Networks","504",NA
"SIS se ha convertido legalmente en un Seguro Público con todos las responsabilidades derivada de ello","SIS has legally become a Public Insurance with all the responsibilities derived from it","504",NA
"100% de la población peruana cuenta con protección del sistema público","100% of the Peruvian population is protected by the public system The","504",NA
"Se cuenta con el Plan Nacional de Atención en Salud homologado en el sistema de salud","National Health Care Plan has been standardized in the health system","504",NA
"100% de la población cuenta con garantía de atención de las franjas de salud","100% of the population has guaranteed care in the health fringes","504",NA
"Se reduce en un 50% el pago directo en el sistema público de en salud","Direct payment in the public health system is reduced by 50%","504",NA
"Deficiente gestión y uso de recursos en el sistema público de salud","Deficient management and use of resources in the public health system","504",NA
"Modernización, desburocratización de la gestión, simplificación de trámites para la prioridad del derecho a la atención","Modernization, Modernization,debureaucratization of management, simplification of procedures to prioritize the right to care","504",NA
"Interconexión informática del sistema de salud para contar con información homogénea en tiempo real, adecuando la labor administrativa del sistema de salud a los avances que las tecnologías de la información y del Gobierno Electrónico, creando el Sistema Nacional de Información en Salud.","Computer interconnection of the health system to have homogeneous information in real time, adapting the administrative work of the health system to the advances in information technology and electronic government, creating the National Health Information System.","504",NA
"Modernizar la gestión de los servicios de salud, sobre la base de la Escuela Nacional de Salud Pública y la formación de gestores de la salud con el concurso de todas las profesiones de la salud y otras profesiones, en la responsabilidad de la conducción y gestión del sistema.","To modernize the management of health services, based on the National School of Public Health and the training of health managers with the participation of all health professions and other professions, in the responsibility of leading and managing the system.","504",NA
"Identificación y reversión de procesos y procedimientos innecesarios y burocráticos para proceder a su anulación en beneficio de la atención oportuna y de calidad en todo el sistema público de salud;","Identification and reversal of unnecessary and bureaucratic processes and procedures in order to proceed to their cancellation for the benefit of timely and quality care throughout the public health system;","504",NA
"así como la homologación e integración de procesos y trámites en el sistema público de salud.","as well as the standardization and integration of processes and procedures in the public health system.","504",NA
"100% de las ciudades de más de 200 mil habitantes incorporadas en el Sistema Nacional de Información Salud","100% of cities with more than 200,000 inhabitants incorporated into the National Health Information System","504",NA
"10% de los Directores de los servicios de salud cuentan con formación e Gestión en Salud","10% of health service directors are trained in health management","504",NA
"Se ha aminorado en un 70% las trabas identificadas para la atención de salud; avance del 50% en la homologación de procesos en el sistema","70% of the obstacles identified for health care have been reduced; 50% progress in the standardization of processes in the system","504",NA
"Insuficiente financiamiento para la atención de las necesidades de salud de la población peruana","Insufficient financing to meet the health needs of the Peruvian population","504",NA
"Incrementar el financiamiento del sistema público de salud para contar con un per cápita superior al promedio latinoamericano","Increase the financing of the public health system in order to have a per capita amount above the Latin American average","504",NA
"Homologar el monto per cápita destinado a la salud en los sistemas públicos de protección en salud (aseguramiento) con garantía de disponibilidad de los montos per cápita necesarios para la atención integral en el SIS y ESSALUD), en cumplimiento del marco legal creado y por crearse para tal fin.","Standardize the per capita amount allocated to health in the public health protection systems (insurance) with a guarantee of availability of the per capita amounts necessary for comprehensive care in the SIS and ESSALUD, in compliance with the legal framework created and to be created for this purpose.","504",NA
"Incrementar el financiamiento del sistema público de salud para avanzar hacia la meta de la atención integral, teniendo como mínimo el 6% del PBI de recursos públicos dedicado a salud, en una combinación de fuentes de financiamiento contributivas y fiscales tanto para el SIS como para ESSALUD.","Increase the financing of the public health system to move towards the goal of comprehensive care, having at least 6% of GDP of public resources dedicated to health, in a combination of contributory and fiscal sources of financing for both the SIS and ESSALUD.","504",NA
"Recuperar y sincerar el financiamiento de ESSALUD para el cumplimiento de sus obligaciones de atención integral utilizando la incidencia política y legal,","Recovering and sincerely recovering ESSALUD's financing for the fulfillment of its comprehensive care obligations using political and legal advocacy,","504",NA
"así como exigiendo mejoras drásticas en la calidad de atención, el trato digno y oportuno y la conformación de espacios de participación vinculante.","as well as demanding drastic improvements in the quality of care, dignified and timely treatment, and the creation of spaces for binding participation.","504",NA
"Se ha homologado el monto per cápita del SIS con ESSALUD en el marco de una tendencia creciente de ambos sistemas","The per capita amount of the SIS has been equalized with ESSALUD in the framework of a growing trend of both systems","504",NA
"6% del PBI destinado a la protección pública en salud, promoviendo formas innovadoras de recaudación","6% of the GDP allocated to public health protection,","504",NA
"50% de los recortes sufridos por ESSALUD son recuperados","50% of the cuts suffered by ESSALUD are recovered","504",NA
"Desregulación de la respuesta privada de los servicios de salud y del acceso a medicamentos","Deregulation of private response to health services and access to medicines","505",NA
"Regular la actividad privada en la atención de salud así como el acceso y los precios en relación al acceso a medicamentos","Regulate private activity in health care as well as access and prices in relation to access to medicines","505",NA
"Supervisar y sancionar los abusos que se cometen en el sistema privado de salud y en el sistema privado de seguros de salud","Supervise and sanction abuses committed in the private health system and in the private health insurance system.","505",NA
"Cumplimiento en sistema privado de salud de los estándares legales establecidos","Compliance of the private health system with established legal standards","505",NA
"Compra regulada de servicios desde el sistema público al sistema privado de salud","Regulated purchase of services from the public system to the private health system","505",NA
"Políticas para regular los precios de los medicamentos desde la capacidad del Estado de ser el principal comprador de medicamentos y desde otros mecanismos como los establecidos por la CAN y la OMC,","Policies to regulate drug prices based on the State's capacity to be the main purchaser of drugs and on other mechanisms such as those established by the CAN and the WTO,","504",NA
"así como desde medidas que enfrenten los monopolios indebidos que ciertos tratados internacionales generan elevando precios de medicamentos.","as well as measures to confront the undue monopolies that certain international treaties generate by raising drug prices.","504",NA
