"text","text_en","cmp_code","eu_code"
"Priorizar la inversión pública (en el marco del Sistema Nacional de Inversión Pública – SNIP).","Prioritize public investment (within the framework of the National Public Investment System - SNIP).","408",NA
"Diseño e implementación de un clasificador presupuestal de género para dar seguimiento al gasto y la inversión pública efectiva que atienda al cierre de brechas.","Design and implementation of a gender budget classifier to track spending and effective public investment that addresses the closing of gaps.","503",NA
"Estimación de la Cuenta Satélite de Trabajo Doméstico no Remunerado TDNR ya reglamentada por el Estado Peruano","Estimate of the Unpaid Domestic Work Satellite Account TDNR already regulated by the Peruvian State","503",NA
"Solo el 29% de empresas tienen entre sus propietarios a mujeres.","Only 29% of companies are owned by women.","503",NA
"Y sólo el 29,3% de los cargos directivos de las empresas en el Perú son ocupadas por mujeres.","And only 29.3% of senior management positions in Peruvian companies are held by women.","503",NA
"Diversificación Productiva para la Autonomía Económica de las mujeres y el Desarrollo Sostenible y Equitativo","Productive Diversification for Women's Economic Autonomy and Sustainable and Equitable Development","503",NA
"Inserción de mujeres a actividades y/o profesiones masculinizadas o de presencia mayoritaria masculina.","Insertion of women into male-dominated or male-dominated activities and/or professions.","503",NA
"Programa Alfabetización Digital y Financiera para mujeres insertadas en PYMES como mecanismo de incremento de la productividad para reducir las barreras de formalización y acceso a crédito y activos.","Digital and Financial Literacy Program for women in SMEs as a mechanism to increase productivity and reduce barriers to formalization and access to credit and assets.","503",NA
"Promoción de instituciones financieras inclusivas, como cooperativas de crédito y bancos de desarrollo local y comunitarios, regulados a partir de subvenciones para garantizar que sean accesibles a las mujeres en situación de pobreza y a las microempresas","Promotion of inclusive financial institutions, such as credit unions and local and community development banks, regulated on the basis of subsidies to ensure that they are accessible to poor women and micro-enterprises","503",NA
"Bajo nivel remunerativo de trabajadoras y trabajadores,","Low level of remuneration of workers,","701",NA
"alto nivel de trabajo precario e informal y desigualdad en el empleo,","high level of precarious and informal work and employment inequality,","701",NA
"importantes sectores de trabajadores que no cuentan con seguridad social de calidad,","important sectors of workers who do not have access to quality social security,","504",NA
"y grave afectación a derechos laborales de trabajadores del estado","and serious impact on state workers' labor rights","701",NA
"1. Incremento real y sostenido de las remuneraciones","1. Real and sustained increase in salaries.","701",NA
"2. Empleo digno y de calidad con igualdad de oportunidades","2. Decent and quality employment with equal opportunities.","701",NA
"3. Universalización de la seguridad social","3. Universalization of social security","504",NA
"4. Pleno respeto de derechos laborales de trabajadores el Estado","4. Full respect for the labor rights of state workers.","701",NA
"Incremento de empleo digno en sectores que generan más puestos de trabajo como agricultura, pesca, manufactura, turismo, comercio y servicios conexos.","Increased decent employment in sectors that generate more jobs such as agriculture, fishing, manufacturing, tourism, trade and related services.","701",NA
"Mayor acceso a créditos en mejores condiciones y menores tasas de interés.","Increased access to credit with better conditions and lower interest rates.","402",NA
"Mayor reactivación de inversión de infraestructura sobre todo en regiones.","Greater reactivation of infrastructure investment, especially in the regions.","411",NA
"Incremento de remuneraciones mínimas y remuneraciones promedio nacionales.","Increase in minimum salaries and national average salaries.","412",NA
"Incremento inmediato de RMV a S/. 1,000","Immediate increase of the RMV to S/. 1,000","412",NA
"Aprobación a nivel legal de fórmula de incremento periódico de RMV según acuerdo de Consejo Nacional de Trabajo y buscando alcanzar la cuantía de la canasta básica familiar.","Approval at the legal level of the formula for the periodic increase of the RMV according to the agreement of the National Labor Council and seeking to reach the amount of the basic family basket.","412",NA
"Incremento de remuneraciones promedio de trabajadores en todos los sectores.","Increase in the average compensation of workers in all sectors.","412",NA
"Inversión en fomento de capacidades laborales y formación para el empleo como parte de educación escolar y en las empresas.","Investment in job skills development and employment training as part of school and in-company education.","411",NA
"Inversión en formación laboral juvenil con derechos laborales así como en formación continua.","Investment in youth job training with labor rights as well as in continuing education.","706",NA
"Ampliación de la negociación colectiva a nivel nacional en particular por rama de actividad.","Expansion of collective bargaining at the national level, particularly by branch of activity.","701",NA
"Escala progresiva de impuesto a la renta según nivel de remuneraciones.","Progressive income tax scale according to remuneration level.","412",NA
"Mejorar sistema de deducciones por gastos de trabajadores y sus familias.","Improve the system of deductions for expenses of workers and their families.","504",NA
"Incremento de alcance de capacidades sancionadoras (administrativas y penales) por incumplimiento de pago (retenciones indebidas) de remuneraciones y beneficios de los trabajadores.","Increase in the scope of sanctioning capacities (administrative and criminal) for non-payment (undue withholdings) of workers' salaries and benefits.","701",NA
"Incremento de la contratación permanente en puestos de trabajo de calidad,","Increase in permanent hiring in quality jobs,","701",NA
"con seguridad social y mejores ingresos","with social security and better income","504",NA
"Reducción de despidos arbitrarios y ceses colectivos injustificados.","Reduction of arbitrary layoffs and unjustified collective dismissals.","701",NA
"Fortalecimiento de organizaciones sindicales.","Strengthening of trade union organizations.","701",NA
"Incremento de las negociaciones colectivas centralizadas (rama de actividad y por grupo de empresa)","Increase in centralized collective bargaining (branch of activity and by company group)","701",NA
"Eliminación de tratamiento discriminatorio entre trabajadores contratados de manera directa y trabajadores tercerizados o intermediados.","Elimination of discriminatory treatment between directly hired workers and outsourced or intermediated workers.","701",NA
"Mayores niveles de igualdad en ingresos y acceso a empleos de calidad reduciendo diferencias por género.","Greater levels of income equality and access to quality jobs, reducing gender differences.","503",NA
"Implementación de acciones afirmativas y planes de conciliación entre vida laboral y familiar.","Implementation of affirmative actions and work-life balance plans.","701",NA
"Implementación efectiva de igualdad de derechos en sectores laborales como de exportación no tradicional, trabajadoras del hogar, agro exportación, estibadores terrestres, entre otros.","Effective implementation of equal rights in labor sectors such as non-traditional exports, domestic workers, agro-exports, land stevedores, among others.","503",NA
"Reestructuración, modernización y fortalecimiento de Ministerio de Trabajo y creación de vice ministerio de Seguridad Social.","Restructuring, modernization and strengthening of the Ministry of Labor and creation of a Vice Ministry of Social Security.","504",NA
"Incremento de presupuesto de sector trabajo así como de SUNAFIL, ampliando competencias para ejercer eficazmente sus funciones.","Increase in the budget of the labor sector as well as SUNAFIL, expanding competencies to effectively perform its functions.","701",NA
"Reforma Integral del Sistema de Seguridad Social (pensiones, salud y protección frente a accidentes de trabajo):","Comprehensive reform of the Social Security System (pensions, health and protection against work accidents):","504",NA
"Establecimiento de pensiones universales no contributivas para todos los adultos mayores.","Establishment of universal non-contributory pensions for all senior citizens.","504",NA
"Incremento de cobertura y calidad de acceso a protección en salud (Ver eje de salud)","Increased coverage and quality of access to health protection (See health axis)","504",NA
"Reforma y fortalecimiento del sistema público de pensiones:","Reform and strengthening of the public pension system:","504",NA
"Mejora de cuantía de pensiones públicas contributivas y fortalecimiento institucional.","Improvement of the amount of contributory public pensions and institutional strengthening.","504",NA
"Implementación de financiamiento tripartito","Implementation of tripartite financing","504",NA
"Incremento de cobertura a cargo de sistema redistributivo y con financiamiento colectivo de carácter público.","Increased coverage through a redistributive system and collective public financing.","504",NA
"Sistema complementario y voluntario de pensiones privadas:","Complementary and voluntary private pension system:","505",NA
"Mayor competencia (permitiendo participación de Bancos y cajas) y menor costo (comisión sobre rentabilidad).","Greater competition (allowing participation of banks and savings banks) and lower cost (commission on profitability).","504",NA
"Reformar seguro complementario por trabajo de riesgos con el objeto de crear un sistema nacional de riesgos de trabajo.","Reform complementary insurance for risky work in order to create a national system for occupational risks.","701",NA
"Mejorar sistema de seguridad y salud en el trabajo.","Improve the occupational health and safety system.","504",NA
"Implementación de recomendaciones de comisión de expertos de OIT en materia de seguridad social.","Implementation of the recommendations of the ILO Commission of Experts on Social Security.","504",NA
"Incorporar enfoque de género.","Incorporate a gender focus.","503",NA
"Creación de Superintendencia de la Seguridad Social y de Institución Nacional de Pensiones","Creation of the Superintendence of Social Security and the National Pension Institution","504",NA
"Evaluación y mejora de reforma del servicio público sin afectar derechos laborales.","Evaluation and improvement of public service reform without affecting labor rights.","701",NA
"Establecimiento inmediato de derecho a la negociación colectiva en el Estado reconociendo sus particularidades.","Immediate establishment of the right to collective bargaining in the State, recognizing its particularities.","504",NA
"Incremento efectivo de ingresos de trabajadores del Estado e índices de medición de incidencia en mejora de servicio público.","Effective increase in the income of government workers and indexes for measuring the impact on the improvement of public services.","303",NA
"Reducción de conflictividad y huelgas y mayor satisfacción de trabajadores del Estado y servicios públicos brindados","Reduction of conflicts and strikes and greater satisfaction of government workers and public services provided","303",NA
"Respeto a línea de carrera y meritocracia con el objeto de mejorar servicio público.","Respect for career lines and meritocracy in order to improve public service.","303",NA
"Medición de transparencia en la gestión y buenas prácticas laborales en el Estado.","Measurement of transparency in management and good labor practices in the State.","304",NA
"Culminación de proceso de revisión de los ceses colectivos, establecidos por la Leyes 27803 y 29059.","Culmination of the review process of collective severance payments established by Laws 27803 and 29059.","701",NA
"Aprobación a nivel legal de fórmula de incremento periódico de RMV buscando alcanzar la canasta básica familiar.","Approval at the legal level of the formula for the periodic increase of the RMV, seeking to reach the basic family basket.","412",NA
"Ratificación e implementación de convenio 131 OIT sobre salario mínimo.","Ratification and implementation of ILO Convention 131 on minimum wage.","412",NA
"Aumento de remuneraciones reales promedio como mínimo en 35%.","Increase in real average compensation by at least 35%.","412",NA
"Mayor liquidez de ingresos de trabajadores como efecto de financiamiento tripartito de aportes a los sistemas de pensiones","Increased liquidity of workers' income as a result of tripartite financing of contributions to pension systems","504",NA
"Implementación de educación para el empleo como parte de últimos años de formación escolar.","Implementation of education for employment as part of the last years of schooling.","411",NA
"Implementación de plan nacional de primer empleo digno y productivo","Implementation of a national plan for the first decent and productive job","701",NA
"Objetivo mínimo de duplicar alcance de convenios colectivos a nivel nacional en distintas actividades económicas con cláusulas de incremento remunerativo","Minimum objective of doubling the scope of collective bargaining agreements at the national level in different economic activities with clauses for pay increases","701",NA
"Implementar sistema de deducción de gastos real que beneficie a trabajadores de menores ingresos.","Implement a real expense deduction system that benefits lower-income workers.","504",NA
"Menores tasas a trabajadores de menores ingresos.","Lower rates for lower-income workers.","504",NA
"Reducción de aporte del trabajador a sistemas de pensiones de 13% promedio actual a un esquema de financiamiento tripartito compartido entre trabajadores, empresas y estado, como en el resto de América Latina.","Reduction of worker contributions to pension systems from the current average of 13% to a tripartite financing scheme shared by workers, companies and the state, as in the rest of Latin America.","504",NA
"Se triplica alcance de inspecciones de trabajo respecto de incumplimiento de pagos y se implementa reforma legal que sanciona como delito retención indebida de remuneraciones y beneficios de trabajadores","The scope of labor inspections for non-compliance with payments is tripled and a legal reform is implemented that punishes as a crime the improper withholding of workers' salaries and benefits","701",NA
"Aprobación de Ley General de Trabajo Digno y Productivo (LGT) que reconozca derechos considerados como objetivos estratégicos en plan, entre otros.","Approval of the General Law for Decent and Productive Work (LGT) that recognizes rights considered as strategic objectives in the plan, among others.","701",NA
"Seguimiento periódico de implementación de LGT a través de registros nacionales (planilla electrónica) y encuestas especializadas.","Periodic monitoring of GLT implementation through national registries (electronic spreadsheet) and specialized surveys.","701",NA
"Implementación de indicadores de trabajo decente y revisión periódica.","Implementation of decent work indicators and periodic review.","701",NA
"Reducción del trabajo precario (no solamente informal) en más del 66% de situación actual.","Reduction of precarious work (not only informal) by more than 66% of the current situation.","701",NA
"Incremento del trabajo digno o decente en similar proporción.","Increase in decent work in similar proportion.","701",NA
"Ratificación de convenio 189 OIT (trabajadoras del hogar) e implementación de recomendaciones sobre igualdad laboral.","Ratification of ILO Convention 189 (domestic workers) and implementation of recommendations on labor equality.","503",NA
"Mejorar sustancialmente recursos materiales y humanos del sector trabajo.","Substantially improve material and human resources in the labor sector.","701",NA
"Durante primer año duplicar cuantía de Pensión 65 y al final de gobierno (2021) contar con una cobertura del 70%, sentando las bases de una estrategia de universalización de las pensiones.","During the first year, double the amount of Pension 65 and by the end of the government (2021) have 70% coverage, laying the foundations for a strategy of universalization of pensions.","504",NA
"Mejorar cuantía de pensiones públicas en un 66% y establecer pensión mínima adecuada a estándares internacionales.","Improve the amount of public pensions by 66% and establish a minimum pension adequate to international standards.","504",NA
"Ejercer competencias en materia de seguridad social de manera efectiva.","To effectively exercise social security competencies.","504",NA
"Creación de Viceministerio y Superintendencia de Seguridad Social.","Creation of the Vice-Ministry and Superintendence of Social Security.","504",NA
"Implementación de sistema nacional de fiscalización laboral electrónica con identificación de historial actualizado de situación laboral de empresas (medianas y grandes).","Implementation of a national electronic labor auditing system with identification of updated history of the labor situation of companies (medium and large).","701",NA
"Creación e implementación de sistema nacional de riesgos de trabajo.","Creation and implementation of a national system of labor risks.","504",NA
"Incremento de cobertura efectiva en un 33%.","Increased effective coverage by 33%.","504",NA
"Reducción de observaciones de OIT a sistema de seguridad social peruano a menos de la tercera parte de último informe.","Reduction of ILO observations on the Peruvian social security system to less than one third of the last report.","504",NA
"Implementación, funcionamiento efectivo y eficiente de Instituto Nacional de Pensiones.","Implementation, effective and efficient operation of the National Pension Institute.","504",NA
"Reducir tiempo de entrega de primer pago de pensiones a un mes.","Reduce delivery time of first pension payment to one month.","504",NA
"Implementación de régimen laboral público que reconozca de manera plena derechos laborales, como permanencia en puesto y negociación colectiva.","Implementation of a public labor regime that fully recognizes labor rights, such as tenure and collective bargaining.","701",NA
"Modificación de artículos de la Ley Servir que desconozcan estos derechos.","Modification of articles of the Servir Law that do not recognize these rights.","701",NA
"Mejora significativa de satisfacción tanto del trabajador como del ciudadano usuario de servicios públicos","Significant improvement in the satisfaction of both the employee and the citizen user of public services","303",NA
"Aplicación de primacía de la realidad respecto de conceptos remunerativos para efectos pensionarios.","Application of the primacy of reality with respect to remunerative concepts for pension purposes.","504",NA
"Eliminar discriminación salarial y en pensiones.","Eliminate wage and pension discrimination.","503",NA
"Implementación de recomendaciones de Defensoria del Pueblo respecto de cesados colectivamente (Leyes 27803 y 29059)","Implementation of Ombudsman's Office recommendations regarding collective dismissals (Laws 27803 and 29059)","201.2",NA
"Las diferencias en el uso del tiempo de mujeres y varones (40 horas semanales dedicadas al TDNR vs. 15 de los hombres) limita la autonomía de las mujeres y condiciona su desarrollo.","The differences in the use of time of women and men (40 hours per week dedicated to TDNR vs. 15 for men) limits women's autonomy and conditions their development.","503",NA
"Fomentar la corresponsabilidad del cuidado y asumir su reconocimiento y promoción desde el Estado para superar la desigualdad de género.","Encourage co-responsibility for care and assume its recognition and promotion by the State in order to overcome gender inequality.","503",NA
"Creación de un Sistema integral de cuidados (SIC).","Creation of an Integrated Care System (ICS).","504",NA
"Nuevo pacto social hacia un modelo de corresponsabilidad social del cuidado a partir de dos estrategias centrales:","New social pact towards a model of social co-responsibility for care based on two central strategies:","504",NA
"Estrategias para afianzar la corresponsabilidad entre los sexos al interior del hogar:","Strategies to strengthen co-responsibility between the sexes within the household:","503",NA
"Estrategias para garantizar la provisión de servicios públicos de cuidado","Strategies to guarantee the provision of public care services","504",NA
"Reconocer y garantizar “los cuidados” como un Derecho Humano, en el marco de los compromisos asumidos por el Estado en la X Conferencia Regional de la Mujer de CEPAL (Quito, 2007).","Recognize and guarantee ""care"" as a Human Right, within the framework of the commitments assumed by the State at the X Regional Conference on Women of ECLAC (Quito, 2007).","201.2",NA
"Reconocimiento constitucional del derecho al cuidado","Constitutional recognition of the right to care","204",NA
"La brecha salarial en promedio en el sector público es de 15%, y asciende al 32% en el sector privado;","The average wage gap in the public sector is 15%, and rises to 32% in the private sector;","701",NA
"más del 90% de las/os trabajadoras del hogar son mujeres, las cuales no tienen derecho a RMV, protección adecuada de la jornada y en caso de despido, derechos laborales recortadas al 50%, entre otros.","more than 90% of domestic workers are women, who do not have the right to RMV, adequate protection of the working day and, in the event of dismissal, labor rights cut to 50%, among others.","503",NA
"Disminuir las brechas salariales en el sector público y privado.","To reduce wage gaps in the public and private sectors.","701",NA
"Dotar de previsibilidad, celeridad y seguridad las denuncias de hostigamiento sexual en el sector público y privado, así como promover protocolos.","Provide predictability, speed and security for complaints of sexual harassment in the public and private sector, as well as promote protocols.","503",NA
"Desarrollar programas de empleo decente para jóvenes, problema multifocal que afecta particularmente a las mujeres jóvenes.","Develop decent employment programs for young people, a multifocal problem that particularly affects young women.","503",NA
"Promover el autoempleo/ trabajo independiente decente, con sistemas de capacitación, facilidades de créditos y otros recursos especialmente para las mujeres en particular hogares mono-parentales de jefatura femenina.","Promote self-employment/decent independent work, with training systems, credit facilities and other resources, especially for women, particularly single-parent households headed by women.","503",NA
"Ampliar la obligación de las empresas públicas y privadas para que incorporen a su carga laboral a personas con discapacidad, con metas de paridad de hombre y mujeres.","Extend the obligation of public and private companies to incorporate people with disabilities into their workload, with parity goals for men and women.","503",NA
"Estadísticas trimestrales sobre promedio remunerativo por género, edades, sectores productivos, a nivel de Lima y semestrales a nivel nacional.","Quarterly statistics on average remuneration by gender, age, productive sectors, at the Lima level and semi-annually at the national level.","701",NA
"Estadística sobre registro de protocolos y procedimientos sancionadores en casos de hostilidad sexual, así como creación de sistema de registro y acceso público de los mismos.","Statistics on the registration of protocols and sanctioning procedures in cases of sexual hostility, as well as the creation of a registration system and public access to them.","503",NA
"Estadísticas de colaboración multisectorial entre sector mujer y trabajo/ empleo sobre seguimiento de empleabilidad, capacitaciones, deserción escolar, paternidad/maternidad temprana por edades, con énfasis en población de 16 a 24 años.","Statistics on multisectoral collaboration between the women's sector and labor/employment on employability, training, school dropouts, early parenthood by age, with emphasis on the population between 16 and 24 years of age.","503",NA
"Estadísticas sobre la base de acceso y monto de pensiones por género y edad.","Statistics on the basis of access and amount of pensions by gender and age.","503",NA
"Eliminar brecha salarial o haber menguado la misma reduciéndola a un mínimo de 10%, con una disminución sostenida de 5% anual.","Eliminate the wage gap or have reduced it to a minimum of 10%, with a sustained decrease of 5% per year.","701",NA
"Eliminar estructuras de desigualdad que limiten accesos a mujeres a puestos de jerarquía o dirección a través del uso de acciones afirmativas para romper el denominado “techo de cristal”.","Eliminate unequal structures that limit women's access to hierarchical or managerial positions through the use of affirmative actions to break the so-called ""glass ceiling"".","503",NA
"Promover la empleabilidad con derechos de jóvenes de 18 a 24 años atendiendo: capacitación adecuada y de calidad,","Promote the employability with rights of young people from 18 to 24 years of age by attending to: adequate and quality training,","706",NA
