"text","text_en","cmp_code","eu_code"
"FRENTE AMPLIO","WIDE FRONT","H",NA
"Por la Justicia, la Vida y la Libertad","For Justice, Life and Liberty","H",NA
"PLAN DE GOBIERNO","GOVERNANCE PLAN","H",NA
"Enero 2016","January 2016","H",NA
"IDEARIO Y PRINCIPIOS","IDEOLOGY AND PRINCIPLES","H",NA
"El Frente Amplio por Justicia, Vida y Libertad es una organización política abierta, incluyente y no confesional, que afirma una democracia participativa sin discriminación étnica, de género, credo, edad, nivel socioeconómico, orientación sexual, discapacidad, o de cualquier otro tipo.","The Frente Amplio por Justicia, Vida y Libertad is an open, inclusive and non-denominational political organization that affirms participatory democracy without discrimination based on ethnicity, gender, creed, age, socioeconomic status, sexual orientation, disability, or any other type of discrimination.","503",NA
"Busca la democratización de la sociedad, de la economía y del sistema político en todo el Perú.","It seeks the democratization of society, the economy and the political system throughout Peru.","202.1",NA
"Afirma una democracia participativa e intercultural con plena vigencia de los derechos humanos,","It affirms a participatory and intercultural democracy with full respect for human rights","201.2",NA
"y relaciones respetuosas entre los seres humanos y la naturaleza, como componentes del Buen Vivir para las generaciones actuales y venideras.","and respectful relations between human beings and nature, as components of Good Living for present and future generations.","501",NA
"Somos ecologistas,","We are ecologists,","501",NA
"interculturales,","interculturalists,","607.1",NA
"feministas,","feminists,","503",NA
"libertarios,","libertarians,","201.1",NA
"descentralistas y socialistas,","decentralists and socialists,","301",NA
"y nos identificamos con los diversos pensamientos y prácticas transformadoras que se vienen sumando como un río para que otro Perú y otro mundo sean posibles.","and we identify with the diverse thoughts and transformative practices that are joining together like a river so that another Peru and another world are possible.","606.1",NA
"Buscamos la ampliación del ejercicio de todos los derechos individuales y colectivos,","We seek the expansion of the exercise of all individual and collective rights,","201.2",NA
"la profundización de la democracia","the deepening of democracy","202.1",NA
"y la afirmación de la ética, como condiciones fundamentales para la construcción de la paz con justicia.","and the affirmation of ethics, as fundamental conditions for the construction of peace with justice.","304",NA
"Trabajamos por que el Perú sea un país un país productivo y diversificado,","We are working to make Peru a productive and diversified country,","410",NA
"biodiverso y sostenible,","and sustainable,","416.2",NA
"trabajador con dignidad, justo y libertario,","worker with dignity, fair and libertarian,","201.1",NA
"educado","polite","506",NA
"y saludable,","and healthy,","504",NA
"plurinacional e intercultural,","plurinational and intercultural,","607.1",NA
"democrático,","democratic,","202.1",NA
"descentralizado y participativo,","decentralized and participatory,","301",NA
"pacífico y seguro,","peaceful and safe,","605.1",NA
"y un país soberano en un mundo multipolar.","and a sovereign country in a multipolar world.","109",NA
"VISION DEL PLAN DE GOBIERNO","VISION OF THE GOVERNMENT PLAN","H",NA
"El Frente Amplio surge en la política peruana para completar las tareas pendientes para ser una sociedad integrada","The Frente Amplio arises in Peruvian politics to complete the pending tasks to become an integrated society","606.1",NA
"y para contar con un estado social de derecho, plurinacional, representativo y profundamente democrático,","and to have a social state based on the rule of law, plurinational, representative and deeply democratic,","202.1",NA
"que sea promotor del desarrollo de todos y todas los peruanos y peruanas.","which promotes the development of all Peruvian men and women.","503",NA
"El Frente Amplio asume como horizonte paradigmático el ""Buen Vivir"", definido como una forma de vida en armonía, igualdad, equidad y solidaridad que aspira a una sociedad justa donde el objetivo central es el ser humano en su condición de parte integrante de la naturaleza en la que vivimos.","The Frente Amplio assumes as its paradigmatic horizon the ""Good Living"", defined as a way of life in harmony, equality, equity and solidarity that aspires to a just society where the central objective is the human being as an integral part of the nature in which we live.","503",NA
"El Frente Amplio considera que las nuevas relaciones entre sociedad, mercado y estado deben estar consagradas en una Nueva Constitución Política que exprese un nuevo acuerdo político fundamental que se garante de los derechos y de los intereses de las grandes mayorías nacionales y no expresión –como es ahora- de la hegemonía de grandes grupos empresariales asociados con elites políticas corruptas.","The Frente Amplio considers that the new relations between society, market and state must be enshrined in a New Political Constitution that expresses a new fundamental political agreement that guarantees the rights and interests of the great national majorities and not the expression -as it is now- of the hegemony of large business groups associated with corrupt political elites.","204",NA
"En el mundo vivimos una creciente desigualdad económica que alienta una peligrosa polarización social.","The world is experiencing growing economic inequality that encourages dangerous social polarization.","503",NA
"El 1% de la población mundial es propietaria del 50% de los ingresos generados en el planeta.","1% of the world's population owns 50% of the income generated on the planet.","503",NA
"En el Perú, el 16 % de la población urbana es pobre, pero en las zonas rurales casi 1 de cada 2 personas es pobre y el ingreso familiar es solo 1/6 del que tienen en las ciudades.","In Peru, 16% of the urban population is poor, but in rural areas almost 1 out of every 2 people is poor and the family income is only 1/6 of what it is in the cities.","503",NA
"En Lima las AFP nos dicen que viviremos 90 años, pero las provincias más pobres la expectativa de vida es casi 20 años menor que el promedio nacional","In Lima the AFPs tell us that we will live 90 years, but in the poorest provinces life expectancy is almost 20 years less than the national average","503",NA
"El Frente Amplio asume que la economía de mercado (intercambio competitivo de bienes y servicios mediante la moneda) es una realidad planetaria que no puede suprimirse ni puede reemplazarse por un modelo de economía auto-referencial o estatista.","The Frente Amplio assumes that the market economy (competitive exchange of goods and services through currency) is a planetary reality that cannot be suppressed nor can it be replaced by a self-referential or statist economic model.","403",NA
"Pero consideramos que los estados y las sociedades tienen el derecho y la obligación de regular el funcionamiento del mercado","But we believe that states and societies have the right and the obligation to regulate the functioning of the market","406",NA
"y de promover un patrón de desarrollo nacional basado en la producción y la innovación que tenga como objetvo central la igualdad, la sostenibilidad y la plurinacionalidad.","and to promote a pattern of national development based on production and innovation that has equality, sustainability and plurinationality as its central objective.","416.2",NA
"En ninguna parte del planeta el mercado se regula solo.","Nowhere on the planet does the market regulate itself.","403",NA
"En todas las economías desarrolladas los estados regulan su funcionamiento y la iniciativa privada para impedir la formación de monopolios proteger la propiedad intelectual, asegurar la calidad en la provisión de bienes y servicios, subvencionar y promover sectores estratégicos, proteger al medio ambiente, etc.","In all developed economies, states regulate their operation and private initiative to prevent the formation of monopolies, protect intellectual property, ensure quality in the provision of goods and services, subsidize and promote strategic sectors, protect the environment, etc.","403",NA
"Junto con la desigualdad económica y social, en el mundo vivimos una gravísima crisis ambiental.","Along with economic and social inequality, the world is experiencing a very serious environmental crisis.","501",NA
"Por acción del hombre, en las últimas decenas de años se ha acelerado el cambio climático más que en los últimos miles de años y hoy día sabemos que permitimos que la temperatura suba otros 2 grados centígrados en las próximas décadas, generaremos una crisis que nos pone en riesgo como especie.","Due to human action, climate change has accelerated in the last tens of years more than in the last thousands of years, and today we know that if we allow the temperature to rise another 2 degrees Celsius in the coming decades, we will generate a crisis that puts us at risk as a species.","501",NA
"A nivel planetario, mientras los grandes capitales se desplazan de un sector al otro en búsqueda de rentabilidad, son los pobres los que pagan las consecuencias del calentamiento global.","At the planetary level, while big capital moves from one sector to another in search of profitability, it is the poor who pay the consequences of global warming.","501",NA
"El Perú, uno de los países mas ricos en biodiversidad es también uno de los más golpeados por el calentamiento global:","Peru, one of the countries richest in biodiversity, is also one of the hardest hit by global warming:","501",NA
"se calientan las aguas del mar y se afecta la pesca, se alteran los ciclos de lluvias y secas y perdemos los glaciales, lo que afecta masivamente a la agricultura,","the sea waters are warming and fishing is affected, the rain and dry cycles are altered and we lose glaciers, which massively affects agriculture,","501",NA
"se desertifica la Amazonía y se pierde biodiversidad, capacidad de absorción y de producción de agua fresca,","the Amazon is desertified and biodiversity is lost, as well as the capacity to absorb and produce fresh water","501",NA
"y capacidad der espacio de vida de los pueblos indígenas.","and the capacity of indigenous peoples to live in their own living space.","501",NA
"El Frente Amplio asume que es necesario reorientar nuestros patrones de producción y consumo en un plazo corto, usando sosteniblemente nuestros recursos renovables (como la pesca y los bosques),","The Frente Amplio assumes that it is necessary to reorient our production and consumption patterns in the short term, sustainably using our renewable resources (such as fisheries and forests),","416.2",NA
"protegiendo nuestras fuentes de agua y las cabeceras de cuenca por donde discurre hacia los lugares de uso productivo y consumo humano,","protecting our water sources and the headwaters through which it flows to places of productive use and human consumption,","416.2",NA
"cambiando nuestra matriz energética de combustible fósiles para generar menos gases de efecto invernadero,","changing our fossil fuel energy matrix to generate less greenhouse gases,","416.2",NA
"y combatiendo el consumismo innecesario alimentado por el afán de lucro.","and combating unnecessary consumerism fueled by the profit motive.","416.2",NA
"El sistema político que nos rige contiene vicios de origen y ha colapsado.","The political system that governs us is flawed and has collapsed.","202.1",NA
"El estado peruano se creó sobre el despojo y la colonización de nuestras naciones indígenas y originarias.","The Peruvian state was created on the dispossession and colonization of our indigenous and native nations.","607.3",NA
"Además, en las últimas décadas, se han incrementado de manera notoria los niveles de corrupción y penetración del narcotráfico en diversos partidos políticos que han sido gobierno y en las estructuras centrales y sub nacionales del Estado, lo que nos lleva a la necesidad de repensar nuestras formas de representación y gestión pública.","In addition, in recent decades, there has been a notorious increase in the levels of corruption and penetration of drug trafficking in various political parties that have been in government and in the central and sub-national structures of the State, which leads us to the need to rethink our forms of representation and public management.","304",NA
"El Frente Amplio asume decididamente la agenda de la reforma política y promoverá una transformación del Estado en cuanto a las formas de elección parlamentaria,","The Frente Amplio is firmly committed to the political reform agenda and will promote a transformation of the State in terms of the forms of parliamentary elections,","202.1",NA
"la vigilancia ciudadana sobre los gobiernos en todo nivel,","citizen oversight of governments at all levels,","202.1",NA
"la transparencia en la gestión,","transparency in management,","304",NA
"la vida institucional de los partidos políticos,","the institutional life of political parties,","202.1",NA
"la autonomía de los órganos de control","the autonomy of control bodies","304",NA
"y la reforma del poder judicial y las fuerzas del orden.","and the reform of the judiciary and the forces of law and order.","605.1",NA
"El Frente Amplio asume la interculturalidad en todo ámbito de gobierno y a mediano plazo la construcción de las estructuras estatales plurinacionales, para que estos compatriotas gocen de derechos colectivos plenos: al autogobierno y territorialidad, a los derechos sociales y culturales, a la participación política y a su territorialidad, a la participación en beneficios económicos, entre otras.","The Frente Amplio assumes interculturalism in all spheres of government and in the medium term the construction of plurinational state structures, so that these compatriots may enjoy full collective rights: to self-government and territoriality, to social and cultural rights, to political participation and territoriality, to participation in economic benefits, among others.","607.3",NA
"En respuesta a los grandes retos arriba mencionados, presentamos los 4 grandes ejes que organizan nuestro Plan de Gobierno para un Nuevo Perú","In response to the major challenges mentioned above, we present the 4 major axes that organize our Government Plan for a New Peru","305.1",NA
"ESTADO PARA LAGENTE, LIBRE DE CORRUPCION","STATE FOR LAGENT, FREE OF CORRUPTION","304",NA
"Propugnamos la superación del patrimonialismo (gobernantes administran los recursos públicos como si fueran propios) que es la herencia colonial de las últimas dos centurias","We advocate overcoming patrimonialism (rulers administer public resources as if they were their own) which is the colonial legacy of the last two centuries","304",NA
"tanto como el enfoque neoliberal (el mercado ""decide"" y el poder económico “ordena”) que ha caracterizado las políticas de los gobiernos en el Perú en las tres últimas décadas.","as well as the neoliberal approach (the market ""decides"" and economic power ""orders"") that has characterized government policies in Peru in the last three decades.","103.2",NA
"Nos proponemos la construcción de un Estado democrático, participativo, plurinacional, soberano, laico, eficiente y descentralizado, que asuma un rol dirigente, planificador y promotor del desarrollo,","We propose the construction of a democratic, participatory, plurinational, sovereign, secular, efficient and decentralized State, which assumes a leading, planning and promoting role in development,","202.1",NA
"brindando una adecuada representación intercultural a los pueblos y las minorías diversas,","providing adequate intercultural representation to diverse peoples and minorities,","607.3",NA
"respetando los derechos humanos y la identidad cultural en aras de alcanzar la paz y la seguridad ciudadanas para todos.","respecting human rights and cultural identity in order to achieve peace and citizen security for all.","201.2",NA
"Así, el Estado promueve el rol protagónico de la participación de la población en las decisiones que comprometen su futuro.","Thus, the State promotes the leading role of the population's participation in the decisions that affect its future.","202.1",NA
"ECONOMIA DE LA GENTE SIN EXCLUSION","ECONOMY OF THE PEOPLE WITHOUT EXCLUSION","503",NA
"Impulsamos la superación del modelo económico extractivista primario exportador centrado en la actividad minera, que genera poco empleo directo, tiene un débil efecto multiplicador en la economía, concentra la productividad y propende la desindustrialización, está sujeto a los vaivenes del mercado internacional y es insostenible en el tiempo.","We promote the overcoming of the extractivist primary export economic model focused on mining activity, which generates little direct employment, has a weak multiplier effect on the economy, concentrates productivity and tends to deindustrialization, is subject to the ups and downs of the international market and is unsustainable over time.","103.2",NA
"Proponemos que la recuperación del crecimiento y la redistribución del ingreso se sustenten en la diversificación y descentralización productiva.","We propose that the recovery of growth and income redistribution be based on productive diversification and decentralization.","410",NA
"Impulsamos los sectores de alta generación de empleo con uso sostenible de los recursos renovables,","We promote high employment generation sectors with sustainable use of renewable resources,","416.2",NA
"la conservación de los ecosistemas y la biodiversidad, y baja huella de carbono.","conservation of ecosystems and biodiversity, and low carbon footprint.","416.2",NA
"Impulsamos la construcción participativa de planes de desarrollo regional y provinciales con sus respectivos planes de Ordenamiento Territorial (OT),","We promote the participatory construction of regional and provincial development plans with their respective Land Use Plans (TO),","301",NA
"poniendo como eje la incorporación del conocimiento y la tecnología en la creación de valor agregado.","focusing on the incorporation of knowledge and technology in the creation of added value.","411",NA
"DERECHOS PARA TODOS Y TODAS SIN DISCRIMINACION","RIGHTS FOR ALL WITHOUT DISCRIMINATION","503",NA
"Propugnamos la desaparición de toda forma de exclusión y maltrato por razón de exclusión por condición de género, orientación sexual, identidad cultural, opción religiosa, ingresos, discapacidad o edad.","We advocate the elimination of all forms of exclusion and mistreatment based on gender, sexual orientation, cultural identity, religious choice, income, disability or age.","503",NA
"Promovemos que todos las y los peruanos sin distinción alguna tengan la capacidad de ejercer los mismos derechos y las mismas oportunidades para que su esfuerzo sea reconocido económica, social y políticamente.","We promote that all Peruvians, without distinction, have the ability to exercise the same rights and have the same opportunities for their efforts to be recognized economically, socially and politically.","503",NA
"DESARROLLO SOSTENIBLE SIN DESTRUCCION","SUSTAINABLE DEVELOPMENT WITHOUT DESTRUCTION","416.2",NA
"Nos afirmamos en la necesidad de frenar la depredación de nuestros territorios y la perdida de nuestra riquísima biodiversidad, resultante del afán de lucro de las grandes empresas y la búsqueda desesperada de opciones de sobrevivencia de los más pobres.","We affirm the need to stop the depredation of our territories and the loss of our rich biodiversity, resulting from the profit motive of large companies and the desperate search for survival options for the poorest.","416.2",NA
"Nos imponemos el reto de ser un país que vive del uso sostenible de sus recursos naturales renovables, asegurando así que las futuras generaciones puedan también gozar de un medio ambiente productivo y saludable.","We set ourselves the challenge of being a country that lives from the sustainable use of its renewable natural resources, thus ensuring that future generations can also enjoy a productive and healthy environment.","416.2",NA
"FRENTE AMPLIO PLAN DE GOBIERNO 2016","BROAD FRONT GOVERNMENT PLAN 2016","H",NA
"DIMENSION SOCIAL","SOCIAL DIMENSION","H",NA
"El Plan de Gobierno del Frente Amplio está orientado hacia el logro de la igualdad mediante una acción del estado que garantice el ejercicio universal de derechos fundamentales","The Frente Amplio's Government Plan is oriented towards the achievement of equality through state action that guarantees the universal exercise of fundamental rights","201.2",NA
"y el acceso universal a servicios públicos gratuitos, de calidad e interculturales a todos y todas,","and universal access to free, quality and intercultural public services for all, and that","504",NA
"y que destierre toda forma de discriminación.","banishes all forms of discrimination.","503",NA
"Problemas identificados","Problems identified","H",NA
"EDUCACION","EDUCATION","H",NA
"La educación rural, de pueblos originarios y de pueblos de frontera es escenario de graves carencias","Rural, indigenous and border town education is the scene of serious deficiencies.","607.1",NA
"Objetivos estratégicos","Strategic objectives","H",NA
"Creación del Sistema Nacional de Educación Rural, de Pueblos Originarios y de Frontera que permitan en el quinquenio 16-21 lograr una educación básica, con cobertura plena, y avances significativos en calidad, equidad y pertinencia.","Creation of the National System of Rural, Native Peoples' and Border Education to achieve basic education with full coverage and significant advances in quality, equity and relevance in the 16-21 quinquennium.","607.1",NA
"Medidas de Política/Indicadores","Policy Measures/Indicators","H",NA
"Porcentaje de población originaria que hacen viva su propia lengua y desarrollan su propia cultura.","Percentage of the indigenous population living their own language and developing their own culture.","607.1",NA
"Porcentaje de incremento de niñas que culminan con éxito y pertinencia la educación básica.","Percentage increase in the number of girls who successfully and appropriately complete basic education.","506",NA
"Al término de ésta, su proceso formativo les permite insertarse en el proceso productivo y/o acceden a la educación superior.","At the end of their training, they are able to enter the productive process and/or access higher education.","506",NA
"Porcentaje de instituciones educativas con docentes especializados en enfoque de educación intercultural y bilingüe, de modo diferenciado para el ámbito rural de costa, andina, amazónica y de frontera.","Percentage of educational institutions with teachers specialized in intercultural and bilingual education, in a differentiated manner for the rural areas of the coast, Andean, Amazonian and border regions.","607.1",NA
"Porcentaje de incremento de docentes nombrados en las instituciones educativas de estos ámbitos con base a su especialización y dominio de lenguas originarias.","Percentage increase in the number of teachers appointed in educational institutions in these areas based on their specialization and proficiency in native languages.","607.1",NA
"Porcentaje de incremento de instituciones educativas o redes territoriales con módulos de infraestructura y equipamiento adecuados al contexto.","Percentage increase of educational institutions or territorial networks with infrastructure and equipment modules appropriate to the context.","506",NA
"Porcentaje de instituciones educativas rurales articuladas y promotoras del desarrollo local, teniendo como eje aprender sirviendo a la comunidad (Aprendizaje – Servicio)","Percentage of rural educational institutions articulated and promoting local development, with learning by serving the community (Service-Learning)","506",NA
"y con una educación productiva como eje articulador de los aprendizajes.","and with productive education as an articulating axis of learning.","411",NA
"Metas a 2021","Goals to 2021","H",NA
"100% de las instituciones educativas organizadas en redes territoriales de servicio educativo integrado.","100% of educational institutions organized in territorial networks of integrated educational services.","506",NA
"Uso de lenguas originarias como lenguas de aprendizaje y de revitalización en el 100% de instituciones educativas del ámbito.","Use of native languages as learning and revitalization languages in 100% of the educational institutions in the area.","607.1",NA
"Extender el uso oficial de lenguas originarias (quechua y aymara) como lenguas de herencia en las áreas urbanas según regiones en las distintas modalidades y niveles educativos.","Extend the official use of native languages (Quechua and Aymara) as heritage languages in urban areas according to regions in the different educational modalities and levels.","607.1",NA
"50% de incremento en el número de niñas que culminan la educación básica y en el número de niñas que acceden a la educación superior.","50% increase in the number of girls completing basic education and in the number of girls accessing higher education.","506",NA
"90% de instituciones educativas y redes territoriales cuentan con equipos completos de docentes especializados.","90% of educational institutions and territorial networks have a full team of specialized teachers.","506",NA
"50% de incremento de plazas de ingreso a carrera pública para docentes especializados","50% increase in the number of public career entry positions for specialized teachers","506",NA
