"text","text_en","cmp_code","eu_code"
"La España de ciudadanos libres e iguales","Spain of free and equal citizens","H",NA
"1. Defender la unidad de España y garantizar la igualdad de derechos de todos los ciudadanos","1. To defend the unity of Spain and guarantee equal rights for all citizens.","H",NA
"1. Aplicaremos el articulo 155 hasta asegurar el restablecimiento de la Constitución en Cataluña para garantizar la convivencia entre todos los catalanes, así como el respeto a las Leyes y las sentencias judiciales.","1. We will apply Article 155 until we ensure the reestablishment of the Constitution in Catalonia to guarantee the coexistence of all Catalans, as well as the respect for the Laws and the judicial sentences.","302",NA
"No podemos tolerar por más tiempo que Torra y los separatistas utilicen las instituciones públicas para sembrar el odio y el enfrentamiento entre los catalanes.","We can no longer tolerate that Torra and the separatists use public institutions to sow hatred and confrontation among Catalans.","302",NA
"Por eso, plantearemos la aplicación del artículo 155 de forma inmediata para garantizar la convivencia en Cataluña, la neutralidad de los espacios públicos y el acatamiento de la Constitución por parte de la Generalitat.","Therefore, we will propose the immediate application of Article 155 to guarantee coexistence in Catalonia, the neutrality of public spaces and the Generalitat's compliance with the Constitution.","302",NA
"2. Mejoraremos los instrumentos para proteger a los españoles de los golpes de Estado en el siglo XXI.","We will improve the instruments to protect Spaniards from coups d'état in the 21st century.","302",NA
"El golpe de Estado de los separatistas catalanes de otoño de 2017 tenía un objetivo claro: liquidar la Constitución y sustituir la legalidad vigente por un marco legal alternativo, saltándose los procedimientos democráticos y vulnerando los derechos fundamentales de millones de catalanes.","The Catalan separatists' coup d'état of autumn 2017 had a clear objective: to liquidate the Constitution and replace the current legality with an alternative legal framework, bypassing democratic procedures and violating the fundamental rights of millions of Catalans.","302",NA
"Actualizaremos el delito de sedición y rebelión en el Código Penal","We will update the crime of sedition and rebellion in the Penal Code","605.1",NA
"y reforzaremos los instrumentos de la ley de Seguridad Nacional y de la ley de Estabilidad Presupuestaria para asegurar que la labor de los Mossos d'Esquadra responde a la defensa leal de la Constitución","and we will reinforce the instruments of the National Security Law and the Budgetary Stability Law to ensure that the work of the Mossos d'Esquadra responds to the loyal defense of the Constitution","203",NA
"y que no se destina ni un solo euro de dinero público a financiar ninguna actividad vinculada al proceso separatista.","and that not a single euro of public money is used to finance any activity linked to the separatist process.","302",NA
"3. Impediremos que quienes se fuguen de la justicia puedan presentarse a las elecciones y/o beneficiarse del dinero de todos.","3. We will prevent those who are fugitives from justice from running for elections and/or benefiting from everyone's money.","304",NA
"Es inadmisible que se destine dinero público a pagar la propaganda separatista y los gastos de Puigdemont y del resto de consellers huidos de la justicia en el extranjero.","It is inadmissible that public money is destined to pay for separatist propaganda and the expenses of Puigdemont and the rest of the consellers fleeing from justice abroad.","302",NA
"Con Cs, los políticos fugados de la justicia perderán automáticamente su cargo, no podrán presentarse a ningunas elecciones y no podrán beneficiarse, directa o indirectamente, de recursos o financiación con cargo a los presupuestos públicos.","With Cs, politicians fugitives from justice will automatically lose their office, will not be able to run for any elections and will not be able to benefit, directly or indirectly, from resources or funding from public budgets.","302",NA
"4. Garantizaremos que se pueda estudiar, trabajar y rotular tu negocio en español en toda Espana.","4. We will guarantee that you can study, work and label your business in Spanish throughout Spain.","601.1",NA
"Es inadmisible que existan CCAA donde las lenguas se utilicen como arma política para crear ciudadanos de primera y de segunda.","It is unacceptable that there are Autonomous Communities where languages are used as a political weapon to create first and second class citizens.","302",NA
"Aprobaremos una nueva ley Orgánica de Lenguas Oficiales que garantice el use del español como lengua oficial y común en toda Espana.","We will approve a new Organic Law of Official Languages that guarantees the use of Spanish as an official and common language throughout Spain.","601.1",NA
"5. El conocimiento de una lengua cooficial autonómica nunca será una barrera para acceder a un empleo público en España.","Knowledge of an autonomous co-official language will never be a barrier to access to public employment in Spain.","302",NA
"El conocimiento de una lengua cooficial podrá ser considerado un mérito, pero nunca un requisito para el acceso a la función pública en cualquier Administración española.","Knowledge of a co-official language may be considered a merit, but never a requirement for access to the civil service in any Spanish Administration.","302",NA
"6. Incluiremos una asignatura sobre la Constitución española, troncal y evaluable en toda España","6. We will include a subject on the Spanish Constitution, core and evaluable throughout Spain","203",NA
"y pondremos fin at adoctrinamiento nacionalista en las escuelas.",", and we will put an end to nationalist indoctrination in schools.","302",NA
"Reforzaremos la Alta Inspección del Estado, dotándola de independencia e iniciativa para garantizar que la enseñanza impartida en las aulas y el contenido de los Libros de texto en cualquier Lugar de España no sean contrarios a la ley y a la Constitución, y haremos públicos sus informes.","We will strengthen the High State Inspection, providing it with independence and initiative to guarantee that the teaching given in classrooms and the content of textbooks in any place in Spain are not contrary to the law and the Constitution, and we will make its reports public.","203",NA
"7. Reformaremos el Tribunal Constitucional para reforzar su capacidad de actuación a la hora de asegurar el respeto a la Constitución.","7. We will reform the Constitutional Court to reinforce its capacity to act in order to ensure respect for the Constitution.","203",NA
"Incluiremos en la ley Orgánica del Tribunal Constitucional el requisito de que todos sus miembros sean reconocidos juristas con al menos 25 años de ejercicio acreditado.","We will include in the Organic Law of the Constitutional Court the requirement that all its members be recognized jurists with at least 25 years of accredited practice.","203",NA
"Estableceremos un estricto sistema de incompatibilidades para evitar su politización.","We will establish a strict system of incompatibilities to avoid politicization.","202.1",NA
"EL mandato será de 12 arios, con jubilación a los 75.","The term of office shall be 12 years, with retirement at 75 years.","202.1",NA
"2. Actualizar la Constitución para garantizar la igualdad","2. Update the Constitution to guarantee equality","H",NA
"8. Impulsaremos la actualización de nuestra Constitución para garantizar que España sea una nación de ciudadanos Libras e iguales.","8. We will promote the updating of our Constitution to ensure that Spain is a nation of free and equal citizens.","203",NA
"En Cs estamos comprometidos con la defensa de la Constitución y por eso creemos necesario actualizarla para reforzar la unión, libertad e igualdad entre todos los españoles frente a los nuevos retos del siglo XXI.","In Cs we are committed to the defense of the Constitution and therefore we believe it is necessary to update it to strengthen the union, freedom and equality among all Spaniards in the face of the new challenges of the 21st century.","203",NA
"Entre otras medidas, proponemos: Reforzar las competencias del Estado para garantizar la igualdad entre todos los españoles y la unidad de mercado.","Among other measures, we propose: Strengthen the powers of the State to guarantee equality among all Spaniards and market unity.","302",NA
"Fijar la distribución de competencias entre el Estado y las CCAA, sin posibilidad de transferencia, para reforzar la seguridad jurídica y la claridad.","To establish the distribution of competences between the State and the Autonomous Regions, without the possibility of transfer, in order to reinforce legal certainty and clarity.","302",NA
"Reformar el Senado como Cámara de representación territorial y, si el bipartidismo se niega a darle utilidad, plantearemos su cierre.","Reform the Senate as a Chamber of territorial representation and, if the bipartisanship refuses to make it useful, we will propose its closure.","303",NA
"Suprimir la posibilidad de anexión de Navarra por el País Vasco recogida en la disposición transitoria cuarta.","To suppress the possibility of annexation of Navarre by the Basque Country contained in the fourth transitory provision.","302",NA
"Reflejar la pertenencia de España a la Unión Europea y el compromiso de nuestro país con el proceso de integración europea.","To reflect Spain's membership in the European Union and our country's commitment to the European integration process.","108",NA
"Ampliar el catálogo de derechos fundamentales, incorporando nuevas realidades, como el derecho a la salud, a la atención a la dependencia, a la conciliación, a la transparencia y al acceso a la información pública.","To expand the catalog of fundamental rights, incorporating new realities, such as the right to health, to care for dependency, to conciliation, to transparency and access to public information.","201.2",NA
"Eliminar la preferencia del varón sobre la mujer en la sucesión de la Corona.","Eliminate the preference of men over women in the succession to the Crown.","503",NA
"Blindar el matrimonio entre personas LGTBI e incluir el derecho a la no discriminación por razón de orientación o condición sexual.","Shield LGTBI marriage and include the right to non-discrimination on the basis of sexual orientation or status.","604",NA
"Eliminar la figura del Real Decreto-Ley para acabar con los abusos del Gobierno de turno.","Eliminate the figure of the Royal Decree-Law to put an end to the abuses of the Government of the day.","202.1",NA
"En su Lugar, la legislación de extraordinaria y urgente necesidad se tramitará por las Cortes en un plazo máximo de 72 horas garantizando el debate parlamentario.","In its place, the legislation of extraordinary and urgent necessity will be processed by the Cortes within a maximum period of 72 hours guaranteeing parliamentary debate.","202.1",NA
"3. Una ley Electoral más justa e igualitaria","3. A fairer and more egalitarian Electoral Law","H",NA
"9. Reformaremos la ley Electoral para que sea más justa e igualitaria para que España no dependa de los que quieren romperla","9. We will reform the Electoral Law to make it fairer and more egalitarian so that Spain does not depend on those who want to break it up.","302",NA
"En Ciudadanos queremos que todos los electores se vean representados en el Congreso","In Ciudadanos we want all voters to be represented in Congress","202.1",NA
"y contar con diputados que trabajen por el interés común de toda España, no solo de una parte.","and to have deputies who work for the common interest of all of Spain, not just one part of it.","302",NA
"Para ello, modificaremos la ley Electoral en los siguientes aspectos: Estableceremos el requisito de que los partidos tengan que conseguir como mínimo el 3% del voto nacional para entrar en el Congreso.","To this end, we will modify the Electoral Law in the following aspects: We will establish the requirement that parties must get at least 3% of the national vote to enter Congress.","202.1",NA
"Mejoraremos la proporcionalidad del sistema electoral para asegurar que el reparto de escaños se ajuste a lo votado por los españoles.","We will improve the proportionality of the electoral system to ensure that the distribution of seats is in line with what Spaniards voted for.","202.1",NA
"Desbloquearemos las listas electorales para que los ciudadanos puedan decidir qua candidatos les representan dentro de la candidatura que elijan.","We will unblock the electoral lists so that citizens can decide which candidates represent them within the candidacy of their choice.","202.1",NA
"Prohibiremos la presencia de cualquier persona imputada formalmente por corrupción en cargos públicos y listas electorales.","We will prohibit the presence of any person formally charged with corruption in public office and on electoral lists.","304",NA
"Reduciremos los gastos electorales para que cada campaña no suponga un despilfarro a costa del bolsillo de los ciudadanos.","We will reduce election expenses so that each campaign is not a waste of money at the expense of citizens' pockets.","303",NA
"Daremos carácter obligatorio a la celebración de debates electorales.","We will make the holding of electoral debates mandatory.","202.1",NA
"Garantizaremos que todas las personas con discapacidad puedan ejercer su derecho de voto de forma autónoma y en igualdad de condiciones.","We will ensure that all persons with disabilities can exercise their right to vote autonomously and on equal terms.","503",NA
"Eliminaremos el actual sistema de 'voto rogado' para que los españoles en el exterior puedan ejercer su derecho de voto con total normalidad.","We will eliminate the current system of 'voto rogado' so that Spaniards abroad can exercise their right to vote with complete normality.","202.1",NA
"4. Una financiación autonómica más justa y transparente","4. A fairer and more transparent regional financing","H",NA
"10.  Impulsaremos la reforma de la financiación autonómica con el objetivo de conseguir un modelo más justo, equitativo y transparente.","10.  We will promote the reform of regional financing in order to achieve a fairer, more equitable and transparent model.","303",NA
"Abordaremos inmediatamente esta reforma, pendiente desde 2014, para conseguir un modelo de financiación más transparente, justo y equitativo, que garantice la igualdad de todos los españoles en el acceso a los servicios públicos.","We will immediately address this reform, pending since 2014, to achieve a more transparent, fair and equitable financing model that guarantees equality for all Spaniards in access to public services.","302",NA
"En paralelo, abordaremos la reforma de la financiación municipal para garantizar una mayor transparencia, responsabilidad y suficiencia de recursos para los Ayuntamientos.","In parallel, we will address the reform of municipal financing to ensure greater transparency, accountability and sufficiency of resources for municipalities.","303",NA
"11.   Acabaremos con el privilegio que supone el actual calculo arbitrario e insolidario del cupo vasco.","11. We will put an end to the privilege of the current arbitrary and unsupportive calculation of the Basque quota.","302",NA
"Sustituiremos el sistema actual de cálculo quinquenal, opaco y politizado, por una metodología estable elaborada por la Autoridad Independiente de Responsabilidad Fiscal (AIReF) que permita un cálculo del cupo transparente, objetivo y riguroso para asegurar la contribución del País Vasco a la solidaridad territorial en las mismas condiciones que el resto de CCAA.","We will replace the current system of five-yearly calculation, opaque and politicized, with a stable methodology developed by the Independent Authority for Fiscal Responsibility (AIReF) that allows a transparent, objective and rigorous calculation of the quota to ensure the contribution of the Basque Country to territorial solidarity under the same conditions as the rest of the Autonomous Communities.","303",NA
"Aplicaremos la misma reforma en el caso de la aportación navarra, para que los sistemas de concierto sean transparentes y solidarios.","We will apply the same reform in the case of the Navarre contribution, in order to make the agreement systems transparent and supportive.","302",NA
"Tolerancia cero con la corrupción","Zero tolerance for corruption","H",NA
"1. Luchar contra la corrupción, proteger a los denunciantes y acabar con los privilegios políticos","1. Fight corruption, protect whistleblowers and end political privilege.","H",NA
"12. Suprimiremos los aforamientos políticos para acabar con los privilegios de los políticos corruptos.","12. We will abolish political immunity to end the privileges of corrupt politicians.","304",NA
"Aprobaremos una modificación exprés de la Constitución para suprimir el aforamiento del que disfrutan los diputados y senadores, así como el presidente y los miembros del Gobierno de España.","We will approve an express amendment to the Constitution to abolish the immunity enjoyed by deputies and senators, as well as the President and members of the Spanish Government.","304",NA
"Impulsaremos la eliminación de los aforamientos políticos autonómicos en todas las CCAA, como ya hemos hecho en Murcia, Cantabria y Andalucía.","We will promote the elimination of regional political immunity in all the Autonomous Communities, as we have already done in Murcia, Cantabria and Andalusia.","304",NA
"13. Tolerancia cero con la corrupción: los corruptos se Irán a su casa.","13. Zero tolerance for corruption: the corrupt will go home.","304",NA
"Estableceremos que quienes sean imputados formalmente por delitos relacionados con la corrupción no puedan ocupar ningún cargo público hasta que no se resuelva su situación judicial.","We will establish that those who are formally charged with corruption-related offenses may not hold any public office until their judicial situation is resolved.","304",NA
"14. Incluiremos en el Código Penal el delito de enriquecimiento injustificado de los cargos públicos.","14. We will include in the Penal Code the crime of unjustified enrichment of public officials.","304",NA
"Los políticos que no puedan justificar incrementos significativos de su patrimonio durante su mandato tendrán que aclarar su origen ante los tribunales, además de responder ante la Agencia Tributaria.","Politicians who cannot justify significant increases in their wealth during their term of office will have to clarify their origin before the courts, in addition to answering to the Tax Agency.","304",NA
"15. Aprobaremos una ley de Protección del Denunciante de Corrupción.","15. We will pass a Corruption Whistleblower Protection Law.","304",NA
"Protegeremos a todas las personas que denuncien casos de corrupción u ordenes Regales de sus superiores.","We will protect all persons who denounce cases of corruption or orders from their superiors.","304",NA
"Crearemos una Autoridad Independiente de Integridad Pública para erradicar la corrupción, fiscalizar a nuestros cargos públicos y garantizar que su actuación responde al interés general.","We will create an Independent Public Integrity Authority to eradicate corruption, oversee our public officials and ensure that their actions are in the general interest.","304",NA
"16. Aprobaremos una nueva ley Orgánica de Partidos Políticos que refuerce la democracia interna, la transparencia y la rendición de cuentas.","16. We will approve a new Political Parties Organic Law that reinforces internal democracy, transparency and accountability.","202.1",NA
"Seguiremos las recomendaciones de la Subcomisión para el estudio de la reforma de los partidos políticos impulsada por Cs en la pasada legislatura.","We will follow the recommendations of the Subcommittee for the study of the reform of political parties promoted by Cs in the last legislature.","202.1",NA
"17. Prohibiremos los indultos a políticos condenados por corrupción, rebelión y sedición para acabar con la impunidad.","17. We will prohibit pardons for politicians convicted of corruption, rebellion and sedition to put an end to impunity.","304",NA
"Pondremos fin a la discrecionalidad del Gobierno: aprobaremos una nueva ley de Indultos para que solo se puedan conceder cuando exista un informe previo favorable del juez o tribunal y para que su resolución siempre deba justificarse y publicarse.","We will put an end to the Government's discretion: we will approve a new law on Pardons so that they can only be granted when there is a prior favorable report from the judge or court and so that their resolution must always be justified and published.","202.1",NA
"2. Acabaremos con los enchufes y el 'capitalismo de amiguetes' del bipartidismo","2. We will put an end to the crony capitalism of the bipartisan system.","H",NA
"18. Acabaremos con los enchufes de 'amiguetes' políticos incompetentes en las Administraciones públicas.","18. We will put an end to the plugging of incompetent political 'cronies' in public administrations.","304",NA
"Revisaremos el Estatuto Básico del Empleado Público y aprobaremos una ley de Función Pública del Estado para garantizar los principios de igualdad, mérito y capacidad, y en concreto:","We will revise the Basic Statute of the Public Employee and we will approve a State Civil Service Law to guarantee the principles of equality, merit and capacity, and specifically:","303",NA
"Limitaremos at mínimo los supuestos de Libre designación para la provisión de puestos de trabajo reservados a funcionarios en todas las Administraciones Públicas y generalizaremos el sistema de concurso.","We will limit to a minimum the cases of free designation for the provision of jobs reserved for civil servants in all Public Administrations and we will generalize the competition system.","303",NA
"Desarrollaremos el Estatuto del Directivo Público para acabar con los dedazos en la Administración General del Estado y en los organismos, empresas y fundaciones públicas (Correos, Paradores, CIS, etc. ).","We will develop the Statute of the Public Manager to put an end to the ""dedazos"" in the General Administration of the State and in public organizations, companies and foundations (Correos, Paradores, CIS, etc.).","303",NA
"Todos los directivos públicos serán elegidos mediante un sistema de selección abierto y transparente basado en el mérito y capacidad por una duración superior a la del Gobierno y estarán sometidos a una evaluación continua de desempeño.","All public managers will be chosen through an open and transparent selection system based on merit and ability for a term of office longer than that of the Government and will be subject to continuous performance evaluation.","303",NA
"Potenciaremos la carrera profesional de los funcionarios, desarrollando de una vez la carrera horizontal en la Administración General del Estado y los incentivos para la promoción profesional y la formación y evaluación continua.","We will strengthen the professional career of civil servants, developing once and for all the horizontal career in the General State Administration and the incentives for professional promotion and continuous training and evaluation.","303",NA
"Acabaremos con la integración de las carreras políticos y funcionariales.","We will put an end to the integration of political and civil service careers.","303",NA
"19. Aprobaremos una ley Antidedazos' en los Organismos Reguladores.","19. We will pass an 'Anti-Deductions' law in the Regulatory Bodies.","303",NA
"Esta ley garantizará la plena independencia y autonomía presupuestaria de los organismos reguladores y que sus responsables sean elegidos mediante un procedimiento de selección abierto, transparente y meritocrático.","This law will guarantee the full independence and budgetary autonomy of regulatory agencies and that their heads are chosen through an open, transparent and meritocratic selection procedure.","303",NA
"20. Actualizaremos la ley de Defensa de la Competencia para asegurarnos de que las prácticas abusivas sean sancionadas.","20. We will update the Antitrust Law to ensure that abusive practices are sanctioned.","403",NA
"Separaremos la Comisión Nacional de los Mercados y la Competencia (CNMC) en dos entidades independientes: una para la regulación de los mercados y otra para la defensa de la competencia y la unidad de mercado, siguiendo el modelo mayoritario en la UE.","We will separate the National Commission for Markets and Competition (CNMC) into two independent entities: one for the regulation of markets and the other for the defense of competition and market unity, following the majority model in the EU.","403",NA
"21. Aprobaremos una ley Orgánica de Transparencia y Participación que refuerce la transparencia y el acceso a toda la información pública.","21. We will approve an Organic Law of Transparency and Participation that reinforces transparency and access to all public information.","303",NA
"Convertiremos el Consejo de Transparencia y Buen Gobierno en una autoridad independiente","We will convert the Council for Transparency and Good Governance into an independent authority","303",NA
"y desbloquearemos de forma inmediata el nombramiento de un nuevo presidente, pendiente desde hace casi 2 años.","and we will immediately unblock the appointment of a new president, pending for almost 2 years.","303",NA
"Retiraremos los recursos judiciales de PP y PSOE contra las resoluciones de esta institución.","We will withdraw the judicial appeals of PP and PSOE against the resolutions of this institution.","303",NA
