"text","text_en","cmp_code","eu_code"
"3. Reforzaremos la prevención y la salud pública para mejorar la calidad de vida de todos los españoles","3. We will strengthen prevention and public health to improve the quality of life of all Spaniards.","H",NA
"118. Convertiremos la prevención y la salud pública en los ejes centrales de nuestra Sanidad.","118. We will make prevention and public health the central axes of our healthcare system.","504",NA
"Para ello impulsaremos, entre otras, las siguientes medidas: Aprobaremos una nueva Estrategia Nacional de Nutrición, Actividad Física y Prevención de la Obesidad, con atención especial a la población infantil.","To this end, we will promote, among others, the following measures: We will approve a new National Strategy for Nutrition, Physical Activity and Obesity Prevention, with special attention to the child population.","504",NA
"Incorporaremos la educación nutricional en todas las escuelas y promoveremos una alimentación saludable entre nuestros jóvenes.","We will incorporate nutrition education in all schools and promote healthy eating among our youth.","504",NA
"Dentista gratis hasta los 16 años en toda España.","Free dentist up to 16 years of age throughout Spain.","504",NA
"Instauraremos un Servicio de Salud Bucodental público para que todos los menores de 16 años tengan las mismas prestaciones bucodentales en todo el territorio nacional.","We will establish a public Oral Health Service so that all children under 16 years of age will have the same oral health services throughout the national territory.","504",NA
"Propondremos una ley nacional de prevención y atención integral en materia de drogas y adicciones.","We will propose a national law on prevention and comprehensive care for drugs and addictions.","504",NA
"Garantizaremos una atención adecuada en toda España para la plena recuperación y reinserción social de las personas afectadas por adicciones.","We will guarantee adequate care throughout Spain for the full recovery and social reintegration of people affected by addictions.","504",NA
"Actuaremos para reducir la prevalencia del juego entre los más jóvenes y vulnerables, limitando la publicidad de juegos y apuestas can los mismos criterios que can el tabaco y el alcohol.","We will act to reduce the prevalence of gambling among the youngest and most vulnerable, limiting the advertising of games and bets with the same criteria as for tobacco and alcohol.","403",NA
"Aprobaremos una ley de derechos de las personas con trastornos mentales para acabar con la estigmatización que sufren.","We will pass a law on the rights of people with mental disorders to end the stigmatization they suffer.","503",NA
"Incorporaremos los servicios de psicología en la Atención Primaria de toda España","We will incorporate psychology services in Primary Care throughout Spain","504",NA
"y elaboraremos un Plan Nacional de Prevención del Suicidio.","and we will develop a National Suicide Prevention Plan.","504",NA
"Lucharemos contra las pseudoterapias sin ninguna evidencia científica.","We will fight against pseudotherapies without any scientific evidence.","403",NA
"Aprobaremos una ley General de Publicidad Sanitaria y modificaremos el Código Penal para perseguir a quienes induzcan al abandono de tratamientos médicos por pseudoterapias que pongan en riesgo la salud de los pacientes.","We will pass a General Law on Health Advertising and we will amend the Penal Code to prosecute those who induce the abandonment of medical treatments for pseudotherapies that put patients' health at risk.","403",NA
"Pondremos fin a las pseudoterapias en los medios de comunicación públicos.","We will put an end to pseudotherapies in the public media.","403",NA
"Regularemos el cannabis terapéutico, siguiendo las recomendaciones de las sociedades científicas acordes con la evidencia terapéutica.","We will regulate therapeutic cannabis, following the recommendations of scientific societies in accordance with the therapeutic evidence.","605.2",NA
"Acabaremos con la discriminación que todavía sufren las personas portadoras del VIH en nuestro país.","We will put an end to the discrimination still suffered by people living with HIV in our country.","503",NA
"Los centros médicos deberán realizar la prueba de detección del VIH de forma anónima.","Medical centers should perform the HIV test anonymously.","503",NA
"Prohibiremos cualquier discriminación, en el acceso al empleo por ser portador de esta enfermedad.","We will prohibit any discrimination in access to employment because of being a carrier of this disease.","503",NA
"Liderar la España del S.XXI: más libertad, más igualdad, más modernidad","Leading the Spain of the 21st century: more freedom, more equality, more modernity","H",NA
"1. Garantizaremos unas pensiones dignas y unos servicios sociales que no dejen a nadie atrás","1. We will guarantee decent pensions and social services that leave no one behind.","H",NA
"119. Propondremos una solución que garantice el poder adquisitivo de las pensiones de nuestros padres y nuestros hijos.","119. We will propose a solution that guarantees the purchasing power of our parents' and children's pensions.","504",NA
"Recuperaremos el Pacto de Toledo para buscar el consenso sobre una reforma que permita mantener el poder adquisitivo de las pensiones presentes y futuras y garantizar la sostenibilidad del sistema en el largo plazo.","We will recover the Toledo Pact to seek consensus on a reform that will maintain the purchasing power of present and future pensions and guarantee the long-term sustainability of the system.","504",NA
"120. Implantaremos la Tarjeta Social para disponer de información sobre los beneficiarios de prestaciones sociales en toda España.","120. We will implement the Social Card to provide information on the beneficiaries of social benefits throughout Spain.","504",NA
"Fomentaremos un acuerdo con las CCAA para la interconexión de sus bases de datos y cruzar información que permita conocer las prestaciones sociales que recibe cada persona para mejorar la complementariedad y atajar posibles fraudes.","We will promote an agreement with the Autonomous Regions for the interconnection of their databases and cross-referencing of information that will make it possible to know the social benefits received by each person in order to improve complementarity and tackle possible fraud.","303",NA
"121. Armonizaremos las rentas mínimas de inserción social en toda España para luchar eficazmente y de manera igualitaria contra la exclusión social.","121. We will harmonize minimum social insertion incomes throughout Spain in order to fight effectively and equally against social exclusion.","504",NA
"Hasta la fecha, cada Comunidad Autónoma ha desarrollado su propia renta mínima de inserción social, con distintas características, cuantías y requisitos para su acceso.","To date, each Autonomous Community has developed its own minimum social insertion income, with different characteristics, amounts and requirements for access.","302",NA
"Fijaremos unos requisitos comunes para todas estas prestaciones","We will establish common requirements for all these benefits","302",NA
"y estableceremos su financiación conjunta por las CCAA y el Estado.","and we will establish their joint financing by the Autonomous Regions and the State.","504",NA
"122. Fomentaremos el Tercer Sector Social y el voluntariado como recursos complementarios a los servicios sociales públicos.","122. We will promote the Third Social Sector and volunteerism as complementary resources to public social services.","606.1",NA
"Pondremos en marcha nuevos programas de financiación, como los bonos de impacto social, para que el Tercer Sector Social pueda responder a los retos actuales.","We will implement new financing programs, such as social impact bonds, so that the Third Social Sector can respond to current challenges.","403",NA
"Abriremos un Centro Nacional de Referencia de Formación e Innovación en Políticas Sociales y Voluntariado.","We will open a National Reference Center for Training and Innovation in Social Policies and Volunteering.","606.1",NA
"Impulsaremos un Servicio Nacional de Voluntariado en proyectos sociales, culturales, ambientales y de interés general, siguiendo el modelo del Servicio Voluntario Europeo.","We will promote a National Volunteer Service in social, cultural, environmental and general interest projects, following the model of the European Voluntary Service.","606.1",NA
"2. Autonomía personal y accesibilidad universal: atención a la dependencia y la discapacidad","2. Personal autonomy and universal accessibility: care for dependence and disability.","H",NA
"123. Garantizaremos la atención a la dependencia en toda España.","123. We will guarantee dependency care throughout Spain.","504",NA
"Incrementaremos recursos y llevaremos a cabo, en coordinación con las CCAA, un proceso de evaluación permanente de los resultados de la ley de Dependencia para garantizar unos estándares comunes de calidad en toda España.","We will increase resources and carry out, in coordination with the Autonomous Regions, a permanent evaluation process of the results of the Dependency Law to guarantee common quality standards throughout Spain.","504",NA
"Impulsaremos la ampliación de la atención a la dependencia a las personas que padezcan enfermedades mentales severas.","We will promote the extension of dependency care to people suffering from severe mental illness.","504",NA
"Apostaremos por la asistencia a domicilio","We will support home assistance","504",NA
"y desarrollaremos la regulación de los servicios personales y domésticos, siguiendo el modelo del 'cheque-servicio' francés, contribuyendo a su vez al afloramiento de empleos que hoy forman parte la economía sumergida.","and develop the regulation of personal and domestic services, following the model of the French 'service check', contributing in turn to the emergence of jobs that today are part of the underground economy.","403",NA
"124. Garantizaremos la igualdad y la plena inclusión social de las personas con discapacidad.","124. We will guarantee equality and full social inclusion of people with disabilities.","503",NA
"Daremos cumplimiento a los compromisos adquiridos por España con la firma de la Convención internacional sobre los derechos de las personas con discapacidad.","We will comply with the commitments acquired by Spain with the signing of the International Convention on the Rights of Persons with Disabilities.","201.2",NA
"En ese sentido, impulsaremos las siguientes medidas: Aprobaremos un nuevo Plan Nacional de Accesibilidad y Desafío Universal, garantizando la plena accesibilidad a los servicios públicos y sanitarios con carácter prioritario.","In this regard, we will promote the following measures: We will approve a new National Accessibility and Universal Challenge Plan, guaranteeing full accessibility to public and health services as a priority.","504",NA
"Reconoceremos la sordoceguera como discapacidad única, estableciendo los medios necesarios para garantizar la plena inclusión social de las personas sordociegas.","We will recognize deafblindness as a unique disability, establishing the necessary means to guarantee the full social inclusion of deafblind people.","503",NA
"Modificaremos la legislación civil y procesal para asegurar la máxima autonomía en la toma de decisiones de las personas que tienen su capacidad jurídica salvaguardada con medidas de protección, asegurando que respeten siempre sus derechos, su voluntad y preferencias personales, medidas que serán proporcionales y adaptadas a las circunstancias de la persona.","We will amend civil and procedural legislation to ensure maximum autonomy in the decision-making of persons whose legal capacity is safeguarded by protective measures, ensuring that their rights, will and personal preferences are always respected, measures that will be proportional and adapted to the person's circumstances.","503",NA
"Aprobaremos una ley para erradicar la esterilización forzosa o no consentida de personas con discapacidad incapacitadas judicialmente para garantizar el respeto a su dignidad y derechos.","We will pass a law to eradicate forced or non-consensual sterilization of judicially incapacitated persons with disabilities to ensure respect for their dignity and rights.","201.2",NA
"Promoveremos un Plan de Empleo con Apoyo para favorecer la inserción laboral de las personas con discapacidad, que incluya el aumento de los fondos para los Centros Especiales de Empleo (CEE), al menos, para compensar la reciente subida del salario mínima, y elevar hasta el 10% el cupo de reserva en el empleo público.","We will promote a Supported Employment Plan to favor the labor insertion of people with disabilities, including an increase in funds for Special Employment Centers (CEE), at least to compensate for the recent increase in the minimum wage, and to raise the reserve quota in public employment to 10%.","504",NA
"3. Una mayor protección y bienestar para los animales como muestra de una sociedad más humana","3. Greater protection and welfare for animals as a sign of a more humane society.","H",NA
"125. Promoveremos una ley de Bienestar y Protección Animal que elevara las penas previstas para el abandono y maltrato de animales.","We will promote an Animal Welfare and Protection Law that will increase the penalties for animal abandonment and mistreatment.","501",NA
"Garantizaremos el buen trato a los animales en toda España, estableciendo medidas que promuevan la adopción, eviten el sacrificio de ejemplares sanos y reduzcan el abandono.","We will guarantee the good treatment of animals throughout Spain, establishing measures to promote adoption, avoid the sacrifice of healthy animals and reduce abandonment.","501",NA
"Promoveremos las reformas necesarias para que los animales de compañía gocen de una categoría especial en nuestro Código Civil y dejen de ser considerados como ""cosas"" por el ordenamiento jurídico.","We will promote the necessary reforms so that companion animals enjoy a special category in our Civil Code and are no longer considered as ""things"" by the legal system.","501",NA
"Cuidar nuestro país para nuestros hijos y nuestros nietos","Taking care of our country for our children and grandchildren","H",NA
"1. Innovación y competitividad para hacer frente at cambio climático","1. Innovation and competitiveness to address climate change","H",NA
"126. Promoveremos una ley de Cambio Climático y Transición Energética que garantice la seguridad jurídica y la no dependencia de combustibles fósiles.","126. We will promote a Climate Change and Energy Transition Law that guarantees legal certainty and non-dependence on fossil fuels.","416.2",NA
"Impulsaremos una transformación hacia un modelo energético basado en energías renovables en 2050.","We will promote a transformation towards an energy model based on renewable energies by 2050.","416.2",NA
"Desarrollaremos un modelo de subasta para la introducción de energías renovables basado en criterios de eficacia tecnológica y eficiencia económica y su programación con un calendario estable.","We will develop an auction model for the introduction of renewable energies based on criteria of technological effectiveness and economic efficiency and its programming with a stable schedule.","416.2",NA
"Garantizaremos un marco jurídico estable y seguro con una adecuada rentabilidad razonable para los inversores en tecnologías renovables que sufrieron los recortes arbitrarios de los gobiernos del PSOE y el PP.","We will guarantee a stable and secure legal framework with an adequate and reasonable return for investors in renewable technologies that suffered the arbitrary cutbacks of the PSOE and PP governments.","416.2",NA
"127. Despolitizaremos el Consejo de Seguridad Nuclear para garantizar la independencia y credibilidad de este organismo regulador.","We will depoliticize the Nuclear Safety Council to guarantee the independence and credibility of this regulatory body.","202.1",NA
"Reformaremos el método de elección de sus miembros, que deberán ser elegidos entre personas con formación y experiencia acreditada en las funciones del regulador","We will reform the method of election of its members, who must be chosen from among persons with training and accredited experience in the functions of the regulator","202.1",NA
"128. Promoveremos la eficiencia energética a través de la rehabilitación de 300.000 viviendas al año.","128. We will promote energy efficiency through the rehabilitation of 300,000 homes per year.","416.2",NA
"Los nuevos inmuebles y todos los edificios e instalaciones públicas se construirán bajo estándares de ""consumo casi nulo"".","New buildings and all public buildings and facilities will be built to ""nearly zero consumption"" standards.","416.2",NA
"129. Bajaremos un tercio la factura de la luz eliminando impuestos e impulsando la competencia, para que España deje de tener uno de los costes de la electricidad más altos de la Unión Europea.","129. We will lower the electricity bill by a third by eliminating taxes and promoting competition, so that Spain will no longer have one of the highest electricity costs in the European Union.","403",NA
"Eliminaremos de la tarifa eléctrica los costes heredados de la nefasta gestión del PP y del PSOE","We will eliminate from the electricity tariff the costs inherited from the nefarious management of the PP and the PSOE","305.1",NA
"y premiaremos la eficiencia en el consumo para reducir su precio en más de un 30%.","and we will reward efficiency in consumption to reduce its price by more than 30%.","416.2",NA
"Plantearemos una senda de reducción tanto de la deuda tarifaria como de los costes políticos que suponen la mitad de la factura de los hogares.","We will propose a path to reduce both the tariff debt and the political costs that account for half of the household bill.","403",NA
"130. Reformaremos el sistema de tarifa eléctrica para hacerla más transparente, estable, predecible y promover la competitividad de nuestra industria.","We will reform the electricity tariff system to make it more transparent, stable, predictable and promote the competitiveness of our industry.","403",NA
"Para ello, entre otras medidas: Aprobaremos un Estatuto del Consumidor Electrointensivo que reconozca las dificultades específicas de este tipo de industrias e introduzca mecanismos que favorezcan su competitividad en el mercado internacional.","To this end, among other measures: We will approve an Electro-intensive Consumer Statute that recognizes the specific difficulties of this type of industry and introduces mechanisms that favor its competitiveness in the international market.","403",NA
"Fomentaremos los contratos bilaterales de entrega de energía eléctrica (conocidos como PPA) para las industrias electrointensivas.","We will encourage bilateral power delivery contracts (known as PPAs) for electro-intensive industries.","403",NA
"Aumentaremos los mecanismos de compensación de costes de emisiones de gases de efecto invernadero, condicionando dicha ayuda a la implementación de medidas de eficiencia energética e innovación por parte de nuestra industria.","We will increase the mechanisms for compensating the costs of greenhouse gas emissions, making such aid conditional on the implementation of energy efficiency and innovation measures by our industry.","416.2",NA
"131. Pondremos en marcha un ambicioso Plan Nacional de Reforestación con el objetivo de plantar 36 árboles por cada español al final de la legislatura.","131. We will implement an ambitious National Reforestation Plan with the goal of planting 36 trees for every Spaniard by the end of the legislature.","501",NA
"Este esfuerzo en reforestación de casi 500 millones de árboles permitirá contribuir además a la preservación de la biodiversidad, luchar contra el cambio climático como si se sustituyesen 100.000 vehículos a motor y promover la creación de empleos estables y dignos en nuestro medio rural.","This reforestation effort of almost 500 million trees will also contribute to the preservation of biodiversity, combat climate change as if 100,000 motor vehicles were replaced, and promote the creation of stable and dignified jobs in our rural areas.","501",NA
"132. Intensificaremos la coordinación para la prevención y extinción de los incendios que cada año asolan nuestros bosques.","We will intensify coordination for the prevention and extinction of the fires that ravage our forests every year.","501",NA
"Aprobaremos un Plan Nacional de Prevención de Incendios y una ley General de Emergencias que establezca los mecanismos de planificación y coordinación de los diferentes Servicios de Prevención, Extinción de Incendios y Salvamento en toda España.","We will approve a National Fire Prevention Plan and a General Emergency Law that establishes the planning and coordination mechanisms for the different Fire Prevention, Fire Fighting and Rescue Services throughout Spain.","501",NA
"133. Profundizaremos en el desarrollo del medio rural unido a la protección de nuestros espacios protegidos y la biodiversidad española.","133. We will deepen the development of the rural environment together with the protection of our protected areas and Spanish biodiversity.","501",NA
"Aseguraremos la protección de las Zonas de Especial Conservación, los Parques Nacionales y Naturales y los demás espacios protegidos por la Red Natural 2000.","We will ensure the protection of Special Areas of Conservation, National and Natural Parks and other areas protected by the Natural 2000 Network.","501",NA
"Crearemos una Red de Parques Subacuáticos y Marinos.","We will create a Network of Underwater and Marine Parks.","501",NA
"Impulsaremos Planes de Recuperación y Conservación de las especies protegidas y los planes de gestión para todas las especies invasoras en nuestro país.","We will promote Recovery and Conservation Plans for protected species and management plans for all invasive species in our country.","501",NA
"2. Promover un mejor aprovechamiento de los recursos","2. Promote a better use of resources","H",NA
"134. Promoveremos una ley de Economía Circular para reducir al mínimo los residuos a vertedero (zero waste to Landfill), a través de: Prohibir los productos de plástico de un solo uso, como las bolsas, vajillas, cuberterías, bastoncillos o envases de poliestireno expandido.","134. We will promote a Circular Economy law to minimize waste to landfill, through: Banning single-use plastic products, such as bags, tableware, cutlery, swabs or expanded polystyrene containers.","416.2",NA
"Reducir los descartes y desperdicios alimentarios.","Reduce food discards and food waste.","416.2",NA
"Incrementar el reciclaje de residuos domésticos mediante el fomento de su recogida selectiva.","To increase the recycling of domestic waste by promoting selective collection.","416.2",NA
"135. Actualizaremos el Plan Hidrológico Nacional, adaptándolo at reto del cambio climático y escenarios 2030-2050.","135. We will update the National Hydrological Plan, adapting it to the challenge of climate change and the 2030-2050 scenarios.","501",NA
"Mejoraremos la gestión, la depuración y la reutilización de aguas urbanas, el aumento de las inversiones, la interrelación de cuencas, la integración de desaladoras, las demarcaciones hidrográficas y administraciones territoriales, a través de:","We will improve the management, purification and reuse of urban water, the increase in investments, the interrelation of basins, the integration of desalination plants, river basin districts and territorial administrations, through:","501",NA
"Un plan de ayudas para cuencas altamente eficientes en su uso del agua, pero deficitarias actualmente, dependientes de trasvases o acuíferos, para desarrollar recursos propios sostenibles ambiental y económicamente.","An aid plan for basins that are highly efficient in their use of water, but currently in deficit, dependent on transfers or aquifers, to develop environmentally and economically sustainable resources of their own.","416.2",NA
"Un plan de ayudas para cuencas ineficientes en su uso del agua, para que adopten mejores prácticas y tecnologías que permitan mejorar la calidad de las aguas y mejorar la gestión de los recursos hídricos.","An aid plan for basins that are inefficient in their use of water, so that they adopt better practices and technologies to improve water quality and water resource management.","501",NA
"Un plan para la recuperación de acuíferos para cerrar el ciclo del agua, persiguiendo los pozos ilegales,","A plan for the recovery of aquifers to close the water cycle, pursuing illegal wells,","501",NA
"y controlar la extensión de regadíos no planificados, así como los desarrollos urbanísticos descontrolados.","and controlling the extension of unplanned irrigation, as well as uncontrolled urban development.","416.2",NA
"Revisaremos el reparto competencial en materia ambiental y de agua para asegurar una mayor eficacia y coordinación de todas las administraciones públicas,","We will review the distribution of competencies in environmental and water matters to ensure greater efficiency and coordination of all public administrations, we","303",NA
"fortaleceremos las herramientas de actuación del Estado con la creación de un organismo regulador nacional del agua.","will strengthen the State's tools for action with the creation of a national water regulatory body.","302",NA
"Un compromiso del Estado para combatir la despoblación","A State commitment to combat depopulation","H",NA
"1. Nuestros compromisos","1. Our commitments","H",NA
