"text","text_en","cmp_code","eu_code"
"lili Así pues, si se emprendiera a nivel estatal la Reforma de la Constitución Española, demandaremos la modificación de la Disposición Adicional Tercera de la Constitución -la referida al REF canario- progresando en el Estado mediante el reconocimiento de la lejanía e insularidad como hechos diferenciales, incorporando los principios como región ultraperiférica de la Unión Europea y determinando la modulación de las políticas del Estado hacia el Archipiélago.","lili Thus, if the Reform of the Spanish Constitution were to be undertaken at the State level, we will demand the modification of the Third Additional Provision of the Constitution -the one referring to the Canarian REF- progressing in the State through the recognition of remoteness and insularity as differential facts, incorporating the principles as an outermost region of the European Union and determining the modulation of State policies towards the Archipelago.","301",NA
"Esa modificación sería el marco idóneo para demandar un Estatuto especial para Canarias.","This modification would be the ideal framework to demand a special Statute for the Canary Islands.","301",NA
"Es cómo hacer viable dentro del Estado español los mecanismos que nos permitan el desarrollo como pueblo en el Atlántico medio.","It is how to make viable within the Spanish State the mechanisms that allow us to develop as a people in the mid-Atlantic.","301",NA
"Es un hecho, acentuado durante la crisis económica, que el poder legislativo y financiero estatal -acompañado por una restrictiva interpretación del Tribunal Constitucional- ha dejado casi vacía de contenido la Disposición Adicional Tercera de la Constitución negando el carácter vinculante al informe que el Parlamento de Canarias ha de emitir sobre las modificaciones del REF, propiciando su vaciado mediante leyes ordinarias, ignorando su fundamento histórico (un trato diferente para un territorio fruto de la expansión atlántica del Reino de Castilla hacia América) y su redefinición en el Derecho primario europeo con el reconocimiento como RUP.","It is a fact, accentuated during the economic crisis, that the legislative and financial power of the State -accompanied by a restrictive interpretation of the Constitutional Court- has left the Third Additional Provision of the Constitution almost empty of content, denying the binding nature of the report that the Parliament of the Canary Islands has to issue on the modifications of the REF, favoring its emptying by means of ordinary laws, ignoring its historical basis (a different treatment for a territory resulting from the Atlantic expansion of the Kingdom of Castile towards America) and its redefinition in the European primary law with the recognition as RUP.","301",NA
"La modificación de la Disposición Adicional Tercera dándole el contenido que requiere -a semejanza del TFUE-será la norma esencial para que el Gobierno y las Cortes Generales de España respeten nuestros hechos diferenciales en un Estatuto especial para Canarias.","The modification of the Third Additional Provision, giving it the required content -like the TFEU- will be the essential rule for the Government and the Spanish Parliament to respect our differential facts in a special Statute for the Canary Islands.","301",NA
"Es insertar nuestra posición asimétrica, a través de esa modificación , dentro de un modelo federal del Estado.","It is to insert our asymmetric position, through this modification, within a federal model of the State.","301",NA
"En todo caso, en tanto no se proceda a esa reforma constitucional, es un objetivo prioritario un nuevo Estatuto de Autonomía de Canarias.","In any case, until this constitutional reform is carried out, a new Statute of Autonomy of the Canary Islands is a priority objective.","301",NA
"Tras el frustrado intento de reforma en 2007, el Parlamento de Canarias ha remitido a las Cortes Generales un nuevo texto estatutario que impulsaremos en la medida en que, en el Estado, se den condiciones políticas para su aprobación.","After the frustrated attempt at reform in 2007, the Parliament of the Canary Islands has submitted to the Cortes Generales a new statutory text that we will promote to the extent that, in the State, the political conditions for its approval are met.","301",NA
"UNA VOZ PROPIA PARA DEFENDER NUESTRAS SINGULARIDADES EN EUROPA","A VOICE OF OUR OWN TO DEFEND OUR UNIQUENESS IN EUROPE","H",NA
"Desde Coalición Canaria, reivindicamos una Europa unida en la diversidad, más eficaz, más democrática, más transparente y más solidaria, y que respete las singularidades de sus territorios más alejados.","From Coalición Canaria, we demand a Europe that is united in diversity, more efficient, more democratic, more transparent and more supportive, and that respects the singularities of its most remote territories.","108",NA
"Seguiremos defendiendo un estatuto particular de Canarias en torno al concepto de regiones ultraperiféricas (RUP) como grupo diferenciado con una realidad que no se parece, en ningún caso, a la de otras regiones de la UE. ••","We will continue to defend a special status for the Canary Islands based on the concept of outermost regions (ORs) as a distinct group with a reality that in no way resembles that of other EU regions. --","301",NA
"Promoveremos un Reglamento general para las RUP y, de cara al futuro, propiciaremos un debate abierto y constructivo con la sociedad canaria sobre las distintas posibilidades de evolución del estatuto jurídico de Canarias en la UE, analizando su factibilidad, sus ventajas y sus inconvenientes, y extrayendo las conclusiones que procedan.","We will promote a general regulation for the ORs and, with a view to the future, we will encourage an open and constructive debate with Canarian society on the different possibilities for the evolution of the legal status of the Canary Islands in the EU, analyzing its feasibility, advantages and disadvantages, and drawing the appropriate conclusions.","301",NA
"Y lo haremos con una voz propia, defendiendo la participación directa de Canarias en los asuntos que le afectan y estableciendo un diálogo directo con las instituciones europeas, los estados miembros y las demás RUP. ••","And we will do so with our own voice, defending the direct participation of the Canary Islands in the matters that affect them and establishing a direct dialogue with the European institutions, the member states and the other outermost regions. --","301",NA
"Abogaremos por el establecimiento definitivo de la circunscripción autonómica para el proceso electoral al Parlamento Europeo.","We will advocate for the definitive establishment of the autonomic constituency for the electoral process to the European Parliament.","301",NA
"En esa eventual modificación, Canarias debe ser una circunscripción electoral propia, en la que se elijan tres eurodiputados, dado que es el único territorio del Estado con estatus diferenciado en la UE.","In this eventual modification, the Canary Islands should be a constituency of its own, in which three MEPs are elected, given that it is the only territory of the State with a differentiated status in the EU.","301",NA
"•• Seguiremos liderando la cooperación con las demás regiones en el marco de la Conferencia de Presidentes de Regiones Ultraperiféricas, y acogeremos la celebración de la misma en Canarias en 2018 e impulsando, si procede, la elaboración de un nuevo Memorándum conjunto.","-- We will continue to lead cooperation with the other regions in the framework of the Conference of Presidents of the Outermost Regions, and we will host the Conference in the Canary Islands in 2018 and promote, if appropriate, the drafting of a new joint Memorandum.","108",NA
"•• Impulsaremos el diálogo con la Administración General del Estado en asuntos europeos, tanto a través de la Conferencia para Asuntos con la Unión Europea (CARUE), como mediante encuentros y mecanismos de coordinación bilaterales. ••","-- We will promote dialogue with the General State Administration on European affairs, both through the Conference for Affairs with the European Union (CARUE) and through bilateral meetings and coordination mechanisms. --","108",NA
"Propugnaremos el incremento y la intensificación de la presencia de las Comunidades Autónomas en todas las formaciones del Consejo de la Unión Europea, de manera particular cuando afecte en materias de su competencia.","We will advocate the increase and intensification of the presence of the Autonomous Communities in all the formations of the Council of the European Union, particularly when it affects matters within their competence.","301",NA
"•• Seguiremos manteniendo la actividad de la Delegación de Canarias en Bruselas actuando permanentemente ante las instituciones europeas. ••","-- We will continue to maintain the activity of the Delegation of the Canary Islands in Brussels, acting permanently before the European institutions. --","108",NA
"Defenderemos el mantenimiento de un Consejero encargado de asuntos ultraperiféricos propuesto por el Gobierno de Canarias en la Representación Permanente de España ante la UE.","We will defend the maintenance of a Councilor in charge of outermost affairs proposed by the Government of the Canary Islands in the Permanent Representation of Spain to the EU.","108",NA
"ACCIÓN EXTERIOR E INTERNACIONALIZACIÓN DE LA ECONOMÍA","EXTERNAL ACTION AND INTERNATIONALIZATION OF THE ECONOMY","H",NA
"En nuestras relaciones con el Gobierno de España, propiciaremos la definición de objetivos comunes y el impulso conjunto de actuaciones estratégicas para Canarias en el ámbito exterior, a través del establecimiento de planes estratégicos y la participación en consorcios como Casa África o la ZEC.","In our relations with the Government of Spain, we will promote the definition of common objectives and the joint promotion of strategic actions for the Canary Islands abroad, through the establishment of strategic plans and participation in consortiums such as Casa África or the ZEC.","107",NA
"•• Reforzaremos el papel del Consejo Asesor para la promoción del comercio con África Occidental (CAPCAO), y solicitaremos una mayor implicación del gobierno nacional a través de los Ministerios de Economía, Fomento y Exteriores. ••","-- We will strengthen the role of the Advisory Council for the Promotion of Trade with West Africa (CAPCAO), and request greater involvement of the national government through the Ministries of Economy, Development and Foreign Affairs. --","408",NA
"Propiciaremos la condición de Canarias como Plataforma de Paz y fomentaremos esta circunstancia para la cooperación con África Occidental.","We will promote the status of the Canary Islands as a Peace Platform and encourage this circumstance for cooperation with West Africa.","106",NA
"•• Impulsaremos la internacionalización de las empresas canarias por medio de iniciativas encaminadas a fomentar la promoción comercial, la capacitación empresarial, las exportaciones de bienes y de servicios, la participación en licitaciones internacionales y el establecimiento en el exterior.","-- We will promote the internationalization of Canary Islands companies through initiatives aimed at encouraging trade promotion, business training, exports of goods and services, participation in international tenders and establishment abroad.","406",NA
"•• Reclamaremos una mayor participación de las empresas canarias en los programas y herramientas estatales -ICEX Next, FIEM, créditos ICO, Cofides, España Expansión Exterior o programas de conversión de deuda en países africanos- a través de una adaptación a sus necesidades y de una especialización en los sectores y países en los que la empresa canaria presenta ventajas comparativas.","-- We will demand a greater participation of Canary Islands companies in state programs and tools -ICEX Next, FIEM, ICO credits, Cofides, España Expansión Exterior or debt conversion programs in African countries- through an adaptation to their needs and a specialization in the sectors and countries in which Canary Islands companies have comparative advantages.","408",NA
"•• Potenciaremos la red europea Enterprise Europe Network (EEN), de la que Canarias forma parte y que tiene como objetivo principal ayudar a las Pymes a mejorar su potencial innovador y a ser más competitivas, e incluye entre sus actuaciones el apoyo a la cooperación empresarial y tecnológica, y el fomento de la internacionalización, así como la participación de las empresas canarias en el nuevo Programa para la Competiti-vidad de las Empresas y las Pyme (Cosme) 2014-2020.","-- We will strengthen the European Enterprise Europe Network (EEN), of which the Canary Islands is a member and whose main objective is to help SMEs to improve their innovative potential and become more competitive, and which includes among its actions support for business and technological cooperation and the promotion of internationalization, as well as the participation of Canary Islands companies in the new Program for the Competitiveness of Enterprises and SMEs (Cosme) 2014-2020.","402",NA
"Canarias, plataforma atlántica","Canary Islands, Atlantic platform","H",NA
"•• Promoveremos la idea de Canarias como plataforma atlántica, como factor de atracción de inversiones exteriores que ponga en valor sus ventajas comparativas, destacando las oportunidades del archipiélago como plataforma atlántica de negocios, operaciones y servicios, y como laboratorio natural para la investigación, desarrollo y ensayo de tecnologías verdes.","-- We will promote the idea of the Canary Islands as an Atlantic platform, as a factor for attracting foreign investment that highlights its comparative advantages, emphasizing the archipelago's opportunities as an Atlantic platform for business, operations and services, and as a natural laboratory for research, development and testing of green technologies.","410",NA
"•• Realizaremos una campaña de promoción internacional de Canarias como centro de servicios hacía África y fortaleceremos la marca de ""Canary Islands, European Business Hub in África"" como centro de transbordo marítimo, centro logístico, nodo de telecomunicaciones, centro de tránsito aéreo, laboratorio natural, sede de centros corporativos y personal expatriado, centro de reparación y avituallamiento de plataformas y buques, centro de servicios para residentes en África, y centro humanitario. ••","-- We will carry out an international promotion campaign of the Canary Islands as a service center towards Africa and strengthen the brand of ""Canary Islands, European Business Hub in Africa"" as a maritime transshipment center, logistics center, telecommunications node, air transit center, natural laboratory, headquarters for corporate centers and expatriate personnel, repair and provisioning center for platforms and ships, service center for residents in Africa, and humanitarian center. --","408",NA
"Intensificaremos las gestiones con las instituciones internacionales más relevantes para darles a conocer la oferta y la experiencia de Canarias como plataforma de ayuda humanitaria.","We will intensify our efforts with the most relevant international institutions to make them aware of the offer and the experience of the Canary Islands as a platform for humanitarian aid.","107",NA
"•• Promoveremos la competitividad de nuestras estructuras de transporte portuarias y aeroportuarias, así como la conectividad marítima y aérea, y favoreceremos un papel más activo de los aeropuertos y defendiendo medidas como la reducción de las tasas aeroportuarias y la gestión por parte de Canarias de sus propios aeropuertos.","-- We will promote the competitiveness of our port and airport transport structures, as well as maritime and air connectivity, and we will favor a more active role for airports and defend measures such as the reduction of airport taxes and the management by the Canary Islands of its own airports.","411",NA
"Trabajaremos para conseguir que el archipiélago consiga la Quinta Libertad, de tal manera que se facilite a las compañías aéreas establecer conexiones con Canarias. ••","We will work to ensure that the archipelago achieves the Fifth Freedom, in order to make it easier for airlines to establish connections with the Canary Islands. --","411",NA
"Defenderemos la puesta en funcionamiento de nuevos cables submarinos que enlacen Europa, África y América a través de Canarias, y que sean capaces de contribuir a convertir a las islas en un punto de encuentro de conectividad fiable y de alta disponibilidad con el oeste de África.","We will defend the implementation of new submarine cables linking Europe, Africa and America through the Canary Islands, which will be able to contribute to making the islands a meeting point for reliable and high availability connectivity with West Africa.","411",NA
"••","--",NA,NA
"Convertiremos a Canarias en un referente atlántico del conocimiento en áreas de especial relevancia en nuestro entorno.","We will turn the Canary Islands into an Atlantic benchmark of knowledge in areas of special relevance in our environment.","411",NA
"••","--",NA,NA
"Fomentaremos el campus tricontinental de las dos universidades canarias, así como la labor de las instituciones y entidades canarias, tanto públicas como privadas, como centros de especialización y transferencia de conocimiento en los países de nuestro entorno.","We will promote the tricontinental campus of the two Canarian universities, as well as the work of Canarian institutions and entities, both public and private, as centers of expertise and knowledge transfer in our neighboring countries.","411",NA
"•• Pondremos en práctica una política de atracción de inversiones que ponga en valor las ventajas de Canarias como laboratorio natural en materias como la astrofísica y el espacio, las ciencias marítimo-marinas, la biotecnología, las energías renovables o el ámbito audiovisual, entre otros.","-- We will put into practice a policy of investment attraction that will highlight the advantages of the Canary Islands as a natural laboratory in areas such as astrophysics and space, maritime-marine sciences, biotechnology, renewable energies or the audiovisual field, among others.","411",NA
"UNA COOPERACIÓN ESTRATÉGICA PARA EL DESARROLLO E INMIGRACIÓN","STRATEGIC COOPERATION FOR DEVELOPMENT AND IMMIGRATION","H",NA
"Impulsar la cooperación al desarrollo implica intentar fijar objetivos de acción pública que abandonamos en el contexto de la profunda crisis.","Boosting development cooperation implies trying to set public action objectives that we abandoned in the context of the deep crisis.","107",NA
"Impulsaremos esta línea en el marco de mejora de las disponibilidades presupuestarias y, en todo caso, garantizaremos la cofinanciación de los programas europeos de cooperación territorial de los que formamos parte.","We will promote this line within the framework of the improvement of the budgetary availabilities and, in any case, we will guarantee the co-financing of the European programs of territorial cooperation of which we are part.","107",NA
"•• En el mismo sentido que la Comunicación que el Gobierno presentó a la cámara en la VIII Legislatura, entendemos desde Coalición Canaria que la política de cooperación al desarrollo sigue siendo un elemento importante para la creación de un área de crecimiento económico y comercial.","-- In the same sense as the Communication that the Government presented to the House in the VIII Legislature, we, from Coalición Canaria, understand that the policy of cooperation for development continues to be an important element for the creation of an area of economic and commercial growth.","107",NA
"Si bien su finalidad última es la lucha contra la pobreza, indirectamente la mejora de las condiciones de vida, el acceso a la sanidad y la educación, la cualificación para el ejercicio de una profesión, el fortalecimiento de las instituciones y la capacitación de las administraciones contribuyen a crear un entorno favorable a la actividad económica, y reforzar la seguridad jurídica y el Estado de Derecho. ••","While its ultimate aim is to combat poverty, indirectly, the improvement of living conditions, access to health and education, professional qualifications, the strengthening of institutions and the empowerment of administrations contribute to creating a favorable environment for economic activity, and to reinforcing legal certainty and the rule of law. --","107",NA
"Sahara Occidental: Coalición Canaria comparte la necesidad de encontrar, en el seno de las Naciones Unidas, una solución política justa, duradera y mutuamente aceptable entre las partes conforme a las diferentes Resoluciones de la ONU.","Western Sahara: Coalición Canaria shares the need to find, within the United Nations, a just, lasting and mutually acceptable political solution between the parties in accordance with the various UN resolutions.","107",NA
"Con respeto a ese marco, seguirá impulsando la ayuda humanitaria a los desplazados y promoverá acciones culturales y de difusión de la lengua española en colaboración con las instituciones estatales, en el territorio del Sáhara.","Within this framework, it will continue to promote humanitarian aid to displaced persons and will promote cultural activities and the dissemination of the Spanish language in collaboration with state institutions in the Saharan territory.","107",NA
"••","--",NA,NA
"Este año han llegado más de 700 mil personas a Europa, la inmensa mayoría potenciales solicitantes de asilo.","More than 700,000 people have arrived in Europe this year, the vast majority of them potential asylum seekers.","201.2",NA
"La situación de los refugiados no es una emergencia coyuntural.","The refugee situation is not a temporary emergency.","201.2",NA
"Es una realidad que deberá afrontar la Unión Europea en los próximos años y por tanto debe empezar a diseñar una política estable.","This is a reality that the European Union will have to face in the coming years and must therefore begin to design a stable policy.","201.2",NA
"••","--",NA,NA
"La respuesta no puede ser únicamente el blindaje de nuestras fronteras.","The answer cannot only be the shielding of our borders.","201.2",NA
"Es un parche insuficiente que nunca podrá atajar el flujo de personas dispuestas a morir en su huida desesperada hacia un mundo que le ofrezca una vida digna.","It is an insufficient stopgap that can never stem the flow of people willing to die in their desperate flight to a world that offers them a dignified life.","201.2",NA
"Además de aumentar los medios materiales y humanos en las zonas fronterizas, con el apoyo de la UE, la respuesta más eficaz a medio y largo plazo es la cooperación internacional para la creación de empleo en sus países de origen. ••","In addition to increasing material and human resources in border areas, with the support of the EU, the most effective response in the medium and long term is international cooperation for job creation in their countries of origin. --","107",NA
"Se debe abordar seriamente en el seno de las organizaciones internacionales la lucha contra las mafias organizadas que se lucran con el tráfico de personas, cuyas redes se extienden a nuestro propio país, garantizar el estricto cumplimiento del derecho de asilo, velar por el respeto de las normas que dicta la Comisión Europea de Derechos Humanos.","The fight against organized mafias that profit from human trafficking, whose networks extend to our own country, must be seriously addressed within international organizations, guaranteeing strict compliance with the right to asylum and ensuring respect for the standards dictated by the European Commission on Human Rights.","201.2",NA
"SEGURIDAD","SECURITY","H",NA
"La Ley 9/2007 del Sistema Canario de Seguridad y Emergencias constituye el marco legal en el que se asienta nuestra acción en materia de seguridad pública.","Law 9/2007 of the Canary Islands Security and Emergency System constitutes the legal framework on which our action in the field of public security is based.","605.1",NA
"Se trata de garantizar el concepto de Seguridad como un bien público determinante para el progreso de una Comunidad, en un modelo que atienda a las singularidades del territorio canario -lejanía e insularidad-, a la población residente y a los turistas que nos visitan y que sustentan nuestra economía.","It is a question of guaranteeing the concept of Security as a determining public good for the progress of a Community, in a model that takes into account the singularities of the Canary Islands territory -remote and insularity-, the resident population and the tourists that visit us and sustain our economy.","605.1",NA
"La crisis ha ralentizado los avances producidos en esta materia por imposibilidad presupuestaria.","The crisis has slowed down the progress made in this area due to budgetary constraints.","605.1",NA
"Proponemos, de aquí en adelante, fortalecer la estructura de Seguridad y Protección Civil, ya que la seguridad también forma parte de las políticas de Bienestar Social a las que el Gobierno ha de atender y es una expresión de autogobierno que los nacionalistas canarios tenemos que promover.","We propose, from now on, to strengthen the structure of Security and Civil Protection, since security is also part of the Social Welfare policies to which the Government has to pay attention and is an expression of self-government that we, the Canary Islands nationalists, have to promote.","605.1",NA
