"text","text_en","cmp_code","eu_code"
"La decisión del Gobierno del Estado de no actualizar el sistema de financiación ha agrandado la brecha entre Canarias y la media del resto del Estado.","The decision of the State Government not to update the financing system has widened the gap between the Canary Islands and the average of the rest of Spain.","301",NA
"Coalición Canaria reclamará en la próxima legislatura que el Gobierno del Estado afronte, junto a todas las Comunidades Autónomas, un debate que no puede seguir aplazando: la reforma del sistema de financiación autonómica.","Coalición Canaria will demand in the next legislature that the State Government, together with all the Autonomous Communities, face a debate that can no longer be postponed: the reform of the autonomous financing system.","301",NA
"El objetivo es que se consensue un sistema que sea más justo y equilibrado con Canarias.","The objective is to reach a consensus on a system that is fairer and more balanced with the Canary Islands.","301",NA
"Canarias, una comunidad cumplidora en los objetivos de déficit fijados por el Ministerio de Hacienda en esta legislatura, exigirá igualdad de trato en el horizonte financiero de los próximos años.","The Canary Islands, a community that complies with the deficit targets set by the Ministry of Finance in this legislature, will demand equal treatment in the financial horizon for the coming years.","414",NA
"No puede existir un tratamiento diferenciado en favor de aquellas autonomías que no han seguido los mismos criterios de prudencia en sus finanzas.","There cannot be a differentiated treatment in favor of those autonomous regions that have not followed the same criteria of prudence in their finances.","414",NA
"Al mismo tiempo, seguiremos reivindicando una financiación equitativa para abordar nuestros compromisos en política social.","At the same time, we will continue to demand equitable funding to address our social policy commitments.","504",NA
"Lo que defenderemos, ni más ni menos, es la igualdad de trato, y este principio debe ser aplicable a la negociación de la nueva financiación autonómica, pues la actual es manifiestamente injusta para las Islas en asignación de recursos por habitante.","What we will defend, no more and no less, is equal treatment, and this principle must be applicable to the negotiation of the new autonomic financing, since the current one is manifestly unfair to the Islands in the allocation of resources per inhabitant.","301",NA
"El actual sistema nos mantiene a la cola en los ingresos estatales para sufragar la sanidad, la educación y los servicios sociales y, además, amplifica con el paso del tiempo las diferencias entre Canarias y el resto del Estado.","The current system keeps us at the tail end of the state income to pay for health, education and social services and, in addition, amplifies the differences between the Canary Islands and the rest of the State over time.","301",NA
"Los agravios no desaparecen por sí solos y, mucho menos, se ocultan huyendo del debate.","Grievances do not go away on their own, much less hide by fleeing the debate.","301",NA
"Los agravios se corrigen equilibrando los recursos independientemente de que sean pocos o muchos porque lo que está en juego es la equidad y el principio de igualdad de todos los ciudadanos.","Grievances are corrected by balancing resources regardless of whether they are few or many because what is at stake is equity and the principle of equality of all citizens.","301",NA
"Existen razones más que de sobra para pedir responsabilidad y altura de miras, sobre todo cuando abordamos fondos vitales para el futuro del Estado.","There are more than enough reasons to ask for responsibility and a clear vision, especially when we are dealing with funds that are vital for the future of the State.","000",NA
"Está en juego el Estado del bienestar que tanto esfuerzo nos ha costado alcanzar y que debemos garantizar a toda costa.","At stake is the welfare state that we have worked so hard to achieve and that we must guarantee at all costs.","504",NA
"Y está en juego el actual modelo territorial, que se resquebraja por el inmovilismo y la ausencia de soluciones políticas.","And at stake is the current territorial model, which is cracking due to immobility and the absence of political solutions.","301",NA
"EL REF QUE NOS PERMITIRÁ CRECER","THE REF THAT WILL ALLOW US TO GROW","H",NA
"El Régimen Económico y Fiscal de Canarias (REF) es el resultado de un proceso histórico que ha pretendido siempre hacer frente a las dificultades derivadas de la insularidad y fragmentación del Archipiélago, de la lejanía de los mercados continentales europeo y americano y de escasez de recursos naturales.","The Economic and Fiscal Regime of the Canary Islands (REF) is the result of a historical process that has always sought to address the difficulties arising from the insularity and fragmentation of the Archipelago, the remoteness of the European and American continental markets and the scarcity of natural resources.","408",NA
"Ha tenido como objetivo hacer frente a nuestras carencias y a conseguir maximizar nuestras ventajas de situación respecto al comercio internacional.","It has been aimed at addressing our shortcomings and maximizing our advantages in terms of international trade.","408",NA
"Hemos dado un paso importante con la reforma de los aspectos fiscales del REF.","We have taken an important step forward with the reform of the fiscal aspects of the REF.","408",NA
"Disponemos de nuevos instrumentos que tendrán que ser necesariamente promocionados por el Gobierno del Estado en el exterior para que Canarias se consolide como un referente económico en el Atlántico Medio.","We have new instruments that will necessarily have to be promoted by the State Government abroad in order to consolidate the Canary Islands as an economic reference in the Mid-Atlantic.","408",NA
"Nuestro reto en la próxima legislatura será concluir la redacción y aprobación de los aspectos económicos del REF.","Our challenge in the next legislature will be to conclude the drafting and approval of the economic aspects of the REF.","408",NA
"El Parlamento de Canarias aprobó una comunicación del Gobierno de Canarias sobre los incentivos económicos del REF, que Coalición Canaria defenderá en la próxima legislatura en el Congreso y en el Senado.","The Parliament of the Canary Islands approved a communication from the Government of the Canary Islands on the economic incentives of the REF, which Coalición Canaria will defend in the next legislature in Congress and the Senate.","408",NA
"Las medidas que se deben incluir son las siguientes:","The measures to be included are as follows:","408",NA
"•• En el ámbito del transporte, debe destacarse su consideración como un servicio público esencial, especialmente en lo que se refiere al transporte de personas, actualizando la cuantía de las subvenciones,","-- In the area of transportation, its consideration as an essential public service should be emphasized, especially with regard to the transportation of persons, updating the amount of subsidies,","504",NA
"posibilitando una mayor compensación de determinadas situaciones económicas y sociales singulares","enabling a greater compensation of certain unique economic and social situations","504",NA
"y garantizando el principio de continuidad territorial, incluso introduciendo la posibilidad de fijar precios máximos de los billetes si lo exigen razones imperiosas de interés general de mecanismo de la Obligación de Servicio Público (OSP).","and guaranteeing the principle of territorial continuity, even introducing the possibility of setting maximum ticket prices if imperative reasons of general interest of the Public Service Obligation (PSO) mechanism so require.","412",NA
"•• Se debe subrayar el carácter esencial de los puertos y aeropuertos canarios para la cohesión económica, social y territorial del archipiélago, asegurar su tratamiento diferenciado dentro de la política general de transportes","-- The essential nature of the Canary Islands' ports and airports for the economic, social and territorial cohesion of the archipelago must be emphasized, and their differentiated treatment within the general transport policy must be ensured.","411",NA
"y garantizar la participación de las instituciones de la Comunidad Autónoma de Canarias en la planificación y gestión del modelo portuario y aeroportuario.","and guarantee the participation of the institutions of the Autonomous Community of the Canary Islands in the planning and management of the port and airport model.","301",NA
"•• Ha de apostarse decididamente por medidas que incentiven una mayor conectividad de Canarias, facilitando su papel como centro de distribución de tráficos aéreos entre tres continentes, en particular mediante la aplicación de la quinta libertad del aire y de la renovación de las autorizaciones requeridas para que los poderes públicos puedan incentivar con carácter permanente el desarrollo de nuevas rutas.","-- A firm commitment must be made to measures that encourage greater connectivity of the Canary Islands, facilitating its role as a hub for air traffic between three continents, in particular through the application of the fifth freedom of the air and the renewal of the authorizations required so that the public authorities can provide permanent incentives for the development of new routes.","411",NA
"La quinta libertad es una herramienta fundamental para permitir vuelos de escala o la creación de ""hubs"" internacionales, facilitando el movimiento de tráfico entre tres países o continentes ya que permite, por ejemplo, que una aeronave despegue de un hipotético Estado A; embarque o desembarque viajeros, correo y carga, en un Estado B, antes de continuar al destino final en un Estado C, de tal forma, que en la última parte del trayecto sea una continuación del vuelo inicial y no una simple escala técnica.","The fifth freedom is a fundamental tool to allow stopover flights or the creation of international hubs, facilitating the movement of traffic between three countries or continents since it allows, for example, an aircraft to take off from a hypothetical State A, embark or disembark passengers, mail and cargo in a State B, before continuing to the final destination in a State C, so that the last part of the journey is a continuation of the initial flight and not a simple technical stopover.","411",NA
"Un ejemplo sería un vuelo entre Singapur y Sao Paulo, en Brasil, con una parada en Canarias que permita embarcar y desembarcar pasajeros y mercancías.","An example would be a flight between Singapore and Sao Paulo, Brazil, with a stop in the Canary Islands, allowing passengers and cargo to embark and disembark.","411",NA
"•• Se debe impulsar, asimismo, la consolidación y actualización del sistema de compensaciones al coste efectivo del transporte marítimo y aéreo de mercancías interinsular y entre las islas Canarias y la Península y el resto de la Unión Europea.","-- The consolidation and updating of the system of compensation for the effective cost of inter-island maritime and air transport of goods and between the Canary Islands and the Peninsula and the rest of the European Union must also be promoted.","411",NA
"•• En el ámbito de las telecomunicaciones, se han de compensar adecuadamente los sobrecostes que garanticen el acceso de toda la población de Canarias a la sociedad del conocimiento, la información y la comunicación en condiciones similares de calidad y precio a las existentes en el resto del territorio nacional, incluyendo la necesidad de equiparar a la población de Canarias en disponibilidad y condiciones de acceso a todo tipo de servicios audiovisuales de banda ancha.","-- In the field of telecommunications, overcosts must be adequately compensated to guarantee access for the entire population of the Canary Islands to the knowledge, information and communication society under similar conditions of quality and price to those existing in the rest of the national territory, including the need to equalize the availability and conditions of access to all types of broadband audiovisual services for the population of the Canary Islands.","411",NA
"•• Otro de los objetivos prioritarios debe ser asegurar la moderación de los precios de la energía en Canarias, manteniendo precios equivalentes a los del resto del territorio español, y estableciendo para ello un marco regulatorio energético propio que se adapte a la condición de región ultraperiférica de Canarias y que asegure la viabilidad y estabilidad del sistema eléctrico. ••","-- Another of the priority objectives must be to ensure the moderation of energy prices in the Canary Islands, maintaining prices equivalent to those of the rest of Spain, and establishing an energy regulatory framework that is adapted to the Canary Islands' status as an outermost region and that ensures the viability and stability of the electricity system. --","412",NA
"Se propone, asimismo, elaborar y poner en marcha un Plan para la implantación de un nuevo modelo energético basado en las energías renovables","It is also proposed to develop and implement a plan for the implementation of a new energy model based on renewable energies.","416.2",NA
"y poner en marcha un Plan de optimización y ahorro de consumos energéticos y de agua, con una política tarifaria que prime el uso racional y el ahorro.","and implement a plan to optimize and save energy and water consumption, with a pricing policy that prioritizes rational use and savings.","416.2",NA
"•• Se ha de establecer un marco regulador específico y medidas de apoyo financiero que promuevan la auto-generación y el autoconsumo de energía basado en energías renovables.","-- A specific regulatory framework and financial support measures must be established to promote self-generation and self-consumption of energy based on renewable energies.","416.2",NA
"•• Se deben introducir medidas sobre gestión, valorización, reciclaje y descontaminación de los residuos en Canarias financiando, cuando no sea de aplicación la responsabilidad ampliada del productor, los costes de traslado de los residuos desde las otras islas hasta la isla donde exista planta de tratamiento, y en su caso, hasta la península, cuando no sea posible su tratamiento en el Archipiélago aplicando, cuando ello sea posible, el principio general de proximidad en la política sobre gestión y tratamiento de residuos en Canarias. lili ••","-- Measures on waste management, recovery, recycling and decontamination should be introduced in the Canary Islands, financing, when extended producer responsibility is not applicable, the costs of transporting waste from the other islands to the island where there is a treatment plant and, where appropriate, to the mainland, when treatment is not possible in the archipelago, applying, where possible, the general principle of proximity in the policy on waste management and treatment in the Canary Islands. lili --","501",NA
"Ha de procurarse un sistema de compensación consignado anualmente en los Presupuestos Generales del Estado para que la población de Canarias pague unos precios equivalentes al resto del territorio nacional por la utilización de agua desalinizada, regenerada o reutilizada.","An annual compensation system must be established in the General State Budget so that the population of the Canary Islands pays prices equivalent to those of the rest of the national territory for the use of desalinated, regenerated or reused water.","412",NA
"••","--",NA,NA
"En el ámbito de la promoción comercial, se propone reforzar la promoción de los productos elaborados en Canarias","In the area of trade promotion, it is proposed to strengthen the promotion of products made in the Canary Islands.","406",NA
"y dar un nuevo impulso al Consejo Asesor para la Promoción del Comercio con África Occidental, ampliando su composición e incluyendo asimismo dentro de su campo de acción la estrategia de potenciación de Canarias como plataforma atlántica en sus distintas dimensiones. ••","and give new impetus to the Advisory Council for the Promotion of Trade with West Africa, expanding its composition and also including within its scope of action the strategy of promoting the Canary Islands as an Atlantic platform in its various dimensions. --","408",NA
"Se han de establecer nuevos planes de promoción turística; en concreto, un Plan Estratégico del Turismo que además tenga en cuenta las consecuencias de la estacionalidad para favorecer el mantenimiento de la actividad económica y el empleo;","New tourism promotion plans must be established; specifically, a Strategic Tourism Plan that also takes into account the consequences of seasonality in order to favor the maintenance of economic activity and employment;","410",NA
"un Plan específico de Formación Profesional en el sector turístico, en el que se dé especial importancia, además de los idiomas, a la utilización de las nuevas tecnologías;","a specific Professional Training Plan for the tourism sector, in which, in addition to languages, special importance is given to the use of new technologies;","411",NA
"y un Plan de Inversiones Públicas en infraestructuras en las áreas turísticas, dotado financieramente en los Presupuestos Generales del Estado y gestionado por la Comunidad Autónoma de Canarias.","and a Public Investment Plan for infrastructures in tourist areas, financially endowed in the General State Budget and managed by the Autonomous Community of the Canary Islands.","411",NA
"•• Dentro de la difusión y fomento del turismo deben adoptarse medidas económicas orientadas a la protección y defensa del paisaje y patrimonio histórico y cultural de Canarias, con el objetivo de lograr un modelo de desarrollo sostenible, respetuoso con el medio ambiente y con el patrimonio cultural canario. ••","-- Within the diffusion and promotion of tourism, economic measures should be adopted aimed at the protection and defense of the landscape and historical and cultural heritage of the Canary Islands, with the objective of achieving a model of sustainable development, respectful of the environment and the cultural heritage of the Canary Islands. --","416.2",NA
"En los incentivos económicos regionales han de primar la inversión en las islas con una prima adicional cuando los proyectos se desarrollen en islas no capitalinas.","Regional economic incentives must give priority to investment in the islands with an additional premium when the projects are developed in non-capital islands.","402",NA
"Además de a las pequeñas y medianas empresas, debe prestarse especial apoyo a las cooperativas y empresas de economía social y primar la creación de empleo de calidad.","In addition to small and medium-sized enterprises, special support should be given to cooperatives and social economy enterprises and priority should be given to the creation of quality employment.","403",NA
"Se ha de promover asimismo la aplicación del principio de responsabilidad social de las empresas en las entidades beneficiarías de incentivos económicos regionales, habilitando al Gobierno de Canarias para modificar los requisitos de dimensión y autofinanciación exigidos a los proyectos de inversión y para definir los sectores y actividades prioritarias.","The application of the principle of corporate social responsibility must also be promoted in the entities benefiting from regional economic incentives, empowering the Government of the Canary Islands to modify the size and self-financing requirements for investment projects and to define the priority sectors and activities.","416.2",NA
"•• En el ámbito de la creación de empleo, el Estado debe financiar un Plan Integral de Empleo que, partiendo de la consideración de Canarias como región ultraperiférica de la UE, apueste por el empleo de calidad, tenga en cuenta las singularidades del mercado laboral canario y que incluya medidas específicas de protección social para colectivos vulnerables en situación de desempleo.","-- In the area of job creation, the State should finance an Integral Employment Plan which, based on the consideration of the Canary Islands as an outermost region of the EU, is committed to quality employment, takes into account the singularities of the Canary Islands labor market and includes specific measures of social protection for vulnerable groups in a situation of unemployment.","701",NA
"•• Se debe incluir un nuevo artículo dentro del REF dedicado a las universidades, destacando su importancia como centros de referencia al servicio del desarrollo económico y social del Archipiélago y su necesaria vinculación a la economía productiva de Canarias, articulando un mecanismo de financiación que contribuya a esa misión.","-- A new article should be included within the REF dedicated to the universities, highlighting their importance as centers of reference at the service of the economic and social development of the Archipelago and their necessary link to the productive economy of the Canary Islands, articulating a financing mechanism that contributes to this mission.","410",NA
"Se debe potenciar el papel de las universidades como centros de conocimiento de referencia en su ámbito geográfico.","The role of universities as centers of knowledge of reference in their geographical area should be strengthened.","411",NA
"En este contexto, han de establecerse programas para el desarrollo de actividades docentes, de investigación y cooperación al desarrollo en los que intervengan las universidades establecidas en Canarias e instituciones europeas y de otros países, especialmente con terceros países vecinos y otras regiones ultra-periféricas. ••","In this context, programs should be established for the development of teaching, research and development cooperation activities involving universities established in the Canary Islands and European institutions and those of other countries, especially with neighboring third countries and other ultra-peripheral regions. --","107",NA
"Es necesario favorecer, en especial, la movilidad de estudiantes y profesores.","It is necessary to favor, in particular, the mobility of students and professors.","506",NA
"Los estudiantes y profesores de las universidades canarias han de tener derecho a una ayuda económica suplementaria para compensar los costes adicionales de la lejanía, equivalente a los gastos de transporte desde su lugar de residencia hasta el de destino, en los programas de investigación, formación y movilidad.","Students and professors of Canarian universities should be entitled to supplementary financial aid to compensate for the additional costs of distance, equivalent to the cost of transportation from their place of residence to their destination, in research, training and mobility programs.","506",NA
"•• Es prioritario establecer un programa específico de becas de estudio para los estudiantes canarios que no encuentren en su isla de residencia la oferta educativa que demanden.","-- It is a priority to establish a specific program of study grants for Canarian students who cannot find the educational offer they require on their island of residence.","506",NA
"Asimismo, debe potenciarse un programa específico de becas de desplazamiento para los jóvenes canarios que hayan finalizado su formación profesional y que realicen prácticas en empresas peninsulares y en cualquier otro Estado miembro de la Unión Europea.","Likewise, a specific program of travel grants should be promoted for young Canary Islanders who have completed their professional training and who carry out internships in companies on the Spanish mainland and in any other member state of the European Union.","411",NA
"••","--",NA,NA
"Se han de ejecutar asimismo Planes de Formación Profesional para el Empleo dirigidos prioritariamente a trabajadores ocupados.","Vocational Training Plans for Employment must also be implemented, aimed primarily at employed workers.","411",NA
"•• Es necesario incluir medidas específicas dirigidas al sector primario con los objetivos de alcanzar una mayor capacidad de autoabastecimiento y garantizar el futuro y el desarrollo a largo plazo de los sectores agrícola y ganadero de Canarias en su condición de región ultraperiférica.","-- It is necessary to include specific measures aimed at the primary sector with the objectives of achieving a greater capacity for self-sufficiency and guaranteeing the future and long-term development of the agricultural and livestock sectors of the Canary Islands as an outermost region.","703.1",NA
"•• En este contexto, para garantizar la competitividad de estos sectores, el Gobierno de España debe consignar anualmente en los Presupuestos Generales del Estado una dotación suficiente para garantizar la totalidad de la financiación adicional de las medidas de fomento de las producciones agrícolas locales autorizada por la Unión Europea en el marco del Programa de Opciones Específicas de Alejamiento e Insularidad (Posei).","-- In this context, in order to guarantee the competitiveness of these sectors, the Spanish Government must annually allocate sufficient funds in the General State Budget to guarantee all the additional financing for measures to promote local agricultural production authorized by the European Union within the framework of the Program of Specific Options for Remoteness and Insularity (Posei).","703.1",NA
