"text","text_en","cmp_code","eu_code"
"•• Activar la obligación de servicio público, estableciendo un precio máximo para las compañías que operen en los trayectos Canarias-Península para que se eliminen las diferencias que, por lejanía, suponen los precios en el transporte aéreo, especialmente en fechas señaladas. ••","-- Activate the public service obligation, establishing a maximum price for companies operating on the Canary Islands-Peninsula routes in order to eliminate the differences in air transport prices due to distance, especially on special dates. --","412",NA
"El establecimiento de la OSP para la isla de La Palma que garantice la conectividad diaria con Madrid y Barcelona.","The establishment of the OSP for the island of La Palma to guarantee daily connectivity with Madrid and Barcelona.","411",NA
"••","--",NA,NA
"Una nueva regulación y mejor aprovechamiento de las subvenciones al transporte.","A new regulation and better use of transport subsidies.","411",NA
"Incremento de las bonificaciones a los pasajeros en las rutas de débil tráfico, sobre todo en las islas de menor población, hasta un 75% del precio del billete.","Increased passenger bonuses on routes with low traffic, especially on the less populated islands, up to 75% of the ticket price.","411",NA
"•• La ampliación a todos los países de la UE del descuento de residente en el billete aéreo para los residentes en Canarias.","-- The extension to all EU countries of the resident discount on airline tickets for residents of the Canary Islands.","411",NA
"•• Recuperar las bonificaciones al transporte de mercancías agrícolas e industriales hasta el 100% del coste del transporte, aplicando un nuevo sistema de bonificación más eficaz que permita que el ahorro repercuta en el precio final del producto.","-- To recover the subsidies for the transport of agricultural and industrial goods up to 100% of the cost of transport, applying a new, more effective system of subsidies that will allow the savings to be passed on to the final price of the product.","411",NA
"•• Desarrollar la estrategia de captación de tráficos aéreos con EEUU, Latinoamérica y África que convierta a Canarias en un hub aéreo;","-- Develop a strategy to attract air traffic to the United States, Latin America and Africa that will turn the Canary Islands into an air hub;","411",NA
"para ello es necesario la inserción dentro del REF de la declaración del régimen de quinta libertad del aire de todos los aeropuertos internacionales canarios así como el Segundo Registro de Aeronaves.","For this purpose, it is necessary to include in the REF the declaration of the fifth freedom of the air regime for all international airports in the Canary Islands, as well as the Second Aircraft Registry.","411",NA
"•• Ayudas al lanzamiento de nuevas rutas tanto aéreas como marítimas (dentro de las autopistas del mar) y la bonificación de todas las operaciones de concentración y distribución de tráficos, potenciando el papel como 'hub' o plataforma logística entre continentes. ••","-- Aid for the launching of new air and sea routes (within the freeways of the sea) and subsidies for all traffic concentration and distribution operations, promoting the role of a hub or logistics platform between continents. --","411",NA
"Mejorar la conectividad de la isla del Hierro en términos de calidad y regularidad en la prestación del servicio de transporte marítimo.","Improve the connectivity of the island of El Hierro in terms of quality and regularity in the provision of maritime transport services.","411",NA
"•• Buscar mecanismos y ayudas que mejoren la exportación de los productos producidos en Canarias hacía los países terceros, haciendo más competitiva la industria y los productos agrícolas y ganaderos. ••","-- Seek mechanisms and aid to improve the export of products produced in the Canary Islands to third countries, making industry and agricultural and livestock products more competitive. --","406",NA
"Recuperar para el interés público los aeropuertos canarios, concebidos como red específica, en la que las administraciones públicas canarias y los agentes económicos y sociales de Canarias jueguen un papel determinante en su estrategia comercial y de desarrollo de estas infraestructuras (segunda pista de Tenerife Sur y Gando, ampliación de las pistas de Lanzarote y el Hierro).","To recover the Canary Islands airports for the public interest, conceived as a specific network, in which the Canary Islands public administrations and the economic and social agents of the Canary Islands play a decisive role in their commercial strategy and the development of these infrastructures (second runway at Tenerife Sur and Gando, extension of the Lanzarote and El Hierro runways).","411",NA
"••","--",NA,NA
"En Canarias no se puede aplicar la suficiencia financiera de las infraestructuras de puertos y aeropuertos cuando en los territorios continentales no son exigibles para carreteras o trenes de alta velocidad, por lo que sus déficits deben ser compensados para que no pierdan competitividad.","In the Canary Islands, the financial sufficiency of port and airport infrastructures cannot be applied when in continental territories they are not required for roads or high-speed trains, so their deficits must be compensated so that they do not lose competitiveness.","411",NA
"••","--",NA,NA
"La transferencia de la competencia en transporte aéreo interinsular, que permita al Gobierno de Canarias fijar los precios de la obligación de servicio público aéreo.","The transfer of competence in inter-island air transport, allowing the Government of the Canary Islands to set the prices of the public air service obligation.","301",NA
"•• Completar el desarrollo de la red de puertos, aeropuertos, carreteras, zonas logísticas e intercambiadores, en consonancia con las necesidades de conectividad de cada isla y de éstas con el resto, y la inserción de estas infraestructuras dentro de la Red Transeuropea de Transportes.","-- Complete the development of the network of ports, airports, roads, logistic areas and interchanges, in accordance with the connectivity needs of each island and of these with the rest, and the insertion of these infrastructures within the Trans-European Transport Network.","411",NA
"UN PACTO NO IDEOLÓGICO POR UNA EDUCACIÓN DE CALIDAD","A NON-IDEOLOGICAL PACT FOR QUALITY EDUCATION","H",NA
"Los próximos años serán decisivos en la configuración del futuro de Canarias en un marco social, político y económico donde nuestras islas deben definir el encaje de las tendencias de carácter global que se manifiestan en su entorno inmediato.","The coming years will be decisive in shaping the future of the Canary Islands in a social, political and economic framework in which our islands must define how they fit in with the global trends that are evident in their immediate environment.","000",NA
"Para ello es imprescindible que nuestra gente y, especialmente, nuestra juventud, esté en condiciones de participar activamente en el desarrollo del autogobierno,","To this end, it is essential that our people, and especially our youth, be in a position to actively participate in the development of self-government,","301",NA
"de liderar el futuro, de impulsar un crecimiento ligado a la calidad, la competitividad y la innovación,","to lead the future, to drive growth linked to quality, competitiveness and innovation,","410",NA
"comprometido con la sostenibilidad, la cohesión social","committed to sustainability, social cohesion","416.2",NA
"y la identidad canaria como expresión de coherencia con nuestro territorio, nuestra situación, nuestra historia y nuestra cultura.","and the Canarian identity as an expression of coherence with our territory, our situation, our history and our culture.","301",NA
"Así seremos capaces de aprovechar las oportunidades de nuestra realidad archipielágica, nuestra naturaleza tri-continental y nuestra posición en el atlántico medio, para convertirnos en referentes para los pueblos de nuestro entorno más próximo, participar y cooperar en su desarrollo y ofrecer un espacio para compartir el liderazgo y la proyección internacional de nuestras relaciones profesionales, económicas, culturales y sociales.","In this way we will be able to take advantage of the opportunities of our archipelagic reality, our tri-continental nature and our position in the mid-Atlantic, to become a reference for the people of our immediate surroundings, to participate and cooperate in their development and to offer a space to share the leadership and international projection of our professional, economic, cultural and social relations.","107",NA
"Sin embargo, ese futuro de progreso sólo será posible si mantenemos a la Educación como uno de los ejes esenciales del diseño del modelo de desarrollo y de construcción nacional de Canarias,","However, this future of progress will only be possible if we maintain Education as one of the essential axes of the design of the model of development and national construction of the Canary Islands,","506",NA
"uno de los ejes sobre el que sustentar el crecimiento económico y la cohesión social,","one of the pillars on which to sustain economic growth and social cohesion,","410",NA
"uno de los ejes desde donde se posibilite la formación y mejora de nuestro capital humano","one of the axes from which the training and improvement of our human capital is made possible.","411",NA
"y desde donde se promueva la construcción de valores, el conocimiento de nuestro patrimonio y la defensa de nuestra identidad.","and from where the construction of values, the knowledge of our heritage and the defense of our identity are promoted.","301",NA
"Es esto lo que nos hace concebir a la Educación como un aspecto esencial de nuestra propuesta programática, al entenderla como un elemento central y un sector estratégico que debe abordar las distintas perspectivas que confluyen en su definición como motor de cambio, pero cuyas propuestas deben contar con la idea de que su financiación debe ser asumida también como una inversión estratégica, su gestión como un referente de autonomía, sostenibilidad y eficiencia, así como sus indicadores como garantía de equidad y mejora continua de su calidad.","This is what makes us conceive Education as an essential aspect of our programmatic proposal, understanding it as a central element and a strategic sector that must address the different perspectives that converge in its definition as an engine of change, but whose proposals must take into account the idea that its financing must also be assumed as a strategic investment, its management as a benchmark of autonomy, sustainability and efficiency, as well as its indicators as a guarantee of equity and continuous improvement of its quality.","506",NA
"Una de esas perspectivas, la social, se deriva de su consideración como derecho universal, lo que determina su inclusión dentro de los parámetros que definen los indicadores de calidad de vida y de desarrollo humano, por ello, hacer posible esa dimensión social de la educación como ámbito en el que se compensen desigualdades y se garantice la equidad en el acceso a la educación de todas las personas, independientemente de su edad, su procedencia, su lugar de nacimiento, etcétera, ha de ser un aspecto esencial del sistema educativo canario.","One of these perspectives, the social one, derives from its consideration as a universal right, which determines its inclusion within the parameters that define the indicators of quality of life and human development. Therefore, making possible this social dimension of education as an area in which inequalities are compensated and equity in access to education is guaranteed for all people, regardless of their age, origin, place of birth, etc., must be an essential aspect of the Canarian educational system.","506",NA
"Por otra parte, su carácter capacitador incorpora una vinculación directa con la mejora del capital humano y con su papel en la definición de un nuevo modelo de desarrollo como el que se pretende para nuestra tierra.","On the other hand, its enabling character incorporates a direct link with the improvement of human capital and with its role in the definition of a new development model such as the one intended for our land.","411",NA
"Así pues, la conexión entre el sistema educativo y el productivo es también un aspecto esencial, en la medida que la mejora de la cualificación y la facilitación del acceso al empleo, establecen que la formación constituye el principal motor de cambio en las perspectivas económicas de quienes se incorporan al mercado de trabajo y un factor de calidad en la conformación de un nuevo modelo de desarrollo.","Thus, the connection between the education system and the productive system is also an essential aspect, insofar as improving qualifications and facilitating access to employment establishes that training is the main driver of change in the economic prospects of those entering the labor market and a quality factor in the shaping of a new development model.","411",NA
"Esta doble perspectiva preside nuestro enfoque de la Educación y su encaje dentro de las políticas sociales como factor de cohesión de igualdad, agente de transformación y de emancipación,","This dual perspective presides over our approach to education and its place within social policies as a factor of cohesion and equality, an agent of transformation and emancipation,","506",NA
"así como su alineamiento entre los ejes de vertebración de un modelo de desarrollo sostenible estructurado sobre un capital humano cualificado, emprendedor e innovador y por ello también debe incluirse como parte de las políticas de empleo y de promoción económica.","as well as its alignment with the backbone of a sustainable development model structured on qualified, entrepreneurial and innovative human capital, and should therefore also be included as part of employment and economic promotion policies.","411",NA
"Pero esa Educación, con la que hemos mantenido un compromiso histórico que hizo posible la modernización de Canarias, debe responder ahora especialmente a las necesidades de nuestra tierra, de su gente, de nuestro contexto geopolítico y, sobre todo, de nuestro tiempo como pueblo y de una realidad económica marcada por la crisis que hace aún más imprescindible apostar por el crecimiento, la calidad, la competitividad, la innovación, la investigación y el desarrollo.","But that Education, with which we have maintained a historical commitment that made possible the modernization of the Canary Islands, must now respond especially to the needs of our land, its people, our geopolitical context and, above all, our time as a people and an economic reality marked by the crisis that makes it even more essential to bet on growth, quality, competitiveness, innovation, research and development.","411",NA
"Estamos convencidos de que para la sociedad canaria, la educación es el medio de transmitir y, al mismo tiempo, de renovar la cultura y el acervo de conocimientos y valores que la sustentan,","We are convinced that for Canarian society, education is the means of transmitting and, at the same time, of renewing culture and the body of knowledge and values that sustain it,","506",NA
"de fomentar la convivencia democrática y el respeto a las diferencias individuales,","to promote democratic coexistence and respect for individual differences,","202.1",NA
"de promover la solidaridad y evitar la discriminación, con el objetivo fundamental de lograr la necesaria igualdad y cohesión social.","to promote solidarity and avoid discrimination, with the fundamental objective of achieving the necessary equality and social cohesion.","503",NA
"Hemos perdido demasiados años en debates estériles, en reformas educativas marcadas por un incuestionable sello ideológico.","We have wasted too many years in sterile debates, in educational reforms marked by an unquestionable ideological stamp.","506",NA
"Siete reformas en más de 35 años no han servido para consolidar un sistema que sigue sin contar con los elementos que necesita para facilitar el tránsito del estudiante hacia el mercado laboral.","Seven reforms in more than 35 years have not served to consolidate a system that still lacks the elements it needs to facilitate students' transition to the labor market.","506",NA
"Por todo ello, plantearemos las siguientes iniciativas:","For all these reasons, we will propose the following initiatives:","506",NA
"•• Instaremos al Gobierno de España, al conjunto de las fuerzas políticas, a todos los agentes sociales a dotar de la necesaria estabilidad al sistema educativo como paso previo a un gran pacto de Estado, en torno a objetivos, prioridades y acciones,","-- We will urge the Government of Spain, all political forces, and all social agents to provide the necessary stability to the educational system as a prior step to a great State pact, based on objectives, priorities and actions,","506",NA
"garantizando en dicho marco nuestra capacidad para ampliar y desarrollar plenamente nuestras competencias educativas.","ensuring within this framework our ability to expand and fully develop our educational competencies.","301",NA
"••","--",NA,NA
"Propondremos el progresivo incremento anual de la inversión en materia educativa, estableciendo como estratégica la financiación del sistema y señalando como objetivo que, al final de la legislatura, se alcance la media de los países de la Unión Europea.","We will propose a progressive annual increase in investment in education, establishing as strategic the financing of the system and setting as an objective that, by the end of the legislature, the average of the countries of the European Union will be reached.","506",NA
"•• Conseguir el apoyo estatal para el desarrollo de mecanismos de transferencia que permitan el flujo de los nuevos conocimientos científicos, tecnológicos y de gestión derivados de la construcción, operación y mantenimiento de las grandes infraestructuras científico-técnicas hacia las empresas implantadas en Canarias al objeto de que puedan ser aprovechados para ofertar productos y servicios altamente diferenciados y competitivos.","-- To obtain state support for the development of transfer mechanisms that allow the flow of new scientific, technological and management knowledge derived from the construction, operation and maintenance of large scientific-technical infrastructures to companies located in the Canary Islands so that they can be used to offer highly differentiated and competitive products and services.","411",NA
"•• Establecer que las bases estatales permitan un mismo procedimiento administrativo de acceso y admisión en la universidad pública canaria favoreciendo el funcionamiento como Distrito Universitario Único.","-- To establish that the state bases allow the same administrative procedure for access and admission to the Canarian public university, favoring the operation as a Single University District.","506",NA
"•• Favorecer el acceso a la educación superior y a las nuevas tecnologías a todos los canarios con independencia de su lugar de residencia","-- To favor access to higher education and new technologies for all Canary Islanders regardless of their place of residence.","506",NA
"así como proyectar la acción del Gobierno en cooperación al desarrollo mediante la formación académica en países de nuestro entorno geográfico o de tradicional influencia.","as well as projecting the Government's action in development cooperation through academic training in countries of our geographical environment or of traditional influence.","107",NA
"•• Lograr que el Estado dote a Canarias de un sistema de compensación que favorezca la plena incorporación o accesibilidad a una enseñanza superior de calidad potenciando los actuales programas de becas y ayudas universitarias que sitúan a Canarias como la primera comunidad autónoma por este concepto. ••","-- To ensure that the State provides the Canary Islands with a compensation system that favors the full incorporation or accessibility to quality higher education, strengthening the current university scholarship and aid programs that place the Canary Islands as the leading autonomous community in this regard. --","506",NA
"Lograr la transferencia de la gestión de los programas de becas del Ministerio de Educación al Gobierno de Canarias.","To achieve the transfer of the management of scholarship programs from the Ministry of Education to the Government of the Canary Islands.","301",NA
"•• Potenciar las acciones que permitan aumentar la proyección internacional de las universidades canarias en el África cercana, particularmente a los países considerados prioritarios en el ámbito de la cooperación canaria: Marruecos, Mauritania, Senegal y Cabo Verde.","-- To promote actions to increase the international projection of Canary Islands universities in nearby Africa, particularly in the countries considered priorities in the field of Canary Islands cooperation: Morocco, Mauritania, Senegal and Cape Verde.","107",NA
"CONSOLIDACIÓN DE LOS SERVICIOS PÚBLICOS Y LAS POLÍTICAS SOCIALES","CONSOLIDATION OF PUBLIC SERVICES AND SOCIAL POLICIES","H",NA
"Sanidad, Educación y Políticas Sociales constituyen los tres pilares del Estado del Bienestar, que posibilitan la igualdad de oportunidades y su prestación constituye la máxima responsabilidad competencial de las comunidades autónomas en el Estado español.","Health, Education and Social Policies are the three pillars of the Welfare State, which make equal opportunities possible, and their provision is the maximum responsibility of the autonomous communities in Spain.","504",NA
"El modelo económico imperante, si no se corrige desde la política, nos lleva objetivamente a la desigualdad, a la desarticulación social, a la sociedad dual de ricos y pobres, al ensanchamiento de la brecha social que conduce inexorablemente a la inestabilidad social y política.","The prevailing economic model, if not corrected by politics, objectively leads us to inequality, to social disarticulation, to a dual society of rich and poor, to the widening of the social gap that inexorably leads to social and political instability.","503",NA
"En esta situación, solo la política entendida como servicio al interés público puede promover la primacía de la economía real sobre la economía financiera.","In this situation, only politics understood as serving the public interest can promote the primacy of the real economy over the financial economy.","606.1",NA
"Hay que impulsar medidas impositivas eficaces, de carácter progresivo, en pura justicia redistributiva que nos permita: ••","It is necessary to promote effective tax measures, of a progressive nature, in pure redistributive justice that will allow us to: --","503",NA
"Consolidar y hacer sostenible un sistema sanitario universal y gratuito.","Consolidate and make sustainable a universal and free health care system.","504",NA
"••","--",NA,NA
"Un sistema educativo que asegure la igualdad de oportunidades para todos y todas.","An education system that ensures equal opportunities for all.","506",NA
"Se trata de invertir en personas y, por lo tanto, invertir en futuro.","It is about investing in people and, therefore, investing in the future.","506",NA
"•• Garantizar un sistema de prestaciones sociales para el Bienestar Social.","-- To guarantee a system of social benefits for Social Welfare.","504",NA
"SANIDAD","HEALTH","H",NA
"Cualquier medida regresiva en la sanidad como las introducidas por el Gobierno de España: los diferentes copagos, la limitación al acceso universal, etcétera, desequilibra la vulnerable economía familiar, lo que hace que, como primera consecuencia, los pacientes abandonen los tratamientos por no poder pagar su aportación.","Any regressive measure in healthcare, such as those introduced by the Spanish Government: the various co-payments, the limitation of universal access, etc., unbalances the vulnerable family economy, which leads, as a first consequence, to patients abandoning treatment because they cannot afford to pay their contribution.","504",NA
"Cualquier medida que discrimine en el acceso convierte a las urgencias en la última tabla de salvación de los que nada tienen; cualquier merma en la financiación significa años de retroceso que impactan negativamente en los resultados de salud ya conseguidos.","Any measure that discriminates in access makes the emergency department the last lifeline for those who have nothing; any decrease in funding means years of setbacks that negatively impact health outcomes already achieved.","504",NA
"Y esto es lo que ha pasado, desgraciadamente, en los últimos años con la aplicación desde el Boletín Oficial del Estado de recortes que han descapitalizado un sistema sanitario que ya era uno de los más eficientes y equitativos del mundo, a tenor de los costes y de los resultados.","And this is what has happened, unfortunately, in recent years with the application from the Official State Gazette of cuts that have decapitalized a health system that was already one of the most efficient and equitable in the world, in view of the costs and results.","504",NA
