"text","text_en","cmp_code","eu_code"
"La hora de actuar: Contrato con el pueblo de Costa Rica","Time to act: Contract with the people of Costa Rica","H",NA
"CON FIRMEZA HACIA DELANTE","STEADILY FORWARD","H",NA
"PRINCIPALES ACCIONES PARA PONER A COSTA RICA EN MOVIMIENTO","MAIN ACTIONS TO GET COSTA RICA MOVING","H",NA
"REFLEXIÓN INICIAL","INITIAL REFLECTION","H",NA
"El bienestar de la persona humana, la familia y -por tanto- la sociedad constituyen el objetivo de nuestro actuar.","The well-being of the human person, the family and - therefore - society is the objective of our actions.","504",NA
"El fin de la acción política del Movimiento Libertario es la persona humana y la familia.","The purpose of the political action of the Libertarian Movement is the human person and the family.","504",NA
"El Estado es útil, pero no como un fin en sí mismo sino como el medio para facilitar las condiciones para que las personas y las familias logren un mayor bienestar.","The State is useful, but not as an end in itself but as a means to facilitate the conditions for individuals and families to achieve greater well-being.","504",NA
"Los libertarios creemos que todas las personas tenemos los mismos derechos","Libertarians believe that all people have the same rights","503",NA
"y que nadie debe considerarse con derecho a obligar a los demás, quo nace¬mos con libertad (libre albedno) y debemos sor res¬ponsables por las decisiones que tomemos","and that no one should consider themselves entitled to force others, that we are born with freedom (free will) and should be responsible for the decisions we make","201.2",NA
"En el Movimiento Liberiano defendemos el derecho de cada persona a escoger su forma de vida. el derecho do actuar y expresarse de la forma quo quiera sin violar derechos de nadie,","In the Liberian Movement we defend the right of each person to choose their way of life. We defend the right toact and express oneself as one wishes without violating the rights of others, the right to","201.1",NA
"el derecho de adquirir propiedad con el fruto de su trabajo y de disponer de esa propiedad en la forma quo quiera sin transgredir los derechos de otras personas,","acquire property with the fruits of one's labor and to dispose of that property as one wishes without infringing on the rights of others,","401",NA
"y defendemos el derecho de cada persona de buscar su propia felicidad.","and we defend the right of each person to pursue his or her own happiness.","201.2",NA
"En la actualidad se nota un profundo desencanto de los costarricenses con el proceso político tradicional y, para algunos, hasta con la propia democracia.","Currently, Costa Ricans are deeply disenchanted with the traditional political process and, for some, even with democracy itself.","202.1",NA
"El problema es que los dirigentes de los dos partidos que durante el ultimo medio siglo han tenido a su cargo la conducción del país, han contado con una visión equivocada de los ongenos de los asuntos quo el Estado está llamado a atender y, por tanto, de cómo hacerlo.","The problem is that the leaders of the two parties that have been in charge of running the country for the last half century have had a mistaken vision of the issues that the State is called upon to address and, therefore, of how to do it.","305.1",NA
"Los dos partidos mayontanos del pasado adoptaron prácticamente al mismo enfoque, al cual consiste en propiciar un Estado grande, desordenado, intervencionista en el quehacer de las personas y de las empresas,","The two Mayontan parties of the past adopted practically the same approach, which consisted of promoting a large, disorderly, interventionist State in the activities of individuals and companies,","401",NA
"lo cual llevó 3 muchos de los males que hoy enfrentamos alto endeudamiento del sector público, alta carga de intereses, elevada inflación y devaluación, una burocracia frondosa, cara, pero que no rinde a la población los frutos que de ella se espera.","which led to many of the ills we face today: high public sector indebtedness, high interest burden, high inflation and devaluation, a lush, expensive bureaucracy, but which does not yield to the population the fruits expected of it.","401",NA
"Hoy enfrentamos problemas de pobreza (mas de un quinto de las familias del pais son pobres), de desempleo, de alto costo de vida, de inseguridad ciudadana, educación pública deficiente,","Today we face problems of poverty (more than one fifth of the country's families are poor), unemployment, high cost of living, citizen insecurity, deficient public education,","503",NA
"infraestructura en mal estado (calles, puertos, puentes, hospitales, escuelas publicas),","infrastructure in poor condition (roads, ports, bridges, hospitals, public schools),","411",NA
"exceso de tramites para todo,","excessive paperwork for everything,","303",NA
"de privilegios para unos que los demás pagamos,","privileges for some that the rest of us pay for,","304",NA
"de corrupción de servidores y dirigentes públicos,","corruption of public servants and leaders,","304",NA
"y de un bajo crecimiento económico que no permite prever un mejorarmiento de la situación actual.","and low economic growth that does not allow us to foresee an improvement of the current situation.","410",NA
"Mas no debemos perder la confianza en el sistema político democrático","But we must not lose confidence in the democratic political system","202.1",NA
"Estamos ante problemas causados por la deficiencia y mediocridad de ciertos políticos, no del sistema","We are facing problems caused by the deficiency and mediocrity of certain politicians, not by the system","202.1",NA
"Necesitamos elegir gobernantes que estén dispuestos -dentro de las reglas democráticas- a cambiar el estilo de conducción de los asuntos públicos.","We need to elect rulers who are willing -within the democratic rules- to change the style of conducting public affairs.","202.1",NA
"Los problemas de la democracia se resuelven con más democracia.","The problems of democracy are solved with more democracy.","202.1",NA
"Debemos pasar de un esquema basado en el intervencionismo y dirigismo estatal propio de los últimos 40 ó 50 años, a uno de respeto del individuo, la familia y de promoción y protección de unos y otros","We must move from a scheme based on the interventionism and state dirigisme of the last 40 or 50 years, to one of respect for the individual, the family and the promotion and protection of each other.","202.1",NA
"El Movimiento Libertario es la única opción que permitirá a Costa Rica realizar los cambios necesarios para enderezar las cosas y enrumbar al pais por la senda del progreso acelerado, realmente compartido y sostenible","The Libertarian Movement is the only option that will allow Costa Rica to make the necessary changes to straighten things out and put the country on the path of accelerated, truly shared and sustainable progress.","305.1",NA
"La pobreza tiene causas múltiples que deben atacarse en su origen y sólo subsidianamente en sus manifestaciones","Poverty has multiple causes that must be tackled at its source and only subsidiarily in its manifestations.","503",NA
"Un mal ambiente para la formación de empresas, unido a un Estado que succiona recursos por la via de los impuestos (en particular por el más injusto de ellos la inflación),","A bad environment for the formation of companies, coupled with a State that sucks resources through taxes (particularly through the most unfair of them, inflation),","408",NA
"y que además es ineficaz con el uso de esos recursos, lleva a poca inversión, a baja creación de empleos, a bajos salarios y por ende a la pobreza y la desesperación","and is inefficient with the use of these resources, leading to low investment, low job creation, low wages and therefore poverty and despair.","503",NA
"Los libertarios abogamos por un Estado que promueva el equilibrio macroeconómico sin déficit fiscal, con baja inflación y devaluación, bajas tasas de interés que estimulen el ahorro y la inversión, y con elevados niveles de empleo.","Libertarians advocate a state that promotes macroeconomic equilibrium without fiscal deficits, with low inflation and devaluation, low interest rates that stimulate savings and investment, and high levels of employment.","414",NA
"Nunca en la historia, ni en la geografía, situaciones de desequilrbno macroeconómico (alta inflación, devaluación y desempleo, alto déficit fiscal y bajo crecimiento) han favorecido a nadie.","Never in history, nor in geography, have situations of macroeconomic imbalance (high inflation, devaluation and unemployment, high fiscal deficit and low growth) favored anyone.","414",NA
"Por el contrario, el mal manejo de las variables fundamentales de la economía ha perjudicado a todos.","On the contrary, the mismanagement of the economy's fundamentals has hurt everyone.","414",NA
"Abogamos por un crecimiento económico acelerado, que supere el promedio de las dos últimas décadas, que beneficie directa e indirectamente a todos los grupos sociales del pais,","We advocate an accelerated economic growth that exceeds the average of the last two decades, that directly and indirectly benefits all social groups in the country,","410",NA
"y que sea sostenible, es decir, que la satisfacción de las necesidades de la generación presente no atente contra la satisfacción de las necesidades de las generaciones futuras (nuestros hijos y nietos).","and that is sustainable, that is, that the satisfaction of the needs of the present generation does not jeopardize the satisfaction of the needs of future generations (our children and grandchildren).","416.2",NA
"Consideramos quo el Estado debe asegurar que servicios como la educación y salud básicas se suplan con alta calidad y eficazmente, pues se trata de servicios que van dirigidos en su mayoría a los sectores más pobres de le sociedad.","We believe that the State must ensure that services such as basic education and health care are provided with high quality and efficiently, since these services are mostly aimed at the poorest sectors of society.","504",NA
"La pobreza se perpetúa cuando no atendemos bien sus causas.","Poverty is perpetuated when we fail to address its causes.","503",NA
"También debe el Estado garantizar un entorno en que se respeten los contratos libremente suscritos por las partos,","The State must also guarantee an environment in which the contracts freely entered into by the parties are respected,","107",NA
"velar eficazmente por la seguridad ciudadana para que los niños puedan salir a jugar en las aceras y parques sin temerá -ser secuestrados, violados y hasta asesinados,","effectively ensure public safety so that children can go out to play on the sidewalks and in the parks without fear of being kidnapped, raped or even murdered,","605.1",NA
"y donde no tengamos que vivir entre rejas, pues los criminales andan libres afuera.","and where we do not have to live behind bars, since criminals roam free outside.","605.1",NA
"El Estado debe también garantizar el derecho a la Propiedad privada.","The State must also guarantee the right to private property.","401",NA
"promover la construcción y el mantenimiento de infraestructura de Interés general,","promote the construction and maintenance of infrastructure of general interest,","411",NA
"regular monopolios naturales (como puertos y aeropuertos),","regulate natural monopolies (such as ports and airports),","403",NA
"promover la libre competencia","to promote free competition","403",NA
"y coadyuvar a que en el proceso productivo y de consumo no se generen costos sociales innecesarios, como los debidos a la contaminación ambiental y al despilfarro de losrecursos naturales","and help ensure that the production and consumption process does not generate unnecessary social costs, such as those due to environmental pollution and waste of natural resources.","416.2",NA
"También debe apoyar e los miembros de la sociedad menos pnvileglados con ayudas localizadas eficaces, que le lleguen a esos sectores en lugar de ser consumidos en gastos administrativos","It must also support the less well-off members of society with effective localized aid, which reaches these sectors instead of being consumed in administrative expenses.","503",NA
"Abogamos por un Estado concentrado en lo que le corresponde, que lo haga bien, y cuyo financiamiento no sea una carga Insoportable para las personas y las empresas","We advocate for a State that concentrates on what it is supposed to do, that does it well, and whose financing is not an unbearable burden for individuals and companies.","504",NA
"Para el Movimiento Libertario le eficacia y la equidad de la labor del Estado debe medirse no por el 'gasto publico', como improcedentemente han hecho las administraciones de los partidos tradicionales, sino por la cantidad y calidad de bienes y servicios (en materia educativa y de salud, kilómetros de carretera, etc.) que ofrezca a la sociedad costarricense y por la Incidencia, es decir, teniendo en cuenta quiénes son los favorecidos_","For the Libertarian Movement, the efficiency and equity of the work of the State should be measured not by the 'public expenditure', as the administrations of the traditional parties have improperly done, but by the quantity and quality of goods and services (in education and health, kilometers of roads, etc.) offered to the Costa Rican society and by the incidence, that is to say, taking into account who are the favored ones_.","504",NA
"Desde el Poder Ejecutivo y desde la Asamblea Legislativa el Movimiento Libertario insistirá en este proceder","From the Executive Branch and the Legislative Assembly, the Libertarian Movement will insist on this course of action.","305.1",NA
"Luchamos porque el Estado opere de manera eficiente y que los servidores públicos, como representantes del pueblo que son, se desempeñen con eficiencia y den cuentas a la sociedad de su actuar","We fight for the State to operate efficiently and for public servants, as representatives of the people, to perform efficiently and be accountable to society for their actions.","303",NA
"Los empleados publicos están para servir a la sociedad, quienes con sus Impuestos y precios pagan sus salarios.","Public employees are there to serve society, who with their taxes and prices pay their salaries.","303",NA
"Ellos no son los dueños de las empresas ni de las instituciones para las cuales laboran y no deben comportarse como si lo fueran.","They are not the owners of the companies or institutions for which they work and should not behave as if they were.","303",NA
"Estas pertenecen a los ciudadanos.","These belong to the citizens.","303",NA
"El Estado no debe ser empresario ni debe llevar a cabo imperfectamente acciones que la iniciatrva privada puede realizar mejor","The State should not be an entrepreneur nor should it imperfectly carry out actions that private initiative can do better.","408",NA
"En el tanto insista en estas actividades, para lo cual es innecesario su actuar, dejará de hacer bien lo que si le corresponde.","As long as it insists on these activities, for which it is unnecessary for it to act, it will fail to do well what it should do.","408",NA
"En el Movimiento Libertarlo favorecemos la apertura de monopolios creados por ley, pues eso va en contra del Interés de los usuarios do sus servicios,","In the Libertarlo Movement we favor the opening of monopolies created by law, as this goes against the interest of the users of their services,","403",NA
"y la suscripción de convenios de libre comercio que generen nuevas oportunidades de empleo bien remunerado para los costarricenses (en particular para los jóvenes que se aprestan a ingresar al mercado de trabajo), que aumentan la cantidad y calidad de productos disponibles para los consumidores, y que reducen el costo de la canasta básica.","and the signing of free trade agreements that generate new opportunities for well-paid employment for Costa Ricans (particularly for young people who are preparing to enter the labor market), that increase the quantity and quality of products available to consumers, and that reduce the cost of the basic basket of goods.","407",NA
"Abogamos por un sistema de Interdependencia comercial que permita a todos los partido obtener el mayor beneficio de sus ventajas productivas.","We advocate a system of commercial interdependence that allows all parties to obtain the greatest benefit from their productive advantages.","403",NA
"Apoyamos la inversión privada de nacionales y extranjeros en todas las actividades económicas legales.","We support private investment by nationals and foreigners in all legal economic activities.","407",NA
"Muchas de esas inversiones estimulan no solo la creación de empleos bien remunerados sino la adopción de nuevas tecnologías y conocimientos","Many of these investments stimulate not only the creation of well-paid jobs but also the adoption of new technologies and knowledge.","407",NA
"Asimismo, favorecemos el control de la carga tributaria y de la inflación que carcomen nuestros sueldos y -en suma- de todos los tributos que el Estado impone sobre las familias costarricenses","We also favor the control of the tax burden and inflation that eat away at our salaries and -in sum- of all the taxes that the State imposes on Costa Rican families.","403",NA
"En e! Movimiento Libertario respetamos y apoyamos todas las manifestaciones culturales de los miembros de la sociedad","In the Libertarian Movement we respect and support all cultural manifestations of the members of society","502",NA
"y estimulamos la educación como mecanismo de deleite personal y como medio para que las personas se ganen la vida.","and encourage education as a mechanism for personal enjoyment and as a means for people to earn a living.","506",NA
"Reconocemos el papel importantísimo de la educación, no sólo para coadyuvar en la calidad a la vida de quienes de ella se benefician, sino para ayudarles a ganarse la vida en el mundo moderno, globalizado.","We recognize the very important role of education, not only to contribute to the quality of life of those who benefit from it, but also to help them earn a living in the modern, globalized world.","506",NA
"Abogamos por mejorar la calidad do la educación en general y la educación publica en particular; todo dentro de un esquema de equilibrio fiscal","We advocate improving the quality of education in general and public education in particular, all within a scheme of fiscal balance","506",NA
"Los libertarios nos oponemos a un Estado grade, ineficaz, altamente endeudado, cuyo costo sea una carga para la sociedad.","Libertarians oppose a large, inefficient, highly indebted State, whose cost is a burden on society. We","408",NA
"a un Estado irrespetuoso de las personas, del régimen de libre empresa y 'dirigiste"",","oppose a State that is disrespectful of people, of the free enterprise regime and 'dirigiste',","408",NA
"y a un régimen de crecimiento económico que no se preocupe por el bienestar do los grupos de la sociedad menos privilegiados","and of a regime of economic growth that does not care for the welfare of the less privileged groups of society.","416.2",NA
"Nos oponemos a regímenes de privilegio creados a través de la figura del Estado-como pensiones de lujo, subsidios encubiertos, que benefician a algunos no necesariamente a los más pobres, y que tenemos que pagar todos.","We oppose regimes of privilege created through the figure of the State-such as luxury pensions, hidden subsidies, which benefit some, not necessarily the poorest, and which we all have to pay for.","304",NA
"También nos oponemos a un régimen de Estado que prefiere darles un pescado a los pobres en vez de ayudarlos a que aprendan a pescar y a valerse por si mismos, generando asi dependencia de la clase politica que maneja los fondos públicos.","We also oppose a state regime that prefers to give fish to the poor instead of helping them learn to fish and fend for themselves, thus generating dependence on the political class that manages public funds.","503",NA
"Nos oponemos a un sistema de autarquía económica, que impide el comercio internacional, pues eso atenta contra el bienestar general y contra la seguridad alimentan en particular.","We are opposed to a system of economic autarky, which prevents international trade, as this undermines general welfare and food security in particular.","407",NA
"Nos oponemos a un Estado que por querer hacer lo que no le es propio, que podría ser realizado de una mejor manera por la libre iniciativa, deje de hacer aquello que le corresponda o que lo haga mal.","We are opposed to a State that, because it wants to do what is not its own, which could be done in a better way by free initiative, stops doing what it should do or does it badly.","408",NA
"Nos oponemos a un Estado cuyos funcionarios no se consideren servidores de le sociedad en general.","We are opposed to a State whose officials do not consider themselves servants of society in general.","202.1",NA
"Es por todo esto que el Movimiento Libertario es diferente a todos los damas partidos políticos quo se postulan para las elecciones del 2006,","It is for all these reasons that the Libertarian Movement is different from all the other political parties running for the 2006 elections,","305.1",NA
"cuyo pensamiento ideológico y programático, asi como el actuar de aquellos que han ejercido el poder, es estatizente y dirigiste.","whose ideological and programmatic thinking, as well as the actions of those who have exercised power, is statist and dirigiste.","305.1",NA
"Los otros parados ven al Estado como un fin, y hacen todo lo que esté a su alcance para fortalecerlo, aunque nos violen derechos a todas las personas.","The other unemployed see the State as an end, and do everything in their power to strengthen it, even if they violate the rights of all of us.","305.1",NA
"Basados en nuestra ideología tenemos respuesta para cada uno de los problemas del pais.","Based on our ideology we have an answer to each of the country's problems.","305.1",NA
"Sin embargo, estamos concientes de que cuatro años de gobierno es un período relativamente corto para resolver todos esos problemas","However, we are aware that four years of government is a relatively short period to solve all these problems.","305.1",NA
"Deberemos prionzar las acciones de gobierno, favoreciendo aquellas quo puedan aumentar en el menor plazo posible el bienestar de todos los costarricenses, y las que nos permitan cimentar la sostenibilidad de las medidas cuyos resultados se verán en el mediano y largo plazo","We must prioritize government actions, favoring those that can increase the well-being of all Costa Ricans in the shortest possible time, and those that allow us to cement the sustainability of the measures whose results will be seen in the medium and long term.","305.1",NA
"Con eso en mente, presentíamos a continuación los ojos de la acción de gobierno más importantes y las principales politices publicas que impulsaremos en los siguientes cuatro años desde los Poderes Ejecutivo y Legislativo.","With that in mind, we present below the most important government actions and the main public policies that we will promote in the next four years from the Executive and Legislative Branches.","305.1",NA
"En diversos estudios que realiza el Programa de las Naciones Unidas para el Desarrollo (PNUD), así como los Informes del Estado de La Nación, entre otros, el tema de la Inseguridad es uno de los principales tópicos por considerar.","In several studies carried out by the United Nations Development Program (UNDP), as well as the State of the Nation Reports, among others, the issue of Insecurity is one of the main topics to be considered.","605.1",NA
"Definitivamente, la inseguridad ciudadana es un tema que interesa y desvela a todos los costarricenses y su solución se ha convertido en un lema"" de campaña durante años, sin que esto signifique hasta ahora verdaderas acciones para combatirla.","Definitely, citizen insecurity is an issue that interests and worries all Costa Ricans and its solution has become a campaign slogan for years, without this meaning real actions to combat it.","605.1",NA
"La muestra está en que la violencia cobra fuerza y se refleja en las tasas de agresión, suicidios, lesiones, homicidios culposos, accidentes de tránsito y en delitos contra la propiedad, entre otros","shown by the rising rates of aggression, suicides, injuries, culpable homicides, traffic accidents and crimes against property, among others.","605.1",NA
"Según datos del Ministerio de Seguridad Publica, es creciente la compra de armas, tanto por adquisiciones de manera legal como en el mercado negro.","According to data from the Ministry of Public Security, there is an increase in the purchase of weapons, both legally and on the black market, as","605.1",NA
"Todavía algunos de nosotros recordamos con nostalgia cuando en nuestros barrios las casas permanecían con las puertas abiertas de par en par","Some of us still remember with nostalgia when in our neighborhoods the doors of our houses were left wide open.","605.1",NA
"Ahora las viviendas tienen portón, doble candado, alarma y en algunos casos un guarda que hace rondas constantes","The homes now have a gate, double padlock, alarm and in some cases a guard who makes constant rounds.","605.1",NA
"Poco a poco, las personas se han ido aislando de la vida en comunidad por causa de la inseguridad.","Little by little, people have become isolated from community life because of insecurity.","605.1",NA
