"text","text_en","cmp_code","eu_code"
"Este es el caso de doña Elizabeth Ulloa, quien tiene más de 50 años, y ahora aquellos días en que Escazu era un sitio seguro","This is the case of Mrs. Elizabeth Ulloa, who is over 50 years old, and now those days when Escazu was a safe place","605.1",NA
"""Antes el país era totalmente diferente. He residido toda mi vida en San Antonio do Escazú.","""Before the country was totally different. I have lived all my life in San Antonio do Escazu.","605.1",NA
"Cuando era niña vivíamos en medio de cafetales y trillos, debíamos pasar por ahí para ir a nuestras cesas pero no sentíamos miedo alguno pues nada malo ocurría.","When I was a child we lived in the middle of coffee plantations and threshing floors, we had to pass through there to go to our farms but we did not feel any fear because nothing bad happened.","605.1",NA
"Antes no sabíamos lo que era tener la puerta cerrada, y menos vivir como encarcelados con barrotes y candados.","Before, we did not know what it was like to have a closed door, let alone to live as if we were imprisoned with bars and padlocks.","605.1",NA
"No había inseguridad.","There was no insecurity.","605.1",NA
"Ahora por el contrario, es algo que nos asusta a todos, no se puede andar en la calle a ninguna hora del día, pero tampoco se puede estar dentro de la casa porque representa un peligro igual, los ladrones no respetan las casas para nada","Now, on the contrary, it is something that scares us all, you can not walk on the street at any time of the day, but you can not be inside the house because it represents an equal danger, the thieves do not respect the houses at all.","605.1",NA
"Pero ¿que hacen las autoridades al respecto5 Esta ciudadana se queja porque en donde vive la única delegación que esta cerca se encuentra siempre cerrada","But what are the authorities doing about it5 This citizen complains that the only nearby police station where she lives is always closed.","605.1",NA
"Cuenta que una vez a sus nietas las asaltaron y nadie vio nada, nadie hizo nada por ellas, no hay justicia, cada cual por su cuenta debe defenderse, es mejor ni salir","She says that once her granddaughters were assaulted and nobody saw anything, nobody did anything for them, there is no justice, everyone has to defend themselves, it is better not to go out.","605.1",NA
"Para doña Elizabeth la solucion esta en 'cortar por lo sano, eliminar lo 'podrido' y hacer castigos mas severos para los delincuentes, porque los agarran y los sueltan inmediatamente, entonces cometen sus delitos porque saben que no hebra castigo para ellos'","For Elizabeth, the solution lies in 'cutting through the rough stuff, eliminating the 'rotten' and making punishments more severe for criminals, because they are caught and released immediately, then they commit their crimes because they know that there is no punishment for them'.","605.1",NA
"Una idea similar tiene Aurelia Núñez ""Hoy en dia vivimos en medio de barrotes, antes tentamos la libertad de tener las puedas abiertas, sin embargo, ahora se vive con miedo dentro de las casas,  y el colmo es que estamos inseguros aún en los autobuses""","A similar idea is shared by Aurelia Núñez ""Today we live in the midst of bars, before we were tempted by the freedom of having our doors open, but now we live in fear inside our homes, and the worst thing is that we are unsafe even on the buses"".","605.1",NA
"Ella añora aquellos días en que uno caminaba por la avenida central sin ningún temor, lujo que no se puede dar ahora.","She longs for the days when one could walk down the central avenue without any fear, a luxury that cannot be afforded now.","605.1",NA
"Para no ser blanco de la delincuencia, tanto ella como su familia evitan salir de noche.","To avoid being targeted by crime, she and her family avoid going out at night.","605.1",NA
"Nunca andan solos y mantienen las puertas cerradas con candados.","They never walk alone and keep their doors padlocked.","605.1",NA
"La Costa Rica de ayer es algo que también sueña Emanuel Hemandez. un costamcense de 80 años, pensionado y que tiene en su memoria los recuerdos de un San Jose muy distinto al de hoy.","The Costa Rica of yesterday is something that Emanuel Hemandez, an 80 year old pensioner from Costa Rica, also dreams about. He has in his memory the memories of a San Jose that is very different from today.","605.1",NA
"Para él, el tema de la seguridad no es nada nuevo, ya que durante 21 años se desempeñó en la Guardia Civil","For him, the issue of security is nothing new, since for 21 years he worked in the Civil Guard.","605.1",NA
"Uno de los cargos que tuvo fue como detective, además estuvo en Casa Presidencial durante la decada de los años 50.","One of the positions he held was as a detective, and he was also in the Presidential House during the 1950's.","605.1",NA
"'Es obvio que la Costa Rica de hoy no es la misma.","'It is obvious that today's Costa Rica is not the same.","605.1",NA
"El nivel de peligro que se vive en estos días es alarmante""","The level of danger that we live in these days is alarming""","605.1",NA
"El señor Hernández ha podido ver serios problemas de delincuencia y drogadicción","Mr. Hernandez has seen serious problems of crime and drug addiction. In","605.1",NA
"Ademas, asegura que en todo el territorio nacional no se puede ignorar la violencia del pais","addition, he assures that throughout the national territory the violence of the country cannot be ignored","605.1",NA
"""Antes uno andaba en San José tranquilo, caminando sin temor a ser asaltado, tambien habla mas policias en las calles que velaban por la seguridad de las personas', agregó el ex Guardia Civil","""Before one walked in San Jose calm, walking without fear of being assaulted, also there were more policemen in the streets who ensured the safety of people',","605.1",NA
"El mismo ha sido victima del hampa, no hace un año le robaron su billetera con todos los papeles y una ""platita' que tenia","He himself has been a victim of the underworld, not a year ago he was robbed of his wallet with all his papers and a 'little money' that he had.","605.1",NA
"Eso fue en la terminal de buces a Alajuela En esa ocasión no fue a la policía, pues considera que los agentes no hacen nada y que mas bien esto se convierte en una perdida de tiempo.","On that occasion he did not go to the police, because he considers that the agents do nothing and that this becomes a waste of time.","605.1",NA
"Según su recomendacion, lo mas importante es lograr mayor vigilancia en las calles y que ademas se capacite a los policias para que puedan realizar mejor su labor","According to his recommendation, the most important thing is to achieve greater vigilance in the streets and to train police officers so that they can do their job better.","605.1",NA
"Pero tal vez el punto mas importante que este ciudadano rescata, es la necesidad de hacer las pruebas que permitan verificar la honestidad de las personas responsables de velar por la segundad de los ciudadanos","But perhaps the most important point that this citizen highlights is the need to carry out tests to verify the honesty of the people responsible for ensuring the safety of citizens.","605.1",NA
"En la ultima edicion del Estado de La Nación, se propone que ante esta problemática tan grave y compleja se elabore urgentemente un plan conjunto con todas las instituciones estatales responsables de la seguridad ciudadana","In the latest edition of the State of the Nation, it is proposed that in the face of such a serious and complex problem, a joint plan be drawn up urgently with all state institutions responsible for citizen security.","605.1",NA
"Este debe incluir la profesionalización de los cuerpos policia les y establecer las leyes y penas necesarias para enfrentar una delincuencia cada vez mejor organizada, con asesona de mafias narcotraficantes y de otros crímenes internacionales.","This should include the professionalization of the police forces and the establishment of the laws and penalties necessary to confront an increasingly organized crime, with the murder of drug trafficking mafias and other international crimes.","605.1",NA
"Un plan ""inteligente y coordinado"" que no se limite a lo estrictamente represivo, dada la naturaleza heterogénea de la criminalidad y la delincuencia, asi como de la galopante impunidad","An ""intelligent and coordinated"" plan that is not limited to strictly repressive measures, given the heterogeneous nature of criminality and delinquency, as well as the rampant impunity.","605.1",NA
"FIRMEZA CONTRA LA INSEGURIDAD","FIRMNESS AGAINST INSECURITY","H",NA
"PARA RECUPERAR LA TRANQUILIDAD","TO REGAIN PEACE OF MIND","H",NA
"Aplicaremos mano dura contra los criminales, nacionales o extranjeros","We will apply an iron fist against criminals, national or foreign.","605.1",NA
"Creemos que todo el que agreda a otra persona debe asumir la responsabilidad por su acción y que las leyes no deben permitir la impunidad","We believe that anyone who assaults another person must take responsibility for his action and that the laws should not allow impunity.","605.1",NA
"Tampoco se debe permitir que los delincuentes violentos sean liberados sin cumplir plenamente su sentencia, porque se pone en riesgo a los ciudadanos respetuosos de las otras personas y sus derechos","Nor should violent criminals be allowed to be released without fully serving their sentence, because it puts at risk citizens who are respectful of others and their rights.","605.1",NA
"Descubriremos el rostro de los delincuentes","We will discover the faces of the criminals","605.1",NA
"Los costarricenses tienen el derecho a conocer la Identidad de aquellas personas que son capturadas mientras atentan contra la vida y propiedades de los ciudadanos, por lo que las autoridades deben mostrarles el rostro","Costa Ricans have the right to know the identity of those who are captured while attempting against the life and property of citizens, so the authorities must show their faces.","605.1",NA
"Aumentaremos la seguridad comunitaria organizando los barrios","We will increase community safety by organizing the neighborhoods","606.1",NA
"Las comunidades, en colaboración con la policía, deben convertirse en el primer frente de batalla contra los criminales","Communities, in collaboration with the police, must become the first front line in the battle against criminals.","606.1",NA
"Promoveremos el programa ""ATREVETE a decir no a las drogas y a la violencia' en todas las escuelas del pais para disminuir la cantidad de personas víctimas de la droga","We will promote the program ""DARE to say no to drugs and violence"" in all schools in the country to reduce the number of people who are victims of drugs.","605.1",NA
"Para los adictos impulsaremos un programa agresivo para rehabilitar a esas personas y alejarlas de la edredón.","For addicts we will push for an aggressive program to rehabilitate these people and get them away from the comforter.","504",NA
"Para los comerciantes de la droga, aplicaremos mano dura","For drug dealers, we will apply a hard hand","605.1",NA
"Equiparemos y entrenaremos mejor a las fuerzas policiales","We will better equip and train police forces","605.1",NA
"·         Aumentaremos las plazas en seguridad pública mediante traslados horizontales de plazas provenientes de otros Ministerios y entidades públicas","- We will increase public security positions through horizontal transfers of positions from other ministries and public entities","605.1",NA
"Eliminaremos la corrupción policial.","We will eliminate police corruption.","304",NA
"Profesionalizaremos los cuerpos policiales y erradicaremos a aquellos oficiales implicados en actos de corrupción.","We will professionalize the police forces and eradicate those officers implicated in acts of corruption.","304",NA
"Descongestionaremos los tribunales de justicia","We will decongest the courts of justice","605.1",NA
"Para ello debemos sacar del ámbito jurisdiccional los casos que perfectamente pueden resolverse en forma privada o fuera do los tribunales de justicia, corno lo son las multas de tránsito y parte del proceso de los cobros judiciales","To this end, we must remove from the jurisdictional sphere those cases that can perfectly well be resolved privately or outside the courts of justice, such as traffic fines and part of the judicial collection process.","605.1",NA
"Ya hemos presentado proyectos de ley en ese sentido.","We have already submitted bills in this regard.","605.1",NA
"Aceleraremos los procesos judiciales.","We will accelerate the judicial processes.","605.1",NA
"Para lograrlo, proponernos que los juicios civiles y los contenciosos administrativos se hagan orales, como los juicios penales","To achieve this, we propose that civil and administrative litigation trials be made oral, like criminal trials.","605.1",NA
"Hemos presentado el proyecto de ley de un nuevo Código General Procesal para lograrlo.","We have presented a bill for a new General Procedural Code to achieve this.","605.1",NA
"Aumentaremos las penas a los reincidentes","We will increase penalties for repeat offenders","605.1",NA
"·            Estableceremos jornadas de trabajo en las cárceles para los condenados con el objetivo de recuperar parte de los costos de la administración del sistema carcelario y compensar a las víctimas parte del daño sufrid.","- We will establish work days in prisons for convicted offenders in order to recover part of the costs of administering the prison system and compensate victims for part of the damage suffered.","605.1",NA
"Estableceremos un registro de casos conciliados entre víctimas y delincuentes con el objeto de no aplicar el beneficio de la conciliación a personas reincidentes en la comisión de delitos.","We will establish a registry of cases conciliated between victims and offenders with the purpose of not applying the benefit of conciliation to repeat offenders.","605.1",NA
"Deportaremos a los extranjeros que cometan crímenes","We will deport foreigners who commit crimes We will","605.1",NA
"No vamos a tolerar que permanezcan en nuestro pais","not tolerate that they remain in our country","605.1",NA
"Exigiremos que el Estado deje de intervenir en cosas que no le corresponden y que concentre su atención de forma prioritaria en brindar paz, seguridad y justicia para todos","We will demand that the State stop intervening in things that do not correspond to it and that it concentrate its attention as a priority on providing peace, security and justice for all","605.1",NA
"Concentraremos a la policía en los verdaderos delitos.","We will concentrate the police on the real crimes.","605.1",NA
"Se debe perseguir el delito real, es decir, en los que hay daño para otros, como el homicidio, la violación, el robo y la estafa.","Real crime should be prosecuted, i.e., where there is harm to others, such as homicide, rape, robbery and swindling.","605.1",NA
"Protegeremos los derechos de las victimas.","We will protect the rights of victims.","503",NA
"Que las víctimas puedan estar presentes y ser consultadas durante el proceso penal de su caso","That victims can be present and consulted during the criminal prosecution of their case","503",NA
"La resolucion judicial debe concentrarse en restituir a las victimas por los daños recibidos, incluyendo daños a la propiedad, costos medicos y sufrimiento","Judicial resolution should focus on compensating victims for damages received, including property damage, medical costs and suffering","503",NA
"Asimismo, si alguien es Injustamente arrestado, acusado, enjuiciado, encarcelado o perjudicado, se lo debe restituir por daños y perjuicios, responsabilizando a los funcionarios estatales","Likewise, if someone is wrongfully arrested, accused, prosecuted, imprisoned or harmed, he or she must be compensated for damages, holding state officials accountable.","503",NA
"Protegeremos el derecho a la defensa propia","We will protect the right to self-defense","605.1",NA
"Debemos respetar el derecho de toda persona a su legitima defensa, incluso a que disponga de un arma para evitar que le agredan y le hagan daño","We must respect the right of every person to self-defense, including the right to have a weapon to prevent assault and harm","605.1",NA
"Cuando las personas estan organizadas para su propia defensa, los criminales temen","When people are organized for self-defense, criminals fear","605.1",NA
"Y en un país en que la policía aparece con alguna frecuencia despues de cometido el delito, esa capacidad de defensa propia debe ser apoyada","And in a country where the police appear with some frequency after a crime has been committed, that capacity for self-defense must be supported","605.1",NA
"Estimularemos formas alternativas de solución de disputas.","We will encourage alternative forms of dispute resolution.","202.1",NA
"Actualmente se recurre con éxito en otros países a opciones privadas como el arbitraje, la mediacion, el mini-juicio y la negociación","Private options such as arbitration, mediation, mini-trial and negotiation are now successfully used in other countries","202.1",NA
"Las partes pagan el servicio y, como los mediadores y árbitros ganan según el trabajo realizado, los procesos son mucho más cortos y expeditos, culminando en acuerdos satisfactorios para las partes","The parties pay for the service and, as mediators and arbitrators earn according to the work performed, the processes are much shorter and expeditious, culminating in satisfactory agreements for the parties.","202.1",NA
"CORRUPCIÓN: UNA VERGÜENZA NACIONAL.","CORRUPTION: A NATIONAL DISGRACE.","H",NA
"Aunque la corrupción no es un tema nuevo en el mundo, para los costarricenses, el percatarse de que este mal ya es parte de su realidad los lleno de enojo y frustración","Although corruption is not a new issue in the world, for Costa Ricans, the realization that this evil is already part of their reality fills them with anger and frustration","304",NA
"La confianza en los políticos se encuentra muy deteriorada","Trust in politicians is very deteriorated","304",NA
"Para el tico, es bochornoso abrir los perrodicos y descubrir a funcionarios, en quienes se ha depositado toda la confianza, involucrados en escándalos por manejos indebidos del dinero de los costarricenses","For the Costa Rican, it is embarrassing to open the door and discover officials, in whom we have placed all our trust, involved in scandals for mishandling the money of Costa Ricans","304",NA
"""Los ticos estarnos cansados de tantas hipocresías.","""We Costa Ricans are tired of so much hypocrisy.","304",NA
"La corrupcion crece día a dia, y en los ultimos tiempos ha tenido un aumento acelerado","Corruption grows day by day, and in recent times has had an accelerated increase","304",NA
"Estamos en un momento en el que a nadie le importa nadie y solo se busca el propio beneficio sin que interese si se afecta o no a los demás"",","We are at a time when no one cares about anyone and only seek their own benefit without caring whether or not it affects others,""","304",NA
"afirmo Javier Rojas, un costarricense que con tan solo 25 años ya siente vergüenza de la Costa Rica que le ha tocado vivir, por culpa de unos cuantos inescrupulosos","said Javier Rojas, a Costa Rican who is only 25 years old and already feels ashamed of the Costa Rica he has had to live in, because of a few unscrupulous people.","304",NA
"Al igual que le sucede a miles de costarricenses, a este joven, los ultimos casos de corrupción vividos, le han provocado que su decepción crezca y no crea en los políticos.","As it happens to thousands of Costa Ricans, to this young man, the last cases of corruption have caused his disappointment to grow and he does not believe in politicians.","304",NA
"Rojas comentó que antes de que se dieran a conocer los escandalos en los casos del Instituto Costarricense de Electricidad (ICE) y la Caja Costarricense de Seguro Social (CCSS), él era militante de uno de los partidos tradicionales","Rojas commented that before the scandals in the cases of the Costa Rican Electricity Institute (ICE) and the Costa Rican Social Security Fund (CCSS) became known, he was a militant of one of the traditional parties.","304",NA
"Cuando la noticia traspasó las fronteras, Rojas tuvo la oportunidad de viajar, loa terrestre, por toda Centroamenca y varias personas de esos paises le comentaban que no podian creer lo que estaba ocurriendo en Costa Rica","When the news crossed the borders, Rojas had the opportunity to travel, overland, throughout Central America and several people from those countries told him that they could not believe what was happening in Costa Rica.","304",NA
"Para el la situacion fue muy difícil, le hubiera gustado poder ocultar aquello que ocurría y que le llenaba de vergüenza,","For him the situation was very difficult, he would have liked to be able to hide what was happening and that filled him with shame,","304",NA
"""yo siendo tico, queria esconder lo que estaba sucediendo porque daba vergüenza que el país estuviese siendo manchado por culpa de los actos ilícitos de otros"".","""As a Costa Rican, I wanted to hide what was happening because I was ashamed that the country was being stained by the illicit acts of others"".","304",NA
"Se siente traicionado no solo de su Presidente, sino de quienes han gobernado a este pais para su propio beneficio o de sus allegados","He feels betrayed not only by his President, but also by those who have governed this country for their own benefit or that of their close associates.","304",NA
"Un caso similar le sucedió a Gerardo Rodriguez, quien tiene varios años de vivir en el extranjero y pudo constatar personalmente las noticias que se esparcían por el mundo sobre los ilícitos que acababan de ser descubiertos","A similar case happened to Gerardo Rodriguez, who has been living abroad for several years and was able to personally witness the news spreading around the world about the illicit activities that had just been uncovered.","304",NA
"""En muchos paises Costa Rica tiene buena popularidad","""In many countries Costa Rica has a good popularity.","304",NA
"Se destaca corno una excelente nación, bonita y tranquila, por ello la llaman la 'Suiza Centroamericana' pero con lo que ha pasado la imagen que tiene el pais se ha deteriorado, la libertad de la que se habla y la democracia se han manchado grandemente"", explicó Rodríguez","It stands out as an excellent nation, beautiful and peaceful, that's why they call it the 'Central American Switzerland' but with what has happened the image of the country has deteriorated, the freedom that is spoken of and democracy have been greatly tarnished,"" Rodriguez explained.","304",NA
"""Ha sido una gran sombra para la fama y prestigio que tiene el pais'","""It has been a great shadow for the fame and prestige that the country has'.","304",NA
"Pero la corrupción no esta solamente en las grandes esferas del gobierno; casi todas las personas han sido victimas de hechos dimos que suceden frente a los ojos pasivos de las autoridades","But corruption is not only in the big spheres of government; almost everyone has been a victim of acts of corruption that happen in front of the passive eyes of the authorities.","304",NA
"Todos los entrevistados concluyeron que la corrupcion se debe eliminar en todos los ámbitos nacionales y es importante, ademas, saber elegir al Gobernante que sea ejemplo de honestidad y servicio al pueblo que los eligió.","All the interviewees concluded that corruption must be eliminated in all national spheres and it is also important to know how to choose the ruler who is an example of honesty and service to the people who elected them.","304",NA
"'La uníca solucion para eliminar la corrupción, es que el bipartidismo deje de gobernar","The only solution to eliminate corruption is for the two-party system to stop governing.","304",NA
"Los partidos tradicionales, siempre han tenido el poder y lo que hacen es robar al pueblo.","The traditional parties have always held power and what they do is to steal from the people.","304",NA
"Hay que darle la oportunidad a los nuevos partidos y así la corrupción acabara"", enfatizo Rolas","We must give the new parties a chance and corruption will end,"" emphasized Rolas.","304",NA
"El sistema politico y los controles","The political system and controls","H",NA
"La corrupcion como problema politico se refiere al aparato estatal como estructura y como este esta diseñado para incentivar o suprimir la corrupción","Corruption as a political problem refers to the state apparatus as a structure and how it is designed to encourage or suppress corruption","304",NA
"Un sistema de pesos y contrapesos efectivo y controles horizontales y verticales hacia el Estado son parte de las condiciones para mantener bajos niveles de corrupción.","An effective system of checks and balances and horizontal and vertical controls within the state are part of the conditions for maintaining low levels of corruption.","304",NA
"Por ejemplo los paises que tienen mejores calificaciones sobre corrupción son aquellos que suelen tener sistemas judiciales fuertes e independientes, trámites simplificados y altos indices de confianza social","For example, countries that have better corruption ratings are those that tend to have strong and independent judicial systems, simplified procedures and high levels of social trust.","304",NA
"La libertad de prensa y de expresión es otro factor clave en este mismo sentido","Freedom of the press and freedom of expression is another key factor in this regard.","201.2",NA
"FIRMEZA CONTRA LA INSEGURIDAD","FIRMNESS AGAINST INSECURITY","H",NA
"PARA RECUPERAR NUESTROS VALORES","TO RECOVER OUR VALUES","H",NA
