"text","text_en","cmp_code","eu_code"
"Introducción","Introduction","H",NA
"Este es un llamado a la conciencia nacional.","This is a call to national conscience.","606.1",NA
"Esta es una CONVOCATORIA A LA CIUDADANÍA, para que unamos esfuerzos y compartamos esperanzas","This is a CALL TO THE CITIZENSHIP, so that we may join efforts and share hopes.","606.1",NA
"Presentamos esta Convocatoria como una herramienta para que los costarricenses conozcan la esencia de nuestro pensamiento y decidan si aceptan nuestro llamado a asumir su responsabilidad en la construcción del destino nacional.","We present this Call as a tool for Costa Ricans to know the essence of our thinking and decide if they accept our call to assume their responsibility in the construction of the national destiny.","305.1",NA
"Aquí interesa el qué vamos a hacer, pero interesa mucho más el cómo, el para qué lo vamos a hacer y el por qué podemos hacerlo.","Here we are interested in what we are going to do, but we are much more interested in how, what we are going to do it for and why we can do it.","305.1",NA
"Comprendemos que la lucha por el desarrollo hay que proyectarla, inevitablemente, al mediano y largo plazo.","We understand that the struggle for development must inevitably be projected in the medium and long term.","404",NA
"Sin embargo, para tener éxito en esa lucha es indispensable que asumamos actitudes y compromisos que desde ya se traduzcan en la cultura requerida para materializar el desarrollo","However, in order to succeed in this struggle, it is essential that we assume attitudes and commitments that translate into the culture required to materialize development.","305.1",NA
"Existen muchas vías para alcanzar el poder, pero únicamente cuando la gente conoce a profundidad el pensamiento, las motivaciones y las agendas reales de quien aspiran a llegar al gobierno, la victoria electoral deja de ser un éxito efímero y engañoso para convertirse en la entrega de un mandato y en la creación de confianza y respeto.","There are many ways to achieve power, but only when people know in depth the thinking, motivations and real agendas of those who aspire to reach government, electoral victory ceases to be an ephemeral and deceitful success and becomes the delivery of a mandate and the creation of trust and respect.","202.1",NA
"Estos elementos son fundamentales para posibilitar la siempre compleja tarea de gobernar.","These elements are fundamental to enable the always complex task of governing.","202.1",NA
"La posibilidad de tomar y ejecutar decisiones, se construye en campaña.","The possibility of making and executing decisions is built in the campaign.","202.1",NA
"Se construye diciendo la verdad tal y como la concibe cada grupo aspirante, enunciando con un lenguaje claro y directo sus prioridades y compromisos, así como los requisitos y costos para avanzar en la dirección propuesta.","It is built by telling the truth as conceived by each aspiring group, stating in clear and direct language their priorities and commitments, as well as the requirements and costs to move in the proposed direction.","202.1",NA
"Se trata de que cada ciudadano al acudir a las urnas sepa exactamente qué puede esperar y a qué se compromete con su voto.","The idea is that every citizen who goes to the polls should know exactly what to expect and what he or she is committing to with his or her vote.","202.1",NA
"El buen gobierno en la democracia es posible si se respetan las opiniones de los otros para lograr acuerdos efectivamente nacionales.","Good governance in democracy is possible if the opinions of others are respected in order to achieve effectively national agreements.","202.1",NA
"Pero para que se materialicen es necesario que cada uno exprese la verdad de su pensamiento de manera clara y transparente.","But for them to materialize, it is necessary for each one to express the truth of his or her thinking in a clear and transparent manner.","202.1",NA
"Cuando lo que se dice no es igual a lo que se piensa o a lo que se intenta hacer, se consuman con alevosa eficiencia la ingobernabilidad y el conflicto.","When what is said is not the same as what is thought or what is intended to be done, ungovernability and conflict are consummated with malicious efficiency.","202.1",NA
"Desde esta concepción de la democracia hemos elaborado la presente Convocatoria a la ciudadanía, en el entendido de que se trata justamente de un llamado para que compartamos la causa del futuro y asumamos colectivamente el reto de construir el destino nacional.","From this conception of democracy, we have prepared this Call to Citizenship, in the understanding that it is precisely a call to share the cause of the future and collectively assume the challenge of building the national destiny.","202.1",NA
"Nuestras propuestas son claras y puntuales, enmarcadas en una filosofía fundada en la acción ciudadana.","Our proposals are clear and specific, framed in a philosophy based on citizen action.","305.1",NA
"Mantendremos una actitud abierta para analizar las propuestas programaticas de otros partidos politicos, a efecto de incorporar a nuestra accion de gobierno aquellos planteamientos positivos para el desarrollo nacional.","We will maintain an open attitude to analyze the programmatic proposals of other political parties, in order to incorporate into our government action those positive proposals for national development.","202.1",NA
"Hemos elaborado esta Convocatoria partiendo de lo mucho positivo que tenemos en Costa Rica.","We have prepared this Call for Proposals based on the many positive things we have in Costa Rica.","601.1",NA
"Hemos escuchado a San Pablo cuando dice: “Examinadlo todo, retened lo bueno”.","We have listened to St. Paul when he says: ""Examine all things, hold fast that which is good"".","601.1",NA
"De lo existente en el país y de las propuestas de todos los partidos se podrán construir consensos en relación con las áreas estratégicas de nuestro desarrollo.","From what exists in the country and from the proposals of all parties, it will be possible to build consensus in relation to the strategic areas of our development.","202.1",NA
"Con ese espiritu hemos suscrito ya la ""Agenda Nacional para la Niñez y la Adolescencia 2000-2010"", por considerarla una propuesta idonea para atender los retos que la sociedad costarricense enfrenta en estos ambitos.","In this spirit, we have already subscribed to the ""National Agenda for Children and Adolescents 2000-2010"", as we consider it a suitable proposal to address the challenges that Costa Rican society faces in these areas.","706",NA
"Del mismo modo, suscribimos el acuerdo alcanzado entre la Camara de exportadores, la Asociacion Nacional de Empleados Publicos y Privados, y la Conferencia de Trabajadores Rerun-Novarum, denominado ""Costa Rica: Hacia la Tercera Republica Frente a los desafios Nacional del Siglo XXI"", donde se propone la estrategia de desarrollo a seguir para encarar los desafios derivados del nuevo orden economico internacional.","Likewise, we subscribe to the agreement reached between the Chamber of Exporters, the National Association of Public and Private Employees, and the Rerun-Novarum Workers Conference, called ""Costa Rica: Towards the Third Republic Facing the National Challenges of the 21st Century"", which proposes the development strategy to be followed to face the challenges derived from the new international economic order.","408",NA
"El desarrollo depende de factores culturales, como el compromiso con el trabajo, la frugalidad, el pago de los impuestos, el esfuerzo propio, el cumplimiento de horarios,","Development depends on cultural factors, such as commitment to work, frugality, payment of taxes, self-effort, adherence to schedules,","408",NA
"el respeto a la diversidad","respect for diversity","503",NA
"y la honestidad en la función pública.","and honesty in public service.","304",NA
"Hoy debemos unirnos, agruparnos, aunar voluntades, para materializar esos factores.","Today we must unite, group together, unite our wills, to materialize these factors.","606.1",NA
"Debemos aprovechar la crisis para inducir la cultura del respeto, la actitud de la gente y la calidad de la política y el gobierno, amigas del progreso.","We must take advantage of the crisis to induce the culture of respect, the attitude of the people and the quality of politics and government, friends of progress.","202.1",NA
"Es nuestra obligación resurgir de la crisis en un estadio superior, compatible con el desarrollo y con los liderazgos internacionales que nos corresponden.","It is our obligation to emerge from the crisis at a higher stage, compatible with development and with the international leadership that corresponds to us.","606.1",NA
"Promoveremos con esmero, convicción y entrega, este cambio cultural basado en el cumplimiento de las responsabilidades de los habitantes.","We will promote with care, conviction and dedication, this cultural change based on the fulfillment of the responsibilities of the inhabitants.","606.1",NA
"Pondremos todo nuestro empeño para que la juventud tenga espacios, exprese sus aspiraciones y sea protagonista en esta revolución pacífica que impulsamos.","We will make every effort to ensure that young people have space, express their aspirations and play a leading role in this peaceful revolution that we are promoting.","706",NA
"Quienes crean en la dignidad y la honradez; quienes crean en el trabajo y el esfuerzo compartido, quienes crean en el diálogo y la participación ciudadana, y quienes crean en la solidaridad y el bien común, quedan convocados a compartir y abonar esta causa por el bien de Costa Rica.","Those who believe in dignity and honesty, those who believe in work and shared effort, those who believe in dialogue and citizen participation, and those who believe in solidarity and the common good, are called upon to share and contribute to this cause for the good of Costa Rica.","606.1",NA
"Solicito su apoyo a esta causa.","I request your support for this cause.","606.1",NA
"Luchemos para que nuestra participación política nos haga mejores ciudadanos.","Let us fight so that our political participation makes us better citizens.","202.1",NA
"Luchemos sin egoísmos para que nuestros hijos y nuestros nietos tengan al menos oportunidades similares de progreso personal y social a las que nosotros disfrutamos gracias al esfuerzo de nuestros próceres.","Let us fight without selfishness so that our children and grandchildren have at least similar opportunities for personal and social progress to those we enjoy thanks to the efforts of our forefathers.","606.1",NA
"Lucharemos por la prosperidad material y social de nuestro país, consientes de que el esfuerzo honraddo de cada uno nos beneficia a todos.","We will fight for the material and social prosperity of our country, aware that the honest effort of each one of us benefits us all.","606.1",NA
"Luchemos para que la política vuelva a ser digna, justa, honesta y respetada.","Let us fight for politics to return to being dignified, fair, honest and respected.","202.1",NA
"Para que los buenos ciudadanos no la eviten sino que la busquen.","So that good citizens do not avoid it but seek it out.","202.1",NA
"Para que las personas con vocación de servicio público se sientan bien en la política y la ciudadanía les tribute respeto y confianza.","For people with a vocation for public service to feel good in politics and for citizens to pay them respect and trust.","202.1",NA
"Como en tiempos de Juan Santamaría, hoy es el momento de portar la tea del desprendimiento por la Patria.","As in the times of Juan Santamaría, today is the time to carry the torch of detachment for the homeland.","606.1",NA
"Este generación podrá convertirlo en el tiempo de los sueños y las esperanzas, si con la llama de la tea no solo incineramos los vicios y obstáculos que han detenido nuestra marcha hacia el desarrollo, sino que también iluminamos el sendero hacia el futuro que anhelamos.","This generation can become the time of dreams and hopes, if with the flame of the fire we not only incinerate the vices and obstacles that have stopped our march towards development, but also illuminate the path towards the future we long for.","606.1",NA
"Sirvámosle a Dios para que Él llene nuestras almas y nos ayude a servirle a la Patria.","Let us serve God so that He may fill our souls and help us to serve our country.","603",NA
"Nuestra razón de ser","Our raison d'être","H",NA
"Desde que anunciamos la posibilidad de un nuevo partido, miles de costarricenses han acudido a crearlo y a darle su apoyo y se han identificado con un conjunto de valores e ideas que reflejan su clamor, sus ansiedades, sus aspiraciones y sus sueños","Since we announced the possibility of a new party, thousands of Costa Ricans have come to create and support it, and have identified with a set of values and ideas that reflect their clamor, their anxieties, their aspirations and their dreams","305.1",NA
"Por eso nacimos para que: • La ciudadanía tenga garantía de sus derechos, pero también conciencia de sus responsabilidades y para que sea protagonista en la construcción de su futuro;","That is why we were born so that: - Citizenship has a guarantee of their rights, but also awareness of their responsibilities and to be protagonists in the construction of their future;","606.1",NA
"El gobierno y las instituciones, cuya gestión representan el 4O% del Producto Interno Bruto - dos mil millones de millones de colones al año - sean eficientes, productivas y estén al servicio de todas y todos los costarricenses;","The government and institutions, whose management represents 4O% of the Gross Domestic Product - two billion colones a year - are efficient, productive and at the service of all Costa Ricans;","303",NA
"A la producción nacional se le trate con respeto y se le otorgue un lugar estratégico en las políticas públicas;","National production is treated with respect and given a strategic place in public policies; the","410",NA
"El ambiente pase a ocupar un lugar central en el desarrollo, no solo como medio sino como fin para la competitividad internacional y el crecimiento económico","environment is given a central place in development, not only as a means but also as an end for international competitiveness and economic growth","416.2",NA
"La juventud sea parte de la historia y actora de primer orden en las alianzas que deben forjar el proceso de desarrollo;","; youth is part of history and a key player in the alliances that must forge the development process;","706",NA
"A la mujer se le respete como un ser con las mismas capacidades, compromisos y derechos que el varón;","women are respected as beings with the same capacities, commitments and rights as men;","503",NA
"La acción política esté subordinada a las leyes y a la Constitución","Political action is subordinated to the laws and the Constitution","203",NA
"y garantice el respeto de los recursos públicos mediante un ejercicio ético y transparente","and guarantees respect for public resources through an ethical and transparent exercise","304",NA
"Las reglas y normas en nuestra sociedad garanticen que a la persona honrada y trabajadora esté donde esté le vaya bien en la vida; para que el esfuerzo honrado sea buen negocio;","The rules and norms in our society guarantee that the honest and hardworking person, wherever he may be, will do well in life; so that honest effort is good business;","701",NA
"Adoptemos un cambio cultural en relación con el pago de tributos, una actitud de compromiso con el trabajo y el esfuerzo propio, con el ahorro, con el cumplimiento de horarios;","Let us adopt a cultural change in relation to the payment of taxes, an attitude of commitment to work and personal effort, with savings, with the fulfillment of schedules; Let us","408",NA
"Activamente respetemos los derechos de las minorías y la diversidad de culturas, gustos, tradiciones, religiones, orientaciones sexuales, orígenes étnicos o nacionalidades","actively respect the rights of minorities and the diversity of cultures, tastes, traditions, religions, sexual orientations, ethnic origins or nationalities;","607.1",NA
"Costa Rica sea respetada y asuma los liderazgos internacionales que le corresponden;","let Costa Rica be respected and assume the international leadership that corresponds to it; let us","107",NA
"Las y los costarricenses tengamos esperanza, seamos vigilantes, propositivos, nos unamos alrededor de un norte común y nos sintamos protagonistas en la construcción de la Patria.","Costa Ricans have hope, let us be vigilant, proactive, let us unite around a common north and let us feel as protagonists in the construction of the Homeland.","606.1",NA
"En Costa Rica no deben hacer exclusiones, ni oscuras mesas de poder","In Costa Rica there should be no exclusions or dark tables of power.","503",NA
"Por el contrario, debemos luchar para que Costa Rica entera, para que la ciudadanía entera, se parte de la histaria y no simple espectadora","On the contrary, we must fight so that Costa Rica as a whole, so that the entire citizenry becomes part of history and not a mere spectator.","503",NA
"Puede ser que algunos difieran de nuestro pensamiento, puede ser que para algunos nuestra visión sea ingenua, puede ser que nos ataquen por ello.","It may be that some may differ from our thinking, it may be that for some our vision is naïve, it may be that we are attacked for it.","202.1",NA
"Pero aun así revelaremos, con el lenguaje más simple y más entendible, nuestra concepción del mundo, nuestros programas, nuestras políticas.","But we will still reveal, in the simplest and most understandable language, our conception of the world, our programs, our policies.","202.1",NA
"Jamás esconderemos un pensamiento por más impopular que sea, porque la verdad es la materia prima de la democracia, es la materia prima de un gobierno efectivo capaz de tomar decisiones, porque la verdad en la política es la materia prima del respeto a los ciudadanos.","We will never hide a thought, no matter how unpopular it may be, because truth is the raw material of democracy, it is the raw material of an effective government capable of making decisions, because truth in politics is the raw material of respect for citizens.","202.1",NA
"Pondremos una luz para que ilumine las mesas de poder y abriremos las ventanas y las puertas para que sin dificultades. ni obstáculos ni excusas, la gente conozca lo que ocurre en esas mesas de poder.","We will put a light to illuminate the tables of power and we will open the windows and doors so that without difficulties, obstacles or excuses, the people will know what is going on at those tables of power.","304",NA
"Así terminaremos con las argollas, los monopolios de poder y los compadrazgos; así terminaremos con las corruptelas-rlos grandes desfalcos.","This is how we will put an end to the rings, monopolies of power and cronyism; this is how we will put an end to corruption-the great embezzlements.","304",NA
"Con nosotros se acaban los pactos al margen de la población como los que caracterizaron los Programas de Ajuste Estructural, los tratados de libre comercio y los combos.","With us, the pacts at the margins of the population, such as those that characterized the Structural Adjustment Programs, the free trade agreements and the combos, will come to an end.","202.1",NA
"A la gente se le debe respetar su criterio y buen juicio. desterrando la creencia de que un grupo de iniciados sabe-lo-todo ostenta el monopolio del conocimiento y la definición de lo que le conviene y no le conviene al país.","People should be respected for their judgment and good judgment, banishing the belief that a group of know-it-all insiders have a monopoly on knowledge and the definition of what is and is not in the country's best interest.","202.1",NA
"Una cosa es la negociación pública entre líderes y grupos políticos, otra cosa es el pacto dirigido a esconder decisiones e intenciones.","Public negotiation between leaders and political groups is one thing, but a pact aimed at hiding decisions and intentions is another.","202.1",NA
"Una cosa es el liderazgo, otra cosa el mesianismo irrespetuoso de los criterios de los demás.","Leadership is one thing; disrespectful messianism of others' criteria is another.","202.1",NA
"Pertas abiertas","Open doors","H",NA
"Abriremos las puertas de la democracia de par en par para Rue la democracia otra vez sea grande y sirva de herramienta para la solución de los problemas que desde hace años se han venido posponiendo con ineficiencias, excusas y retórica vacía.","We will open the doors of democracy wide to Rue democracy once again be great and serve as a tool for the solution of the problems that for years have been postponed with inefficiencies, excuses and empty rhetoric.","202.1",NA
"Trabajaremos para que se respeten los derechos de todas y todos los costarricenses, para que su esfuerzo honrado rinda frutos, para que no existan atajos, ni rutas cortas, ni padrinazgos que pongan la política y el gobierno al servicio de unos pocos privilegiados.","We will work so that the rights of all Costa Ricans are respected, so that their honest effort pays off, so that there are no shortcuts, no short routes, no patronage that puts politics and government at the service of a privileged few.","304",NA
"La politiquería desaparecerá tanto de la asignación de grandes contratos como de la selección de beneficiarios de las ayudas sociales.","Politics will disappear both from the allocation of large contracts and from the selection of beneficiaries of social assistance.","304",NA
"Con nosotros se termina esa vergonzosa práctica de meter la política en el nombramiento de policías, educadores y otros puestos en la función pública","With us, the shameful practice of putting politics in the appointment of policemen, educators and other positions in the public service will end.","304",NA
"Con nosotros se terminará esa primitiva práctica de poner placas en las obras públicas con el nombre de diputados y gobernantes.","With us, the primitive practice of putting plaques in public works with the name of deputies and governors will end.","304",NA
"El o la diputada que quiera una placa con su nombre en un puente que lo financie con su propio dinero.","The congressman or congresswoman who wants a plaque with his or her name on a bridge should finance it with his or her own money.","304",NA
"Así es hoy en los países más desarrollados y así será en Costa Rica a partir del próximo 8 de mayo.","This is the way it is today in the most developed countries and it will be the same in Costa Rica as of May 8.","304",NA
"Los recursos públicos no son propiedad del sector público y menos de sus funcionarios.","Public resources are not the property of the public sector and even less of its officials.","304",NA
"Son propiedad de las y los empresarios y de las y los trabajadores que pagan impuestos y de las y los destinatarios finales estipulados por ley.","They are the property of the employers and workers who pay taxes and of the final recipients stipulated by law.","304",NA
"Por eso este Partido define como robo hasta el mínimo abuso y promueve el respeto total a esos recursos porque son de las y los costarricenses","That is why this Party defines even the slightest abuse as theft and promotes total respect for these resources because they belong to Costa Ricans.","304",NA
"Si el presidente, las y los vicepresidentes, ministros, diputados y jerarcas de las empresas públicas e instituciones autónomas quieren comer y tomar licor, ir a pasear al exterior, movilizarse en vehículos oficiales para asuntos personales, que lo hagan con su propio dinero.","If the president, vice presidents, ministers, deputies and heads of public companies and autonomous institutions want to eat and drink liquor, go abroad, travel in official vehicles for personal matters, they can do so with their own money.","304",NA
"Los recursos públicos sólo pueden utilizarse para cumplir las funciones que la Constitución y las leyes asignen a las instituciones.","Public resources may only be used to fulfill the functions assigned to the institutions by the Constitution and the law.","304",NA
"Así fue Costa Rica en un pasado no muy lejano y así son hoy los países más desarrollados.","This is how Costa Rica was in the not too distant past and how the most developed countries are today.","305.1",NA
"Así volverá a ser Costa Rica a partir del próximo 8 de mayo.","This is what Costa Rica will be like again as of May 8.","305.1",NA
"El partido de la gente","The party of the people","H",NA
"Desde hace tiempo miles y miles de costarricenses tenían en sus corazones la visión que hoy promueve el PAC sobre lo que debe ser la política y lo que debe ser el desarrollo nacional.","For a long time, thousands and thousands of Costa Ricans had in their hearts the vision that today the PAC promotes about what politics should be and what national development should be.","305.1",NA
"Por ello el PAC pertenece a la gente y debe siempre pertenecer a la gente de cada rincón de Costa Rica.","That is why PAC belongs to the people and should always belong to the people in every corner of Costa Rica.","305.1",NA
"Este partido se hizo en tan poco tiempo y con tan poco dinero no por los méritos de unos pocos sino por el coraje, la independencia, el orgullo y la dignidad de los costarricenses.","This party was made in such a short time and with so little money not because of the merits of a few but because of the courage, independence, pride and dignity of Costa Ricans.","305.1",NA
