"text","text_en","cmp_code","eu_code"
"Fin del motín político","End of the political mutiny","H",NA
"En el gobierno del PAC enfrentaremos el reto de implantar en todo el sector público un verdadero concepto gerencial a través del nombramiento de jerarcas capaces de administrar eficientemente los recursos humanos y financieros a su cargo a partir de criterios técnicos que trasciendan las consideraciones político-partidistas.","In the PAC government, we will face the challenge of implementing a true managerial concept throughout the public sector by appointing managers capable of efficiently managing the human and financial resources under their charge based on technical criteria that transcend political-partisan considerations.","303",NA
"Es inadmisible, por ejemplo, que en nuestro país se nombre para presidir una institución que administra 0200,000 millones al año, a una persona cuyo mayor mérito fue tiaber contribuido en una campaña política sin importar su capacidad gerencial","It is inadmissible, for example, that in our country a person whose greatest merit was to have contributed to a political campaign, regardless of his managerial capacity, is appointed to the presidency of an institution that manages 2.2 million dollars a year,","304",NA
"O bien nombrar a directivos de instituciones autónomas, como el ICE, solo porque se fue diputado o amigo de un presidente.","or to appoint directors of autonomous institutions, such as ICE, only because he was a congressman or a friend of a president.","304",NA
"En nuestro gobierno todos los jerarcas serán nombrados, ya sea por organizaciones de la sociedad civil en las cuales deleguemos esa tarea, tal el caso de instituciones corno el Consejo Nacional de Producción, el Patronato Nacional de la Infancia y el Movimiento Nacional de Juventudes, entre otras","In our government, all the hierarchs will be appointed either by civil society organizations to which we delegate this task, such as the National Production Council, the National Children's Trust and the National Youth Movement, among others,","304",NA
"o bien mediante concursos de antecedentes conducidos por empresas de consultoría expertas en la materia, sin importar la militancia o color político de los aspirantes.","or through background contests conducted by expert consulting firms in the field, regardless of the political militancy or color of the candidates.","304",NA
"Con nosotros se acabará el botín político que por muchos años ha representado la repartición de puestos de gobierno, lo mismo que la asignación de recursos y construcción de obras públicas que en no pocos casos sólo obedecen a los intereses particulares de funcionarios, parientes o amigos de los que ostentan el poder.","With us, the political spoils that for many years have represented the distribution of government positions, as well as the allocation of resources and the construction of public works, which in many cases only obey the private interests of officials, relatives or friends of those in power, will come to an end.","304",NA
"Porque la productividad pasa también por la ética y la moral tanto de los jerarcas como de los subalternos, así como por el respeto a las leyes que rigen el desempeño de cada una de las instituciones.","Because productivity also depends on the ethics and morals of both managers and subordinates, as well as respect for the laws that govern the performance of each of the institutions.","304",NA
"Si existen leyes que determinan, por ejemplo, cómo Asignaciones Familiares o el IMAS deben invertir sus recursos de ayuda social, no tiene por qué una primera dama o una vicepresidenta financiar programas personales con esos mismos recursos, incompatibles muchas veces con planes integrales de combate a la pobreza.","If there are laws that determine, for example, how Asignaciones Familiares or IMAS should invest their social assistance resources, there is no reason for a first lady or vice president to finance personal programs with those same resources, which are often incompatible with comprehensive plans to combat poverty.","304",NA
"Y así como esta, el sector público está plagado de violaciones y superposiciones de unas leyes sobre otras que solo acarrean más ineficiencia y menos productividad.","And just like this, the public sector is plagued by violations and overlapping of laws that only lead to more inefficiency and less productivity.","303",NA
"Lo más significativo es que todo este atropello a la eficiencia y la productividad institucional se puede corregir","The most significant thing is that all this violation of institutional efficiency and productivity can be corrected","303",NA
"y ese es nuestro compromiso con el país sin necesidad de nuevas leyes ni de mayores recursos humanos o financieros.","and that is our commitment to the country without the need for new laws or greater human or financial resources.","305.1",NA
"Sólo basta la voluntad política y en el PAC podemos hacerlo. porque no tenemos compromisos con nadie más que con el bienestar integral de toda la sociedad costarricense.","All it takes is political will and in the PAC we can do it, because we have no commitments to anyone but the integral wellbeing of all Costa Rican society.","305.1",NA
"En el gobierno del PAC no habrá un solo nombramiento, ni se destinará un solo céntimo, ya sea en obras, o ayuda social, que noesté debidamente justificado desde el punto de vista técnico y que no obedezca a planes integrales de desarrollo o combate a la pobreza.","In the PAC government there will not be a single appointment, nor will a single cent be allocated, whether in works or social aid, that is not duly justified from a technical point of view and that does not obey comprehensive development plans or plans to combat poverty.","305.1",NA
"Esta, sin embargo, es una tarea que no podremos llevarla a la práctica sin la participación plena de la ciudadanía en general y de los se en particular, porque si una institución está mal organizada, o si e compensa por igual su buen o mal desempeño, será escasa su contribución a la calidad y productividad del sector público en su conjunto.","This, however, is a task that we will not be able to carry out without the full participation of the citizenry in general and of the public sector in particular, because if an institution is poorly organized, or if its good or bad performance is equally compensated, its contribution to the quality and productivity of the public sector as a whole will be limited.","606.1",NA
"Por eso daremos participación a las y los ciudadanos en la definición de estándares de calidad de los servicios públicos y pondremos a su disposición los mecanismos necesarios para hacer valer sus derechos ante las y los funcionarios públicos así como antes las respectivas instituciones.","For this reason, we will involve citizens in the definition of quality standards for public services and we will provide them with the necessary mechanisms to assert their rights before public officials and the respective institutions.","202.1",NA
"Con ese fin impulsaremos la creación de juntas comunales para el mejoramiento educativo y de protección ambiental, entre otros aspectos, así como auditorías ciudadanas para fiscalizar la forma en que se ejercen los presupuestos y se prestan los servicios en las empresas estatales, de manera tal que los empleados públicos actúen en verdad como empleados del público, ejerciendo sus derechos pero también asumiendo las responsabilidades que les corresponde.","To this end, we will promote the creation of community boards for educational improvement and environmental protection, among other aspects, as well as citizen audits to oversee the way in which budgets are spent and services are provided in state-owned companies, so that public employees truly act as employees of the public, exercising their rights but also assuming the responsibilities that correspond to them.","202.1",NA
"El sistema judicial","The judicial system","H",NA
"Hay instituciones cuya labor y eficiencia son factor esencial para mejorar la calidad y productividad de todo el sector público.","There are institutions whose work and efficiency are an essential factor in improving the quality and productivity of the entire public sector.","202.1",NA
"Entre ellas destaca el Poder Judicial.","Among them is the Judiciary.","202.1",NA
"El respeto a la legalidad, la seguridad ciudadana, la protección de los derechos de propiedad y el combate a la corrupción, entre otras acciones vitales para el correcto desempeño tanto del sector público como privado dependen de la buena marcha de todo el sistema judicial.","Respect for legality, citizen security, the protection of property rights and the fight against corruption, among other vital actions for the correct performance of both the public and private sectors, depend on the proper functioning of the entire judicial system.","202.1",NA
"Si no fortalecemos al sistema judicial, si no le damos los instrumentos adecuados, si no reformamos las leyes para que el sistema pueda cumplir de manera eficiente y oportuna sus funciones, estaríamos encaminándonos por la tortuoso ruta que han seguido muchos países en años recientes.","If we do not strengthen the judicial system, if we do not give it the appropriate instruments, if we do not reform the laws so that the system can perform its functions efficiently and in a timely manner, we will be heading down the tortuous path that many countries have followed in recent years.","202.1",NA
"Una crisis prolongada del sistema judicial nos llevaría a un escenario en el cual se ponen en riesgo los derechos de los individuos y de la propiedad, no se cumplen los contratos; un escenario en que los  procesos judiciales duran años o hasta decenios.","A prolonged crisis of the judicial system would lead us to a scenario in which the rights of individuals and property are put at risk, contracts are not enforced; a scenario in which judicial processes last years or even decades.","202.1",NA
"En tal situación los individuos que quebrantan la ley no reciben el debido castigo, o son castigas tanto tiempo después que el efecto disuasivo de la pena se disipa","In such a situation individuals who break the law do not receive due punishment, or are punished so long after the fact that the deterrent effect of the penalty dissipates","202.1",NA
"pero además de lo dicho, hay muchas otras razones que hacen obligatorio que el país enfrente de manera valiente las reformas y ajustes que se requieran, y asigne los recursos necesarios para lograr un sistema que se destaque por su reacción oportuna y por su integridad.",", but in addition to the above, there are many other reasons that make it mandatory for the country to courageously face the reforms and adjustments that are required, and allocate the necessary resources to achieve a system that stands out for its timely reaction and integrity.","202.1",NA
"No hay duda de que un sistema lento proporciona un incentivo implícito para la evasión tributaria, para la corrupción y para otras actividades ¡licitas.","There is no doubt that a slow system provides an implicit incentive for tax evasion, corruption and other illegal activities.","304",NA
"Por eso en el gobierno del PAC promoveremos, con apego absoluto a la independencia de poderes que establece la Constitución Política, aquellas acciones que la Corte Suprema de Justicia estime pertinentes para fortalecer y agilizar su papel como garante de la seguridad jurídica en nuestra sociedad.","That is why in the PAC government we will promote, with absolute adherence to the independence of powers established by the Political Constitution, those actions that the Supreme Court of Justice deems pertinent to strengthen and streamline its role as guarantor of legal security in our society.","202.1",NA
"Pero no podemos ignorar que la credibilidad de los costarricenses en el Poder Judicial ha sufrido una erosión significativa en los últimos años, fenómeno que en buena medida responde a la creciente intromisión de intereses político-partidistas en la designación de los magistrados que integran la Corte Suprema de Justicia.","But we cannot ignore that the credibility of Costa Ricans in the Judiciary has suffered a significant erosion in recent years, a phenomenon that largely responds to the growing interference of political-partisan interests in the appointment of the magistrates that make up the Supreme Court of Justice.","304",NA
"Nuestro partido luchará tenazmente para que se respete la majestuosidad del Poder Judicial y para que la designación de sus máximos jerarcas se sustraiga de los vaivenes político-electorales, como primer paso para restituirle la plena confianza de la ciudadanía.","Our party will fight tenaciously so that the majesty of the Judiciary is respected and so that the appointment of its highest hierarchs is removed from the political-electoral ups and downs, as a first step to restore the full confidence of the citizens.","202.1",NA
"Currupción como freno del desarrollo","Curruption as a brake on development","H",NA
"El combate a la corrupción trasciende el plano de la ética y la moral en la función pública pues no solo se trata de salvaguardar los recursos públicos, sino también de evitar que las prácticas desleales en el ámbito privado - alentadas por el tráfico de influencias políticas - anulen el principio de la libre competencia dentro de la economía y la producción.","The fight against corruption transcends the level of ethics and morality in public service, since it is not only a matter of safeguarding public resources, but also of preventing unfair practices in the private sphere - encouraged by political influence peddling - from nullifying the principle of free competition within the economy and production.","304",NA
"La libre competencia, principio esencial para el correcto funcionamiento de una economía que como la nuestra se fundamenta en la propiedad privada","Free competition, an essential principle for the proper functioning of an economy based on private property, is","403",NA
"se desnaturaliza cuando los agentes económicos violan la ley para sacar ventaja al amparo de padrinazgos políticos.","distorted when economic agents violate the law to take advantage of political patronage.","304",NA
"Ningún empresario por más eficiente y esforzado que sea, puede enfrentar a un competidor que evade tributos y cargas sociales, introduce contrabandos, subfactura importaciones, obtiene créditos bancarios que luego no paga, o gestiona al margen de la ley permisos y licencias.","No businessman, no matter how efficient and hard-working he may be, can face a competitor that evades taxes and social charges, smuggles contraband, under-invoices imports, obtains bank loans that he does not pay, or manages permits and licenses outside the law.","304",NA
"Menos aún puede competir contra empresarios que reciben millonarios incentivos por simular exportaciones, tal como ha sucedido con los Certificados de Abono Tributario (CATs).","Even less can it compete against businessmen who receive millionaire incentives for simulating exports, as has happened with the Tax Credit Certificates (CATs).","304",NA
"El sistema de contratación administrativa es todavía más sensible a esos vicios y distorsiones que surgen del tráfico de influencias políticas.","The administrative contracting system is even more sensitive to these vices and distortions arising from political influence peddling.","304",NA
"Es inadmisible que una empresa vea limitadas sus posibilidades de proveerle bienes y servicios al Estado por no contar con padrinazgos políticos o por no resignarse a entrar en su juego.","It is unacceptable for a company to see its possibilities of providing goods and services to the State limited because it does not have political sponsors or because it does not resign itself to playing their game.","304",NA
"No por casualidad el Banco Mundial ha establecido que uno de los mayores obstáculos que existe en los países latinoamericanos para su desarrollo económico, es justamente el impacto de la corrupción política en las actividades productivas.","It is no coincidence that the World Bank has established that one of the greatest obstacles to economic development in Latin American countries is precisely the impact of political corruption on productive activities.","304",NA
"Esta amenaza de la corrupción como lastre para el desarrollo se multiplica ante la expansión de otros fenómenos que, como el lavado de dinero proveniente del narcotráfico, parece sobrepasar la capacidad de los Estados para combatirlo","This threat of corruption as a burden for development is multiplied by the expansion of other phenomena, such as money laundering from drug trafficking, which seems to surpass the capacity of the States to combat it","304",NA
"En el contexto anterior, el reto de la productividad y los compromiso del PAC en este campo suponen no solo el aprovechamiento eficiente de los recursos del Estado","In the above context, the challenge of productivity and the PAC's commitments in this field involve not only the efficient use of State resources","303",NA
"y el funcionamiento adecuado del Poder Judicial","and the proper functioning of the Judiciary","202.1",NA
"sino también un combate frontal a la corrupción política y sus implicaciones en las actividades económicas y productivas",", but also a frontal fight against political corruption and its implications in economic and productive activities.","304",NA
"V Paridad entre mujeres y hombres","V Parity between women and men","H",NA
"Hace poco más de 25 años la Organización de las Naciones Unidas celebró la I Conferencia Mundial de la Mujer (México, 1975) y declaró el Decenio de la Mujer (1975-1985) haciendo un llamado enfático a los Estados a comprometer sus mejores esfuerzos para lograr el adelanto de las mujeres y una mayor igualdad con los hombres.","A little more than 25 years ago, the United Nations held the First World Conference on Women (Mexico, 1975) and declared the Decade of Women (1975-1985), emphatically calling on States to commit their best efforts to achieve the advancement of women and greater equality with men.","503",NA
"En este período la ONU celebró otras 3 conferencias mundiales de la mujer y promulgó la Convención para la Eliminación de Todas Formas de Discriminación Contra la Mujer, ratificada por nuestro país en 1984.","During this period, the UN held three other world women's conferences and enacted the Convention on the Elimination of All Forms of Discrimination Against Women, ratified by our country in 1984.","503",NA
"Recientemente entró en vigencia el Protocolo de esta Convención por medio del cual se establecen mecanismos de investigación y denuncia en contra de los Estados que incumplen la Convención.","Recently, the Protocol to this Convention came into force, which establishes mechanisms for investigation and denunciation against States that fail to comply with the Convention.","503",NA
"Han sido múltiples y sistemáticas las iniciativas y esfuerzos de la comunidad internacional por erradicar la discriminación y la desigualdad que viven las mujeres.","There have been multiple and systematic initiatives and efforts by the international community to eradicate discrimination and inequality experienced by women.","503",NA
"Al adherirse a estos compromisos e instrumentos internacionales, nuestro país se ha comprometido a seguir una política encaminada a eliminar la discriminación contra las mujeres","By adhering to these international commitments and instruments, our country has undertaken to pursue a policy aimed at eliminating discrimination against women","503",NA
"y a asegurar por ley y todos los medios apropiados, la realización práctica del principio de igualdad y reconoce el papel rector y normativo del Estado,","and to ensure by law and all appropriate means, the practical realization of the principle of equality and recognizes the guiding and normative role of the State, as","503",NA
"así como de garante de los derechos efectivos de las mujeres.","well as the role of guarantor of women's effective rights.","503",NA
"En nuestro país, la promulgación en marzo de 1990 de la ley de Promoción de la Igualdad Social de la Mujer con el fin de concretar la aplicación de la Convención, así como la adopción de planes y políticas de igualdad luego de la IV Conferencia Mundial de la Mujer en Beijing en 1995, constituyen actos claros y decididos para cerrar la brecha entre la igualdad formal y la igualdad real.","In our country, the enactment in March 1990 of the Law for the Promotion of Women's Social Equality in order to implement the Convention, as well as the adoption of equality plans and policies after the IV World Conference on Women in Beijing in 1995, constitute clear and decisive acts to close the gap between formal equality and real equality.","503",NA
"En estos 25 años se ha avanzado pero hay cambios que todavía no se concretan o extremadamente lentos, que prolongan un tiempo de transición agobiador para las mujeres.","In these 25 years, progress has been made, but there are changes that are still not taking place or are extremely slow, which prolongs a time of transition that is burdensome for women.","503",NA
"Nos encontramos en un punto en la historia en el que alcanzar logros más significativos y las transformaciones de fondo aun pendientes para hacer realidad la igualdad entre mujeres y hombres requiere pensar un nuevo modelo de desarrollo,","We are at a point in history in which the most significant achievements and the fundamental transformations still pending to make equality between women and men a reality require a new development model, as well as","503",NA
"así como la reforma y modernización del Estado.","the reform and modernization of the State.","303",NA
"La estrategia de desarrollo adoptada e impulsada a partir de los años ochenta, centrada en la promoción de las exportaciones no tradicionales a terceros mercados y la reducción del aparato estatal, está recortando el horizonte de los logros","The development strategy adopted and promoted since the 1980s, focused on the promotion of non-traditional exports to third markets and the reduction of the state apparatus, is shortening the horizon of achievements","403",NA
"y los avances en el campo de la equidad social y la igualdad de género.","and progress in the field of social equity and gender equality.","503",NA
"La visión y propuestas en los diferentes campos de acción a partir de los cuales convocamos a los y las costarricenses, se proponen contribuir a desarrollar relaciones más igualitarias y paritarias con los hombres.","The vision and proposals in the different fields of action from which we call on Costa Ricans are intended to contribute to the development of more egalitarian and equal relations with men.","503",NA
"Sin embargo, el Partido Acción Ciudadana se ha dado a la tarea de identificar campos de acción y propuestas estratégicas específicas y diferenciadas a favor de las mujeres con el propósito de enfatizar y relevar su importancia para cerrar las brechas de equidad","However, the Citizen Action Party has taken on the task of identifying fields of action and specific and differentiated strategic proposals in favor of women in order to emphasize and highlight their importance in closing the equity gaps","503",NA
"No sin olvidar que las mujeres no tienen un solo rostro.",", without forgetting that women do not have only one face.","503",NA
"Están cruzadas, como los hombres, por diferencias en razón de la edad, la condición económica, el origen y la pertenencia étnica, la condición de discapacidad, las diferencias regionales y la nacionalidad, entre otras.","They are, like men, crossed by differences based on age, economic status, origin and ethnicity, disability status, regional differences and nationality, among others.","503",NA
"Es consustancial a la democracia reconocer esos múltiples rostros.","It is consubstantial to democracy to recognize these multiple faces.","503",NA
"Nuestra principal propuesta consiste en promover un proceso de reforma a la Ley de Promoción de la Igualdad Social de la Mujer con el fin de convertirla en un instrumento efectivo y eficaz para concretar la igualdad real de las mujeres en su diversidad.","Our main proposal is to promote a process of reform of the Law for the Promotion of Women's Social Equality in order to turn it into an effective and efficient instrument to achieve real equality for women in their diversity.","503",NA
"Reforma y modernización del Estado","Reform and modernization of the State","H",NA
"La igualdad y equidad suponen y requieren planificación, políticas públicas y normas legales para redistribuir el poder entre distintos sectores de la población.","Equality and equity imply and require planning, public policies and legal norms to redistribute power among different sectors of the population.","503",NA
"Un modelo de desarrollo basado en la reducción del aparato del Estado y de su función distributiva, no hace más que restringir las posibilidades de intervención y planificación","A development model based on the reduction of the state apparatus and its distributive function only restricts the possibilities for intervention and planning","403",NA
