"text","text_en","cmp_code","eu_code"
"En primer lugar, debemos reducir la deuda interna reordenando algunos activos públicos.","First, we must reduce domestic debt by reallocating some public assets.","414",NA
"Desde 1997 Ottón Solís presentó un proyecto de ley (Gaceta 229, 27 Nov. 1 997 ) para reducir su monto en aproximadamente una cuarta parte, por medio de ese mecanismo.","Since 1997, Ottón Solís presented a bill (Gaceta 229, 27 Nov. 1997) to reduce its amount by approximately a quarter through this mechanism.","414",NA
"La propuesta es entregar el Banco de Costa Rica al Banco Nacional y reducir la deuda del Gobierno con el Banco Nacional en el monto en que se valore el Banco de Costa Rica.","The proposal is to turn over Banco de Costa Rica to Banco Nacional and reduce the Government's debt with Banco Nacional by the amount at which Banco de Costa Rica is valued.","414",NA
"De igual manera se propone reducir la deuda del Gobierno con la Caja Costarricense de Seguro Social entregándole el Instituto Nacional de Seguros (INS), y la correspondiente al INA entregándole la Fábrica Nacional de Licores 1FANAL).","Likewise, it is proposed to reduce the Government's debt with the Costa Rican Social Security Fund by handing over the National Insurance Institute (INS), and that corresponding to INA by handing over the National Liquor Factory (Fábrica Nacional de Licores 1FANAL).","408",NA
"En segundo lugar, debemos recolectar bien los impuestos, empezando por lo de aduana, donde se ""desaparecen"" más de 120 mil millones de colones al año.","Secondly, we must collect taxes properly, starting with customs, where more than 120 billion colones a year ""disappear"".","403",NA
"Luego debe enfatizarse el cobro del impuesto sobre la renta el cual es evadido por algunos empresarios y por muchos profesionales liberales.","Then, emphasis should be placed on the collection of income tax, which is evaded by some businessmen and by many liberal professionals.","403",NA
"Posteriormente debe hacerse un esfuerzo en la recolección del impuesto de ventas donde pareciera siguen existiendo cobros que no son trasladados al Ministerio de Hacienda.","Subsequently, an effort must be made in the collection of sales tax, where it appears that there are still some charges that are not transferred to the Ministry of Finance.","403",NA
"Para estos propósitos es necesario aprobar alguna legislación (ya planteada en la Asamblea Legislativa) para dedicar la cartera de Hacienda exclusivamente al cobro de impuestos.","For these purposes it is necessary to pass legislation (already before the Legislative Assembly) to dedicate the Treasury portfolio exclusively to tax collection.","403",NA
"Este cambio ya se intentó en 1997 por medio de reformas a la ley de presupuestos públicos, las cuales buscaban trasladar a MIDEPLAN — con el mismo personal y recursos - la absorbente tarea de elaborar y negociar el presupuesto de gastos a partir de la cifra global definida por Hacienda.","This change was already attempted in 1997 through reforms to the public budget law, which sought to transfer to MIDEPLAN - with the same staff and resources - the absorbing task of preparing and negotiating the expenditure budget based on the overall figure defined by the Treasury.","403",NA
"En el gobierno del PAC lo haremos voluntariamente desde el inicio de funciones.","In the PAC government, we will do this voluntarily from the beginning of our term of office.","403",NA
"En tercer lugar, terminaremos con el abuso de los recursos públicos ,-que superan los 40.000 millones de colones al ano -, el tráfico influencias nfluencias y el uso del poder para beneficiar intereses propios o de socios, parientes y amigos.","Third, we will put an end to the abuse of public resources, which exceed 40,000 million colones a year, influence peddling and the use of power to benefit our own interests or those of partners, relatives and friends.","304",NA
"Tenemos que dar un salto para situarnos al nivel de respeto por lo ajeno que los políticos practican en los paises más avanzados.","We have to make a leap to reach the level of respect for others that politicians practice in the most advanced countries.","304",NA
"Los recursos públicos son propiedad de los empresarios y trabajadores que pagan impuestos y de los destinatarios finales estipulados por ley.","Public resources are the property of taxpaying employers and workers and of the final recipients stipulated by law.","304",NA
"No son del sector público y menos de sus funcionarios.","They do not belong to the public sector and even less to its employees.","304",NA
"El PAC define como robo hasta el mínimo abuso y practicará un respeto total a esos recursos por que son de los y las costarricenses.","The PAC defines even the slightest abuse as theft and will practice total respect for these resources because they belong to Costa Ricans.","304",NA
"Como se ha señalado en otras secciones de este documento, si el presidente, las y los vicepresidentes, ministros, diputados y jerarcas de las empresas públicas y las instituciones autónomas quieren comer y tomar licor, quieren pasear en el exterior, quieren dotar de vehículo a su familia. quieren que sus parientes ganen un salario, quieren promover su imagen por la prensa, la radio o la televisión, que lo hagan con su propio dinero.","As has been pointed out in other sections of this document, if the president, vice presidents, ministers, deputies and heads of public enterprises and autonomous institutions want to eat and drink liquor, want to travel abroad, want to provide their family with a vehicle, want their relatives to earn a salary, want to promote their image through the press, radio or television, let them do it with their own money.","304",NA
"Los recursos públicos sólo pueden utilizarse para cumplir las funciones que la Constitución y las leyes asignen a las instituciones","Public resources can only be used to fulfill the functions that the Constitution and the laws assign to the institutions","304",NA
"Si esos funcionarios quieren hacerse ricos o ayudar a sus amigos y parientes a hacerse ricos, que trabajen honradamente en el sector privado y no usen corruptamente un puesto público para esos propósitos","If those officials want to get rich or help their friends and relatives to get rich, let them work honestly in the private sector and not corruptly use a public position for those purposes","304",NA
"No podemos dejar de enfatizar que mientras no se eliminen de las altas esferas de la administración pública los pequeños y grandes robos, el tráfico de influencias y los conflictos de interés, no existirá autoridad moral para cobrar todos los impuestos a los empresarios, ni para exigir eficiencia y compromiso a todos los empleados publicos,","We cannot fail to emphasize that as long as petty and grand theft, influence peddling and conflicts of interest are not eliminated from the upper echelons of public administration, there will be no moral authority to collect all taxes from businessmen, nor to demand efficiency and commitment from all public employees,","304",NA
"Por ello el requisito para inducir el programa de responsabilidad arriba esbozado, es la transparencia, la honestidad y el respeto total por lo ajeno por parte de la jerarquía política del país","Therefore, the prerequisite to induce the program of responsibility outlined above is transparency, honesty and total respect for others by the political hierarchy of the country. Within","304",NA
"En el marco de este enfoque, desde el inicio de nuestra gestión enfrentaremos el grave problema fiscal.","the framework of this approach, from the beginning of our administration we will face the serious fiscal problem.","414",NA
"Finalmente, vamos a reducir los presupuestos del IMAS. Asignaciones Familiares y otras instituciones del sector social, eliminando de las listas de beneficiarios los originados en el clientelismo político","Finally, we will reduce the budgets of IMAS. Asignaciones Familiares and other institutions of the social sector, eliminating from the lists of beneficiaries those originated in political clientelism","304",NA
"y en su lugar, dando mejor apoyo a los que lo requieran por su condición económica o situación de desventaja o discapacidad.","and instead, giving better support to those who require it due to their economic condition or situation of disadvantage or disability.","504",NA
"Un programa de este tipo conducirá en dos años a una eliminación del déficit fiscal y a la generación de un superávit del 1% del PIB y. consecuentemente, a una reducción de las tasas de interés y de la inflación, frenará la devaluación","Such a program will lead in two years to an elimination of the fiscal deficit and the generation of a surplus of 1% of GDP and, consequently, to a reduction in interest rates and inflation, will slow down the devaluation of the peso, and will reduce the inflation rate.","414",NA
"y como colorario, estimulará un incremento en la inversión y en el crecimiento económico.","and, as a corollary, stimulate an increase in investment and economic growth.","410",NA
"Además, liberará recursos para invertir en educación,","It will also free up resources to invest in education,","506",NA
"seguridad ciudadana","public safety","605.1",NA
"subsidios agrícolas,","agricultural subsidies,","703.1",NA
"desarrollo tecnológico y otros programas.","technological development and other programs.","411",NA
"Acciones  especificas:","Specific actions:","H",NA
"1. Reducción de la deuda pública, mediante la venta de la Fábrica Nacional de Licores al sector privado, o en su lugar su traslado al INA, y la venta del Instituto Nacional de Seguros a la Caja Costarricense de Seguro Social, y del Banco de Costa Rica al Banco Nacional, lo que permitiría una reducción sustancial de la deuda pública","1. Reduction of the public debt, through the sale of the National Liquor Factory to the private sector, or its transfer to INA, and the sale of the National Insurance Institute to the Costa Rican Social Security Fund, and of the Bank of Costa Rica to the National Bank, which would allow a substantial reduction of the public debt","414",NA
"sin que esas instituciones pasen al sector privado.","without these institutions being transferred to the private sector.","403",NA
"2. Aplicación de un sistema automatizado e integrado de tributación que abarque todas las fuentes de generación de tributos, con sistemas estandarizados y con clara identificación de cada contribuyente.","2. Implementation of an automated and integrated taxation system that covers all sources of tax generation, with standardized systems and with clear identification of each taxpayer.","403",NA
"3. Eliminación de los gastos superfluos del gobierno como los de propaganda1 viajes al exterior que no dejan beneficios al país; pagos injustificados de horas extra a empleados públicos: uso de vehículos del Estado para fines particulares, entre otros vicios que se han entronizado.","3. Elimination of superfluous government expenditures such as propaganda1 trips abroad that do not benefit the country; unjustified overtime payments to public employees; use of state vehicles for private purposes, among other vices that have become entrenched.","303",NA
"4. Compromiso inclaudicable de mantener una sana disciplina fiscal y monetaria.","4. Unwavering commitment to maintain sound fiscal and monetary discipline.","414",NA
"XIX- Reforma financiera","XIX- Financial reform","H",NA
"Las causas que explican el escaso desarrollo del sistema financiero costarricense son variadas: entre ellas se encuentran la falta de una cultura de banca","The causes for the low development of the Costa Rican financial system are varied: among them are the lack of a banking culture","408",NA
"y el empobrecimiento de la población, que reduce sus posibilidades de ahorro","and the impoverishment of the population, which reduces its savings possibilities.","503",NA
"Pero la promulgación de la Ley de Protección al Trabajador","But the enactment of the Workers' Protection Law","701",NA
"y la creación de los regímenes de pensiones complementarias. sin duda contribuirán en el mediano plazo a su crecimiento.","and the creation of supplementary pension schemes will undoubtedly contribute to its growth in the medium term.","504",NA
"Ese escaso desarrollo del sistema se traduce también en un menor acceso de la población a los servicios financieros.","This underdevelopment of the system also translates into less access to financial services for the population.","402",NA
"Esto limita las posibilidades de emprender proyectos y de alcanzar mayores niveles de bienestar personal y colectivo, y reduce la competitividad de las empresas colocándolas en desventaja frente a sus similares de otros países.","This limits the possibilities of undertaking projects and achieving higher levels of personal and collective well-being, and reduces the competitiveness of companies, placing them at a disadvantage compared to their peers in other countries.","402",NA
"Respecto al acceso al crédito, los bancos estatales han concentrado sus esfuerzos en la producción de ganancias y esto les ha limitado el cumplimiento de sus objetivos de apoyo al surgimiento y expansión de la actividad empresaria.","Regarding access to credit, state-owned banks have concentrated their efforts on the production of profits and this has limited the fulfillment of their objectives of supporting the emergence and expansion of entrepreneurial activity.","402",NA
"Asimismo, algunas regulaciones emitidas por los órganos de supervisión y regulación de la banca han limitado su desarrollo.","In addition, some regulations issued by banking supervisory and regulatory bodies have limited their development.","402",NA
"En lo que se refiere al mercado de capitales. un alto volumen de negociaciones corresponde a valores emitidos por el sector público.","With regard to the capital markets, a high volume of trading corresponds to securities issued by the public sector.","408",NA
"Los empresarios costarricenses aún no utilizan en forma habitual esa fuente de financiamiento debido entre otros factores. a aspectos culturales. como la propiedad familiar de las empresas y el incipiente desarrollo de la banca de inversión.","Costa Rican entrepreneurs still do not use this source of financing on a regular basis due to cultural aspects, among other factors, such as family ownership of companies and the incipient development of investment banking.","408",NA
"Por otra parte, la carencia de oportunidades de inversión en proyectos privados provoca que el ahorro interno que se genera en el país se utilice para atender la demanda del sector público. o para inversiones en el extranjero, ya sea directamente mediante la fuga de capitales o mediante la utilización de esquemas de inversión 'off shore'.","On the other hand, the lack of investment opportunities in private projects causes the domestic savings generated in the country to be used to meet the demand of the public sector or for investments abroad, either directly through capital flight or through the use of off-shore investment schemes.","403",NA
"En consecuencia, un alto porcentaje de los activos financieros de los grupos que operan en el país escapa al sistema de regulación y supervisión existente.","As a result, a high percentage of the financial assets of the groups operating in the country escape the existing regulatory and supervisory system.","403",NA
"En este sentido, el PAC proyecta convertir al sistema financiero en un catalizador de cambio del sistema productivo costarricense y en un agente de profundización de la movilidad social. de manera que canalice el ahorro hacia las diferentes actividades productivas del país.","In this sense, the PAC plans to turn the financial system into a catalyst for change in Costa Rica's productive system and an agent for deepening social mobility by channeling savings toward the country's different productive activities.","410",NA
"En paralelo establecerá las regulaciones adecuadas para que pueda desarrollar su' sentido social y financiar las áreas productivas que tienen un mayor impacto social,","In parallel, it will establish the appropriate regulations so that it can develop its' social sense and finance the productive areas that have a greater social impact. It","403",NA
"También promoverá el desarrollo del mercado de valores de largo plazo para que funcione como un mecanismo sano para el financiamiento de las empresas y de las obras públicas.","will also promote the development of the long-term securities market so that it can function as a healthy mechanism for financing companies and public works.","404",NA
"Se subsidiará el crédito que recibirán los sectores productivos más débiles del país.","Credit will be subsidized for the country's weakest productive sectors.","402",NA
"Esos subsidios serán condicionados al cumplimiento de determinados requisitos relacionados con el esfuerzo personal y con el avance tecnológico de los beneficiarios.","These subsidies will be conditioned to the fulfillment of certain requirements related to the personal effort and technological progress of the beneficiaries.","402",NA
"En este contexto nos empeñaremos en que la banca privada cumpla con las condiciones establecidas en la ley para el acceso a cuentas corrientes y redescuento.","In this context, we will strive to ensure that private banks comply with the conditions established by law for access to checking and rediscount accounts.","402",NA
"Mientras no se establezca el fondo de crédito subsidiado que se estipuló en dicha legislación como parte de un acuerdo nacional democráticamente negociado, no impulsaremos reformas adicionales en el sistema financiero, excepto aquellas que mejoren las posibilidades de acceso a crédito subsidiado a sectores especiales como la agricultura y las pequeñas y medianas empresas (PYMES).","As long as the subsidized credit fund that was stipulated in that legislation as part of a democratically negotiated national agreement is not established, we will not promote additional reforms in the financial system, except those that improve the possibilities of access to subsidized credit for special sectors such as agriculture and small and medium-sized enterprises (SMEs).","402",NA
"Acciones específicas:","Specific actions:","H",NA
"1. Programa de crédito subsidiado para los sectores productivos más débiles del país, para lo cual se deberá desarrollar un reglamento acorde con el artículo 59 de la Ley Orgánica del Sistema Bancario Nacional.","1. Subsidized credit program for the weakest productive sectors of the country, for which a regulation should be developed in accordance with Article 59 of the Organic Law of the National Banking System.","402",NA
"2. Instrucción a las instituciones autónomas para que analicen la viabilidad de utilizar el mercado de valores como un esquema alternativo de financiamiento para sus proyectos de inversión.","2. Instruction to the autonomous institutions to analyze the feasibility of using the stock market as an alternative financing scheme for their investment projects.","408",NA
"3. Programa de apoyo a los intermediarios financieros, para que puedan escoger la mejor tecnología disponible e incorporar con agilidad las innovaciones que sean introducidas en el mercado. y de ese modo brindar mejores servicios.","3. Support program for financial intermediaries, so that they can choose the best technology available and incorporate with agility the innovations that are introduced in the market, and thus provide better services.","411",NA
"4. Programa de reducción escalonada del margen de intermediación y de los costos de transacción. para que los niveles mostrados se acerquen a los de economías de similares características y con sistemas financieros más desarrollados que el costarricense.","4. Program for the gradual reduction of the intermediation margin and transaction costs, so that the levels shown approach those of economies with similar characteristics and with more developed financial systems than Costa Rica.","408",NA
"5. Readaptación de las ideas centrales que dieron origen a las Juntas Rurales de Crédito Agrícola del Banco Nacional de Costa Rica. en la banca estatal de desarrollo, con el propósito de atender las necesidades de financiamiento de la clientela agrícola, artesanal y pequeños y micro empresarios.","Readaptation of the central ideas that gave rise to the Rural Agricultural Credit Boards of the Banco Nacional de Costa Rica into the state development bank, with the purpose of meeting the financing needs of the agricultural, artisan and small and micro business clientele.","402",NA
"6. Impulso al desarrollo del mercado de capitales, mediante la generación de alternativas de inversión (accionarías, bonos estructurados e inversiones inmobiliarias).","6. Promote the development of the capital market by generating investment alternatives (shares, structured bonds and real estate investments).","408",NA
"7. Creación de unidades de banca de inversión que se encargarán de estructurar y levantar los fondos que requieren los emisores de títulos valores.","7. Creation of investment banking units that will be in charge of structuring and raising the funds required by the issuers of securities.","408",NA
"8. Creación de una unidad de títularización dentro de la administración del Banco Hipotecario de la Vivienda, encargada de iniciar un programa de estandarización de hipotecas, para titularizar ese conjunto de derechos de crédito hipotecario.","Creation of a securitization unit within the administration of the Banco Hipotecario de la Vivienda, in charge of initiating a mortgage standardization program to securitize that set of mortgage credit rights.","504",NA
"9. Reforzamiento de las Superintendencias, para que implanten adecuada y enérgicamente el respeto a la integridad el ordenamiento jurídico que deben tutelar.","Strengthening of the Superintendencies, so that they may adequately and vigorously enforce respect for the integrity of the legal system that they must protect.","403",NA
"XX- Competitividad y Comercio Internacional","XX- Competitiveness and International Trade","H",NA
"La superación de la crisis fiscal no basta para alcanzar la competitividad internacional y las tasas de crecimiento económico que son necesarias para nuestro desarrollo","Overcoming the fiscal crisis is not enough to achieve international competitiveness and the economic growth rates that are necessary for our development.","410",NA
"Es urgente tambien mejorar la calidad de la infraestructura y el costo de los servicios que presta el Estado","It is also urgent to improve the quality of infrastructure and the cost of services provided by the State","411",NA
"Para ello, además del cambio de actitud de los empleados públicos promoveremos la concesión de puertos, aeropuertos, ferrocarriles y algunas carreteras en el marco de contratos transparentes, prefijados y beneficiosos para el país a partir de acuerdos con los trabajadores, justos y equilibrados.",". To this end, in addition to changing the attitude of public employees, we will promote the concession of ports, airports, railroads and some highways within the framework of transparent, predetermined and beneficial contracts for the country based on fair and balanced agreements with workers.","411",NA
"Además. todo contrato de concesión será público desde las primeras etapas de negociación.","In addition, all concession contracts will be public from the early stages of negotiation.","304",NA
"La concesión bien ejecutada mejora la eficiencia y contribuye a reducir el déficit fiscal.","A well-executed concession improves efficiency and contributes to reducing the fiscal deficit.","414",NA
"Por otra parte, debe hacerse un esfuerzo para que el INA, el cual es financiado por el sector privado, adapte sus programas a las necesidades de una juventud que desea educarse para el trabajo, de empleados que necesitan re-capacitarse para nuevos puestos y de los empresarios que desean producir con eficiencia.","On the other hand, an effort must be made for the INA, which is funded by the private sector, to adapt its programs to the needs of youth who want to be educated for work, employees who need to be retrained for new positions, and entrepreneurs who want to produce efficiently.","411",NA
"En el INA deben converger el sector empresarial, los trabajadores y la juventud alrededor de los conceptos de oportunidad, empleo, productividad, competitividad y esperanza.","In the INA, the business sector, workers and youth must converge around the concepts of opportunity, employment, productivity, competitiveness and hope.","411",NA
"Bajas tasas de interés, estabilidad macroeconómica, servicios públicos baratos y eficientes, trámites simples y predecibles, desregufación, buena infraestructura, trabajadores capacitados, reglas claras, respeto a los derechos de propiedad, apoyo tecnológico, paz social y armonía laboral: estos son los acicates de la inversión privada y del crecimiento económico.","Low interest rates, macroeconomic stability, cheap and efficient public services, simple and predictable procedures, deregulation, good infrastructure, skilled workers, clear rules, respect for property rights, technological support, social peace and labor harmony: these are the spurs to private investment and economic growth.","410",NA
"Sin embargo, como ya reseñamos, también vamos a promover un modelo de desarrollo para el mediano y largo plazo","However, as we have already outlined, we will also promote a development model for the medium and long term","404",NA
"centrado en el ambiente.","focused on the environment.","416.2",NA
